Unnamed: 0,County,Name,RWC,Type,Amount,Unit,Waste type,Time,time2,Hardness (mg/l),As (mg/l),B (mg/l),Ba (mg/l),Ca (mg/l),Cu (mg/l),Fe (mg/l),Li (mg/l),Mg (mg/l),Mn (mg/l),Na (mg/l),Se (mg/l),Sr (mg/l),Zn (mg/l),Alkalinity (mgCaCO3/l),Br (mg/l),Cl (mg/l),COD (mg/l),Specific conductance (umhos/cm),pH,TDS (mg/l),TSS (mg/l),Gross a (pCi/L or g),Gross b (pCi/L or g),Ra-226 (pCi/L or g),Ra-228 (pCi/L or g),Th-228 (pCi/L or g),Temp (__C),Unnamed: 40,year,month,day,Farm_1,Farm_2,Farm_3,Farm_4,Farm_5,RWC_new,Type_new,Spud_year,Spud_month,Spud_day,Well_permit,OGO_num,Well_latitude,Well_longitude,Unconventional,Well_config,Well_type,Unit_2,year_match,Type_match,Waste_quantity,Gas_quantity,Gas_prod_day,Oil_quantity,Oil_prod_day,Spud_time,time_collect-spud,Ra-226/228,logHardness,logB,logBa,logCa,logFe,logLi,logMg,logNa,logSr,logZn,logAlk,logBr,logCl,logCOD,logSpecCon,logpH,logTDS,logTSS,logAlpha,logBeta,logRa226,logRa228,logRa226/228,DataType,SO4 (mg/l),K (mg/l),DOC (mg/l),TOC (mg/l),F (mg/l),P_total (mg/l),N_total (mg/l),Al (ppm),S (ppm),type_mark0,BRADFORD,Bacorn bra pad,805,Flowback,398496,gal,liquid,42668,10/25/16,55200,0,6.3,6710,20100,0,106,285,1230,8.57,24700,0,5680,0,44.1,731,129000,0,270000,5.7,281000,238,21800,3830,1710,0,0,21.8,14300,2016,10,25,BACORN,BRA,PAD,0,0,802,Flowback,2015,5,1,015-23158,OGO-65420,41.585831,-76.507014,Yes,Horizontal Well,GAS,Bbl,Yes,PW,0,1024276,90,0,0,2015.416667,1.416666667,0,4.741939078,0.799340549,3.82672252,4.303196057,2.025305865,2.45484486,3.089905111,4.392696953,3.754348336,0,1.644438589,2.863917377,5.11058971,0,5.431363764,0.755874856,5.44870632,2.376576957,4.338456494,3.583198774,3.23299611,0,0,0,0,0,0,0,0,0,0,0,0,51,BRADFORD,Bacorn bra pad,802,PW,1035125,gal,liquid,42718,12/14/16,57300,0,6.38,7470,20700,0,109,280,1340,9.62,23500,0,5290,0,49.3,825,137000,0,294000,6.8,241000,280,46500,22700,14600,1640,0,22.4,0,2016,12,14,BACORN,BRA,PAD,0,0,802,PW,2015,5,1,015-23158,OGO-65420,41.585831,-76.507014,Yes,Horizontal Well,GAS,Bbl,Yes,Yes,1276.46,1024276,90,0,0,2015.416667,1.583333333,8.902439024,4.758154622,0.804820679,3.873320602,4.315970345,2.037426498,2.447158031,3.127104798,4.371067862,3.723455672,0,1.692846919,2.916453949,5.136720567,0,5.46834733,0.832508913,5.382017043,2.447158031,4.667452953,4.356025857,4.164352856,3.214843848,0.949509008,0,0,0,0,0,0,0,0,0,0,42,BRADFORD,BIM BRA PAD,802,PW,39900,gal,liquid,42718,12/14/16,20300,0,5.49,9030,7270,0,127,279,528,5.33,18000,0,3060,0,52.4,625,85200,0,259000,6.4,165000,265,13200,4880,3530,1160,0,21.8,0,2016,12,14,BIM,BRA,PAD,0,0,802,PW,2014,7,7,015-22829,OGO-65420,41.569183,-76.219406,Yes,Horizontal Well,GAS,Bbl,2017,Yes,0,0,0,0,0,2014.583333,2.416666667,3.043103448,4.307496038,0.739572344,3.95568775,3.861534411,2.103803721,2.445604203,2.722633923,4.255272505,3.485721426,0,1.719331287,2.795880017,4.930439595,0,5.413299764,0.806179974,5.217483944,2.423245874,4.120573931,3.688419822,3.547774705,3.064457989,0.483316716,0,0,0,0,0,0,0,0,0,0,43,BRADFORD,JES BRA PAD,805,Flowback,9156,gal,liquid,42696,11/22/16,12400,0,5.19,8200,4430,0,127,219,319,6.51,23600,0,2020,0,81.2,0,48300,0,131000,7.5,104000,136,68200,14300,5210,618,0,21.6,0,2016,11,22,JES,BRA,PAD,0,0,802,Flowback,2013,8,7,015-22630,OGO-65420,41.565358,-76.286167,Yes,Horizontal Well,GAS,Bbl,2014,PW,0,0,0,0,0,2013.666667,3.25,8.430420712,4.093421685,0.715167358,3.913813852,3.646403726,2.103803721,2.340444115,2.503790683,4.372912003,3.305351369,0,1.909556029,0,4.683947131,0,5.117271296,0.875061263,5.017033339,2.133538908,4.833784375,4.155336037,3.716837723,2.790988475,0.925849248,0,0,0,0,0,0,0,0,0,0,54,BRADFORD,JES BRA PAD,802,PW,84966,gal,liquid,42718,12/14/16,14400,0,5.63,8190,5150,0,199,236,371,6.31,16000,0,2060,0,101,488,60100,0,178000,6.6,113000,1640,19700,8050,7790,792,0,21.8,0,2016,12,14,JES,BRA,PAD,0,0,802,PW,2013,8,7,015-22630,OGO-65420,41.565358,-76.286167,Yes,Horizontal Well,GAS,Bbl,2014,Yes,0,0,0,0,0,2013.666667,3.333333333,9.835858586,4.158362492,0.750508395,3.913283902,3.711807229,2.298853076,2.372912003,2.56937391,4.204119983,3.31386722,0,2.004321374,2.688419822,4.778874472,0,5.250420002,0.819543936,5.053078443,3.214843848,4.294466226,3.90579588,3.891537458,2.898725182,0.992812276,0,0,0,0,0,0,0,0,0,0,45,BRADFORD,ALVAREZ BRA PAD,804,Flowback,439301,gal,liquid,42192,7/7/15,12000,0,0,5850,4310,0,194,177,296,4.51,21300,0,1630,0,93.2,417,53800,0,177000,6,113000,149,9320,2930,5170,616,0,0,0,2015,7,7,ALVAREZ,BRA,PAD,0,0,802,Flowback,2014,6,23,015-22917,OGO-65420,41.586881,-76.212006,Yes,Horizontal Well,GAS,Bbl,2014,PW,0,1271217,113,0,0,2014.5,-1.666666667,8.392857143,4.079181246,0,3.767155866,3.63447727,2.28780173,2.247973266,2.471291711,4.328379603,3.212187604,0,1.969415912,2.620136055,4.730782276,0,5.247973266,0.77815125,5.053078443,2.173186268,3.969415912,3.46686762,3.713490543,2.789580712,0.923909831,0,0,0,0,0,0,0,0,0,0,56,BRADFORD,ALVAREZ BRA PAD,802,PW,118104,gal,liquid,42207,7/22/15,12400,0,5.32,6380,4470,0,215,194,306,5.99,21100,0,1670,0,141,409,51700,0,170000,6,94400,112,25200,10000,5100,693,0,0,0,2015,7,22,ALVAREZ,BRA,PAD,0,0,802,PW,2014,6,23,015-22917,OGO-65420,41.586881,-76.212006,Yes,Horizontal Well,GAS,Bbl,2014,Yes,0,1271217,113,0,0,2014.5,-1.666666667,7.359307359,4.093421685,0.725911632,3.804820679,3.650307523,2.33243846,2.28780173,2.485721426,4.324282455,3.222716471,0,2.149219113,2.611723308,4.713490543,0,5.230448921,0.77815125,4.974971994,2.049218023,4.401400541,4,3.707570176,2.840733235,0.866836941,0,0,0,0,0,0,0,0,0,0,47,BRADFORD,ELWELL BRA PAD,804,Flowback,0,gal,liquid,42199,7/14/15,31000,0,0,7350,11100,0,419,204,806,13.6,28200,0,3550,0,95.1,591,78700,29300,231000,5.8,193000,156,16900,6080,8030,1050,0,0,0,2015,7,14,ELWELL,BRA,PAD,0,0,802,Flowback,2012,3,20,015-22124,OGO-65420,41.589158,-76.248161,Yes,Horizontal Well,GAS,Bbl,2013,PW,0,0,0,0,0,2012.25,3.333333333,7.647619048,4.491361694,0,3.866287339,4.045322979,2.622214023,2.309630167,2.906335042,4.450249108,3.550228353,0,1.978180517,2.771587481,4.895974732,4.46686762,5.36361198,0.763427994,5.285557309,2.193124598,4.227886705,3.783903579,3.904715545,3.021189299,0.883526246,0,0,0,0,0,0,0,0,0,0,58,BRADFORD,ELWELL BRA PAD,802,PW,4578,gal,liquid,42227,8/11/15,23200,0,0,4370,8290,0,150,203,618,10.9,18900,0,2780,4.2,0,463,62100,32200,203000,4.4,137000,40,38300,14800,9140,808,0,0,0,2015,8,11,ELWELL,BRA,PAD,0,0,802,PW,2012,3,20,015-22124,OGO-65420,41.589158,-76.248161,Yes,Horizontal Well,GAS,Bbl,2013,Yes,0,0,0,0,0,2012.25,3.416666667,11.31188119,4.365487985,0,3.640481437,3.918554531,2.176091259,2.307496038,2.790988475,4.276461804,3.444044796,0.62324929,0,2.665580991,4.7930916,4.507855872,5.307496038,0.643452676,5.136720567,1.602059991,4.583198774,4.170261715,3.960946196,2.907411361,1.053534835,0,0,0,0,0,0,0,0,0,0,49,BRADFORD,ICEMAN BRA PAD,804,Flowback,328254,gal,liquid,42207,7/22/15,17700,0,6.46,3870,6280,0,144,166,497,5.27,22500,0,2090,0,51.8,450,57800,0,182000,5.8,136000,130,30300,10400,8190,861,0,0,0,2015,7,22,ICEMAN,BRA,PAD,0,0,802,Flowback,2012,10,24,015-22251,OGO-65420,41.588619,-76.289433,Yes,Horizontal Well,GAS,Bbl,2012,PW,0,0,0,0,0,2012.833333,2.75,9.512195122,4.247973266,0.810232518,3.587710965,3.797959644,2.158362492,2.220108088,2.696356389,4.352182518,3.320146286,0,1.71432976,2.653212514,4.761927838,0,5.260071388,0.763427994,5.133538908,2.113943352,4.481442629,4.017033339,3.913283902,2.935003151,0.97828075,0,0,0,0,0,0,0,0,0,0,510,BRADFORD,ICEMAN BRA PAD,802,PW,111804,gal,liquid,42235,8/19/15,23900,0,7,5850,8540,0,124,218,626,5.68,30300,0,3280,0,125,518,71500,12800,225000,6.5,163000,199,32000,13400,8140,910,0,0,0,2015,8,19,ICEMAN,BRA,PAD,0,0,802,PW,2012,10,24,015-22251,OGO-65420,41.588619,-76.289433,Yes,Horizontal Well,GAS,Bbl,2012,Yes,0,0,0,0,0,2012.833333,2.833333333,8.945054945,4.378397901,0.84509804,3.767155866,3.931457871,2.093421685,2.338456494,2.796574333,4.481442629,3.515873844,0,2.096910013,2.71432976,4.854306042,4.10720997,5.352182518,0.812913357,5.212187604,2.298853076,4.505149978,4.127104798,3.910624405,2.959041392,0.951583013,0,0,0,0,0,0,0,0,0,0,411,BRADFORD,BEEBE BRA PAD,802,PW,38220,gal,liquid,41673,2/3/14,36100,0,0,2430,13300,0,85.3,167,726,9.03,10600,0,3890,0,67.3,1100,262000,0,563000,6.1,298000,98,6100,3590,3380,668,0,0,0,2014,2,3,BEEBE,BRA,PAD,0,0,802,PW,2010,10,2,015-21048,OGO-65420,41.704589,-76.403325,Yes,Horizontal Well,GAS,Bbl,2012,Yes,0,394099,333,0,0,2010.833333,3.333333333,5.05988024,4.557507202,0,3.385606274,4.123851641,1.930949031,2.222716471,2.860936621,4.025305865,3.589949601,0,1.828015064,3.041392685,5.418301291,0,5.750508395,0.785329835,5.474216264,1.991226076,3.785329835,3.555094449,3.5289167,2.824776462,0.704140238,0,0,0,0,0,0,0,0,0,0,412,BRADFORD,BEEBE BRA PAD,802,PW,67204,gal,liquid,41673,2/3/14,36100,0,0,2430,13300,0,85.3,167,726,9.03,10600,0,3890,0,67.3,1100,262000,0,563000,6.1,298000,98,0,0,0,0,0,0,0,2014,2,3,BEEBE,BRA,PAD,0,0,802,PW,2010,10,2,015-21048,OGO-65420,41.704589,-76.403325,Yes,Horizontal Well,GAS,Bbl,2012,Yes,0,394099,333,0,0,2010.833333,3.333333333,0,4.557507202,0,3.385606274,4.123851641,1.930949031,2.222716471,2.860936621,4.025305865,3.589949601,0,1.828015064,3.041392685,5.418301291,0,5.750508395,0.785329835,5.474216264,1.991226076,0,0,0,0,0,0,0,0,0,0,0,0,0,0,0,413,BRADFORD,BKT BRA PAD,804,Flowback,1233449,gal,liquid,41724,3/26/14,19100,0,6.59,5400,6990,0,58.3,169,404,2.5,22200,0,2080,0,107,341,58600,0,201000,6.8,128000,283,19300,4350,9040,700,0,0,0,2014,3,26,BKT,BRA,PAD,0,0,802,Flowback,2013,1,23,015-22274,OGO-65420,41.560325,-76.263897,Yes,Horizontal Well,GAS,Bbl,2013,PW,0,2192376,252,0,0,2013.083333,1.166666667,12.91428571,4.281033367,0.818885415,3.73239376,3.844477176,1.765668555,2.227886705,2.606381365,4.346352974,3.318063335,0,2.029383778,2.532754379,4.767897616,0,5.303196057,0.832508913,5.10720997,2.451786436,4.285557309,3.638489257,3.95616843,2.84509804,1.11107039,0,0,0,0,0,0,0,0,0,0,514,BRADFORD,BKT BRA PAD,802,PW,795117,gal,liquid,41794,6/4/14,11800,0,0,5520,4250,0,76.1,162,190,2.4,12200,0,1800,0,119,423,60700,0,183000,6.3,106000,92.7,38900,15000,8930,752,0,0,0,2014,6,4,BKT,BRA,PAD,0,0,802,PW,2013,1,23,015-22274,OGO-65420,41.560325,-76.263897,Yes,Horizontal Well,GAS,Bbl,2013,Yes,0,2192376,252,0,0,2013.083333,1.416666667,11.875,4.071882007,0,3.741939078,3.62838893,1.881384657,2.209515015,2.278753601,4.086359831,3.255272505,0,2.075546961,2.626340367,4.783188691,0,5.26245109,0.799340549,5.025305865,1.967079734,4.589949601,4.176091259,3.950851459,2.876217841,1.074633618,0,0,0,0,0,0,0,0,0,0,415,BRADFORD,BLUEBERRY HILL BRA PAD,804,Flowback,1064696,gal,liquid,41852,8/1/14,31700,0,7.07,5640,11500,0,79.2,172,730,6.81,29900,0,3190,0,93,425,78200,0,245000,6.2,197000,180,25100,8830,7700,794,0,0,0,2014,8,1,BLUEBERRY,HILL,BRA,PAD,0,802,Flowback,2013,3,25,015-22387,OGO-65420,41.606275,-76.505842,Yes,Horizontal Well,GAS,Bbl,2013,PW,0,1452024,161,0,0,2013.25,1.416666667,9.697732997,4.501059262,0.849419414,3.751279104,4.06069784,1.898725182,2.235528447,2.86332286,4.475671188,3.503790683,0,1.968482949,2.62838893,4.893206753,0,5.389166084,0.792391689,5.294466226,2.255272505,4.399673721,3.945960704,3.886490725,2.899820502,0.986670223,0,0,0,0,0,0,0,0,0,0,516,BRADFORD,BLUEBERRY HILL BRA PAD,802,PW,594696,gal,liquid,41876,8/25/14,52200,0,6.89,7780,18900,0,106,246,1210,10.6,38800,0,5370,0,84.5,617,122000,0,317000,6.2,215000,105,45400,16600,16600,1510,0,0,0,2014,8,25,BLUEBERRY,HILL,BRA,PAD,0,802,PW,2013,3,25,015-22387,OGO-65420,41.606275,-76.505842,Yes,Horizontal Well,GAS,Bbl,2013,Yes,0,1452024,161,0,0,2013.25,1.416666667,10.99337748,4.717670503,0.838219222,3.890979597,4.276461804,2.025305865,2.390935107,3.08278537,4.588831726,3.729974286,0,1.926856709,2.790285164,5.086359831,0,5.501059262,0.792391689,5.33243846,2.021189299,4.657055853,4.220108088,4.220108088,3.178976947,1.041131141,0,0,0,0,0,0,0,0,0,0,417,BRADFORD,BRIAN HARRIS BRA 1 PAD,802,PW,8400,gal,liquid,41793,6/3/14,45900,0,0,11100,16000,0,203,163,1450,10.8,27900,0,4810,0,0,713,107000,0,304000,4.4,198000,386,52600,21300,2300,1140,0,0,0,2014,6,3,BRIAN,HARRIS,BRA,1,PAD,802,PW,1996,7,19,015-20037,OGO-65420,41.882087,-76.615295,No,Vertical Well,GAS,Bbl,-,Yes,0,0,0,0,0,1996.583333,0,2.01754386,4.661812686,0,4.045322979,4.204119983,2.307496038,2.212187604,3.161368002,4.445604203,3.682145076,0,0,2.85308953,5.029383778,0,5.482873584,0.643452676,5.29666519,2.586587305,4.720985744,4.328379603,3.361727836,3.056904851,0.304822985,0,0,0,0,0,0,0,0,0,0,418,BRADFORD,BROWN HOMESTEAD BRA PAD,802,PW,220561,gal,liquid,41746,4/17/14,49000,0,0,10000,17600,0,129,294,1220,7.61,37600,0,4580,0,58.2,778,135000,0,396000,6,228000,147,318,103,18700,1650,0,0,0,2014,4,17,BROWN,HOMESTEAD,BRA,PAD,0,802,PW,2012,11,12,015-22243,OGO-65420,41.660336,-76.245967,Yes,Horizontal Well,GAS,Bbl,2013,PW,0,2734177,359,0,0,2012.916667,4.416666667,11.33333333,4.69019608,0,4,4.245512668,2.11058971,2.46834733,3.086359831,4.575187845,3.660865478,0,1.764922985,2.890979597,5.130333768,0,5.597695186,0.77815125,5.357934847,2.167317335,2.50242712,2.012837225,4.271841607,3.217483944,1.054357662,0,0,0,0,0,0,0,0,0,0,419,BRADFORD,CDJ BRA PAD,804,Flowback,1450806,gal,liquid,41731,4/2/14,11600,0,5.69,6460,4160,0,41.3,181,305,1.53,21000,0,1540,0,132,400,51700,0,154000,6.9,84800,90.6,16600,5630,5160,518,0,0,0,2014,4,2,CDJ,BRA,PAD,0,0,802,Flowback,2013,1,24,015-22263,OGO-65420,41.562294,-76.254117,Yes,Horizontal Well,GAS,Bbl,2013,PW,0,2857183,269,0,0,2013.083333,1.25,9.961389961,4.064457989,0.755112266,3.810232518,3.619093331,1.615950052,2.257678575,2.484299839,4.322219295,3.187520721,0,2.120573931,2.602059991,4.713490543,0,5.187520721,0.838849091,4.928395852,1.957128198,4.220108088,3.750508395,3.712649702,2.71432976,0.998319942,0,0,0,0,0,0,0,0,0,0,520,BRADFORD,CDJ BRA PAD,802,PW,1055867,gal,liquid,41794,6/4/14,13200,0,0,6980,4720,0,111,188,346,2.62,13000,0,1910,0,192,398,59900,0,169000,6.4,98800,178,41000,16300,9280,617,0,0,0,2014,6,4,CDJ,BRA,PAD,0,0,802,PW,2013,1,24,015-22263,OGO-65420,41.562294,-76.254117,Yes,Horizontal Well,GAS,Bbl,2013,Yes,0,2857183,269,0,0,2013.083333,1.416666667,15.04051864,4.120573931,0,3.843855423,3.673941999,2.045322979,2.274157849,2.539076099,4.113943352,3.281033367,0,2.283301229,2.599883072,4.777426822,0,5.227886705,0.806179974,4.994756945,2.250420002,4.612783857,4.212187604,3.967547976,2.790285164,1.177262812,0,0,0,0,0,0,0,0,0,0,421,BRADFORD,CIRCLE H BRA PAD,804,Flowback,304730,gal,liquid,41689,2/19/14,16900,0,6.92,5000,6010,0,51.7,173,457,3.34,24300,0,2180,3.12,85.7,326,84400,0,176000,6.6,102000,87.2,19000,4420,10500,622,0,0,0,2014,2,19,CIRCLE,H,BRA,PAD,0,802,Flowback,2012,4,16,015-22178,OGO-65420,41.5924,-76.325619,Yes,Horizontal Well,GAS,Bbl,2012,PW,0,2544631,311,0,0,2012.333333,1.833333333,16.88102894,4.227886705,0.840106094,3.698970004,3.778874472,1.713490543,2.238046103,2.6599162,4.385606274,3.338456494,0.494154594,1.932980822,2.5132176,4.926342447,0,5.245512668,0.819543936,5.008600172,1.940516485,4.278753601,3.645422269,4.021189299,2.793790385,1.227398914,0,0,0,0,0,0,0,0,0,0,522,BRADFORD,CIRCLE Z BRA PAD,804,Flowback,129126,gal,liquid,41899,9/17/14,31100,0,8.01,6140,11100,0,110,237,818,5.29,32400,0,3410,0,103,590,67800,0,261000,6.3,117000,137,84500,37700,19200,1350,0,0,0,2014,9,17,CIRCLE,Z,BRA,PAD,0,802,Flowback,2012,4,16,015-22178,OGO-65420,41.5924,-76.325619,Yes,Horizontal Well,GAS,Bbl,2012,PW,0,2544631,311,0,0,2012.333333,2.416666667,14.22222222,4.492760389,0.903632516,3.788168371,4.045322979,2.041392685,2.374748346,2.912753304,4.51054501,3.532754379,0,2.012837225,2.770852012,4.831229694,0,5.416640507,0.799340549,5.068185862,2.136720567,4.926856709,4.57634135,4.283301229,3.130333768,1.15296746,0,0,0,0,0,0,0,0,0,0,523,BRADFORD,CIRCLE H BRA PAD,802,PW,116609,gal,liquid,41730,4/1/14,20300,0,6.37,6130,7190,0,103,183,558,4.59,26500,0,2840,0,71.4,410,63900,0,190000,6.5,112000,74.5,17500,7590,8200,767,0,0,0,2014,4,1,CIRCLE,H,BRA,PAD,0,802,PW,2012,4,16,015-22178,OGO-65420,41.5924,-76.325619,Yes,Horizontal Well,GAS,Bbl,2012,Yes,0,2544631,311,0,0,2012.333333,2,10.69100391,4.307496038,0.804139432,3.787460475,3.85672889,2.012837225,2.26245109,2.746634199,4.423245874,3.45331834,0,1.853698212,2.612783857,4.805500858,0,5.278753601,0.812913357,5.049218023,1.872156273,4.243038049,3.880241776,3.913813852,2.884795364,1.029018488,0,0,0,0,0,0,0,0,0,0,424,BRADFORD,CIRCLE Z BRA PAD,802,PW,159028,gal,liquid,41936,10/24/14,31200,0,6.33,7450,11100,0,63.8,243,837,4.96,33500,0,3960,0,75.9,645,112000,0,245000,5.9,160000,58.7,53000,12200,19500,1340,0,0,0,2014,10,24,CIRCLE,Z,BRA,PAD,0,802,PW,2012,4,16,015-22178,OGO-65420,41.5924,-76.325619,Yes,Horizontal Well,GAS,Bbl,2012,Yes,0,2544631,311,0,0,2012.333333,2.5,14.55223881,4.494154594,0.80140371,3.872156273,4.045322979,1.804820679,2.385606274,2.922725458,4.525044807,3.597695186,0,1.880241776,2.809559715,5.049218023,0,5.389166084,0.770852012,5.204119983,1.768638101,4.72427587,4.086359831,4.290034611,3.127104798,1.162929813,0,0,0,0,0,0,0,0,0,0,425,BRADFORD,DAN ELLIS BRA PAD,804,Flowback,1230889,gal,liquid,41708,3/10/14,50500,0,7.13,6560,18500,0,103,258,1080,10.4,55000,0,4300,0,21.8,734,134000,0,407000,5.7,240000,322,30900,5040,17000,1350,0,0,0,2014,3,10,DAN,ELLIS,BRA,PAD,0,802,Flowback,2010,4,13,015-20480,OGO-65420,41.691936,-76.466036,Yes,Horizontal Well,GAS,Bbl,2012,PW,0,1750808,300,0,0,2010.333333,3.916666667,12.59259259,4.703291378,0.85308953,3.816903839,4.267171728,2.012837225,2.411619706,3.033423755,4.740362689,3.633468456,0,1.338456494,2.86569606,5.127104798,0,5.609594409,0.755874856,5.380211242,2.507855872,4.489958479,3.702430536,4.230448921,3.130333768,1.100115153,0,0,0,0,0,0,0,0,0,0,526,BRADFORD,DAN ELLIS BRA PAD,802,PW,1169309,gal,liquid,41745,4/16/14,64200,0,5.94,7420,23600,0,109,304,1300,11.6,39000,0,5490,0,30.8,873,150000,0,461000,5.8,253000,250,59600,23700,17700,1800,0,0,0,2014,4,16,DAN,ELLIS,BRA,PAD,0,802,PW,2010,4,13,015-20480,OGO-65420,41.691936,-76.466036,Yes,Horizontal Well,GAS,Bbl,2012,Yes,0,1750808,300,0,0,2010.333333,4,9.833333333,4.807535028,0.773786445,3.870403905,4.372912003,2.037426498,2.482873584,3.113943352,4.591064607,3.739572344,0,1.488550717,2.941014244,5.176091259,0,5.663700925,0.763427994,5.403120521,2.397940009,4.77524626,4.374748346,4.247973266,3.255272505,0.992700761,0,0,0,0,0,0,0,0,0,0,427,BRADFORD,FINAN BRA PAD,804,Flowback,126060,gal,liquid,41899,9/17/14,17900,0,7.29,7910,6390,0,66.3,226,466,3.57,26600,0,2040,0,137,481,63000,0,204000,6.5,107000,242,35300,13200,8830,751,0,0,0,2014,9,17,FINAN,BRA,PAD,0,0,802,Flowback,2013,8,10,015-22698,OGO-65420,41.568328,-76.347783,Yes,Horizontal Well,GAS,Bbl,Yes,PW,0,1654711,118,0,0,2013.666667,1.083333333,11.75765646,4.252853031,0.862727528,3.898176483,3.805500858,1.821513528,2.354108439,2.668385917,4.424881637,3.309630167,0,2.136720567,2.682145076,4.799340549,0,5.309630167,0.812913357,5.029383778,2.383815366,4.547774705,4.120573931,3.945960704,2.875639937,1.070320767,0,0,0,0,0,0,0,0,0,0,528,BRADFORD,FINAN BRA PAD,802,PW,272138,gal,liquid,41921,10/9/14,16200,0,6.2,7650,5820,0,67.2,212,415,3.29,24500,0,1940,0,101,344,59800,36800,190000,6.4,118000,190,14500,3640,8860,737,0,0,0,2014,10,9,FINAN,BRA,PAD,0,0,802,PW,2013,8,10,015-22698,OGO-65420,41.568328,-76.347783,Yes,Horizontal Well,GAS,Bbl,Yes,Yes,75,1654711,118,0,0,2013.666667,1.166666667,12.02170963,4.209515015,0.792391689,3.883661435,3.764922985,1.827369273,2.326335861,2.618048097,4.389166084,3.28780173,0,2.004321374,2.536558443,4.776701184,4.565847819,5.278753601,0.806179974,5.071882007,2.278753601,4.161368002,3.561101384,3.947433722,2.867467488,1.079966234,0,0,0,0,0,0,0,0,0,0,429,BRADFORD,FREED BRA PAD,804,Flowback,410567,gal,liquid,41814,6/24/14,24100,0,6.46,4430,8720,0,52.2,197,558,3.44,22200,0,2600,0,97.3,474,71600,0,255000,6.2,140000,403,26500,12900,8500,955,0,0,0,2014,6,24,FREED,BRA,PAD,0,0,802,Flowback,2013,3,21,015-22443,OGO-65420,41.596686,-76.381422,Yes,Horizontal Well,GAS,Bbl,2013,PW,0,2201398,197,0,0,2013.25,1.25,8.90052356,4.382017043,0.810232518,3.646403726,3.940516485,1.717670503,2.294466226,2.746634199,4.346352974,3.414973348,0,1.98811284,2.675778342,4.854913022,0,5.40654018,0.792391689,5.146128036,2.605305046,4.423245874,4.11058971,3.929418926,2.980003372,0.949415554,0,0,0,0,0,0,0,0,0,0,530,BRADFORD,FREED BRA PAD,802,PW,224492,gal,liquid,41841,7/21/14,28200,0,6.94,6210,10200,0,95.1,250,668,4.93,25100,0,3660,0,113,494,95300,0,267000,6.3,174000,174,26600,9740,9870,1190,0,0,0,2014,7,21,FREED,BRA,PAD,0,0,802,PW,2013,3,21,015-22443,OGO-65420,41.596686,-76.381422,Yes,Horizontal Well,GAS,Bbl,2013,Yes,0,2201398,197,0,0,2013.25,1.333333333,8.294117647,4.450249108,0.84135947,3.7930916,4.008600172,1.978180517,2.397940009,2.824776462,4.399673721,3.563481085,0,2.053078443,2.693726949,4.979092901,0,5.426511261,0.799340549,5.240549248,2.240549248,4.424881637,3.988558957,3.994317153,3.075546961,0.918770191,0,0,0,0,0,0,0,0,0,0,431,BRADFORD,GOWAN BRA PAD,804,Flowback,64053,gal,liquid,41801,6/11/14,67100,0,7.4,3920,24500,0,282,326,1450,17.6,50500,0,5950,2.4,30.8,913,181000,0,436000,5.6,267000,648,44900,21500,13200,2030,0,0,0,2014,6,11,GOWAN,BRA,PAD,0,0,802,Flowback,2009,10,7,015-20375,OGO-65420,41.642644,-76.374069,Yes,Horizontal Well,GAS,Bbl,2012,PW,0,1167515,209,0,0,2009.833333,4.666666667,6.502463054,4.82672252,0.86923172,3.593286067,4.389166084,2.450249108,2.5132176,3.161368002,4.703291378,3.774516966,0.380211242,1.488550717,2.960470778,5.257678575,0,5.639486489,0.748188027,5.426511261,2.811575006,4.652246341,4.33243846,4.120573931,3.307496038,0.813077893,0,0,0,0,0,0,0,0,0,0,532,BRADFORD,JAMES BARRETT BRA PAD,804,Flowback,274111,gal,liquid,41754,4/25/14,44600,0,6.08,4220,16400,0,107,233,897,8.17,59900,0,3930,0,49.7,789,152000,0,514000,6,330000,895,21300,4520,14300,1640,0,0,0,2014,4,25,JAMES,BARRETT,BRA,PAD,0,802,Flowback,2009,2,15,015-20120,OGO-65420,41.674049,-76.378271,Yes,Horizontal Well,GAS,Bbl,2013,PW,0,0,0,0,0,2009.166667,5.166666667,8.719512195,4.649334859,0.783903579,3.625312451,4.214843848,2.029383778,2.367355921,2.952792443,4.777426822,3.59439255,0,1.696356389,2.897077003,5.181843588,0,5.710963119,0.77815125,5.51851394,2.951823035,4.328379603,3.655138435,4.155336037,3.214843848,0.940492189,0,0,0,0,0,0,0,0,0,0,533,BRADFORD,JOE BRA PAD,804,Flowback,103972,gal,liquid,41899,9/17/14,30000,0,6.63,8090,10800,0,49.3,272,731,17.6,29900,0,3980,0,85.8,732,89400,0,291000,6.3,162000,65.8,38600,21200,10700,1190,0,0,0,2014,9,17,JOE,BRA,PAD,0,0,802,Flowback,2011,11,8,015-21976,OGO-65420,41.600725,-76.230739,Yes,Horizontal Well,GAS,Bbl,2012,PW,0,0,0,0,0,2011.916667,2.833333333,8.991596639,4.477121255,0.821513528,3.907948522,4.033423755,1.692846919,2.434568904,2.863917377,4.475671188,3.599883072,0,1.933487288,2.864511081,4.951337519,0,5.463892989,0.799340549,5.209515015,1.818225894,4.586587305,4.326335861,4.029383778,3.075546961,0.953836816,0,0,0,0,0,0,0,0,0,0,534,BRADFORD,JOE BRA PAD,802,PW,172635,gal,liquid,41927,10/15/14,296000,0,61.1,22000,106000,0,461,2650,7320,161,290000,0,39400,8.24,64.3,664,90500,0,277000,6,175000,31,24400,7390,10600,1160,0,0,0,2014,10,15,JOE,BRA,PAD,0,0,802,PW,2011,11,8,015-21976,OGO-65420,41.600725,-76.230739,Yes,Horizontal Well,GAS,Bbl,2012,Yes,0,0,0,0,0,2011.916667,2.916666667,9.137931034,5.471291711,1.78604121,4.342422681,5.025305865,2.663700925,3.423245874,3.864511081,5.462397998,4.595496222,0.915927212,1.808210973,2.822168079,4.956648579,0,5.442479769,0.77815125,5.243038049,1.491361694,4.387389826,3.868644438,4.025305865,3.064457989,0.960847876,0,0,0,0,0,0,0,0,0,0,435,BRADFORD,LINES BRA PAD,804,Flowback,61950,gal,liquid,41745,4/16/14,24100,0,0,10200,8680,0,189,222,587,5.72,26700,0,3070,0,146,452,74100,0,253000,6.3,167000,501,154,53,11200,569,0,0,0,2014,4,16,LINES,BRA,PAD,0,0,802,Flowback,2012,2,1,015-22104,OGO-65420,41.683444,-76.506261,Yes,Horizontal Well,GAS,Bbl,2012,PW,0,2458880,264,0,0,2012.166667,2.166666667,19.68365554,4.382017043,0,4.008600172,3.938519725,2.276461804,2.346352974,2.768638101,4.426511261,3.487138375,0,2.164352856,2.655138435,4.869818208,0,5.403120521,0.799340549,5.222716471,2.699837726,2.187520721,1.72427587,4.049218023,2.755112266,1.294105756,0,0,0,0,0,0,0,0,0,0,536,BRADFORD,LINES BRA PAD,802,PW,117928,gal,liquid,41794,6/4/14,19100,0,0,9270,6860,0,78,225,481,2.96,15200,0,2610,0,104,524,77700,0,205000,6.3,170000,165,9500,5510,10200,737,0,0,0,2014,6,4,LINES,BRA,PAD,0,0,802,PW,2012,2,1,015-22104,OGO-65420,41.683444,-76.506261,Yes,Horizontal Well,GAS,Bbl,2012,Yes,0,2458880,264,0,0,2012.166667,2.333333333,13.83989145,4.281033367,0,3.967079734,3.836324116,1.892094603,2.352182518,2.682145076,4.181843588,3.416640507,0,2.017033339,2.719331287,4.890421019,0,5.311753861,0.799340549,5.230448921,2.217483944,3.977723605,3.741151599,4.008600172,2.867467488,1.141132684,0,0,0,0,0,0,0,0,0,0,437,BRADFORD,MAKAYLA BRA PAD,802,PW,244894,gal,liquid,41730,4/1/14,37600,0,5.03,13000,13600,0,155,301,917,6.65,33400,0,5540,0,83.5,688,134000,0,344000,6.3,171000,171,38900,13100,13700,1630,0,0,0,2014,4,1,MAKAYLA,BRA,PAD,0,0,802,PW,2012,8,27,015-22230,OGO-65420,41.628611,-76.210144,Yes,Horizontal Well,GAS,Bbl,2012,Yes,0,3241483,364,0,0,2012.666667,1.666666667,8.404907975,4.575187845,0.701567985,4.113943352,4.133538908,2.190331698,2.478566496,2.962369336,4.523746467,3.743509765,0,1.921686475,2.837588438,5.127104798,0,5.536558443,0.799340549,5.23299611,2.23299611,4.589949601,4.117271296,4.136720567,3.212187604,0.924532963,0,0,0,0,0,0,0,0,0,0,438,BRADFORD,MANAHAN BRA PAD,804,Flowback,373747,gal,liquid,41887,9/5/14,30000,0,6.59,5990,10900,0,85.6,196,707,4.81,31700,0,3290,0,65,468,63200,0,271000,6.2,163000,75.3,37700,10600,11500,920,0,0,0,2014,9,5,MANAHAN,BRA,PAD,0,0,802,Flowback,2012,10,11,015-22176,OGO-65420,41.602794,-76.471386,Yes,Horizontal Well,GAS,Bbl,2012,PW,0,0,0,0,0,2012.833333,1.916666667,12.5,4.477121255,0.818885415,3.777426822,4.037426498,1.932473765,2.292256071,2.849419414,4.501059262,3.517195898,0,1.812913357,2.670245853,4.800717078,0,5.432969291,0.792391689,5.212187604,1.876794976,4.57634135,4.025305865,4.06069784,2.963787827,1.096910013,0,0,0,0,0,0,0,0,0,0,539,BRADFORD,MANAHAN BRA PAD,802,PW,276598,gal,liquid,41921,10/9/14,41000,0,6.77,6370,14800,0,100,248,973,6.31,26800,0,3910,0,49.5,517,74300,0,302000,5.9,239000,80,27200,8300,14500,1300,0,0,0,2014,10,9,MANAHAN,BRA,PAD,0,0,802,PW,2012,10,11,015-22176,OGO-65420,41.602794,-76.471386,Yes,Horizontal Well,GAS,Bbl,2012,Yes,0,0,0,0,0,2012.833333,2,11.15384615,4.612783857,0.830588669,3.804139432,4.170261715,2,2.394451681,2.98811284,4.428134794,3.592176757,0,1.694605199,2.713490543,4.870988814,0,5.480006943,0.770852012,5.378397901,1.903089987,4.434568904,3.919078092,4.161368002,3.113943352,1.04742465,0,0,0,0,0,0,0,0,0,0,440,BRADFORD,MORSE BRA PAD,802,PW,203189,gal,liquid,41760,5/1/14,101000,0,5.89,2100,36600,0,108,306,2290,20.1,15700,0,5710,0,0,1560,217000,0,511000,4.6,351000,530,32000,7250,12600,2580,0,0,0,2014,5,1,MORSE,BRA,PAD,0,0,802,PW,2010,8,17,015-20929,OGO-65420,41.683219,-76.656019,Yes,Horizontal Well,GAS,Bbl,2012,Yes,0,166528,335,0,0,2010.666667,3.75,4.88372093,5.004321374,0.770115295,3.322219295,4.563481085,2.033423755,2.485721426,3.359835482,4.195899652,3.756636108,0,0,3.193124598,5.336459734,0,5.7084209,0.662757832,5.545307116,2.72427587,4.505149978,3.860338007,4.100370545,3.411619706,0.688750839,0,0,0,0,0,0,0,0,0,0,441,BRADFORD,RAINBOW BRA PAD,804,Flowback,559413,gal,liquid,41814,6/24/14,18800,0,5.27,5890,6850,0,78.5,165,419,8.09,19900,0,1700,0,127,327,66700,0,201000,6.3,119000,146,23300,12900,6200,795,0,0,0,2014,6,24,RAINBOW,BRA,PAD,0,0,802,Flowback,2012,11,8,015-22257,OGO-65420,41.576261,-76.357683,Yes,Horizontal Well,GAS,Bbl,2012,PW,0,2000022,198,0,0,2012.916667,1.583333333,7.798742138,4.274157849,0.721810615,3.770115295,3.835690571,1.894869657,2.217483944,2.622214023,4.298853076,3.230448921,0,2.103803721,2.514547753,4.824125834,0,5.303196057,0.799340549,5.075546961,2.164352856,4.367355921,4.11058971,3.792391689,2.900367129,0.892024561,0,0,0,0,0,0,0,0,0,0,542,BRADFORD,RAINBOW BRA PAD,802,PW,176900,gal,liquid,41837,7/17/14,18900,0,6.12,9480,6830,0,99.6,206,454,10.6,27300,0,2690,0,102,403,78100,0,232000,6.4,112000,67.8,11400,2440,6760,797,0,0,0,2014,7,17,RAINBOW,BRA,PAD,0,0,802,PW,2012,11,8,015-22257,OGO-65420,41.576261,-76.357683,Yes,Horizontal Well,GAS,Bbl,2012,Yes,0,2000022,198,0,0,2012.916667,1.666666667,8.481806775,4.276461804,0.786751422,3.976808337,3.834420704,1.998259338,2.31386722,2.657055853,4.436162647,3.42975228,0,2.008600172,2.605305046,4.892651034,0,5.365487985,0.806179974,5.049218023,1.831229694,4.056904851,3.387389826,3.829946696,2.901458321,0.928488375,0,0,0,0,0,0,0,0,0,0,443,BRADFORD,STETHERS BRA PAD,804,Flowback,974543,gal,liquid,41689,2/19/14,34100,0,0,8080,12200,0,71,197,878,4.43,30500,0,3910,0,43.9,572,106000,0,271000,6.1,149000,83,19000,5380,13100,839,0,0,0,2014,2,19,STETHERS,BRA,PAD,0,0,802,Flowback,2012,12,18,015-22281,OGO-65420,41.730522,-76.226656,Yes,Horizontal Well,GAS,Bbl,2013,PW,0,2006723,317,0,0,2013,1.166666667,15.61382598,4.532754379,0,3.907411361,4.086359831,1.851258349,2.294466226,2.943494516,4.484299839,3.592176757,0,1.64246452,2.757396029,5.025305865,0,5.432969291,0.785329835,5.173186268,1.919078092,4.278753601,3.730782276,4.117271296,2.923761961,1.193509335,0,0,0,0,0,0,0,0,0,0,544,BRADFORD,STETHERS BRA PAD,802,PW,412123,gal,liquid,41746,4/17/14,47800,0,0,11600,17100,0,116,261,1250,6.67,37300,0,4880,0,70.2,553,132000,0,386000,6.2,294000,119,314,121,15600,1330,0,0,0,2014,4,17,STETHERS,BRA,PAD,0,0,802,PW,2012,12,18,015-22281,OGO-65420,41.730522,-76.226656,Yes,Horizontal Well,GAS,Bbl,2013,Yes,0,2006723,317,0,0,2013,1.333333333,11.72932331,4.679427897,0,4.064457989,4.23299611,2.064457989,2.416640507,3.096910013,4.571708832,3.688419822,0,1.846337112,2.742725131,5.120573931,0,5.586587305,0.792391689,5.46834733,2.075546961,2.496929648,2.08278537,4.193124598,3.123851641,1.069272957,0,0,0,0,0,0,0,0,0,0,445,BRADFORD,STORMS BRA PAD,804,Flowback,439973,gal,liquid,41724,3/26/14,25800,0,0,8680,9160,0,62.4,189,706,2.96,25600,0,3190,0,83.3,413,77700,0,248000,6.4,130000,147,14600,3750,5600,824,0,0,0,2014,3,26,STORMS,BRA,PAD,0,0,802,Flowback,2009,12,4,015-20413,OGO-65420,41.726017,-76.178514,Yes,Horizontal Well,GAS,Bbl,2012,PW,0,526603,284,0,0,2010,4.25,6.796116505,4.411619706,0,3.938519725,3.961895474,1.79518459,2.276461804,2.848804701,4.408239965,3.503790683,0,1.920645001,2.615950052,4.890421019,0,5.394451681,0.806179974,5.113943352,2.167317335,4.164352856,3.574031268,3.748188027,2.915927212,0.832260815,0,0,0,0,0,0,0,0,0,0,546,BRADFORD,STORMS BRA PAD,802,PW,670083,gal,liquid,41774,5/15/14,36400,0,0,15700,13000,0,92.6,262,981,4.4,33200,0,5310,0,96.8,652,104000,0,339000,6.1,171000,145,19000,7800,7640,1090,0,0,0,2014,5,15,STORMS,BRA,PAD,0,0,802,PW,2009,12,4,015-20413,OGO-65420,41.726017,-76.178514,Yes,Horizontal Well,GAS,Bbl,2012,Yes,0,526603,284,0,0,2010,4.416666667,7.009174312,4.561101384,0,4.195899652,4.113943352,1.966610987,2.418301291,2.991669007,4.521138084,3.725094521,0,1.985875357,2.814247596,5.017033339,0,5.530199698,0.785329835,5.23299611,2.161368002,4.278753601,3.892094603,3.883093359,3.037426498,0.845666861,0,0,0,0,0,0,0,0,0,0,447,BRADFORD,TUFANO BRA PAD,804,Flowback,1026067,gal,liquid,41852,8/1/14,38800,0,7.31,6590,14100,0,70.7,209,879,6.16,35300,0,3910,0,67.2,532,95500,0,282000,6.2,239000,357,32500,14200,15000,1020,0,0,0,2014,8,1,TUFANO,BRA,PAD,0,0,802,Flowback,2013,5,19,015-22296,OGO-65420,41.618931,-76.531608,Yes,Horizontal Well,GAS,Bbl,Yes,PW,0,1658699,162,0,0,2013.416667,1.25,14.70588235,4.588831726,0.863917377,3.818885415,4.149219113,1.849419414,2.320146286,2.943988875,4.547774705,3.592176757,0,1.827369273,2.725911632,4.980003372,0,5.450249108,0.792391689,5.378397901,2.552668216,4.511883361,4.152288344,4.176091259,3.008600172,1.167491087,0,0,0,0,0,0,0,0,0,0,548,BRADFORD,TUFANO BRA PAD,802,PW,1452670,gal,liquid,41876,8/25/14,43600,0,6.82,7740,15800,0,77.1,225,1010,6.91,35600,0,4350,0,89.9,604,117000,0,285000,6.4,184000,141,39400,20000,14600,1200,0,0,0,2014,8,25,TUFANO,BRA,PAD,0,0,802,PW,2013,5,19,015-22296,OGO-65420,41.618931,-76.531608,Yes,Horizontal Well,GAS,Bbl,Yes,Yes,0,1658699,162,0,0,2013.416667,1.25,12.16666667,4.639486489,0.833784375,3.888740961,4.198657087,1.887054378,2.352182518,3.004321374,4.551449998,3.638489257,0,1.953759692,2.781036939,5.068185862,0,5.45484486,0.806179974,5.264817823,2.149219113,4.595496222,4.301029996,4.164352856,3.079181246,1.08517161,0,0,0,0,0,0,0,0,0,0,449,BRADFORD,YEDWIN CA BRA PAD,804,Flowback,931605,gal,liquid,41870,8/19/14,20200,0,5.49,4270,7280,0,60.8,150,482,3.64,25200,0,2180,0,79.5,404,28900,0,174000,6.5,102000,109,38600,8910,5910,603,0,0,0,2014,8,19,YEDWIN,CA,BRA,PAD,0,802,Flowback,0,0,0,0,0,0,0,0,0,0,0,0,0,0,0,0,0,0,0,0,9.800995025,4.305351369,0.739572344,3.630427875,3.862131379,1.783903579,2.176091259,2.683047038,4.401400541,3.338456494,0,1.900367129,2.606381365,4.460897843,0,5.240549248,0.812913357,5.008600172,2.037426498,4.586587305,3.949877704,3.771587481,2.780317312,0.991270169,0,0,0,0,0,0,0,0,0,0,550,BRADFORD,YEDWIN CA BRA PAD,802,PW,708006,gal,liquid,41912,9/30/14,31700,0,5.73,6910,11500,0,86.6,209,747,6.17,31100,0,3580,0,101,473,102000,0,257000,6.3,145000,57,39400,13400,16700,969,0,0,0,2014,9,30,YEDWIN,CA,BRA,PAD,0,802,PW,0,0,0,0,0,0,0,0,0,0,0,0,0,0,0,0,0,0,0,0,17.23426213,4.501059262,0.758154622,3.839478047,4.06069784,1.937517892,2.320146286,2.873320602,4.492760389,3.553883027,0,2.004321374,2.674861141,5.008600172,0,5.409933123,0.799340549,5.161368002,1.755874856,4.595496222,4.127104798,4.222716471,2.986323777,1.236392694,0,0,0,0,0,0,0,0,0,0,451,BRADFORD,YOST BRA PAD,804,Flowback,2157603,gal,liquid,41936,10/24/14,25600,0,5.51,3810,9310,0,56.9,138,572,5.6,26600,0,2150,0,59.5,368,76800,0,204000,6,131000,97.3,15300,3610,5610,507,0,0,0,2014,10,24,YOST,BRA,PAD,0,0,802,Flowback,2014,5,7,015-22237,OGO-65420,41.706811,-76.558739,Yes,Horizontal Well,GAS,Bbl,Yes,PW,0,581881,72,0,0,2014.416667,0.416666667,11.06508876,4.408239965,0.741151599,3.580924976,3.968949681,1.755112266,2.139879086,2.757396029,4.424881637,3.33243846,0,1.774516966,2.565847819,4.88536122,0,5.309630167,0.77815125,5.117271296,1.98811284,4.184691431,3.557507202,3.748962861,2.705007959,1.043954902,0,0,0,0,0,0,0,0,0,0,552,BRADFORD,YOST BRA PAD,802,PW,915504,gal,liquid,41984,12/11/14,18700,0,0,3190,6800,0,23.5,94.5,426,2.59,7740,0,1800,0,62.8,752,121000,0,342000,6.7,227000,98,42700,20800,14700,1470,0,0,0,2014,12,11,YOST,BRA,PAD,0,0,802,PW,2014,5,7,015-22237,OGO-65420,41.706811,-76.558739,Yes,Horizontal Well,GAS,Bbl,Yes,Yes,45,581881,72,0,0,2014.416667,0.583333333,10,4.271841607,0,3.503790683,3.832508913,1.371067862,1.975431809,2.629409599,3.888740961,3.255272505,0,1.797959644,2.876217841,5.08278537,0,5.534026106,0.826074803,5.356025857,1.991226076,4.630427875,4.318063335,4.167317335,3.167317335,1,0,0,0,0,0,0,0,0,0,0,453,BRADFORD,ACW BRA PAD,804,Flowback,84236,gal,liquid,41423,5/29/13,51600,0.1,4.8,11900,14000,0,136,225,1060,5.1,31200,0.184,4000,0,114,832,113000,0,278000,6.1,257000,202,29500,4900,9690,1050,0,0,0,2013,5,29,ACW,BRA,PAD,0,0,802,Flowback,2012,1,16,015-21872,OGO-65420,41.669144,-76.70065,Yes,Horizontal Well,GAS,Bbl,2012,PW,0,1570135,214,0,0,2012.083333,1.333333333,9.228571429,4.712649702,0.681241237,4.075546961,4.146128036,2.133538908,2.352182518,3.025305865,4.494154594,3.602059991,0,2.056904851,2.920123326,5.053078443,0,5.444044796,0.785329835,5.409933123,2.305351369,4.469822016,3.69019608,3.986323777,3.021189299,0.965134478,0,0,0,0,0,0,0,0,0,0,554,BRADFORD,ACW BRA PAD,802,PW,143416,gal,liquid,41487,8/1/13,57500,0,3.94,11200,15000,0,80.1,208,1050,5.54,26700,0,3770,0,43.3,887,99600,0,329000,6,256000,193,59000,14600,8600,1190,0,0,0,2013,8,1,ACW,BRA,PAD,0,0,802,PW,2012,1,16,015-21872,OGO-65420,41.669144,-76.70065,Yes,Horizontal Well,GAS,Bbl,2012,Yes,0,1570135,214,0,0,2012.083333,1.583333333,7.226890756,4.759667845,0.595496222,4.049218023,4.176091259,1.903632516,2.318063335,3.021189299,4.426511261,3.57634135,0,1.636487896,2.94792362,4.998259338,0,5.517195898,0.77815125,5.408239965,2.285557309,4.770852012,4.164352856,3.934498451,3.075546961,0.85895149,0,0,0,0,0,0,0,0,0,0,455,BRADFORD,AKITA BRA PAD,802,PW,205332,gal,liquid,41429,6/4/13,76800,0,2.96,14300,18400,0,130,263,1370,3.39,34200,0,7640,0.517,40.6,812,121000,0,364000,6,290000,214,25100,10600,12900,1250,0,0,0,2013,6,4,AKITA,BRA,PAD,0,0,802,PW,2010,8,6,015-20998,OGO-65420,41.865908,-76.610467,Yes,Horizontal Well,GAS,Bbl,2012,Yes,0,889589,351,0,0,2010.666667,2.833333333,10.32,4.88536122,0.471291711,4.155336037,4.264817823,2.113943352,2.419955748,3.136720567,4.534026106,3.883093359,-0.286509457,1.608526034,2.909556029,5.08278537,0,5.561101384,0.77815125,5.462397998,2.330413773,4.399673721,4.025305865,4.11058971,3.096910013,1.013679697,0,0,0,0,0,0,0,0,0,0,456,BRADFORD,ALBERTSON BRA PAD,802,PW,267977,gal,liquid,41430,6/5/13,82500,0,3.23,11700,19500,0,95.9,218,1590,6.37,38500,0,5810,0,34.4,1020,137000,0,381000,5.9,295000,71.6,15000,4020,13500,1320,0,0,0,2013,6,5,ALBERTSON,BRA,PAD,0,0,802,PW,2011,12,14,015-22020,OGO-65420,41.927275,-76.488467,Yes,Horizontal Well,GAS,Bbl,2012,Yes,0,294646,363,0,0,2012,1.5,10.22727273,4.916453949,0.509202522,4.068185862,4.290034611,1.981818607,2.338456494,3.201397124,4.58546073,3.764176132,0,1.536558443,3.008600172,5.136720567,0,5.580924976,0.770852012,5.469822016,1.854913022,4.176091259,3.604226053,4.130333768,3.120573931,1.009759837,0,0,0,0,0,0,0,0,0,0,457,BRADFORD,ALDERFER BRA PAD,802,PW,143847,gal,liquid,41395,5/1/13,70300,0,3.25,9350,19600,0,66.7,184,1600,4.48,26800,0,4920,0,44.9,894,119000,0,307000,6.2,228000,34.4,26200,11600,11000,1180,0,0,0,2013,5,1,ALDERFER,BRA,PAD,0,0,802,PW,2010,9,14,015-20989,OGO-65420,41.931944,-76.409753,Yes,Horizontal Well,GAS,Bbl,2012,Yes,0,316183,364,0,0,2010.75,2.666666667,9.322033898,4.846955325,0.511883361,3.970811611,4.292256071,1.824125834,2.264817823,3.204119983,4.428134794,3.691965103,0,1.652246341,2.951337519,5.075546961,0,5.487138375,0.792391689,5.357934847,1.536558443,4.418301291,4.064457989,4.041392685,3.071882007,0.969510678,0,0,0,0,0,0,0,0,0,0,458,BRADFORD,ALEXANDER BRA PAD,804,Flowback,936952,gal,liquid,41397,5/3/13,44300,0,6.24,11200,10800,0,65.1,283,712,3.41,37600,0,4150,0,92.7,665,87700,0,248000,6.5,193000,67.2,10800,2000,11500,1020,0,0,0,2013,5,3,ALEXANDER,BRA,PAD,0,0,802,Flowback,2011,12,15,015-21965,OGO-65420,41.612803,-76.312358,Yes,Horizontal Well,GAS,Bbl,2012,PW,0,974284,246,0,0,2012,1.416666667,11.2745098,4.646403726,0.79518459,4.049218023,4.033423755,1.813580989,2.451786436,2.852479994,4.575187845,3.618048097,0,1.967079734,2.822821645,4.942999593,0,5.394451681,0.812913357,5.285557309,1.827369273,4.033423755,3.301029996,4.06069784,3.008600172,1.052097669,0,0,0,0,0,0,0,0,0,0,559,BRADFORD,ALEXANDER BRA PAD,802,PW,496932,gal,liquid,41493,8/7/13,50600,0,5.5,13200,13200,0,138,293,905,6.05,41300,0,5250,0,109,730,110000,0,342000,6,245000,92,39800,23800,18100,1560,0,0,0,2013,8,7,ALEXANDER,BRA,PAD,0,0,802,PW,2011,12,15,015-21965,OGO-65420,41.612803,-76.312358,Yes,Horizontal Well,GAS,Bbl,2012,Yes,0,974284,246,0,0,2012,1.666666667,11.6025641,4.704150517,0.740362689,4.120573931,4.120573931,2.139879086,2.46686762,2.956648579,4.615950052,3.720159303,0,2.037426498,2.86332286,5.041392685,0,5.534026106,0.77815125,5.389166084,1.963787827,4.599883072,4.376576957,4.257678575,3.193124598,1.064553977,0,0,0,0,0,0,0,0,0,0,460,BRADFORD,ALKAN BRA PAD,804,Flowback,234394,gal,liquid,41549,10/2/13,30300,0,6.96,11600,10900,0,100,292,767,6.23,40500,0,4310,4.67,85.2,618,89400,0,241000,6.1,158000,282,23200,5110,11500,1060,0,0,0,2013,10,2,ALKAN,BRA,PAD,0,0,802,Flowback,2012,1,19,015-22087,OGO-65420,41.628447,-76.271922,Yes,Horizontal Well,GAS,Bbl,2012,PW,0,887242,98,0,0,2012.083333,1.75,10.8490566,4.481442629,0.84260924,4.064457989,4.037426498,2,2.465382851,2.884795364,4.607455023,3.63447727,0.669316881,1.930439595,2.790988475,4.951337519,0,5.382017043,0.785329835,5.198657087,2.450249108,4.365487985,3.7084209,4.06069784,3.025305865,1.035391975,0,0,0,0,0,0,0,0,0,0,561,BRADFORD,ALKAN BRA PAD,802,PW,259514,gal,liquid,41583,11/5/13,29900,0,5.99,12000,10700,0,112,297,777,5.56,33700,0,4300,0,84.3,471,94500,0,282000,6.2,195000,31.2,32000,13100,11600,1200,0,0,0,2013,11,5,ALKAN,BRA,PAD,0,0,802,PW,2012,1,19,015-22087,OGO-65420,41.628447,-76.271922,Yes,Horizontal Well,GAS,Bbl,2012,Yes,0,887242,98,0,0,2012.083333,1.833333333,9.666666667,4.475671188,0.777426822,4.079181246,4.029383778,2.049218023,2.472756449,2.890421019,4.527629901,3.633468456,0,1.925827575,2.673020907,4.975431809,0,5.450249108,0.792391689,5.290034611,1.494154594,4.505149978,4.117271296,4.064457989,3.079181246,0.985276743,0,0,0,0,0,0,0,0,0,0,462,BRADFORD,ALLFORD BRA PAD,802,PW,410447,gal,liquid,41429,6/4/13,72200,0,2.76,13800,17800,0,81.8,244,1390,3.97,37600,0,7110,0,41.5,931,131000,0,371000,6,290000,65.3,14000,4250,13400,1280,0,0,0,2013,6,4,ALLFORD,BRA,PAD,0,0,802,PW,2010,4,28,015-20769,OGO-65420,41.858908,-76.581269,Yes,Horizontal Well,GAS,Bbl,2012,Yes,0,638242,351,0,0,2010.333333,3.166666667,10.46875,4.858537198,0.440909082,4.139879086,4.250420002,1.912753304,2.387389826,3.1430148,4.575187845,3.851869601,0,1.618048097,2.968949681,5.117271296,0,5.56937391,0.77815125,5.462397998,1.814913181,4.146128036,3.62838893,4.127104798,3.10720997,1.019894829,0,0,0,0,0,0,0,0,0,0,463,BRADFORD,ALTON BRA PAD,802,PW,315388,gal,liquid,41507,8/21/13,41000,0,0,14300,14500,0,185,224,1140,5.08,45000,0,4990,0,49,795,120000,0,323000,5.7,229000,326,15100,4770,10100,940,0,0,0,2013,8,21,ALTON,BRA,PAD,0,0,802,PW,2010,5,18,015-20734,OGO-65420,41.808972,-76.540275,Yes,Horizontal Well,GAS,Bbl,2012,Yes,0,1081920,356,0,0,2010.416667,3.25,10.74468085,4.612783857,0,4.155336037,4.161368002,2.267171728,2.350248018,3.056904851,4.653212514,3.698100546,0,1.69019608,2.900367129,5.079181246,0,5.509202522,0.755874856,5.359835482,2.5132176,4.178976947,3.678518379,4.004321374,2.973127854,1.03119352,0,0,0,0,0,0,0,0,0,0,464,BRADFORD,ATGAS BRA PAD,804,Flowback,110057,gal,liquid,41369,4/5/13,89100,0,3.94,17100,22500,0,87.7,240,1300,8.69,45600,0,6330,0.574,29.3,0,135000,0,365000,5.7,331000,202,20100,10000,5940,1480,0,0,0,2013,4,5,ATGAS,BRA,PAD,0,0,802,Flowback,2010,12,22,015-21237,OGO-65420,41.666425,-76.709769,Yes,Horizontal Well,GAS,Bbl,2012,PW,0,975313,273,0,0,2011,2.333333333,4.013513514,4.949877704,0.595496222,4.23299611,4.352182518,1.942999593,2.380211242,3.113943352,4.658964843,3.80140371,-0.241088108,1.46686762,0,5.130333768,0,5.562292864,0.755874856,5.519827994,2.305351369,4.303196057,4,3.773786445,3.170261715,0.60352473,0,0,0,0,0,0,0,0,0,0,565,BRADFORD,ATGAS BRA PAD,802,PW,193361,gal,liquid,41439,6/14/13,103000,0,3.52,16200,24600,0,88.4,280,1540,11.2,42200,0,5900,0.461,31.1,1040,141000,0,460000,5.6,353000,59,11500,3440,8790,1730,0,0,0,2013,6,14,ATGAS,BRA,PAD,0,0,802,PW,2010,12,22,015-21237,OGO-65420,41.666425,-76.709769,Yes,Horizontal Well,GAS,Bbl,2012,Yes,0,975313,273,0,0,2011,2.5,5.080924855,5.012837225,0.546542663,4.209515015,4.390935107,1.946452265,2.447158031,3.187520721,4.625312451,3.770852012,-0.336299075,1.492760389,3.017033339,5.149219113,0,5.662757832,0.748188027,5.547774705,1.770852012,4.06069784,3.536558443,3.943988875,3.238046103,0.705942772,0,0,0,0,0,0,0,0,0,0,466,BRADFORD,BARCLAY BRA PAD,804,Flowback,399908,gal,liquid,41327,2/22/13,78500,0,5.85,13300,22100,0,74.8,273,1370,9.05,45900,0,5920,0.43,61.6,0,142000,0,360000,6,288000,158,33000,5100,12100,1550,0,0,0,2013,2,22,BARCLAY,BRA,PAD,0,0,802,Flowback,2011,7,1,015-21697,OGO-65420,41.697131,-76.588044,Yes,Horizontal Well,GAS,Bbl,2012,PW,0,709947,328,0,0,2011.583333,1.583333333,7.806451613,4.894869657,0.767155866,4.123851641,4.344392274,1.873901598,2.436162647,3.136720567,4.661812686,3.772321707,-0.366531544,1.789580712,0,5.152288344,0,5.556302501,0.77815125,5.459392488,2.198657087,4.51851394,3.707570176,4.08278537,3.190331698,0.892453672,0,0,0,0,0,0,0,0,0,0,567,BRADFORD,BARCLAY BRA PAD,802,PW,965304,gal,liquid,41439,6/14/13,92000,0,4.7,13900,24800,0,85.2,316,1440,9.1,42200,0,6380,0,34.1,1030,169000,0,450000,5.6,354000,46,20000,4260,16300,1890,0,0,0,2013,6,14,BARCLAY,BRA,PAD,0,0,802,PW,2011,7,1,015-21697,OGO-65420,41.697131,-76.588044,Yes,Horizontal Well,GAS,Bbl,2012,Yes,0,709947,328,0,0,2011.583333,1.916666667,8.624338624,4.963787827,0.672097858,4.1430148,4.394451681,1.930439595,2.499687083,3.158362492,4.625312451,3.804820679,0,1.532754379,3.012837225,5.227886705,0,5.653212514,0.748188027,5.549003262,1.662757832,4.301029996,3.629409599,4.212187604,3.276461804,0.9357258,0,0,0,0,0,0,0,0,0,0,468,BRADFORD,BARNES BRA PAD,802,PW,101010,gal,liquid,41429,6/4/13,50500,0,2.92,12600,10900,0,62.8,241,859,3.3,31200,0,4880,0.42,49.3,638,91900,0,287000,6.1,208000,43.2,16600,6460,8920,818,0,0,0,2013,6,4,BARNES,BRA,PAD,0,0,802,PW,2011,4,28,015-20965,OGO-65420,41.856697,-76.624714,Yes,Horizontal Well,GAS,Bbl,2012,Yes,0,1655964,355,0,0,2011.333333,2.166666667,10.90464548,4.703291378,0.465382851,4.100370545,4.037426498,1.797959644,2.382017043,2.933993164,4.494154594,3.688419822,-0.37675071,1.692846919,2.804820679,4.963315511,0,5.457881897,0.785329835,5.318063335,1.635483747,4.220108088,3.810232518,3.950364854,2.912753304,1.037611551,0,0,0,0,0,0,0,0,0,0,469,BRADFORD,BARTHOLOMEW BRA PAD,804,Flowback,25158,gal,liquid,41373,4/9/13,42500,0,4.22,10900,10400,0,178,221,741,5.11,38800,0.148,3610,1,89.6,680,88500,0,214000,6.2,205000,218,19500,8970,3680,880,0,0,0,2013,4,9,BARTHOLOMEW,BRA,PAD,0,0,802,Flowback,2012,4,4,015-22156,OGO-65420,41.697392,-76.565364,Yes,Horizontal Well,GAS,Bbl,2012,PW,0,455747,252,0,0,2012.333333,1,4.181818182,4.62838893,0.625312451,4.037426498,4.017033339,2.250420002,2.344392274,2.869818208,4.588831726,3.557507202,0,1.95230801,2.832508913,4.946943271,0,5.330413773,0.792391689,5.311753861,2.338456494,4.290034611,3.952792443,3.565847819,2.944482672,0.621365147,0,0,0,0,0,0,0,0,0,0,570,BRADFORD,BARTHOLOMEW BRA PAD,802,PW,80966,gal,liquid,41439,6/14/13,43700,0,4.36,11400,10800,0,186,251,724,6.15,37200,0,3610,0.527,49.4,489,86000,0,271000,5.9,201000,67,8690,2350,7170,818,0,0,0,2013,6,14,BARTHOLOMEW,BRA,PAD,0,0,802,PW,2012,4,4,015-22156,OGO-65420,41.697392,-76.565364,Yes,Horizontal Well,GAS,Bbl,2012,Yes,0,455747,252,0,0,2012.333333,1.166666667,8.765281174,4.640481437,0.639486489,4.056904851,4.033423755,2.269512944,2.399673721,2.859738566,4.57054294,3.557507202,-0.278189385,1.693726949,2.689308859,4.934498451,0,5.432969291,0.770852012,5.303196057,1.826074803,3.939019776,3.371067862,3.855519156,2.912753304,0.942765852,0,0,0,0,0,0,0,0,0,0,471,BRADFORD,BDF BRA PAD,802,PW,101196,gal,liquid,41429,6/4/13,47600,0,2.85,12200,11300,0,115,196,972,3.82,31100,0,4110,0,55.8,754,99000,0,301000,6,204000,140,6290,3710,3600,845,0,0,0,2013,6,4,BDF,BRA,PAD,0,0,802,PW,2010,10,11,015-20883,OGO-65420,41.865603,-76.640819,Yes,Horizontal Well,GAS,Bbl,2012,Yes,0,1668338,356,0,0,2010.833333,2.666666667,4.26035503,4.677606953,0.45484486,4.086359831,4.053078443,2.06069784,2.292256071,2.987666265,4.492760389,3.613841822,0,1.746634199,2.877371346,4.995635195,0,5.478566496,0.77815125,5.309630167,2.146128036,3.798650645,3.56937391,3.556302501,2.926856709,0.629445792,0,0,0,0,0,0,0,0,0,0,472,BRADFORD,BEEMAN BRA,804,Flowback,0,0,liquid,41277,1/3/13,65700,0,3.1,7320,17900,0,82.5,163,1350,11.6,44800,0,4400,0.92,58,0,119000,0,295000,6.2,239000,53.2,17500,6420,4280,1050,0,0,0,2013,1,3,BEEMAN,BRA,0,0,0,802,Flowback,2011,6,29,015-21588,OGO-65420,41.985658,-76.453019,Yes,Horizontal Well,GAS,Bbl,2012,PW,0,700315,364,0,0,2011.5,1.583333333,4.076190476,4.81756537,0.491361694,3.864511081,4.252853031,1.916453949,2.212187604,3.130333768,4.651278014,3.643452676,-0.036212173,1.763427994,0,5.075546961,0,5.469822016,0.792391689,5.378397901,1.725911632,4.243038049,3.807535028,3.631443769,3.021189299,0.61025447,0,0,0,0,0,0,0,0,0,0,573,BRADFORD,BEEMAN BRA,802,PW,386535,gal,liquid,41430,6/5/13,69900,0,2.77,8790,21200,0,80.1,186,1660,11.7,35200,0,5560,0,22.4,1040,136000,0,387000,5.8,291000,46,10400,3610,5620,1220,0,0,0,2013,6,5,BEEMAN,BRA,0,0,0,802,PW,2011,6,29,015-21588,OGO-65420,41.985658,-76.453019,Yes,Horizontal Well,GAS,Bbl,2012,Yes,0,700315,364,0,0,2011.5,2,4.606557377,4.844477176,0.442479769,3.943988875,4.326335861,1.903632516,2.269512944,3.220108088,4.546542663,3.745074792,0,1.350248018,3.017033339,5.133538908,0,5.587710965,0.763427994,5.463892989,1.662757832,4.017033339,3.557507202,3.749736316,3.086359831,0.663376485,0,0,0,0,0,0,0,0,0,0,474,BRADFORD,BELAWSKE BRA PAD,804,Flowback,108230,gal,liquid,41423,5/29/13,25500,0,4.58,5480,6640,0,87.8,143,537,3.22,27700,0.117,2170,0.205,169,464,59200,0,168000,6.5,131000,197,6860,2680,3850,489,0,0,0,2013,5,29,BELAWSKE,BRA,PAD,0,0,802,Flowback,2011,11,8,015-21831,OGO-65420,41.78315,-76.602236,Yes,Horizontal Well,GAS,Bbl,2012,PW,0,1008553,221,0,0,2011.916667,1.5,7.873210634,4.40654018,0.660865478,3.738780558,3.822168079,1.943494516,2.155336037,2.729974286,4.442479769,3.336459734,-0.688246139,2.227886705,2.666517981,4.772321707,0,5.225309282,0.812913357,5.117271296,2.294466226,3.836324116,3.428134794,3.58546073,2.689308859,0.89615187,0,0,0,0,0,0,0,0,0,0,575,BRADFORD,BELAWSKE BRA PAD,802,PW,202806,gal,liquid,41507,8/21/13,31700,0,0,10700,11200,0,101,197,881,3.61,38600,0,3860,0,87.6,693,98900,0,281000,6.1,184000,102,11500,3640,6290,663,0,0,0,2013,8,21,BELAWSKE,BRA,PAD,0,0,802,PW,2011,11,8,015-21831,OGO-65420,41.78315,-76.602236,Yes,Horizontal Well,GAS,Bbl,2012,Yes,0,1008553,221,0,0,2011.916667,1.75,9.487179487,4.501059262,0,4.029383778,4.049218023,2.004321374,2.294466226,2.944975908,4.586587305,3.586587305,0,1.942504106,2.840733235,4.995196292,0,5.44870632,0.785329835,5.264817823,2.008600172,4.06069784,3.561101384,3.798650645,2.821513528,0.977137117,0,0,0,0,0,0,0,0,0,0,476,BRADFORD,BRACKMAN BRA PAD,802,PW,76969,gal,liquid,41502,8/16/13,71200,0,0,18100,26000,0,94.6,292,1520,12.6,40200,0,6790,0,25.6,1110,152000,0,431000,5.4,361000,85,26900,5380,15900,2240,0,0,0,2013,8,16,BRACKMAN,BRA,PAD,0,0,802,PW,2010,5,14,015-20758,OGO-65420,41.667356,-76.740831,Yes,Horizontal Well,GAS,Bbl,2012,Yes,0,41523,240,0,0,2010.416667,3.25,7.098214286,4.852479994,0,4.257678575,4.414973348,1.975891136,2.465382851,3.181843588,4.604226053,3.831869774,0,1.408239965,3.045322979,5.181843588,0,5.63447727,0.73239376,5.557507202,1.929418926,4.42975228,3.730782276,4.201397124,3.350248018,0.851149106,0,0,0,0,0,0,0,0,0,0,477,BRADFORD,BROWN HOMESTEAD BRA PAD,804,Flowback,425900,gal,liquid,41619,12/11/13,42400,0,5.87,8210,15200,0,82.4,268,1040,5.7,32100,0,4400,0,38.3,754,117000,0,328000,5.7,175000,293,70000,28800,13200,1350,0,0,0,2013,12,11,BROWN,HOMESTEAD,BRA,PAD,0,802,Flowback,2012,11,12,015-22243,OGO-65420,41.660336,-76.245967,Yes,Horizontal Well,GAS,Bbl,2013,PW,0,198464,27,0,0,2012.916667,4.083333333,9.777777778,4.627365857,0.768638101,3.914343157,4.181843588,1.915927212,2.428134794,3.017033339,4.506505032,3.643452676,0,1.583198774,2.877371346,5.068185862,0,5.515873844,0.755874856,5.243038049,2.46686762,4.84509804,4.459392488,4.120573931,3.130333768,0.990240163,0,0,0,0,0,0,0,0,0,0,578,BRADFORD,BURKE BRA PAD,804,Flowback,34020,gal,liquid,41429,6/4/13,11500,0,4.01,3880,2260,0,79.6,138,167,2.19,13800,0,927,0,120,0,34300,0,110000,6.4,64600,375,7140,2510,4460,283,0,0,0,2013,6,4,BURKE,BRA,PAD,0,0,802,Flowback,2011,7,14,015-21735,OGO-65420,41.555439,-76.242356,Yes,Horizontal Well,GAS,Bbl,2012,PW,0,341471,140,0,0,2011.583333,1.5,15.75971731,4.06069784,0.603144373,3.588831726,3.354108439,1.900913068,2.139879086,2.222716471,4.139879086,2.967079734,0,2.079181246,0,4.53529412,0,5.041392685,0.806179974,4.810232518,2.574031268,3.853698212,3.399673721,3.649334859,2.451786436,1.197548423,0,0,0,0,0,0,0,0,0,0,579,BRADFORD,BURKE BRA PAD,802,PW,92087,gal,liquid,41494,8/8/13,25900,0,5.34,9970,7200,0,157,266,493,4.94,32100,0,3550,0,100,677,88000,0,257000,6.1,176000,221,28500,9220,4720,1200,0,0,0,2013,8,8,BURKE,BRA,PAD,0,0,802,PW,2011,7,14,015-21735,OGO-65420,41.555439,-76.242356,Yes,Horizontal Well,GAS,Bbl,2012,PW,0,341471,140,0,0,2011.583333,1.666666667,3.933333333,4.413299764,0.727541257,3.998695158,3.857332496,2.195899652,2.424881637,2.692846919,4.506505032,3.550228353,0,2,2.830588669,4.944482672,0,5.409933123,0.785329835,5.245512668,2.344392274,4.45484486,3.964730921,3.673941999,3.079181246,0.594760753,0,0,0,0,0,0,0,0,0,0,480,BRADFORD,BURKMONT FARMS BRA PAD,804,Flowback,102880,gal,liquid,41397,5/3/13,42800,0,6.83,10400,10200,0,135,282,780,5.85,35700,0,4130,0,159,696,87400,0,253000,6.4,201000,214,7780,1790,9730,1160,0,0,0,2013,5,3,BURKMONT,FARMS,BRA,PAD,0,802,Flowback,2011,6,15,015-21704,OGO-65420,41.602128,-76.267647,Yes,Horizontal Well,GAS,Bbl,2012,PW,0,2551154,248,0,0,2011.5,1.916666667,8.387931034,4.631443769,0.834420704,4.017033339,4.008600172,2.130333768,2.450249108,2.892094603,4.552668216,3.615950052,0,2.201397124,2.84260924,4.941511433,0,5.403120521,0.806179974,5.303196057,2.330413773,3.890979597,3.252853031,3.98811284,3.064457989,0.923654851,0,0,0,0,0,0,0,0,0,0,581,BRADFORD,BURKMONT FARMS BRA PAD,802,PW,128731,gal,liquid,41493,8/7/13,28200,0,5,11300,9810,0,77.8,262,708,5.37,34800,0,3960,0,97.6,678,78600,0,281000,6.1,191000,61.2,25800,11300,8470,1180,0,0,0,2013,8,7,BURKMONT,FARMS,BRA,PAD,0,802,PW,2011,6,15,015-21704,OGO-65420,41.602128,-76.267647,Yes,Horizontal Well,GAS,Bbl,2012,Yes,0,2551154,248,0,0,2011.5,2.166666667,7.177966102,4.450249108,0.698970004,4.053078443,3.991669007,1.890979597,2.418301291,2.850033258,4.541579244,3.597695186,0,1.989449818,2.831229694,4.895422546,0,5.44870632,0.785329835,5.281033367,1.786751422,4.411619706,4.053078443,3.92788341,3.071882007,0.856001403,0,0,0,0,0,0,0,0,0,0,482,BRADFORD,BURNS BRA PAD,804,Flowback,239070,gal,liquid,41425,5/31/13,59900,0,3.79,12800,14800,0,56.6,199,1240,2.32,31400,0,6850,0,62.4,701,90900,0,294000,6,187000,81,20800,5760,17000,893,0,0,0,2013,5,31,BURNS,BRA,PAD,0,0,802,Flowback,2011,10,19,015-21876,OGO-65420,41.889169,-76.520975,Yes,Horizontal Well,GAS,Bbl,2012,PW,0,563360,198,0,0,2011.833333,1.583333333,19.03695409,4.777426822,0.57863921,4.10720997,4.170261715,1.752816431,2.298853076,3.093421685,4.496929648,3.835690571,0,1.79518459,2.845718018,4.958563883,0,5.46834733,0.77815125,5.271841607,1.908485019,4.318063335,3.760422483,4.230448921,2.950851459,1.279597462,0,0,0,0,0,0,0,0,0,0,583,BRADFORD,BURNS BRA PAD,802,PW,260974,gal,liquid,41507,8/21/13,50400,0,0,11000,17600,0,68.5,211,1570,2.82,35500,0,7810,0,37.6,861,127000,0,352000,5.6,262000,75.6,35100,9110,20600,1210,0,0,0,2013,8,21,BURNS,BRA,PAD,0,0,802,PW,2011,10,19,015-21876,OGO-65420,41.889169,-76.520975,Yes,Horizontal Well,GAS,Bbl,2012,Yes,0,563360,198,0,0,2011.833333,1.833333333,17.02479339,4.702430536,0,4.041392685,4.245512668,1.835690571,2.324282455,3.195899652,4.550228353,3.892651034,0,1.575187845,2.935003151,5.103803721,0,5.546542663,0.748188027,5.418301291,1.878521796,4.545307116,3.959518377,4.31386722,3.08278537,1.23108185,0,0,0,0,0,0,0,0,0,0,484,BRADFORD,BUSTIN HOMESTEAD BRA PAD,804,Flowback,254866,gal,liquid,41381,4/17/13,103000,0.24,3.87,8190,28500,0,103,329,2230,5.95,37900,0.513,6840,0,40.9,1310,217000,0,415000,5.9,386000,74.8,41500,23700,31400,2000,0,0,0,2013,4,17,BUSTIN,HOMESTEAD,BRA,PAD,0,802,Flowback,2011,5,12,015-21591,OGO-65420,41.823561,-76.452761,Yes,Horizontal Well,GAS,Bbl,2012,PW,0,219684,279,0,0,2011.416667,1.916666667,15.7,5.012837225,0.587710965,3.913283902,4.45484486,2.012837225,2.517195898,3.348304863,4.57863921,3.835056102,0,1.611723308,3.117271296,5.336459734,0,5.618048097,0.770852012,5.586587305,1.873901598,4.618048097,4.374748346,4.496929648,3.301029996,1.195899652,0,0,0,0,0,0,0,0,0,0,585,BRADFORD,BUSTIN HOMESTEAD BRA PAD,802,PW,903474,gal,liquid,41467,7/12/13,104000,0,3,15500,28300,0,90.6,310,2310,5.77,42200,0,6180,0.358,31.3,1070,163000,0,493000,5.8,418000,80,38100,15500,19200,1990,0,0,0,2013,7,12,BUSTIN,HOMESTEAD,BRA,PAD,0,802,PW,2011,5,12,015-21591,OGO-65420,41.823561,-76.452761,Yes,Horizontal Well,GAS,Bbl,2012,Yes,0,219684,279,0,0,2011.416667,2.166666667,9.648241206,5.017033339,0.477121255,4.190331698,4.451786436,1.957128198,2.491361694,3.36361198,4.625312451,3.790988475,-0.446116973,1.495544338,3.029383778,5.212187604,0,5.692846919,0.763427994,5.621176282,1.903089987,4.580924976,4.190331698,4.283301229,3.298853076,0.984448152,0,0,0,0,0,0,0,0,0,0,486,BRADFORD,CALMITCH BRA PAD,804,Flowback,24486,gal,liquid,41612,12/4/13,33800,0,5.93,8920,12100,0,162,280,856,6.06,25000,0,3600,0,61.7,620,102000,0,302000,5.9,158000,191,72700,27000,13700,1260,0,0,0,2013,12,4,CALMITCH,BRA,PAD,0,0,802,Flowback,2012,4,23,015-22143,OGO-65420,41.601472,-76.278194,Yes,Horizontal Well,GAS,Bbl,2012,DrillFluid,0,0,0,0,0,2012.333333,1.666666667,10.87301587,4.5289167,0.773054693,3.950364854,4.08278537,2.209515015,2.447158031,2.932473765,4.397940009,3.556302501,0,1.790285164,2.792391689,5.008600172,0,5.480006943,0.770852012,5.198657087,2.281033367,4.861534411,4.431363764,4.136720567,3.100370545,1.036350022,0,0,0,0,0,0,0,0,0,0,587,BRADFORD,CALMITCH BRA PAD,802,PW,4200,gal,liquid,41638,12/30/13,29200,0,5.47,8400,10500,0,102,282,740,5.51,29700,0,3750,0,71.8,633,102000,0,357000,6.1,158000,34.8,13400,3700,12900,1130,0,0,0,2013,12,30,CALMITCH,BRA,PAD,0,0,802,PW,2012,4,23,015-22143,OGO-65420,41.601472,-76.278194,Yes,Horizontal Well,GAS,Bbl,2012,DrillFluid,0,0,0,0,0,2012.333333,1.666666667,11.4159292,4.465382851,0.737987326,3.924279286,4.021189299,2.008600172,2.450249108,2.86923172,4.472756449,3.574031268,0,1.856124444,2.80140371,5.008600172,0,5.552668216,0.785329835,5.198657087,1.541579244,4.127104798,3.568201724,4.11058971,3.053078443,1.057511267,0,0,0,0,0,0,0,0,0,0,488,BRADFORD,CHAMPDALE BRA PAD,802,PW,171640,gal,liquid,41394,4/30/13,29100,0,3.2,7280,6670,0,72.5,202,606,3.6,28800,0,2430,0.165,127,523,66900,0,184000,6.5,135000,70,4390,2210,1680,589,0,0,0,2013,4,30,CHAMPDALE,BRA,PAD,0,0,802,PW,2010,5,20,015-20941,OGO-65420,41.663275,-76.159731,Yes,Horizontal Well,GAS,Bbl,2012,Yes,0,2619323,365,0,0,2010.416667,2.916666667,2.85229202,4.463892989,0.505149978,3.862131379,3.824125834,1.860338007,2.305351369,2.782472624,4.459392488,3.385606274,-0.782516056,2.103803721,2.718501689,4.825426118,0,5.264817823,0.812913357,5.130333768,1.84509804,3.64246452,3.344392274,3.225309282,2.770115295,0.455193987,0,0,0,0,0,0,0,0,0,0,489,BRADFORD,CHAMPLUVIER BRA PAD,802,PW,46526,gal,liquid,41394,4/30/13,10700,0,1.87,3390,2030,0,90.1,75.7,161,6.25,11700,0,865,0,137,0,23000,55100,68000,6.7,44000,116,8150,3510,3470,182,0,0,0,2013,4,30,CHAMPLUVIER,BRA,PAD,0,0,802,PW,2010,9,7,015-21060,OGO-65420,41.661997,-76.166508,Yes,Horizontal Well,GAS,Bbl,2012,Yes,0,3561822,365,0,0,2010.75,2.583333333,19.06593407,4.029383778,0.271841607,3.530199698,3.307496038,1.954724791,1.87909588,2.206825876,4.068185862,2.937016107,0,2.136720567,0,4.361727836,4.741151599,4.832508913,0.826074803,4.643452676,2.064457989,3.911157609,3.545307116,3.540329475,2.260071388,1.280258087,0,0,0,0,0,0,0,0,0,0,490,BRADFORD,CLARKE BRA PAD,804,Flowback,302040,gal,liquid,41598,11/20/13,52500,0,6.46,9010,19000,0,86.3,265,1230,9.46,39000,0,5930,0,46.8,740,126000,0,340000,5.7,193000,131,11000,3860,10300,1410,0,0,0,2013,11,20,CLARKE,BRA,PAD,0,0,802,Flowback,2011,2,11,015-21512,OGO-65420,41.582803,-76.534953,Yes,Horizontal Well,GAS,Bbl,Yes,PW,0,372495,53,0,0,2011.166667,2.75,7.304964539,4.720159303,0.810232518,3.954724791,4.278753601,1.936010796,2.423245874,3.089905111,4.591064607,3.773054693,0,1.670245853,2.86923172,5.100370545,0,5.531478917,0.755874856,5.285557309,2.117271296,4.041392685,3.586587305,4.012837225,3.149219113,0.863618112,0,0,0,0,0,0,0,0,0,0,591,BRADFORD,CLARKE BRA PAD,802,PW,82078,gal,liquid,41624,12/16/13,57700,0,5.45,10100,20900,0,116,269,1350,9.04,36700,0,6320,0,95.1,831,161000,0,415000,6.2,196000,86,27400,8480,11500,1520,0,0,0,2013,12,16,CLARKE,BRA,PAD,0,0,802,PW,2011,2,11,015-21512,OGO-65420,41.582803,-76.534953,Yes,Horizontal Well,GAS,Bbl,Yes,Yes,100,372495,53,0,0,2011.166667,2.833333333,7.565789474,4.761175813,0.736396502,4.004321374,4.320146286,2.064457989,2.42975228,3.130333768,4.564666064,3.800717078,0,1.978180517,2.919601024,5.206825876,0,5.618048097,0.792391689,5.292256071,1.934498451,4.437750563,3.928395852,4.06069784,3.181843588,0.878854252,0,0,0,0,0,0,0,0,0,0,492,BRADFORD,COMSTOCK BRA PAD,802,PW,241978,gal,liquid,41528,9/11/13,83800,0,0,13100,29800,0,133,233,2290,10.5,48600,0,8830,0,3.5,1280,153000,0,448000,5.6,338000,313,75200,7660,10300,1860,0,0,0,2013,9,11,COMSTOCK,BRA,PAD,0,0,802,PW,2011,3,16,015-21584,OGO-65420,41.910461,-76.337417,Yes,Horizontal Well,GAS,Bbl,2012,Yes,0,277926,359,0,0,2011.25,2.5,5.537634409,4.923244019,0,4.117271296,4.474216264,2.123851641,2.367355921,3.359835482,4.686636269,3.945960704,0,0.544068044,3.10720997,5.184691431,0,5.651278014,0.748188027,5.5289167,2.495544338,4.876217841,3.88422877,4.012837225,3.269512944,0.74332428,0,0,0,0,0,0,0,0,0,0,493,BRADFORD,COVINGTON BRA PAD,802,PW,127339,gal,liquid,41389,4/25/13,103000,0,3.74,11300,32800,0,107,279,2190,13.3,40700,0,7700,0,49.3,1200,163000,0,424000,6,396000,84.7,32800,8320,20100,1900,0,0,0,2013,4,25,COVINGTON,BRA,PAD,0,0,802,PW,2010,11,11,015-21152,OGO-65420,41.882697,-76.423344,Yes,Horizontal Well,GAS,Bbl,2012,Yes,0,327916,365,0,0,2010.916667,2.416666667,10.57894737,5.012837225,0.572871602,4.053078443,4.515873844,2.029383778,2.445604203,3.340444115,4.609594409,3.886490725,0,1.692846919,3.079181246,5.212187604,0,5.627365857,0.77815125,5.597695186,1.92788341,4.515873844,3.920123326,4.303196057,3.278753601,1.024442456,0,0,0,0,0,0,0,0,0,0,494,BRADFORD,COYLE BRA PAD,804,Flowback,17762,gal,liquid,41374,4/10/13,37100,0,4.74,9280,7910,0,153,235,559,3.48,31600,0,3300,1.07,147,0,77800,54300,191000,6.5,142000,151,21900,9190,8610,964,0,0,0,2013,4,10,COYLE,BRA,PAD,0,0,802,Flowback,2012,2,11,015-22113,OGO-65420,41.586508,-76.394561,Yes,Horizontal Well,GAS,Bbl,2012,PW,0,2789930,288,0,0,2012.166667,1.166666667,8.93153527,4.56937391,0.675778342,3.967547976,3.898176483,2.184691431,2.371067862,2.747411808,4.499687083,3.51851394,0.029383778,2.167317335,0,4.890979597,4.73479983,5.281033367,0.812913357,5.152288344,2.178976947,4.340444115,3.963315511,3.935003151,2.984077034,0.950926118,0,0,0,0,0,0,0,0,0,0,595,BRADFORD,COYLE BRA PAD,802,PW,68948,gal,liquid,41565,10/18/13,21200,0,0,11700,7650,0,149,233,514,4.89,29500,0,3620,0,52.1,618,68800,0,246000,6.4,171000,196,33100,10600,5760,999,0,0,0,2013,10,18,COYLE,BRA,PAD,0,0,802,PW,2012,2,11,015-22113,OGO-65420,41.586508,-76.394561,Yes,Horizontal Well,GAS,Bbl,2012,Yes,0,2789930,288,0,0,2012.166667,1.666666667,5.765765766,4.326335861,0,4.068185862,3.883661435,2.173186268,2.367355921,2.710963119,4.469822016,3.558708571,0,1.716837723,2.790988475,4.837588438,0,5.390935107,0.806179974,5.23299611,2.292256071,4.519827994,4.025305865,3.760422483,2.999565488,0.760856995,0,0,0,0,0,0,0,0,0,0,496,BRADFORD,CRAIN BRA PAD,802,PW,33306,gal,liquid,41530,9/13/13,42900,0,5.51,12000,15100,0,118,172,1290,5.87,40700,0,4470,0,35.4,874,116000,0,347000,5.3,201000,177,20000,5500,11200,1060,0,0,0,2013,9,13,CRAIN,BRA,PAD,0,0,802,PW,2011,7,1,015-21732,OGO-65420,41.903539,-76.389292,Yes,Horizontal Well,GAS,Bbl,2012,Yes,0,547788,364,0,0,2011.583333,2.166666667,10.56603774,4.632457292,0.741151599,4.079181246,4.178976947,2.071882007,2.235528447,3.11058971,4.609594409,3.650307523,0,1.549003262,2.941511433,5.064457989,0,5.540329475,0.72427587,5.303196057,2.247973266,4.301029996,3.740362689,4.049218023,3.025305865,1.023912157,0,0,0,0,0,0,0,0,0,0,497,BRADFORD,CRANRUN BRA PAD,802,PW,149992,gal,liquid,41502,8/16/13,57200,0,0,16800,20500,0,109,217,1470,10.8,39900,0,5850,0,53.2,1050,124000,0,390000,5.9,297000,153,16700,2140,6160,1450,0,0,0,2013,8,16,CRANRUN,BRA,PAD,0,0,802,PW,2010,7,21,015-20995,OGO-65420,41.662872,-76.726075,Yes,Horizontal Well,GAS,Bbl,2012,Yes,0,385693,352,0,0,2010.583333,3.083333333,4.248275862,4.757396029,0,4.225309282,4.311753861,2.037426498,2.336459734,3.167317335,4.600972896,3.767155866,0,1.725911632,3.021189299,5.093421685,0,5.591064607,0.770852012,5.472756449,2.184691431,4.222716471,3.330413773,3.789580712,3.161368002,0.62821271,0,0,0,0,0,0,0,0,0,0,498,BRADFORD,CRYSTAL BRA PAD,804,Flowback,30534,gal,liquid,41375,4/11/13,15900,0,3.55,3070,4070,0,73.4,116,335,3.73,17000,0,1160,0.21,198,0,38400,0,118000,6.6,90800,116,6440,2420,3230,201,0,0,0,2013,4,11,CRYSTAL,BRA,PAD,0,0,802,Flowback,2011,2,19,015-21394,OGO-65420,41.795683,-76.516186,Yes,Horizontal Well,GAS,Bbl,2012,PW,0,1553284,276,0,0,2011.166667,2.166666667,16.06965174,4.201397124,0.550228353,3.487138375,3.609594409,1.86569606,2.064457989,2.525044807,4.230448921,3.064457989,-0.677780705,2.29666519,0,4.584331224,0,5.071882007,0.819543936,4.958085849,2.064457989,3.808885867,3.383815366,3.509202522,2.303196057,1.206006465,0,0,0,0,0,0,0,0,0,0,599,BRADFORD,CRYSTAL BRA PAD,802,PW,69831,gal,liquid,41478,7/23/13,18400,0,3.34,4870,4210,0,54.4,146,349,2.38,22300,0,1330,0.251,122,338,52000,0,160000,6.6,104000,132,7900,3710,3160,276,0,0,0,2013,7,23,CRYSTAL,BRA,PAD,0,0,802,PW,2011,2,19,015-21394,OGO-65420,41.795683,-76.516186,Yes,Horizontal Well,GAS,Bbl,2012,Yes,0,1553284,276,0,0,2011.166667,2.416666667,11.44927536,4.264817823,0.523746467,3.687528961,3.624282096,1.7355989,2.164352856,2.542825427,4.348304863,3.123851641,-0.600326279,2.086359831,2.5289167,4.716003344,0,5.204119983,0.819543936,5.017033339,2.120573931,3.897627091,3.56937391,3.499687083,2.440909082,1.058778001,0,0,0,0,0,0,0,0,0,0,4100,BRADFORD,CSI BRA PAD,802,PW,134344,gal,liquid,41516,8/30/13,35200,0,0,12500,12300,0,272,184,1080,5.08,42400,0,4060,0,26,702,168000,0,292000,5.5,214000,229,11300,2390,4940,792,0,0,0,2013,8,30,CSI,BRA,PAD,0,0,802,PW,2009,10,31,015-20290,OGO-65420,41.794028,-76.571472,Yes,Horizontal Well,GAS,Bbl,2012,Yes,0,668967,359,0,0,2009.833333,3.833333333,6.237373737,4.546542663,0,4.096910013,4.089905111,2.434568904,2.264817823,3.033423755,4.627365857,3.608526034,0,1.414973348,2.846337112,5.225309282,0,5.465382851,0.740362689,5.330413773,2.359835482,4.053078443,3.378397901,3.693726949,2.898725182,0.795001767,0,0,0,0,0,0,0,0,0,0,4101,BRADFORD,CUTHBERTSON BRA PAD,804,Flowback,47082,gal,liquid,41424,5/30/13,40300,0,6.07,10700,9910,0,173,304,686,5.45,33800,0,3840,0.242,121,660,116000,0,249000,6.3,165000,258,49100,17400,13000,1190,0,0,0,2013,5,30,CUTHBERTSON,BRA,PAD,0,0,802,Flowback,2011,11,29,015-21797,OGO-65420,41.617167,-76.288783,Yes,Horizontal Well,GAS,Bbl,2012,PW,0,367012,221,0,0,2011.916667,1.5,10.92436975,4.605305046,0.783188691,4.029383778,3.996073654,2.238046103,2.482873584,2.836324116,4.5289167,3.584331224,-0.616184634,2.08278537,2.819543936,5.064457989,0,5.396199347,0.799340549,5.217483944,2.411619706,4.691081492,4.240549248,4.113943352,3.075546961,1.038396391,0,0,0,0,0,0,0,0,0,0,5102,BRADFORD,CUTHBERTSON BRA PAD,802,PW,34667,gal,liquid,41493,8/7/13,23200,0,0,14300,9920,0,282,272,674,6.56,35300,0,4140,0,66.2,691,104000,0,293000,5.8,186000,459,66000,24500,13900,1300,0,0,0,2013,8,7,CUTHBERTSON,BRA,PAD,0,0,802,PW,2011,11,29,015-21797,OGO-65420,41.617167,-76.288783,Yes,Horizontal Well,GAS,Bbl,2012,Yes,0,367012,221,0,0,2011.916667,1.75,10.69230769,4.365487985,0,4.155336037,3.996511672,2.450249108,2.434568904,2.828659897,4.547774705,3.617000341,0,1.820857989,2.839478047,5.017033339,0,5.46686762,0.763427994,5.269512944,2.661812686,4.819543936,4.389166084,4.1430148,3.113943352,1.029071448,0,0,0,0,0,0,0,0,0,0,4103,BRADFORD,DGSM BRA PAD,804,Flowback,70386,gal,liquid,41463,7/8/13,51400,0,3.65,11500,12500,0,92.8,213,1110,3.71,38800,0,4140,0.213,67,822,109000,0,325000,5.9,261000,127,33300,16700,12000,918,0,0,0,2013,7,8,DGSM,BRA,PAD,0,0,802,Flowback,2011,3,20,015-21557,OGO-65420,41.893633,-76.600467,Yes,Horizontal Well,GAS,Bbl,2012,PW,0,467545,182,0,0,2011.25,2.333333333,13.07189542,4.710963119,0.562292864,4.06069784,4.096910013,1.967547976,2.328379603,3.045322979,4.588831726,3.617000341,-0.671620397,1.826074803,2.914871818,5.037426498,0,5.511883361,0.770852012,5.416640507,2.103803721,4.522444234,4.222716471,4.079181246,2.962842681,1.116338565,0,0,0,0,0,0,0,0,0,0,5104,BRADFORD,DGSM BRA PAD,802,PW,202783,gal,liquid,41569,10/22/13,48600,0,0,11600,17100,0,72,231,1440,4.97,35400,0,4310,0,31,888,133000,0,383000,6,190000,51.5,36600,15100,9060,1250,0,0,0,2013,10,22,DGSM,BRA,PAD,0,0,802,PW,2011,3,20,015-21557,OGO-65420,41.893633,-76.600467,Yes,Horizontal Well,GAS,Bbl,2012,Yes,0,467545,182,0,0,2011.25,2.583333333,7.248,4.686636269,0,4.064457989,4.23299611,1.857332496,2.36361198,3.158362492,4.549003262,3.63447727,0,1.491361694,2.948412966,5.123851641,0,5.583198774,0.77815125,5.278753601,1.711807229,4.563481085,4.178976947,3.957128198,3.096910013,0.860218185,0,0,0,0,0,0,0,0,0,0,4105,BRADFORD,DONNA BRA PAD,804,Flowback,319067,gal,liquid,41418,5/24/13,42400,0,4.83,7110,11900,0,46.4,228,687,4.59,31900,0.132,3200,0.359,65.4,668,88600,0,227000,6.3,184000,390,17000,4350,9450,896,0,0,0,2013,5,24,DONNA,BRA,PAD,0,0,802,Flowback,2011,8,13,015-21144,OGO-65420,41.686128,-76.281133,Yes,Horizontal Well,GAS,Bbl,2011,DrillFluid,0,0,0,0,0,2011.666667,1.75,10.546875,4.627365857,0.683947131,3.851869601,4.075546961,1.666517981,2.357934847,2.836956737,4.503790683,3.505149978,-0.444905551,1.815577748,2.824776462,4.947433722,0,5.356025857,0.799340549,5.264817823,2.591064607,4.230448921,3.638489257,3.975431809,2.95230801,1.023123799,0,0,0,0,0,0,0,0,0,0,5106,BRADFORD,DONNA BRA PAD,802,PW,229446,gal,liquid,41568,10/21/13,48400,0,0,16300,17500,0,312,305,1120,8.5,39200,0,6210,0,39.4,857,124000,0,366000,5.9,177000,593,70000,20400,11800,1470,0,0,0,2013,10,21,DONNA,BRA,PAD,0,0,802,PW,2011,8,13,015-21144,OGO-65420,41.686128,-76.281133,Yes,Horizontal Well,GAS,Bbl,2011,DrillFluid,0,0,0,0,0,2011.666667,2.166666667,8.027210884,4.684845362,0,4.212187604,4.243038049,2.494154594,2.484299839,3.049218023,4.593286067,3.7930916,0,1.595496222,2.932980822,5.093421685,0,5.563481085,0.770852012,5.247973266,2.773054693,4.84509804,4.309630167,4.071882007,3.167317335,0.904564673,0,0,0,0,0,0,0,0,0,0,4107,BRADFORD,DRISCOLL BRA PAD,802,PW,403874,gal,liquid,41390,4/26/13,69700,0.117,7.17,10900,18200,0,114,246,1460,0.654,35700,0.184,5600,0,72.1,770,117000,0,324000,6.1,223000,96.4,21400,7970,13900,1550,0,0,0,2013,4,26,DRISCOLL,BRA,PAD,0,0,802,PW,2011,4,2,015-21429,OGO-65420,41.605306,-76.567419,Yes,Horizontal Well,GAS,Bbl,2012,Yes,0,1740941,365,0,0,2011.333333,2,8.967741935,4.843232778,0.855519156,4.037426498,4.260071388,2.056904851,2.390935107,3.164352856,4.552668216,3.748188027,0,1.857935265,2.886490725,5.068185862,0,5.51054501,0.785329835,5.348304863,1.984077034,4.330413773,3.901458321,4.1430148,3.190331698,0.952683102,0,0,0,0,0,0,0,0,0,0,4108,BRADFORD,DUANE BRA PAD,802,PW,179641,gal,liquid,41502,8/16/13,61700,0,0,18000,22200,0,144,237,1530,10.6,36600,0,7350,0,67.2,1080,158000,0,434000,5.8,383000,143,13100,3260,6550,1830,0,0,0,2013,8,16,DUANE,BRA,PAD,0,0,802,PW,2010,9,9,015-20890,OGO-65420,41.642658,-76.757869,Yes,Horizontal Well,GAS,Bbl,2012,Yes,0,638803,354,0,0,2010.75,2.916666667,3.579234973,4.790285164,0,4.255272505,4.346352974,2.158362492,2.374748346,3.184691431,4.563481085,3.866287339,0,1.827369273,3.033423755,5.198657087,0,5.63748973,0.763427994,5.583198774,2.155336037,4.117271296,3.5132176,3.8162413,3.26245109,0.55379021,0,0,0,0,0,0,0,0,0,0,4109,BRADFORD,DUNHAM BRA PAD,802,PW,194791,gal,liquid,41480,7/25/13,55600,0,4.34,10800,14500,0,127,251,1030,8.57,40100,0,5460,0,39.2,472,96700,0,294000,5.9,234000,48,20800,6270,7900,1390,0,0,0,2013,7,25,DUNHAM,BRA,PAD,0,0,802,PW,2010,4,15,015-20688,OGO-65420,41.620503,-76.460847,Yes,Horizontal Well,GAS,Bbl,2012,Yes,0,2005212,365,0,0,2010.333333,3.25,5.683453237,4.745074792,0.63748973,4.033423755,4.161368002,2.103803721,2.399673721,3.012837225,4.603144373,3.737192643,0,1.593286067,2.673941999,4.985426474,0,5.46834733,0.770852012,5.369215857,1.681241237,4.318063335,3.797267541,3.897627091,3.1430148,0.754612291,0,0,0,0,0,0,0,0,0,0,4110,BRADFORD,DZIUBA BRA PAD,804,Flowback,124804,gal,liquid,41376,4/12/13,59000,0.203,4.53,11300,11900,0,118,277,1080,4.56,34000,0,4970,0,75.8,0,104000,0,280000,6.3,197000,193,16400,12700,16200,1220,0,0,0,2013,4,12,DZIUBA,BRA,PAD,0,0,802,Flowback,2011,6,17,015-21687,OGO-65420,41.695878,-76.159486,Yes,Horizontal Well,GAS,Bbl,2012,PW,0,1824786,284,0,0,2011.5,1.833333333,13.27868852,4.770852012,0.656098202,4.053078443,4.075546961,2.071882007,2.442479769,3.033423755,4.531478917,3.696356389,0,1.879669206,0,5.017033339,0,5.447158031,0.799340549,5.294466226,2.285557309,4.214843848,4.103803721,4.209515015,3.086359831,1.123155184,0,0,0,0,0,0,0,0,0,0,5111,BRADFORD,DZIUBA BRA PAD,802,PW,321556,gal,liquid,41479,7/24/13,65100,0,3.81,15700,16300,0,78.3,310,1260,5.77,37000,0,6390,0,55.4,785,122000,0,367000,5.9,273000,57.3,24200,11000,10600,1480,0,0,0,2013,7,24,DZIUBA,BRA,PAD,0,0,802,PW,2011,6,17,015-21687,OGO-65420,41.695878,-76.159486,Yes,Horizontal Well,GAS,Bbl,2012,Yes,0,1824786,284,0,0,2011.5,2.083333333,7.162162162,4.813580989,0.580924976,4.195899652,4.212187604,1.893761762,2.491361694,3.100370545,4.568201724,3.805500858,0,1.743509765,2.894869657,5.086359831,0,5.564666064,0.770852012,5.436162647,1.758154622,4.383815366,4.041392685,4.025305865,3.170261715,0.85504415,0,0,0,0,0,0,0,0,0,0,4112,BRADFORD,EDGER BRA,804,Flowback,423558,gal,liquid,41429,6/4/13,65700,0,3.93,10300,17800,0,66,242,1320,4.2,32700,0,5070,0,50.7,872,127000,0,348000,6,247000,92.7,18600,10500,13300,1180,0,0,0,2013,6,4,EDGER,BRA,0,0,0,802,Flowback,2012,2,20,015-22092,OGO-65420,41.871642,-76.555658,Yes,Horizontal Well,GAS,Bbl,2012,PW,0,196331,169,0,0,2012.166667,1.333333333,11.27118644,4.81756537,0.59439255,4.012837225,4.250420002,1.819543936,2.383815366,3.120573931,4.514547753,3.705007959,0,1.705007959,2.940516485,5.103803721,0,5.541579244,0.77815125,5.392696953,1.967079734,4.269512944,4.021189299,4.123851641,3.071882007,1.051969634,0,0,0,0,0,0,0,0,0,0,5113,BRADFORD,EDGER BRA,802,PW,598966,gal,liquid,41502,8/16/13,60900,0,0,12900,21500,0,82.6,230,1740,5.55,31100,0,6110,0,56.2,996,135000,0,381000,6,294000,152,18900,3480,13600,1450,0,0,0,2013,8,16,EDGER,BRA,0,0,0,802,PW,2012,2,20,015-22092,OGO-65420,41.871642,-76.555658,Yes,Horizontal Well,GAS,Bbl,2012,Yes,0,196331,169,0,0,2012.166667,1.5,9.379310345,4.784617293,0,4.11058971,4.33243846,1.916980047,2.361727836,3.240549248,4.492760389,3.78604121,0,1.749736316,2.998259338,5.130333768,0,5.580924976,0.77815125,5.46834733,2.181843588,4.276461804,3.541579244,4.133538908,3.161368002,0.972170906,0,0,0,0,0,0,0,0,0,0,4114,BRADFORD,EILEEN BRA PAD,802,PW,39406,gal,liquid,41425,5/31/13,25500,0,1.97,7140,5640,0,114,119,529,6.1,21200,0,2270,0.246,97.4,348,51600,0,149000,6.4,113000,75.3,4400,1420,2760,414,0,0,0,2013,5,31,EILEEN,BRA,PAD,0,0,802,PW,2009,12,8,015-20363,OGO-65420,41.833923,-76.648592,Yes,Horizontal Well,GAS,Bbl,2012,Yes,0,978735,355,0,0,2010,3.416666667,6.666666667,4.40654018,0.294466226,3.853698212,3.751279104,2.056904851,2.075546961,2.723455672,4.326335861,3.356025857,-0.609064893,1.988558957,2.541579244,4.712649702,0,5.173186268,0.806179974,5.053078443,1.876794976,3.643452676,3.152288344,3.440909082,2.617000341,0.823908741,0,0,0,0,0,0,0,0,0,0,4115,BRADFORD,ELEVATION BRA PAD,804,Flowback,16800,gal,liquid,41465,7/10/13,29700,0,3.24,8220,6800,0,167,199,563,3.46,35100,0,2470,0,202,583,78000,0,238000,6.4,163000,65,37300,13500,6320,602,0,0,0,2013,7,10,ELEVATION,BRA,PAD,0,0,802,Flowback,2010,6,7,015-20624,OGO-65420,41.776586,-76.467044,Yes,Horizontal Well,GAS,Bbl,2012,PW,0,244408,187,0,0,2010.5,3.083333333,10.49833887,4.472756449,0.51054501,3.914871818,3.832508913,2.222716471,2.298853076,2.750508395,4.545307116,3.392696953,0,2.305351369,2.765668555,4.892094603,0,5.376576957,0.806179974,5.212187604,1.812913357,4.571708832,4.130333768,3.800717078,2.779596491,1.021120587,0,0,0,0,0,0,0,0,0,0,5116,BRADFORD,ELEVATION BRA PAD,802,PW,11214,gal,liquid,41563,10/16/13,21400,0,0,8080,7540,0,247,221,622,6.05,35400,0,2700,0,9.9,531,77700,0,261000,5.6,161000,511,14100,1140,8750,519,0,0,0,2013,10,16,ELEVATION,BRA,PAD,0,0,802,PW,2010,6,7,015-20624,OGO-65420,41.776586,-76.467044,Yes,Horizontal Well,GAS,Bbl,2012,Yes,0,244408,187,0,0,2010.5,3.333333333,16.85934489,4.330413773,0,3.907411361,3.877371346,2.392696953,2.344392274,2.793790385,4.549003262,3.431363764,0,0.995635195,2.725094521,4.890421019,0,5.416640507,0.748188027,5.206825876,2.7084209,4.149219113,3.056904851,3.942008053,2.715167358,1.226840695,0,0,0,0,0,0,0,0,0,0,4117,BRADFORD,ENGELKE BRA PAD,802,PW,373536,gal,liquid,41471,7/16/13,119000,0.101,3.92,8640,33700,0,143,353,2660,7.47,26400,0,6650,0,60,1150,175000,0,471000,5.6,436000,60.4,51200,19000,16500,1980,0,0,0,2013,7,16,ENGELKE,BRA,PAD,0,0,802,PW,2010,3,16,015-20625,OGO-65420,41.749428,-76.775481,Yes,Horizontal Well,GAS,Bbl,2012,Yes,0,865884,354,0,0,2010.25,3.333333333,8.333333333,5.075546961,0.593286067,3.936513742,4.527629901,2.155336037,2.547774705,3.424881637,4.421603927,3.822821645,0,1.77815125,3.06069784,5.243038049,0,5.673020907,0.748188027,5.639486489,1.781036939,4.709269961,4.278753601,4.217483944,3.29666519,0.920818754,0,0,0,0,0,0,0,0,0,0,4118,BRADFORD,FARR BRA PAD,802,PW,183619,gal,liquid,41446,6/21/13,69700,0,2.65,14100,19700,0,80.6,239,1400,5.72,35300,0,4050,0,68.7,1090,146000,0,399000,5.6,304000,98.4,12600,4070,10400,1480,0,0,0,2013,6,21,FARR,BRA,PAD,0,0,802,PW,2009,12,22,015-20202,OGO-65420,41.766172,-76.492189,Yes,Horizontal Well,GAS,Bbl,2012,Yes,0,1203889,365,0,0,2010,3.5,7.027027027,4.843232778,0.423245874,4.149219113,4.294466226,1.906335042,2.378397901,3.146128036,4.547774705,3.607455023,0,1.836956737,3.037426498,5.164352856,0,5.600972896,0.748188027,5.482873584,1.992995098,4.100370545,3.609594409,4.017033339,3.170261715,0.846771624,0,0,0,0,0,0,0,0,0,0,4119,BRADFORD,FELTER BRA PAD,804,Flowback,106124,gal,liquid,41345,3/12/13,75500,0,4.81,15100,20200,0,147,349,1530,7.86,41500,0,6970,0.43,88,1040,145000,31300,285000,6.1,258000,65.6,18600,5020,13900,1910,0,0,0,2013,3,12,FELTER,BRA,PAD,0,0,802,Flowback,2010,8,21,015-21081,OGO-65420,41.681594,-76.260869,Yes,Horizontal Well,GAS,Bbl,2012,PW,0,316877,260,0,0,2010.666667,2.583333333,7.277486911,4.877946952,0.682145076,4.178976947,4.305351369,2.167317335,2.542825427,3.184691431,4.618048097,3.843232778,-0.366531544,1.944482672,3.017033339,5.161368002,4.495544338,5.45484486,0.785329835,5.411619706,1.816903839,4.269512944,3.700703717,4.1430148,3.281033367,0.861981433,0,0,0,0,0,0,0,0,0,0,5120,BRADFORD,FELTER BRA PAD,802,PW,1167776,gal,liquid,41481,7/26/13,64900,0,4.53,16800,21000,0,244,350,1430,9.16,53800,0,6820,0,34.6,817,118000,0,372000,5.6,308000,271,32400,17400,16100,1840,0,0,0,2013,7,26,FELTER,BRA,PAD,0,0,802,PW,2010,8,21,015-21081,OGO-65420,41.681594,-76.260869,Yes,Horizontal Well,GAS,Bbl,2012,Yes,0,316877,260,0,0,2010.666667,2.916666667,8.75,4.812244697,0.656098202,4.225309282,4.322219295,2.387389826,2.544068044,3.155336037,4.730782276,3.833784375,0,1.539076099,2.912222057,5.071882007,0,5.57054294,0.748188027,5.488550717,2.432969291,4.51054501,4.240549248,4.206825876,3.264817823,0.942008053,0,0,0,0,0,0,0,0,0,0,4121,BRADFORD,FERRARO BRA PAD,804,Flowback,457940,gal,liquid,41527,9/10/13,26600,0,7.1,9680,9560,0,85.5,265,661,3.49,38200,0,3510,0,66.2,574,75200,0,248000,6.4,136000,116,25300,6810,16900,979,0,0,0,2013,9,10,FERRARO,BRA,PAD,0,0,802,Flowback,2012,8,27,015-22192,OGO-65420,41.613375,-76.3367,Yes,Horizontal Well,GAS,Bbl,2012,PW,0,1190628,117,0,0,2012.666667,1.083333333,17.26251277,4.424881637,0.851258349,3.985875357,3.980457892,1.931966115,2.423245874,2.820201459,4.582063363,3.545307116,0,1.820857989,2.758911892,4.876217841,0,5.394451681,0.806179974,5.133538908,2.064457989,4.403120521,3.833147112,4.227886705,2.990782692,1.237104013,0,0,0,0,0,0,0,0,0,0,5122,BRADFORD,FERRARO BRA PAD,802,PW,83034,gal,liquid,41564,10/17/13,26800,0,5.71,8030,9640,0,105,255,657,3.47,19100,0,3790,0,59.6,718,87600,0,302000,6.4,195000,384,69900,27300,9800,1360,0,0,0,2013,10,17,FERRARO,BRA,PAD,0,0,802,PW,2012,8,27,015-22192,OGO-65420,41.613375,-76.3367,Yes,Horizontal Well,GAS,Bbl,2012,Yes,0,1190628,117,0,0,2012.666667,1.166666667,7.205882353,4.428134794,0.756636108,3.904715545,3.984077034,2.021189299,2.40654018,2.81756537,4.281033367,3.57863921,0,1.77524626,2.856124444,4.942504106,0,5.480006943,0.806179974,5.290034611,2.584331224,4.844477176,4.436162647,3.991226076,3.133538908,0.857687167,0,0,0,0,0,0,0,0,0,0,4123,BRADFORD,FINNERTY BRA PAD,802,PW,42624,gal,liquid,41431,6/6/13,33100,0,2.64,8720,6550,0,76.6,192,561,3.77,25900,0,2910,0,73,503,130000,0,216000,6.3,150000,64.8,6740,1560,6680,588,0,0,0,2013,6,6,FINNERTY,BRA,PAD,0,0,802,PW,2010,8,7,015-20661,OGO-65420,41.803369,-76.638283,Yes,Horizontal Well,GAS,Bbl,2012,Yes,0,981178,354,0,0,2010.666667,2.833333333,11.36054422,4.519827994,0.421603927,3.940516485,3.8162413,1.88422877,2.283301229,2.748962861,4.413299764,3.463892989,0,1.86332286,2.701567985,5.113943352,0,5.334453751,0.799340549,5.176091259,1.811575006,3.828659897,3.193124598,3.824776462,2.769377326,1.055399136,0,0,0,0,0,0,0,0,0,0,4124,BRADFORD,FISHER BRA PAD,804,Flowback,446330,gal,liquid,41341,3/8/13,89000,0,4,11100,23800,0,110,267,1730,10.7,48400,0,6260,0,24.8,1140,158000,0,348000,5.9,315000,70.4,18200,4840,11600,1860,0,0,0,2013,3,8,FISHER,BRA,PAD,0,0,802,Flowback,2011,10,23,015-21781,OGO-65420,41.787072,-76.400547,Yes,Horizontal Well,GAS,Bbl,2012,PW,0,664304,354,0,0,2011.833333,1.416666667,6.23655914,4.949390007,0.602059991,4.045322979,4.376576957,2.041392685,2.426511261,3.238046103,4.684845362,3.796574333,0,1.394451681,3.056904851,5.198657087,0,5.541579244,0.770852012,5.498310554,1.847572659,4.260071388,3.684845362,4.064457989,3.269512944,0.794945045,0,0,0,0,0,0,0,0,0,0,5125,BRADFORD,FISHER BRA PAD,802,PW,656777,gal,liquid,41436,6/11/13,96900,0,3.35,11500,26300,0,105,317,1550,12.3,48900,0,6310,0,43.3,1130,199000,0,464000,5.7,351000,36,20500,5570,14100,1990,0,0,0,2013,6,11,FISHER,BRA,PAD,0,0,802,PW,2011,10,23,015-21781,OGO-65420,41.787072,-76.400547,Yes,Horizontal Well,GAS,Bbl,2012,Yes,0,664304,354,0,0,2011.833333,1.666666667,7.085427136,4.986323777,0.525044807,4.06069784,4.419955748,2.021189299,2.501059262,3.190331698,4.689308859,3.800029359,0,1.636487896,3.053078443,5.298853076,0,5.666517981,0.755874856,5.545307116,1.556302501,4.311753861,3.745855195,4.149219113,3.298853076,0.850366036,0,0,0,0,0,0,0,0,0,0,4126,BRADFORD,FLASH BRA PAD,804,Flowback,138741,gal,liquid,41382,4/18/13,105000,0,3.53,9830,33100,0,101,300,2060,4.53,42700,0,7090,0.432,30.9,1460,186000,0,468000,6,353000,43.6,51300,10100,25300,2260,0,0,0,2013,4,18,FLASH,BRA,PAD,0,0,802,Flowback,2010,8,2,015-20944,OGO-65420,41.842481,-76.383672,Yes,Horizontal Well,GAS,Bbl,2012,PW,0,195612,202,0,0,2010.666667,2.666666667,11.19469027,5.021189299,0.547774705,3.992553518,4.519827994,2.004321374,2.477121255,3.31386722,4.630427875,3.850646235,-0.364516253,1.489958479,3.164352856,5.269512944,0,5.670245853,0.77815125,5.547774705,1.639486489,4.710117365,4.004321374,4.403120521,3.354108439,1.049012082,0,0,0,0,0,0,0,0,0,0,5127,BRADFORD,FLASH BRA PAD,802,PW,855164,gal,liquid,41467,7/12/13,105000,0,2.51,14600,31100,0,99.6,270,2390,12,25900,0,5330,0.343,16,1280,182000,0,548000,5.5,468000,109,50500,17500,14800,2360,0,0,0,2013,7,12,FLASH,BRA,PAD,0,0,802,PW,2010,8,2,015-20944,OGO-65420,41.842481,-76.383672,Yes,Horizontal Well,GAS,Bbl,2012,Yes,0,195612,202,0,0,2010.666667,2.916666667,6.271186441,5.021189299,0.399673721,4.164352856,4.492760389,1.998259338,2.431363764,3.378397901,4.413299764,3.726727209,-0.46470588,1.204119983,3.10720997,5.260071388,0,5.738780558,0.740362689,5.670245853,2.037426498,4.703291378,4.243038049,4.170261715,3.372912003,0.797349712,0,0,0,0,0,0,0,0,0,0,4128,BRADFORD,FLOYDIE BRA PAD,804,Flowback,514235,gal,liquid,41368,4/4/13,23500,0,4.44,7800,5750,0,56.5,178,445,2.09,26800,0,2100,0.261,193,0,51700,10700,146000,7,115000,44.8,15600,6670,5900,521,0,0,0,2013,4,4,FLOYDIE,BRA,PAD,0,0,802,Flowback,2012,7,22,015-22190,OGO-65420,41.665544,-76.126558,Yes,Horizontal Well,GAS,Bbl,2012,PW,0,2904690,277,0,0,2012.583333,0.75,11.3243762,4.371067862,0.64738297,3.892094603,3.759667845,1.752048448,2.250420002,2.648360011,4.428134794,3.322219295,-0.583359493,2.285557309,0,4.713490543,4.029383778,5.164352856,0.84509804,5.06069784,1.651278014,4.193124598,3.824125834,3.770852012,2.716837723,1.054014288,0,0,0,0,0,0,0,0,0,0,5129,BRADFORD,FLOYDIE BRA PAD,802,PW,313996,gal,liquid,41500,8/14/13,12900,0,0,6930,4540,0,124,161,376,4.33,22000,0,1810,0,148,357,51700,37300,149000,6.2,98000,224,6070,1180,6160,559,0,0,0,2013,8,14,FLOYDIE,BRA,PAD,0,0,802,PW,2012,7,22,015-22190,OGO-65420,41.665544,-76.126558,Yes,Horizontal Well,GAS,Bbl,2012,Yes,0,2904690,277,0,0,2012.583333,1.083333333,11.019678,4.11058971,0,3.840733235,3.657055853,2.093421685,2.206825876,2.575187845,4.342422681,3.257678575,0,2.170261715,2.552668216,4.713490543,4.571708832,5.173186268,0.792391689,4.991226076,2.350248018,3.783188691,3.071882007,3.789580712,2.747411808,1.042168904,0,0,0,0,0,0,0,0,0,0,4130,BRADFORD,FORBES BRA PAD,802,PW,62718,gal,liquid,41410,5/16/13,97600,0.115,4.41,18500,26600,0,212,343,1560,14.5,44600,0,7880,0.448,24.8,1020,202000,0,401000,5.6,374000,120,34100,11500,15900,2290,0,0,0,2013,5,16,FORBES,BRA,PAD,0,0,802,PW,2011,2,24,015-21146,OGO-65420,41.708117,-76.393275,Yes,Horizontal Well,GAS,Bbl,2012,Yes,0,868894,365,0,0,2011.166667,2.25,6.943231441,4.989449818,0.644438589,4.267171728,4.424881637,2.326335861,2.53529412,3.193124598,4.649334859,3.896526217,-0.348721986,1.394451681,3.008600172,5.305351369,0,5.603144373,0.748188027,5.572871602,2.079181246,4.532754379,4.06069784,4.201397124,3.359835482,0.841561642,0,0,0,0,0,0,0,0,0,0,4131,BRADFORD,FRED BRA PAD,802,PW,360229,gal,liquid,41471,7/16/13,60800,0,3.52,13600,20900,0,84.7,278,1740,9.07,27200,0,5730,0.273,60.8,927,150000,0,455000,5.7,399000,89.3,46000,15100,13900,1880,0,0,0,2013,7,16,FRED,BRA,PAD,0,0,802,PW,2010,11,14,015-20542,OGO-65420,41.640514,-76.767236,Yes,Horizontal Well,GAS,Bbl,2012,Yes,0,652401,354,0,0,2010.916667,2.666666667,7.393617021,4.783903579,0.546542663,4.133538908,4.320146286,1.92788341,2.444044796,3.240549248,4.434568904,3.758154622,-0.563837353,1.783903579,2.967079734,5.176091259,0,5.658011397,0.755874856,5.600972896,1.950851459,4.662757832,4.178976947,4.1430148,3.274157849,0.868856951,0,0,0,0,0,0,0,0,0,0,4132,BRADFORD,FRISBEE BRA PAD,804,Flowback,114999,gal,liquid,41381,4/17/13,111000,0,3.25,12900,33100,0,96.9,307,2360,4.89,40500,0,7170,0.57,36.1,1350,177000,0,450000,5.8,370000,70,46800,26600,29700,2950,0,0,0,2013,4,17,FRISBEE,BRA,PAD,0,0,802,Flowback,2010,5,26,015-20792,OGO-65420,41.876625,-76.276761,Yes,Horizontal Well,GAS,Bbl,2012,PW,0,327851,352,0,0,2010.416667,2.916666667,10.06779661,5.045322979,0.511883361,4.11058971,4.519827994,1.986323777,2.487138375,3.372912003,4.607455023,3.855519156,-0.244125144,1.557507202,3.130333768,5.247973266,0,5.653212514,0.763427994,5.568201724,1.84509804,4.670245853,4.424881637,4.472756449,3.469822016,1.002934433,0,0,0,0,0,0,0,0,0,0,5133,BRADFORD,GARDNER BRA PAD,804,Flowback,306309,gal,liquid,41382,4/18/13,34700,0,6.94,6670,10900,0,88.2,245,739,5.18,35500,0,3680,0.329,90.5,0,89500,0,247000,6.7,172000,165,14900,4040,10300,1090,0,0,0,2013,4,18,GARDNER,BRA,PAD,0,0,802,Flowback,2012,2,27,015-22090,OGO-65420,41.564156,-76.424161,Yes,Horizontal Well,GAS,Bbl,2012,PW,0,1260822,263,0,0,2012.166667,1.166666667,9.449541284,4.540329475,0.84135947,3.824125834,4.037426498,1.945468585,2.389166084,2.868644438,4.550228353,3.565847819,-0.482804102,1.956648579,0,4.951823035,0,5.392696953,0.826074803,5.235528447,2.217483944,4.173186268,3.606381365,4.012837225,3.037426498,0.975410727,0,0,0,0,0,0,0,0,0,0,5134,BRADFORD,GARDNER BRA PAD,802,PW,203809,gal,liquid,41470,7/15/13,42000,0,5.05,7870,9840,0,139,232,642,5.62,33800,0,3490,0.381,114,552,84400,28200,250000,6.2,193000,170,34200,12800,10800,1090,0,0,0,2013,7,15,GARDNER,BRA,PAD,0,0,802,PW,2012,2,27,015-22090,OGO-65420,41.564156,-76.424161,Yes,Horizontal Well,GAS,Bbl,2012,Yes,0,1260822,263,0,0,2012.166667,1.416666667,9.908256881,4.62324929,0.703291378,3.895974732,3.992995098,2.1430148,2.365487985,2.807535028,4.5289167,3.542825427,-0.419075024,2.056904851,2.741939078,4.926342447,4.450249108,5.397940009,0.792391689,5.285557309,2.230448921,4.534026106,4.10720997,4.033423755,3.037426498,0.995997258,0,0,0,0,0,0,0,0,0,0,4135,BRADFORD,GESTEWITZ BRA PAD,804,Flowback,78530,gal,liquid,41375,4/11/13,30900,0,0,7600,7440,0,64.4,184,638,2.54,24600,0.129,2460,0.369,83,0,74600,0,191000,6.2,143000,116,20400,7600,6980,509,0,0,0,2013,4,11,GESTEWITZ,BRA,PAD,0,0,802,Flowback,2012,2,14,015-22063,OGO-65420,41.792136,-76.503497,Yes,Horizontal Well,GAS,Bbl,2012,PW,0,711843,270,0,0,2012.166667,1.166666667,13.71316306,4.489958479,0,3.880813592,3.871572936,1.808885867,2.264817823,2.804820679,4.390935107,3.390935107,-0.432973634,1.919078092,0,4.872738827,0,5.281033367,0.792391689,5.155336037,2.064457989,4.309630167,3.880813592,3.843855423,2.706717782,1.13713764,0,0,0,0,0,0,0,0,0,0,5136,BRADFORD,GESTEWITZ BRA PAD,802,PW,69011,gal,liquid,41478,7/23/13,37100,0,3.2,8760,8540,0,94.3,188,715,3.04,35100,0,2700,0.229,60.6,507,78800,0,236000,6.1,167000,113,26100,7600,7410,710,0,0,0,2013,7,23,GESTEWITZ,BRA,PAD,0,0,802,PW,2012,2,14,015-22063,OGO-65420,41.792136,-76.503497,Yes,Horizontal Well,GAS,Bbl,2012,Yes,0,711843,270,0,0,2012.166667,1.416666667,10.43661972,4.56937391,0.505149978,3.942504106,3.931457871,1.974511693,2.274157849,2.854306042,4.545307116,3.431363764,-0.640164518,1.782472624,2.705007959,4.896526217,0,5.372912003,0.785329835,5.222716471,2.053078443,4.416640507,3.880813592,3.869818208,2.851258349,1.018559859,0,0,0,0,0,0,0,0,0,0,4137,BRADFORD,GOLL BRA PAD,802,PW,1012494,gal,liquid,41486,7/31/13,74900,0,2.66,15700,18100,0,59.5,239,1470,3.79,45800,0,7130,0,45.4,760,116000,0,348000,5.9,254000,171,39600,18400,13000,1450,0,0,0,2013,7,31,GOLL,BRA,PAD,0,0,802,PW,2011,1,17,015-21290,OGO-65420,41.888022,-76.53175,Yes,Horizontal Well,GAS,Bbl,2012,Yes,0,736498,356,0,0,2011.083333,2.5,8.965517241,4.874481818,0.424881637,4.195899652,4.257678575,1.774516966,2.378397901,3.167317335,4.660865478,3.85308953,0,1.657055853,2.880813592,5.064457989,0,5.541579244,0.770852012,5.404833717,2.23299611,4.597695186,4.264817823,4.113943352,3.161368002,0.95257535,0,0,0,0,0,0,0,0,0,0,4138,BRADFORD,GOVERNALE BRA PAD,802,PW,173358,gal,liquid,41537,9/20/13,73900,0,0,16100,26600,0,124,239,1790,14,24400,0,7390,0,0,1260,165000,0,462000,5.8,375000,112,0,0,0,0,0,0,0,2013,9,20,GOVERNALE,BRA,PAD,0,0,802,PW,2010,12,26,015-21284,OGO-65420,41.8161,-76.345167,Yes,Horizontal Well,GAS,Bbl,2012,Yes,0,1041090,365,0,0,2011,2.75,0,4.868644438,0,4.206825876,4.424881637,2.093421685,2.378397901,3.252853031,4.387389826,3.868644438,0,0,3.100370545,5.217483944,0,5.664641976,0.763427994,5.574031268,2.049218023,0,0,0,0,0,0,0,0,0,0,0,0,0,0,0,4139,BRADFORD,GRANT BRA PAD,802,PW,166724,gal,liquid,41507,8/21/13,33200,0,0,11400,11500,0,283,169,1110,4.21,40700,0,4070,0,74.8,784,132000,0,299000,6,215000,1140,8890,3490,5680,803,0,0,0,2013,8,21,GRANT,BRA,PAD,0,0,802,PW,2011,3,5,015-21363,OGO-65420,41.839494,-76.595536,Yes,Horizontal Well,GAS,Bbl,2012,Yes,0,716546,356,0,0,2011.25,2.416666667,7.073474471,4.521138084,0,4.056904851,4.06069784,2.451786436,2.227886705,3.045322979,4.609594409,3.609594409,0,1.873901598,2.894316063,5.120573931,0,5.475671188,0.77815125,5.33243846,3.056904851,3.948901761,3.542825427,3.754348336,2.904715545,0.84963279,0,0,0,0,0,0,0,0,0,0,4140,BRADFORD,HANNAN BRA PAD,802,PW,68990,gal,liquid,41501,8/15/13,75900,0,0,13700,27600,0,110,263,1660,10.4,46900,0,6760,0,5.3,1050,161000,0,438000,5,320000,166,12600,3680,8100,1620,0,0,0,2013,8,15,HANNAN,BRA,PAD,0,0,802,PW,2009,10,27,015-20261,OGO-65420,41.766694,-76.711064,Yes,Horizontal Well,GAS,Bbl,2012,Yes,0,501147,350,0,0,2009.833333,3.833333333,5,4.880241776,0,4.136720567,4.440909082,2.041392685,2.419955748,3.220108088,4.671172843,3.829946696,0,0.72427587,3.021189299,5.206825876,0,5.641474111,0.698970004,5.505149978,2.220108088,4.100370545,3.565847819,3.908485019,3.209515015,0.698970004,0,0,0,0,0,0,0,0,0,0,4141,BRADFORD,HARRY BRA PAD,802,PW,211426,gal,liquid,41501,8/15/13,59900,0,0,15700,21700,0,121,249,1410,6.83,30500,0,6650,0,40.2,1030,146000,0,397000,5.7,278000,91.5,24700,3680,11400,1320,0,0,0,2013,8,15,HARRY,BRA,PAD,0,0,802,PW,2009,10,21,015-20325,OGO-65420,41.766722,-76.698311,Yes,Horizontal Well,GAS,Bbl,2012,Yes,0,732375,350,0,0,2009.833333,3.833333333,8.636363636,4.777426822,0,4.195899652,4.336459734,2.08278537,2.396199347,3.149219113,4.484299839,3.822821645,0,1.604226053,3.012837225,5.164352856,0,5.598790507,0.755874856,5.444044796,1.961421094,4.392696953,3.565847819,4.056904851,3.120573931,0.93633092,0,0,0,0,0,0,0,0,0,0,4142,BRADFORD,HART BRA PAD,804,Flowback,144559,gal,liquid,41612,12/4/13,27100,0,0,9570,9740,0,95.5,218,682,4.1,28700,0,3220,0,56.4,545,84200,0,245000,6,159000,131,48400,18900,10100,851,0,0,0,2013,12,4,HART,BRA,PAD,0,0,802,Flowback,2012,11,19,015-22253,OGO-65420,41.669567,-76.22265,Yes,Horizontal Well,GAS,Bbl,2012,PW,0,270803,35,0,0,2012.916667,1.083333333,11.86839013,4.432969291,0,3.980911938,3.988558957,1.980003372,2.338456494,2.833784375,4.457881897,3.507855872,0,1.751279104,2.736396502,4.925312091,0,5.389166084,0.77815125,5.201397124,2.117271296,4.684845362,4.276461804,4.004321374,2.92992956,1.074391814,0,0,0,0,0,0,0,0,0,0,5143,BRADFORD,HART BRA PAD,802,PW,208090,gal,liquid,41638,12/30/13,26500,0,0,14700,9490,0,112,240,687,3.95,29200,0,3660,0,72.9,630,89600,25700,342000,6.1,148000,159,11000,4060,12200,1010,0,0,0,2013,12,30,HART,BRA,PAD,0,0,802,PW,2012,11,19,015-22253,OGO-65420,41.669567,-76.22265,Yes,Horizontal Well,GAS,Bbl,2012,Yes,0,270803,35,0,0,2012.916667,1.083333333,12.07920792,4.423245874,0,4.167317335,3.977266212,2.049218023,2.380211242,2.836956737,4.465382851,3.563481085,0,1.862727528,2.799340549,4.95230801,4.409933123,5.534026106,0.785329835,5.170261715,2.201397124,4.041392685,3.608526034,4.086359831,3.004321374,1.082038457,0,0,0,0,0,0,0,0,0,0,4144,BRADFORD,HARTZ BRA PAD,802,PW,210320,gal,liquid,41540,9/23/13,71100,0,0,15000,25100,0,107,257,2070,6.51,42100,0,7330,0,32.9,972,141000,0,438000,6,314000,69.2,41100,13100,25100,1780,0,0,0,2013,9,23,HARTZ,BRA,PAD,0,0,802,PW,2011,4,15,015-21494,OGO-65420,41.855608,-76.519544,Yes,Horizontal Well,GAS,Bbl,2012,Yes,0,351811,346,0,0,2011.333333,2.416666667,14.1011236,4.851869601,0,4.176091259,4.399673721,2.029383778,2.409933123,3.315970345,4.624282096,3.865103975,0,1.517195898,2.987666265,5.149219113,0,5.641474111,0.77815125,5.496929648,1.840106094,4.613841822,4.117271296,4.399673721,3.250420002,1.149253719,0,0,0,0,0,0,0,0,0,0,4145,BRADFORD,HENRY BRA PAD,802,PW,193706,gal,liquid,41470,7/15/13,72800,0,4.37,12400,18700,0,94.5,299,1230,9.41,46700,0,6430,0.255,47,868,138000,0,392000,5.8,333000,51,31700,10500,9400,1750,0,0,0,2013,7,15,HENRY,BRA,PAD,0,0,802,PW,2010,7,23,015-20673,OGO-65420,41.626117,-76.439472,Yes,Horizontal Well,GAS,Bbl,2012,Yes,0,3495144,365,0,0,2010.583333,3,5.371428571,4.862131379,0.640481437,4.093421685,4.271841607,1.975431809,2.475671188,3.089905111,4.669316881,3.808210973,-0.59345982,1.672097858,2.938519725,5.139879086,0,5.593286067,0.763427994,5.522444234,1.707570176,4.501059262,4.021189299,3.973127854,3.243038049,0.730089805,0,0,0,0,0,0,0,0,0,0,4146,BRADFORD,HI-LEV BRA PAD,802,PW,96097,gal,liquid,41471,7/16/13,108000,0.11,4.16,6070,31400,0,141,338,2520,11.4,25500,0,6560,0,28.4,1060,179000,0,517000,5.4,459000,53.7,42000,15300,13000,1920,0,0,0,2013,7,16,HI-LEV,BRA,PAD,0,0,802,PW,0,0,0,0,0,0,0,0,0,0,0,0,0,0,0,0,0,0,0,0,6.770833333,5.033423755,0.619093331,3.783188691,4.496929648,2.149219113,2.5289167,3.401400541,4.40654018,3.816903839,0,1.45331834,3.025305865,5.252853031,0,5.713490543,0.73239376,5.661812686,1.729974286,4.62324929,4.184691431,4.113943352,3.283301229,0.830642124,0,0,0,0,0,0,0,0,0,0,4147,BRADFORD,HOFFMAN BRA PAD,802,PW,38579,gal,liquid,41446,6/21/13,46400,0,2.36,11200,10600,0,99.9,197,912,4.88,37000,0,3350,0.235,59.2,783,100000,0,292000,5.9,213000,114,12100,3590,8880,902,0,0,0,2013,6,21,HOFFMAN,BRA,PAD,0,0,802,PW,2010,10,30,015-20650,OGO-65420,41.761086,-76.479417,Yes,Horizontal Well,GAS,Bbl,2012,Yes,0,1182482,365,0,0,2010.833333,2.666666667,9.844789357,4.666517981,0.372912003,4.049218023,4.025305865,1.999565488,2.294466226,2.959994838,4.568201724,3.525044807,-0.628932138,1.772321707,2.893761762,5,0,5.465382851,0.770852012,5.328379603,2.056904851,4.08278537,3.555094449,3.948412966,2.955206538,0.993206428,0,0,0,0,0,0,0,0,0,0,4148,BRADFORD,HOPSON BRA PAD,802,PW,156268,gal,liquid,41410,5/16/13,113000,0.118,3.72,17400,27900,0,171,355,1670,16.4,41800,0,8480,0.49,28.2,1200,193000,0,419000,5.7,406000,132,16200,7140,10200,2490,0,0,0,2013,5,16,HOPSON,BRA,PAD,0,0,802,PW,2011,1,3,015-21313,OGO-65420,41.706119,-76.381769,Yes,Horizontal Well,GAS,Bbl,2012,Yes,0,908033,365,0,0,2011.083333,2.333333333,4.096385542,5.053078443,0.57054294,4.240549248,4.445604203,2.23299611,2.550228353,3.222716471,4.621176282,3.928395852,-0.30980392,1.450249108,3.079181246,5.285557309,0,5.622214023,0.755874856,5.608526034,2.120573931,4.209515015,3.853698212,4.008600172,3.396199347,0.612400825,0,0,0,0,0,0,0,0,0,0,4149,BRADFORD,HORST BRA PAD,802,PW,72605,gal,liquid,41425,5/31/13,34800,0,2.51,11000,7630,0,104,179,658,4.01,30800,0,3160,0,119,500,74600,0,229000,6.4,140000,94,8620,2810,3990,540,0,0,0,2013,5,31,HORST,BRA,PAD,0,0,802,PW,2009,12,19,015-20431,OGO-65420,41.828917,-76.65575,Yes,Horizontal Well,GAS,Bbl,2012,Yes,0,728394,350,0,0,2010,3.416666667,7.388888889,4.541579244,0.399673721,4.041392685,3.882524538,2.017033339,2.252853031,2.818225894,4.488550717,3.499687083,0,2.075546961,2.698970004,4.872738827,0,5.359835482,0.806179974,5.146128036,1.973127854,3.935507266,3.44870632,3.600972896,2.73239376,0.868579136,0,0,0,0,0,0,0,0,0,0,4150,BRADFORD,HULSLANDER BRA PAD,802,PW,92729,gal,liquid,41502,8/16/13,29700,0,0,12900,10500,0,79.4,202,878,2.85,36900,0,4230,0,125,671,86600,0,270000,6.2,201000,87.2,21900,4090,9040,803,0,0,0,2013,8,16,HULSLANDER,BRA,PAD,0,0,802,PW,2011,10,25,015-21792,OGO-65420,41.852717,-76.655303,Yes,Horizontal Well,GAS,Bbl,2012,Yes,0,690801,176,0,0,2011.833333,1.833333333,11.25778331,4.472756449,0,4.11058971,4.021189299,1.899820502,2.305351369,2.943494516,4.567026366,3.626340367,0,2.096910013,2.82672252,4.937517892,0,5.431363764,0.792391689,5.303196057,1.940516485,4.340444115,3.611723308,3.95616843,2.904715545,1.051452885,0,0,0,0,0,0,0,0,0,0,4151,BRADFORD,IH BRA PAD,802,PW,278120,gal,liquid,41429,6/4/13,55200,0,2.92,15800,11500,0,62.9,292,880,5.06,31700,0,5100,0,83.6,898,111000,37700,322000,6,224000,25.6,12100,5460,8880,1170,0,0,0,2013,6,4,IH,BRA,PAD,0,0,802,PW,2011,8,24,015-21849,OGO-65420,41.75255,-76.132183,Yes,Horizontal Well,GAS,Bbl,2012,Yes,0,1549262,365,0,0,2011.666667,1.833333333,7.58974359,4.741939078,0.465382851,4.198657087,4.06069784,1.798650645,2.465382851,2.944482672,4.501059262,3.707570176,0,1.922206277,2.953276337,5.045322979,4.57634135,5.507855872,0.77815125,5.350248018,1.408239965,4.08278537,3.737192643,3.948412966,3.068185862,0.880227104,0,0,0,0,0,0,0,0,0,0,4152,BRADFORD,ISBELL BRA PAD,802,PW,87233,gal,liquid,41516,8/30/13,19000,0,0,7290,6720,0,81.4,149,542,3.47,29800,0,2500,0,51.5,504,63300,0,201000,6,125000,171,4890,1030,5070,433,0,0,0,2013,8,30,ISBELL,BRA,PAD,0,0,802,PW,2009,5,30,015-20258,OGO-65420,41.795806,-76.584492,Yes,Horizontal Well,GAS,Bbl,2012,Yes,0,1430352,359,0,0,2009.416667,4.25,11.70900693,4.278753601,0,3.862727528,3.827369273,1.910624405,2.173186268,2.733999287,4.474216264,3.397940009,0,1.711807229,2.702430536,4.80140371,0,5.303196057,0.77815125,5.096910013,2.23299611,3.689308859,3.012837225,3.705007959,2.636487896,1.068520063,0,0,0,0,0,0,0,0,0,0,4153,BRADFORD,J&J BRA PAD,804,Flowback,111340,gal,liquid,41423,5/29/13,26200,0,3.96,6880,6030,0,100,158,534,2.62,27800,0.125,2350,0.186,152,470,64100,0,178000,6.4,144000,147,7520,2310,4470,393,0,0,0,2013,5,29,J&J,BRA,PAD,0,0,802,Flowback,2011,8,28,015-21853,OGO-65420,41.82771,-76.5565,Yes,Horizontal Well,GAS,Bbl,2015,PW,0,627022,170,0,0,2011.666667,1.75,11.3740458,4.418301291,0.597695186,3.837588438,3.780317312,2,2.198657087,2.727541257,4.444044796,3.371067862,-0.730487056,2.181843588,2.672097858,4.80685803,0,5.250420002,0.806179974,5.158362492,2.167317335,3.876217841,3.36361198,3.650307523,2.59439255,1.055914973,0,0,0,0,0,0,0,0,0,0,5154,BRADFORD,J&J BRA PAD,802,PW,188077,gal,liquid,41486,7/31/13,37600,0,3.15,12000,8070,0,93.7,203,696,2.01,35400,0,3500,0,104,535,77200,0,241000,6.3,183000,202,11800,7590,5260,751,0,0,0,2013,7,31,J&J,BRA,PAD,0,0,802,PW,2011,8,28,015-21853,OGO-65420,41.82771,-76.5565,Yes,Horizontal Well,GAS,Bbl,2015,Yes,0,627022,170,0,0,2011.666667,1.916666667,7.003994674,4.575187845,0.498310554,4.079181246,3.906873535,1.971739591,2.307496038,2.84260924,4.549003262,3.544068044,0,2.017033339,2.728353782,4.8876173,0,5.382017043,0.799340549,5.26245109,2.305351369,4.071882007,3.880241776,3.720985744,2.875639937,0.845345807,0,0,0,0,0,0,0,0,0,0,4155,BRADFORD,JACOBS BRA PAD,802,PW,169528,gal,liquid,41529,9/12/13,98800,0,0,12400,35700,0,184,312,2360,15.2,85200,0,8220,0,10.1,1280,195000,0,550000,5.7,518000,690,33700,9930,23300,2270,0,0,0,2013,9,12,JACOBS,BRA,PAD,0,0,802,PW,2010,10,1,015-21110,OGO-65420,41.878636,-76.347675,Yes,Horizontal Well,GAS,Bbl,2012,Yes,0,448444,362,0,0,2010.833333,2.916666667,10.26431718,4.994756945,0,4.093421685,4.552668216,2.264817823,2.494154594,3.372912003,4.930439595,3.914871818,0,1.004321374,3.10720997,5.290034611,0,5.740362689,0.755874856,5.71432976,2.838849091,4.527629901,3.996949248,4.367355921,3.356025857,1.011330064,0,0,0,0,0,0,0,0,0,0,4156,BRADFORD,JAG BRA PAD,804,Flowback,154781,gal,liquid,41465,7/10/13,54400,0,5.6,10500,15200,0,256,252,967,7.42,46300,0,4380,1.18,147,776,105000,0,336000,6.3,245000,237,33500,14500,14100,1240,0,0,0,2013,7,10,JAG,BRA,PAD,0,0,802,Flowback,2012,4,10,015-22101,OGO-65420,41.705833,-76.540242,Yes,Horizontal Well,GAS,Bbl,Yes,PW,0,1182110,180,0,0,2012.333333,1.25,11.37096774,4.7355989,0.748188027,4.021189299,4.181843588,2.408239965,2.401400541,2.985426474,4.665580991,3.641474111,0.071882007,2.167317335,2.889861721,5.021189299,0,5.526339277,0.799340549,5.389166084,2.374748346,4.525044807,4.161368002,4.149219113,3.093421685,1.055797427,0,0,0,0,0,0,0,0,0,0,5157,BRADFORD,JAG BRA PAD,802,PW,168630,gal,liquid,41584,11/6/13,52500,0,0,13800,19100,0,159,275,1200,8.02,43200,0,5960,0,55.4,816,137000,0,378000,5.8,288000,135,56800,21300,18000,1400,0,0,0,2013,11,6,JAG,BRA,PAD,0,0,802,PW,2012,4,10,015-22101,OGO-65420,41.705833,-76.540242,Yes,Horizontal Well,GAS,Bbl,Yes,Yes,220,1182110,180,0,0,2012.333333,1.583333333,12.85714286,4.720159303,0,4.139879086,4.281033367,2.201397124,2.439332694,3.079181246,4.635483747,3.77524626,0,1.743509765,2.911690159,5.136720567,0,5.5774918,0.763427994,5.459392488,2.130333768,4.754348336,4.328379603,4.255272505,3.146128036,1.109144469,0,0,0,0,0,0,0,0,0,0,4158,BRADFORD,JANET BRA PAD,802,PW,305237,gal,liquid,41480,7/25/13,95100,0,3.45,19900,25700,0,123,345,1460,13.8,50200,0,7490,0,32.8,0,60800,0,439000,5.6,376000,340,43800,20500,16100,2300,0,0,0,2013,7,25,JANET,BRA,PAD,0,0,802,PW,2010,6,30,015-20794,OGO-65420,41.70545,-76.433731,Yes,Horizontal Well,GAS,Bbl,2012,Yes,0,880585,365,0,0,2010.5,3.083333333,7,4.978180517,0.537819095,4.298853076,4.409933123,2.089905111,2.537819095,3.164352856,4.700703717,3.874481818,0,1.515873844,0,4.783903579,0,5.64246452,0.748188027,5.575187845,2.531478917,4.641474111,4.311753861,4.206825876,3.361727836,0.84509804,0,0,0,0,0,0,0,0,0,0,4159,BRADFORD,JOHNSON BRA PAD,802,PW,121679,gal,liquid,41565,10/18/13,39500,0,0,13100,14200,0,154,215,946,7.56,29600,0,4930,0,2.7,782,95300,0,326000,5.4,244000,95,35400,14100,8550,1120,0,0,0,2013,10,18,JOHNSON,BRA,PAD,0,0,802,PW,2010,6,22,015-20730,OGO-65420,41.66861,-76.461,Yes,Horizontal Well,GAS,Bbl,2012,Yes,0,528575.67,363,0,0,2010.5,3.333333333,7.633928571,4.596597096,0,4.117271296,4.152288344,2.187520721,2.33243846,2.975891136,4.471291711,3.692846919,0,0.431363764,2.893206753,4.979092901,0,5.5132176,0.73239376,5.387389826,1.977723605,4.549003262,4.149219113,3.931966115,3.049218023,0.882748092,0,0,0,0,0,0,0,0,0,0,4160,BRADFORD,JONES BRA PAD,804,Flowback,438223,gal,liquid,41402,5/8/13,97900,0,4.2,11200,27500,0,115,305,1750,10.5,38800,0,6430,0.421,43.2,1310,173000,0,396000,5.7,290000,64.8,52700,17200,15900,1650,0,0,0,2013,5,8,JONES,BRA,PAD,0,0,802,Flowback,2011,7,25,117-21426,OGO-67805,41.943819,-76.939403,Yes,Horizontal Well,GAS,Tons,2012,DrillCuttings,0,0,0,0,0,2011.583333,1.833333333,9.636363636,4.990782692,0.62324929,4.049218023,4.439332694,2.06069784,2.484299839,3.243038049,4.588831726,3.808210973,-0.375717904,1.635483747,3.117271296,5.238046103,0,5.597695186,0.755874856,5.462397998,1.811575006,4.721810615,4.235528447,4.201397124,3.217483944,0.98391318,0,0,0,0,0,0,0,0,0,0,5161,BRADFORD,JONES BRA PAD,802,PW,512651,gal,liquid,41481,7/26/13,85000,0,4.71,10500,33700,0,110,371,2060,16.8,49000,0,7660,0,14.6,829,103000,0,541000,5.4,430000,322,58700,26500,21300,2290,0,0,0,2013,7,26,JONES,BRA,PAD,0,0,802,PW,2012,2,25,117-21426,OGO-67805,41.943819,-76.939403,Yes,Horizontal Well,GAS,Tons,2012,DrillCuttings,0,0,0,0,0,2012.166667,1.416666667,9.301310044,4.929418926,0.673020907,4.021189299,4.527629901,2.041392685,2.56937391,3.31386722,4.69019608,3.88422877,0,1.164352856,2.918554531,5.012837225,0,5.733197265,0.73239376,5.633468456,2.507855872,4.768638101,4.423245874,4.328379603,3.359835482,0.968544121,0,0,0,0,0,0,0,0,0,0,4162,BRADFORD,JUDD BRA PAD,802,PW,130819,gal,liquid,41480,7/25/13,91800,0,3.65,15900,24700,0,94.2,307,1430,18.6,52400,0,6690,0,13.7,723,143000,0,400000,5.6,346000,49,37700,18200,6310,1930,0,0,0,2013,7,25,JUDD,BRA,PAD,0,0,802,PW,2009,5,12,015-20129,OGO-65420,41.701725,-76.442658,Yes,Horizontal Well,GAS,Bbl,2012,Yes,0,675343,313,0,0,2009.416667,4.166666667,3.269430052,4.962842681,0.562292864,4.201397124,4.392696953,1.974050903,2.487138375,3.155336037,4.719331287,3.825426118,0,1.136720567,2.859138297,5.155336037,0,5.602059991,0.748188027,5.539076099,1.69019608,4.57634135,4.260071388,3.800029359,3.285557309,0.51447205,0,0,0,0,0,0,0,0,0,0,4163,BRADFORD,KALINOWSKI BRA PAD,802,PW,650878,gal,liquid,41439,6/14/13,104000,0.163,3.33,11500,28400,0,113,306,2120,5.47,38700,0.263,6960,0.335,26.9,1110,176000,0,443000,5.5,318000,51.6,28900,5300,13300,1820,0,0,0,2013,6,14,KALINOWSKI,BRA,PAD,0,0,802,PW,2010,7,11,015-20639,OGO-65420,41.779047,-76.650394,Yes,Horizontal Well,GAS,Bbl,2012,Yes,0,1305603,355,0,0,2010.583333,2.916666667,7.307692308,5.017033339,0.522444234,4.06069784,4.45331834,2.053078443,2.485721426,3.326335861,4.587710965,3.84260924,-0.474955193,1.42975228,3.045322979,5.245512668,0,5.646403726,0.740362689,5.50242712,1.712649702,4.460897843,3.72427587,4.123851641,3.260071388,0.863780253,0,0,0,0,0,0,0,0,0,0,4164,BRADFORD,KATHRYN BRA PAD,804,Flowback,82247,gal,liquid,41397,5/3/13,45100,0,6.11,11700,9860,0,101,289,732,3.58,36700,0,3900,0,122,734,91000,0,251000,6.3,197000,113,12900,3030,13700,1080,0,0,0,2013,5,3,KATHRYN,BRA,PAD,0,0,802,Flowback,2012,4,19,015-22171,OGO-65420,41.626869,-76.251211,Yes,Horizontal Well,GAS,Bbl,2012,PW,0,2287373,248,0,0,2012.333333,1.083333333,12.68518519,4.654176542,0.78604121,4.068185862,3.993876915,2.004321374,2.460897843,2.864511081,4.564666064,3.591064607,0,2.086359831,2.86569606,4.959041392,0,5.399673721,0.799340549,5.294466226,2.053078443,4.11058971,3.481442629,4.136720567,3.033423755,1.103296812,0,0,0,0,0,0,0,0,0,0,5165,BRADFORD,KATHRYN BRA PAD,802,PW,70392,gal,liquid,41494,8/8/13,34000,0,0,10900,9450,0,226,274,681,4.06,31300,0,3290,0,81.8,747,124000,0,281000,6,200000,406,33700,18800,12000,1240,0,0,0,2013,8,8,KATHRYN,BRA,PAD,0,0,802,PW,2012,4,19,015-22171,OGO-65420,41.626869,-76.251211,Yes,Horizontal Well,GAS,Bbl,2012,Yes,0,2287373,248,0,0,2012.333333,1.333333333,9.677419355,4.531478917,0,4.037426498,3.975431809,2.354108439,2.437750563,2.833147112,4.495544338,3.517195898,0,1.912753304,2.873320602,5.093421685,0,5.44870632,0.77815125,5.301029996,2.608526034,4.527629901,4.274157849,4.079181246,3.093421685,0.985759561,0,0,0,0,0,0,0,0,0,0,4166,BRADFORD,KATZENSTEIN BRA PAD,802,PW,217083,gal,liquid,41436,6/11/13,95400,0,3.06,16700,25400,0,105,257,1550,8.72,46800,0,7080,0,70.8,1120,152000,0,444000,6,338000,38.4,25400,4420,13500,1710,0,0,0,2013,6,11,KATZENSTEIN,BRA,PAD,0,0,802,PW,2011,3,20,015-21078,OGO-65420,41.814253,-76.375108,Yes,Horizontal Well,GAS,Bbl,2012,Yes,0,269341,365,0,0,2011.25,2.25,7.894736842,4.979548375,0.485721426,4.222716471,4.404833717,2.021189299,2.409933123,3.190331698,4.670245853,3.850033258,0,1.850033258,3.049218023,5.181843588,0,5.64738297,0.77815125,5.5289167,1.584331224,4.404833717,3.645422269,4.130333768,3.23299611,0.897337658,0,0,0,0,0,0,0,0,0,0,4167,BRADFORD,KEELER HOLLOW BRA PAD,802,PW,439281,gal,liquid,41537,9/20/13,66400,0,0,15700,23200,0,86.7,260,2040,3.7,24200,0,9850,0,31.7,963,128000,0,409000,6,320000,114,79300,33500,42700,1760,0,0,0,2013,9,20,KEELER,HOLLOW,BRA,PAD,0,802,PW,2010,12,15,015-21243,OGO-65420,41.900336,-76.573411,Yes,Horizontal Well,GAS,Bbl,2012,Yes,0,581326,348,0,0,2011,2.75,24.26136364,4.822168079,0,4.195899652,4.365487985,1.938019097,2.414973348,3.309630167,4.383815366,3.99343623,0,1.501059262,2.983626287,5.10720997,0,5.611723308,0.77815125,5.505149978,2.056904851,4.899273187,4.525044807,4.630427875,3.245512668,1.384915207,0,0,0,0,0,0,0,0,0,0,4168,BRADFORD,KEIR BRA PAD,802,PW,538559,gal,liquid,41395,5/1/13,91900,0,3.06,8360,22100,0,86.8,216,1720,7.2,18600,0,5090,0,50.1,1070,151000,0,374000,6,285000,53.6,23300,15600,14100,1730,0,0,0,2013,5,1,KEIR,BRA,PAD,0,0,802,PW,2011,2,10,015-21528,OGO-65420,41.879742,-76.441511,Yes,Horizontal Well,GAS,Bbl,2012,Yes,0,1092579,365,0,0,2011.166667,2.25,8.150289017,4.963315511,0.485721426,3.922206277,4.344392274,1.938519725,2.334453751,3.235528447,4.269512944,3.706717782,0,1.699837726,3.029383778,5.178976947,0,5.572871602,0.77815125,5.45484486,1.72916479,4.367355921,4.193124598,4.149219113,3.238046103,0.91117301,0,0,0,0,0,0,0,0,0,0,4169,BRADFORD,KENT BRA PAD,802,PW,274359,gal,liquid,41446,6/21/13,77300,0,2.7,13300,20500,0,95.9,243,1450,6.84,36800,0,4050,0.27,51.8,1080,138000,0,409000,5.6,316000,215,16600,4130,12700,1570,0,0,0,2013,6,21,KENT,BRA,PAD,0,0,802,PW,2009,12,16,015-20221,OGO-65420,41.763419,-76.510214,Yes,Horizontal Well,GAS,Bbl,2012,Yes,0,522713,362,0,0,2010,3.5,8.089171975,4.888179494,0.431363764,4.123851641,4.311753861,1.981818607,2.385606274,3.161368002,4.565847819,3.607455023,-0.568636236,1.71432976,3.033423755,5.139879086,0,5.611723308,0.748188027,5.499687083,2.33243846,4.220108088,3.615950052,4.103803721,3.195899652,0.907904069,0,0,0,0,0,0,0,0,0,0,4170,BRADFORD,KENYON BRA PAD,802,PW,148531,gal,liquid,41390,4/26/13,71300,0,5.97,11900,19300,0,175,291,1410,8.24,39300,0.209,6190,0.374,68.7,771,121000,0,334000,6.1,237000,109,22600,8500,17600,1660,0,0,0,2013,4,26,KENYON,BRA,PAD,0,0,802,PW,2010,8,16,015-20966,OGO-65420,41.600436,-76.533228,Yes,Horizontal Well,GAS,Bbl,2012,Yes,0,1997097,365,0,0,2010.666667,2.666666667,10.60240964,4.85308953,0.775974331,4.075546961,4.285557309,2.243038049,2.463892989,3.149219113,4.59439255,3.791690649,-0.427128398,1.836956737,2.887054378,5.08278537,0,5.523746467,0.785329835,5.374748346,2.037426498,4.354108439,3.929418926,4.245512668,3.220108088,1.02540458,0,0,0,0,0,0,0,0,0,0,4171,BRADFORD,KINGSLEY BRA PAD,802,PW,286385,gal,liquid,41439,6/14/13,80200,0,3.45,10100,19900,0,99.7,231,1600,4.17,36100,0,4690,0.326,68.7,876,130000,0,356000,5.8,282000,56,13600,2920,10300,1260,0,0,0,2013,6,14,KINGSLEY,BRA,PAD,0,0,802,PW,2011,8,31,015-21861,OGO-65420,41.854539,-76.591192,Yes,Horizontal Well,GAS,Bbl,2012,Yes,0,981513,351,0,0,2011.666667,1.833333333,8.174603175,4.904174368,0.537819095,4.004321374,4.298853076,1.998695158,2.36361198,3.204119983,4.557507202,3.671172843,-0.4867824,1.836956737,2.942504106,5.113943352,0,5.551449998,0.763427994,5.450249108,1.748188027,4.133538908,3.465382851,4.012837225,3.100370545,0.91246668,0,0,0,0,0,0,0,0,0,0,4172,BRADFORD,KNAPP BRA PAD,804,Flowback,126186,gal,liquid,41491,8/5/13,21000,0,3.64,5660,4970,0,55.1,137,447,1.86,18500,0,1310,0,144,408,47400,21000,154000,6.6,113000,191,22000,7200,5570,387,0,0,0,2013,8,5,KNAPP,BRA,PAD,0,0,802,Flowback,2012,1,10,015-22083,OGO-65420,41.794525,-76.551028,Yes,Horizontal Well,GAS,Bbl,Yes,PW,0,1217709,155,0,0,2012.083333,1.583333333,14.39276486,4.322219295,0.561101384,3.752816431,3.696356389,1.741151599,2.136720567,2.650307523,4.267171728,3.117271296,0,2.158362492,2.610660163,4.675778342,4.322219295,5.187520721,0.819543936,5.053078443,2.281033367,4.342422681,3.857332496,3.745855195,2.587710965,1.15814423,0,0,0,0,0,0,0,0,0,0,5173,BRADFORD,KNAPP BRA PAD,802,PW,272508,gal,liquid,41563,10/16/13,21700,0,0,8730,7670,0,76.2,191,617,2.29,33400,0,2680,0,74.8,595,64500,0,197000,6.5,140000,239,29300,10400,7800,544,0,0,0,2013,10,16,KNAPP,BRA,PAD,0,0,802,PW,2012,1,10,015-22083,OGO-65420,41.794525,-76.551028,Yes,Horizontal Well,GAS,Bbl,Yes,Yes,409,1217709,155,0,0,2012.083333,1.75,14.33823529,4.336459734,0,3.941014244,3.884795364,1.881954971,2.281033367,2.790285164,4.523746467,3.428134794,0,1.873901598,2.774516966,4.809559715,0,5.294466226,0.812913357,5.146128036,2.378397901,4.46686762,4.017033339,3.892094603,2.7355989,1.156495703,0,0,0,0,0,0,0,0,0,0,4174,BRADFORD,KNICKERBOCKER BRA PAD,804,Flowback,129671,gal,liquid,41327,2/22/13,90300,0,4.68,11500,27200,0,117,324,1600,11.8,41700,0.309,5910,0.41,68.4,0,172000,26700,402000,6,313000,104,26400,5550,10900,1880,0,0,0,2013,2,22,KNICKERBOCKER,BRA,PAD,0,0,802,Flowback,2011,8,20,015-21843,OGO-65420,41.688878,-76.630147,Yes,Horizontal Well,GAS,Bbl,2012,PW,0,1344582,362,0,0,2011.666667,1.5,5.79787234,4.95568775,0.670245853,4.06069784,4.434568904,2.068185862,2.51054501,3.204119983,4.620136055,3.771587481,-0.387216143,1.835056102,0,5.235528447,4.426511261,5.604226053,0.77815125,5.495544338,2.017033339,4.421603927,3.744292983,4.037426498,3.274157849,0.763268649,0,0,0,0,0,0,0,0,0,0,5175,BRADFORD,KNICKERBOCKER BRA PAD,802,PW,319754,gal,liquid,41439,6/14/13,106000,0.138,3.88,15100,29200,0,130,346,2040,11.3,38900,0,7970,0.549,40.4,1220,192000,0,513000,5.5,360000,65.5,25000,5330,18900,2090,0,0,0,2013,6,14,KNICKERBOCKER,BRA,PAD,0,0,802,PW,2011,8,20,015-21843,OGO-65420,41.688878,-76.630147,Yes,Horizontal Well,GAS,Bbl,2012,Yes,0,1344582,362,0,0,2011.666667,1.833333333,9.043062201,5.025305865,0.588831726,4.178976947,4.465382851,2.113943352,2.539076099,3.309630167,4.589949601,3.901458321,-0.260427656,1.606381365,3.086359831,5.283301229,0,5.710117365,0.740362689,5.556302501,1.8162413,4.397940009,3.726727209,4.276461804,3.320146286,0.956315518,0,0,0,0,0,0,0,0,0,0,4176,BRADFORD,KRISE BRA PAD,804,Flowback,197199,gal,liquid,41408,5/14/13,55300,0,4.87,10900,13500,0.178,114,213,1020,5.87,38800,0,3790,0.251,85.3,703,89000,0,234000,6.2,218000,1210,11400,6980,11600,973,0,0,0,2013,5,14,KRISE,BRA,PAD,0,0,802,Flowback,2012,3,7,015-22123,OGO-65420,41.673478,-76.689286,Yes,Horizontal Well,GAS,Bbl,2012,PW,0,1762153,221,0,0,2012.25,1.166666667,11.92189106,4.742725131,0.687528961,4.037426498,4.130333768,2.056904851,2.328379603,3.008600172,4.588831726,3.57863921,-0.600326279,1.930949031,2.846955325,4.949390007,0,5.369215857,0.792391689,5.338456494,3.08278537,4.056904851,3.843855423,4.064457989,2.98811284,1.076345149,0,0,0,0,0,0,0,0,0,0,5177,BRADFORD,KRISE BRA PAD,802,PW,281839,gal,liquid,41487,8/1/13,52400,0,3.99,13300,16200,0,83.7,231,1130,7.52,26100,0,4800,0,51.2,957,110000,0,360000,6.1,300000,214,38400,14800,8210,1290,0,0,0,2013,8,1,KRISE,BRA,PAD,0,0,802,PW,2012,3,7,015-22123,OGO-65420,41.673478,-76.689286,Yes,Horizontal Well,GAS,Bbl,2012,Yes,0,1762153,221,0,0,2012.25,1.416666667,6.364341085,4.719331287,0.600972896,4.123851641,4.209515015,1.922725458,2.36361198,3.053078443,4.416640507,3.681241237,0,1.709269961,2.980911938,5.041392685,0,5.556302501,0.785329835,5.477121255,2.330413773,4.584331224,4.170261715,3.914343157,3.11058971,0.803753447,0,0,0,0,0,0,0,0,0,0,4178,BRADFORD,LANDMESSER BRA PAD,804,Flowback,460130,gal,liquid,41527,9/10/13,103000,0,0,8850,36500,0,125,318,2780,19.7,42200,0,6920,0,0,1470,201000,0,533000,5.1,502000,229,26700,9670,18600,2040,0,0,0,2013,9,10,LANDMESSER,BRA,PAD,0,0,802,Flowback,2011,6,22,015-21701,OGO-65420,41.732797,-76.496372,Yes,Horizontal Well,GAS,Bbl,2012,PW,0,72276,115,0,0,2011.5,2.25,9.117647059,5.012837225,0,3.946943271,4.562292864,2.096910013,2.50242712,3.444044796,4.625312451,3.840106094,0,0,3.167317335,5.303196057,0,5.726727209,0.707570176,5.700703717,2.359835482,4.426511261,3.985426474,4.269512944,3.309630167,0.959882777,0,0,0,0,0,0,0,0,0,0,5179,BRADFORD,LANDMESSER BRA PAD,802,PW,472394,gal,liquid,41584,11/6/13,101000,0,0,9780,35800,0,111,325,2850,24.4,39000,0,7000,0,5.5,1270,200000,0,552000,5.2,429000,167,45400,17600,8870,2250,0,0,0,2013,11,6,LANDMESSER,BRA,PAD,0,0,802,PW,2011,6,22,015-21701,OGO-65420,41.732797,-76.496372,Yes,Horizontal Well,GAS,Bbl,2012,Yes,0,72276,115,0,0,2011.5,2.416666667,3.942222222,5.004321374,0,3.990338855,4.553883027,2.045322979,2.511883361,3.45484486,4.591064607,3.84509804,0,0.740362689,3.103803721,5.301029996,0,5.741939078,0.716003344,5.632457292,2.222716471,4.657055853,4.245512668,3.94792362,3.352182518,0.595741102,0,0,0,0,0,0,0,0,0,0,4180,BRADFORD,LAUREL BRA PAD,804,Flowback,128174,gal,liquid,41418,5/24/13,31700,0,5.65,6150,8500,0,82.5,201,539,2.72,27400,0.143,2740,0.214,94.8,513,69500,0,196000,6.4,166000,426,11500,5180,11800,615,0,0,0,2013,5,24,LAUREL,BRA,PAD,0,0,802,Flowback,2012,4,23,015-22021,OGO-65420,41.653386,-76.539069,Yes,Horizontal Well,GAS,Bbl,2012,PW,0,1641413,229,0,0,2012.333333,1.083333333,19.18699187,4.501059262,0.752048448,3.788875116,3.929418926,1.916453949,2.303196057,2.731588765,4.437750563,3.437750563,-0.669586227,1.976808337,2.710117365,4.841984805,0,5.292256071,0.806179974,5.220108088,2.629409599,4.06069784,3.71432976,4.071882007,2.788875116,1.283006892,0,0,0,0,0,0,0,0,0,0,5181,BRADFORD,LAUREL BRA PAD,802,PW,94404,gal,liquid,41555,10/8/13,24800,0,0,8620,8930,0,156,202,617,4.1,31300,0,3390,0,43.7,486,64500,37100,224000,6,164000,60.8,14200,1580,15100,822,0,0,0,2013,10,8,LAUREL,BRA,PAD,0,0,802,PW,2012,4,23,015-22021,OGO-65420,41.653386,-76.539069,Yes,Horizontal Well,GAS,Bbl,2012,Yes,0,1641413,229,0,0,2012.333333,1.5,18.36982968,4.394451681,0,3.935507266,3.950851459,2.193124598,2.305351369,2.790285164,4.495544338,3.530199698,0,1.640481437,2.686636269,4.809559715,4.56937391,5.350248018,0.77815125,5.214843848,1.783903579,4.152288344,3.198657087,4.178976947,2.914871818,1.26410513,0,0,0,0,0,0,0,0,0,0,4182,BRADFORD,LEAMAN BRA PAD,802,PW,30324,gal,liquid,41439,6/14/13,62600,0,2.31,14900,19400,0,95.3,220,1240,6.34,41200,0,5660,0.627,24.5,718,128000,0,310000,5.3,243000,132,11200,2570,8630,1050,0,0,0,2013,6,14,LEAMAN,BRA,PAD,0,0,802,PW,2010,4,15,015-20638,OGO-65420,41.773022,-76.668578,Yes,Horizontal Well,GAS,Bbl,2012,Yes,0,386042,352,0,0,2010.333333,3.166666667,8.219047619,4.796574333,0.36361198,4.173186268,4.28780173,1.979092901,2.342422681,3.093421685,4.614897216,3.752816431,-0.202732459,1.389166084,2.856124444,5.10720997,0,5.491361694,0.72427587,5.385606274,2.120573931,4.049218023,3.409933123,3.936010796,3.021189299,0.914821497,0,0,0,0,0,0,0,0,0,0,4183,BRADFORD,LEMOREVIEW FARMS BRA PAD,804,Flowback,272453,gal,liquid,41484,7/29/13,93100,0.107,4.15,14600,33600,0,113,317,2210,7.94,50800,0,8090,0.42,39.6,947,165000,0,535000,5.7,502000,274,59400,31500,29600,2450,0,0,0,2013,7,29,LEMOREVIEW,FARMS,BRA,PAD,0,802,Flowback,2011,1,23,015-21305,OGO-65420,41.671392,-76.774764,Yes,Horizontal Well,GAS,Bbl,2012,PW,0,223221,161,0,0,2011.083333,2.5,12.08163265,4.968949681,0.618048097,4.164352856,4.526339277,2.053078443,2.501059262,3.344392274,4.705863712,3.907948522,-0.37675071,1.597695186,2.976349979,5.217483944,0,5.728353782,0.755874856,5.700703717,2.437750563,4.773786445,4.498310554,4.471291711,3.389166084,1.082125627,0,0,0,0,0,0,0,0,0,0,5184,BRADFORD,LEMOREVIEW FARMS BRA PAD,802,PW,524230,gal,liquid,41550,10/3/13,91100,0,0,18800,32700,0,99.9,276,2310,16.1,68200,0,8650,0,9.5,1180,217000,0,449000,5.6,367000,146,52000,12800,26900,2440,0,0,0,2013,10,3,LEMOREVIEW,FARMS,BRA,PAD,0,802,PW,2011,1,23,015-21305,OGO-65420,41.671392,-76.774764,Yes,Horizontal Well,GAS,Bbl,2012,Yes,0,223221,161,0,0,2011.083333,2.75,11.02459016,4.959518377,0,4.274157849,4.514547753,1.999565488,2.440909082,3.36361198,4.833784375,3.937016107,0,0.977723605,3.071882007,5.336459734,0,5.652246341,0.748188027,5.564666064,2.164352856,4.716003344,4.10720997,4.42975228,3.387389826,1.042362454,0,0,0,0,0,0,0,0,0,0,4185,BRADFORD,LINSKI BRA PAD,802,PW,43262,gal,liquid,41394,4/30/13,16100,0,2.08,5100,2930,0,91.5,104,242,6.2,11200,0,833,0.11,143,0,34700,67600,93300,6.6,61600,251,9430,4120,5060,359,0,0,0,2013,4,30,LINSKI,BRA,PAD,0,0,802,PW,2011,12,4,015-22029,OGO-65420,41.666928,-76.149,Yes,Horizontal Well,GAS,Bbl,2012,Yes,0,2945855,363,0,0,2012,1.333333333,14.09470752,4.206825876,0.318063335,3.707570176,3.46686762,1.961421094,2.017033339,2.383815366,4.049218023,2.920645001,-0.958607315,2.155336037,0,4.540329475,4.829946696,4.969881644,0.819543936,4.789580712,2.399673721,3.974511693,3.614897216,3.704150517,2.555094449,1.149056068,0,0,0,0,0,0,0,0,0,0,4186,BRADFORD,LOMISON INC BRA,804,Flowback,0,gal,liquid,41277,1/3/13,24800,0,3.4,5940,5230,0,75.3,156,442,1.97,27600,0,1820,0.476,134,0,58500,0,163000,6.3,126000,199,10300,9700,3520,333,0,0,0,2013,1,3,LOMISON,INC,BRA,0,0,802,Flowback,2011,8,12,015-21813,OGO-65420,41.788847,-76.537628,Yes,Horizontal Well,GAS,Bbl,2012,PW,0,1272110,361,0,0,2011.666667,1.416666667,10.57057057,4.394451681,0.531478917,3.773786445,3.718501689,1.876794976,2.193124598,2.645422269,4.440909082,3.260071388,-0.322393047,2.127104798,0,4.767155866,0,5.212187604,0.799340549,5.100370545,2.298853076,4.012837225,3.986771734,3.546542663,2.522444234,1.02409843,0,0,0,0,0,0,0,0,0,0,5187,BRADFORD,LOMISON INC BRA,802,PW,396577,gal,liquid,41430,6/5/13,20500,0,3.07,5460,4810,0,48.2,142,411,1.36,25300,0,1630,0,122,413,59600,0,173000,6.6,105000,0,3470,1260,3360,348,0,0,0,2013,6,5,LOMISON,INC,BRA,0,0,802,PW,2011,8,12,015-21813,OGO-65420,41.788847,-76.537628,Yes,Horizontal Well,GAS,Bbl,2012,Yes,0,1272110,361,0,0,2011.666667,1.833333333,9.655172414,4.311753861,0.487138375,3.737192643,3.682145076,1.683047038,2.152288344,2.613841822,4.403120521,3.212187604,0,2.086359831,2.615950052,4.77524626,0,5.238046103,0.819543936,5.021189299,0,3.540329475,3.100370545,3.526339277,2.541579244,0.984760033,0,0,0,0,0,0,0,0,0,0,4188,BRADFORD,LYTWYN BRA PAD,802,PW,71419,gal,liquid,41431,6/6/13,75500,0,3.23,13600,19500,0,80.3,292,1620,3.53,38700,0,6930,0,57.3,1140,132000,0,381000,6,254000,44,22900,4450,22100,1540,0,0,0,2013,6,6,LYTWYN,BRA,PAD,0,0,802,PW,2011,2,15,015-21530,OGO-65420,41.857039,-76.572511,Yes,Horizontal Well,GAS,Bbl,2012,Yes,0,543271,351,0,0,2011.166667,2.333333333,14.35064935,4.877946952,0.509202522,4.133538908,4.290034611,1.904715545,2.465382851,3.209515015,4.587710965,3.840733235,0,1.758154622,3.056904851,5.120573931,0,5.580924976,0.77815125,5.404833717,1.643452676,4.359835482,3.648360011,4.344392274,3.187520721,1.156871553,0,0,0,0,0,0,0,0,0,0,4189,BRADFORD,MAD DOG BRA PAD,804,Flowback,121952,gal,liquid,41556,10/9/13,30600,0,6.53,8710,10900,0,69,249,808,4.86,35100,0,4130,0,56.7,607,87900,0,272000,6.1,162000,228,11800,2190,10200,1190,0,0,0,2013,10,9,MAD,DOG,BRA,PAD,0,802,Flowback,2011,11,22,015-21995,OGO-65420,41.589442,-76.335097,Yes,Horizontal Well,GAS,Bbl,2012,PW,0,669809,81,0,0,2011.916667,1.916666667,8.571428571,4.485721426,0.814913181,3.940018155,4.037426498,1.838849091,2.396199347,2.907411361,4.545307116,3.615950052,0,1.753583059,2.783188691,4.943988875,0,5.434568904,0.785329835,5.209515015,2.357934847,4.071882007,3.340444115,4.008600172,3.075546961,0.93305321,0,0,0,0,0,0,0,0,0,0,5190,BRADFORD,MAD DOG BRA PAD,802,PW,17472,gal,liquid,41580,11/2/13,34300,0,6.66,8740,12200,0,76.5,274,919,5.94,34600,0,3970,0,72.7,539,89500,0,259000,5.9,157000,215,21700,4230,15500,1280,0,0,0,2013,11,2,MAD,DOG,BRA,PAD,0,802,PW,2011,11,22,015-21995,OGO-65420,41.589442,-76.335097,Yes,Horizontal Well,GAS,Bbl,2012,Yes,0,669809,81,0,0,2011.916667,2,12.109375,4.53529412,0.823474229,3.941511433,4.086359831,1.883661435,2.437750563,2.963315511,4.539076099,3.598790507,0,1.861534411,2.731588765,4.951823035,0,5.413299764,0.770852012,5.195899652,2.33243846,4.336459734,3.626340367,4.190331698,3.10720997,1.083121729,0,0,0,0,0,0,0,0,0,0,4191,BRADFORD,MADDEN BRA PAD,802,PW,98571,gal,liquid,41430,6/5/13,102000,0,2.61,13000,26200,0,96.3,326,1610,8.8,31100,0,7310,0.585,16.3,1150,178000,0,480000,5.7,354000,130,19400,7840,21900,2460,0,0,0,2013,6,5,MADDEN,BRA,PAD,0,0,802,PW,2010,7,15,015-20873,OGO-65420,41.738856,-76.396097,Yes,Horizontal Well,GAS,Bbl,2012,Yes,0,359825,336,0,0,2010.583333,2.916666667,8.902439024,5.008600172,0.416640507,4.113943352,4.418301291,1.983626287,2.5132176,3.206825876,4.492760389,3.863917377,-0.232844134,1.212187604,3.06069784,5.250420002,0,5.681241237,0.755874856,5.549003262,2.113943352,4.28780173,3.894316063,4.340444115,3.390935107,0.949509008,0,0,0,0,0,0,0,0,0,0,4192,BRADFORD,MAKAYLA BRA PAD,804,Flowback,228295,gal,liquid,41627,12/19/13,35300,0,5.67,11600,12700,0,91.1,297,903,4.83,35300,0,4830,0,50.1,737,117000,0,366000,5.8,187000,174,53100,22800,17400,1670,0,0,0,2013,12,19,MAKAYLA,BRA,PAD,0,0,802,Flowback,2012,8,27,015-22230,OGO-65420,41.628611,-76.210144,Yes,Horizontal Well,GAS,Bbl,2012,PW,0,200038,17,0,0,2012.666667,1.333333333,10.41916168,4.547774705,0.753583059,4.064457989,4.103803721,1.959518377,2.472756449,2.95568775,4.547774705,3.683947131,0,1.699837726,2.867467488,5.068185862,0,5.563481085,0.763427994,5.271841607,2.240549248,4.725094521,4.357934847,4.240549248,3.222716471,1.017832777,0,0,0,0,0,0,0,0,0,0,5193,BRADFORD,MCCABE BRA PAD,802,PW,141485,gal,liquid,41487,8/1/13,107000,0,1.81,11300,29900,0,89.2,248,1920,15.5,26900,0,5930,0,0,1270,143000,0,474000,4.5,452000,130,40600,21700,8820,2080,0,0,0,2013,8,1,MCCABE,BRA,PAD,0,0,802,PW,2011,1,8,015-21267,OGO-65420,41.735919,-76.518444,Yes,Horizontal Well,GAS,Bbl,2012,Yes,0,130903,356,0,0,2011.083333,2.583333333,4.240384615,5.029383778,0.257678575,4.053078443,4.475671188,1.950364854,2.394451681,3.283301229,4.42975228,3.773054693,0,0,3.103803721,5.155336037,0,5.675778342,0.653212514,5.655138435,2.113943352,4.608526034,4.336459734,3.945468585,3.318063335,0.62740525,0,0,0,0,0,0,0,0,0,0,4194,BRADFORD,MCCONNELL BRA PAD,802,PW,118451,gal,liquid,41409,5/15/13,65000,0,5.15,10800,15100,0,100,256,980,6.4,36700,0,4790,0,97.9,725,118000,0,271000,6.3,213000,128,42800,16100,17900,1420,0,0,0,2013,5,15,MCCONNELL,BRA,PAD,0,0,802,PW,2010,6,27,015-20705,OGO-65420,41.611381,-76.548339,Yes,Horizontal Well,GAS,Bbl,2012,Yes,0,2239262,365,0,0,2010.5,2.916666667,12.6056338,4.812913357,0.711807229,4.033423755,4.178976947,2,2.408239965,2.991226076,4.564666064,3.680335513,0,1.990782692,2.860338007,5.071882007,0,5.432969291,0.799340549,5.328379603,2.10720997,4.631443769,4.206825876,4.252853031,3.152288344,1.100564687,0,0,0,0,0,0,0,0,0,0,4195,BRADFORD,MCGROARTY BRA WELL,804,Flowback,150522,gal,liquid,41465,7/10/13,37100,0,5.99,10900,8880,0,65.5,256,595,4.39,33100,0,3040,0.754,101,611,81000,0,250000,6.3,173000,151,29800,9650,8820,886,0,0,0,2013,7,10,MCGROARTY,BRA,WELL,0,0,802,Flowback,2011,12,4,015-21986,OGO-65420,41.586422,-76.410794,Yes,Horizontal Well,GAS,Bbl,2012,PW,0,1633131,177,0,0,2012,1.583333333,9.954853273,4.56937391,0.777426822,4.037426498,3.948412966,1.8162413,2.408239965,2.774516966,4.519827994,3.482873584,-0.122628654,2.004321374,2.78604121,4.908485019,0,5.397940009,0.799340549,5.238046103,2.178976947,4.474216264,3.984527313,3.945468585,2.947433722,0.998034863,0,0,0,0,0,0,0,0,0,0,5196,BRADFORD,MCGROARTY BRA WELL,802,PW,43334,gal,liquid,41565,10/18/13,31500,0,5.4,12300,11300,0,117,274,787,5.19,29500,0,4750,0,62.5,719,103000,0,295000,6.4,226000,206,58400,30200,9410,1230,0,0,0,2013,10,18,MCGROARTY,BRA,WELL,0,0,802,PW,2011,12,4,015-21986,OGO-65420,41.586422,-76.410794,Yes,Horizontal Well,GAS,Bbl,2012,Yes,0,1633131,177,0,0,2012,1.833333333,7.650406504,4.498310554,0.73239376,4.089905111,4.053078443,2.068185862,2.437750563,2.895974732,4.469822016,3.67669361,0,1.795880017,2.85672889,5.012837225,0,5.469822016,0.806179974,5.354108439,2.31386722,4.766412847,4.480006943,3.973589623,3.089905111,0.883684512,0,0,0,0,0,0,0,0,0,0,4197,BRADFORD,MEL BRA PAD,804,Flowback,267907,gal,liquid,41327,2/22/13,97700,0,6.26,8970,31500,0,109,328,1830,10.6,43800,0,6070,0.461,31.9,0,188000,0,382000,5.8,308000,120,43000,7440,10800,2050,0,0,0,2013,2,22,MEL,BRA,PAD,0,0,802,Flowback,2011,12,8,015-21854,OGO-65420,41.696836,-76.598531,Yes,Horizontal Well,GAS,Bbl,2012,PW,0,637843,328,0,0,2012,1.166666667,5.268292683,4.989894564,0.796574333,3.952792443,4.498310554,2.037426498,2.515873844,3.26245109,4.641474111,3.783188691,-0.336299075,1.503790683,0,5.274157849,0,5.582063363,0.763427994,5.488550717,2.079181246,4.633468456,3.871572936,4.033423755,3.311753861,0.721669894,0,0,0,0,0,0,0,0,0,0,5198,BRADFORD,MEL BRA PAD,802,PW,202751,gal,liquid,41487,8/1/13,87400,0,4.92,8160,29900,0,102,323,1700,11.7,23800,0,5420,0,28,1270,162000,0,486000,5.5,424000,125,72300,37700,19900,2390,0,0,0,2013,8,1,MEL,BRA,PAD,0,0,802,PW,2011,12,8,015-21854,OGO-65420,41.696836,-76.598531,Yes,Horizontal Well,GAS,Bbl,2012,Yes,0,637843,328,0,0,2012,1.666666667,8.326359833,4.941511433,0.691965103,3.911690159,4.475671188,2.008600172,2.509202522,3.230448921,4.376576957,3.733999287,0,1.447158031,3.103803721,5.209515015,0,5.686636269,0.740362689,5.627365857,2.096910013,4.859138297,4.57634135,4.298853076,3.378397901,0.920455175,0,0,0,0,0,0,0,0,0,0,4199,BRADFORD,MERRYALL BRA PAD,804,Flowback,374056,gal,liquid,41487,8/1/13,55100,0,4.44,14500,13600,0,87.8,285,1070,4.24,40300,0,5280,0,70,1100,120000,0,255000,6.2,209000,84.8,16700,5990,10800,1230,0,0,0,2013,8,1,MERRYALL,BRA,PAD,0,0,802,Flowback,2011,11,23,015-21981,OGO-65420,41.694206,-76.237864,Yes,Horizontal Well,GAS,Bbl,2012,PW,0,206406,331,0,0,2011.916667,1.75,8.780487805,4.741151599,0.64738297,4.161368002,4.133538908,1.943494516,2.45484486,3.029383778,4.605305046,3.722633923,0,1.84509804,3.041392685,5.079181246,0,5.40654018,0.792391689,5.320146286,1.928395852,4.222716471,3.777426822,4.033423755,3.089905111,0.943518644,0,0,0,0,0,0,0,0,0,0,5200,BRADFORD,MERRYALL BRA PAD,802,PW,237820,gal,liquid,41479,7/24/13,59200,0,3.08,17600,13900,0,96.2,264,1060,5.27,36400,0,5460,0.401,82.1,719,109000,0,305000,6.1,247000,321,31900,12300,8600,1300,0,0,0,2013,7,24,MERRYALL,BRA,PAD,0,0,802,PW,2011,11,23,015-21981,OGO-65420,41.694206,-76.237864,Yes,Horizontal Well,GAS,Bbl,2012,Yes,0,206406,331,0,0,2011.916667,1.666666667,6.615384615,4.772321707,0.488550717,4.245512668,4.1430148,1.983175072,2.421603927,3.025305865,4.561101384,3.737192643,-0.396855627,1.914343157,2.85672889,5.037426498,0,5.484299839,0.785329835,5.392696953,2.506505032,4.503790683,4.089905111,3.934498451,3.113943352,0.820555099,0,0,0,0,0,0,0,0,0,0,4201,BRADFORD,MESSERSMITH BRA PAD,802,PW,14700,gal,liquid,41411,5/17/13,21000,0,3.87,6610,4400,0,93.9,177,306,5.72,20700,0,1900,0.138,90.7,348,46600,27400,125000,6.4,99700,139,8320,2890,6600,640,0,0,0,2013,5,17,MESSERSMITH,BRA,PAD,0,0,802,PW,2012,4,10,015-22138,OGO-65420,41.563969,-76.3205,Yes,Horizontal Well,GAS,Bbl,2012,Yes,0,3261775,365,0,0,2012.333333,1.083333333,10.3125,4.322219295,0.587710965,3.820201459,3.643452676,1.972665592,2.247973266,2.485721426,4.315970345,3.278753601,-0.860120914,1.957607287,2.541579244,4.668385917,4.437750563,5.096910013,0.806179974,4.998695158,2.1430148,3.920123326,3.460897843,3.819543936,2.806179974,1.013363962,0,0,0,0,0,0,0,0,0,0,4202,BRADFORD,MILLER BRA PAD,802,PW,244447,gal,liquid,41446,6/21/13,84700,0,2.72,16000,24600,0,85.6,247,1680,11.6,33500,0,5290,0,34.9,1050,203000,0,453000,5.5,383000,269,10900,4210,6530,1680,0,0,0,2013,6,21,MILLER,BRA,PAD,0,0,802,PW,2009,12,19,015-20207,OGO-65420,41.762033,-76.498139,Yes,Horizontal Well,GAS,Bbl,2012,PW,0,127592,234,0,0,2010,4.833333333,3.886904762,4.92788341,0.434568904,4.204119983,4.390935107,1.932473765,2.392696953,3.225309282,4.525044807,3.723455672,0,1.542825427,3.021189299,5.307496038,0,5.656098202,0.740362689,5.583198774,2.42975228,4.037426498,3.624282096,3.814913181,3.225309282,0.5896039,0,0,0,0,0,0,0,0,0,0,4203,BRADFORD,MOODY BRA PAD,802,PW,34566,gal,liquid,41425,5/31/13,32000,0,3.02,10500,6800,0,121,177,528,4.27,28800,0,2970,0,117,512,75400,0,202000,6.4,158000,90,9680,3450,4620,560,0,0,0,2013,5,31,MOODY,BRA,PAD,0,0,802,PW,2011,7,22,015-21759,OGO-65420,41.824611,-76.678767,Yes,Horizontal Well,GAS,Bbl,2012,Yes,0,1594581,355,0,0,2011.583333,1.833333333,8.25,4.505149978,0.480006943,4.021189299,3.832508913,2.08278537,2.247973266,2.722633923,4.459392488,3.472756449,0,2.068185862,2.709269961,4.877371346,0,5.305351369,0.806179974,5.198657087,1.954242509,3.985875357,3.537819095,3.664641976,2.748188027,0.916453949,0,0,0,0,0,0,0,0,0,0,4204,BRADFORD,MOORE FARM BRA PAD,804,Flowback,138256,gal,liquid,41487,8/1/13,106000,0,3.6,11800,26000,0,86.3,263,1800,7.09,37800,0,6440,3.33,47.1,1140,139000,0,468000,5.8,389000,60,102000,36800,21800,2200,0,0,0,2013,8,1,MOORE,FARM,BRA,PAD,0,802,Flowback,2010,11,20,015-21148,OGO-65420,41.671442,-76.78515,Yes,Horizontal Well,GAS,Bbl,2012,PW,0,316269,162,0,0,2010.916667,1.166666667,9.909090909,5.025305865,0.556302501,4.071882007,4.414973348,1.936010796,2.419955748,3.255272505,4.5774918,3.808885867,0.522444234,1.673020907,3.056904851,5.1430148,0,5.670245853,0.763427994,5.589949601,1.77815125,5.008600172,4.565847819,4.338456494,3.342422681,0.996033813,0,0,0,0,0,0,0,0,0,0,5205,BRADFORD,MOORE FARM BRA PAD,802,PW,185314,gal,liquid,41550,10/3/13,83500,0,0,17200,29800,0,91.9,259,2220,14.1,68000,0,8010,0,21.2,1140,237000,0,425000,5.6,337000,125,23200,10300,17900,2200,0,0,0,2013,10,3,MOORE,FARM,BRA,PAD,0,802,PW,2010,11,20,015-21148,OGO-65420,41.671442,-76.78515,Yes,Horizontal Well,GAS,Bbl,2012,PW,0,316269,162,0,0,2010.916667,1.333333333,8.136363636,4.921686475,0,4.235528447,4.474216264,1.963315511,2.413299764,3.346352974,4.832508913,3.903632516,0,1.326335861,3.056904851,5.374748346,0,5.62838893,0.748188027,5.527629901,2.096910013,4.365487985,4.012837225,4.252853031,3.342422681,0.91043035,0,0,0,0,0,0,0,0,0,0,4206,BRADFORD,MOOSE BRA PAD,802,PW,51408,gal,liquid,41467,7/12/13,107000,0,3.38,11500,30400,0,151,332,2030,13.3,48900,0,5600,0.329,42.4,1340,178000,0,534000,5.6,482000,153,57200,17400,16800,2140,0,0,0,2013,7,12,MOOSE,BRA,PAD,0,0,802,PW,2010,10,26,015-21098,OGO-65420,41.815872,-76.322056,Yes,Horizontal Well,GAS,Bbl,2012,Yes,0,952499,365,0,0,2010.833333,2.75,7.85046729,5.029383778,0.5289167,4.06069784,4.482873584,2.178976947,2.521138084,3.307496038,4.689308859,3.748188027,-0.482804102,1.627365857,3.127104798,5.250420002,0,5.727541257,0.748188027,5.683047038,2.184691431,4.757396029,4.240549248,4.225309282,3.330413773,0.894895508,0,0,0,0,0,0,0,0,0,0,4207,BRADFORD,MORSE BRA PAD,804,Flowback,75600,gal,liquid,41635,12/27/13,108000,0,8.42,1650,38600,0,146,369,2770,21.9,36400,0,3960,2.39,11.2,1460,249000,0,680000,5.1,387000,152,19700,2480,18000,2850,0,0,0,2013,12,27,MORSE,BRA,PAD,0,0,802,Flowback,2010,8,17,015-20929,OGO-65420,41.683219,-76.656019,Yes,Horizontal Well,GAS,Bbl,2012,PW,0,46684,13,0,0,2010.666667,3.333333333,6.315789474,5.033423755,0.925312091,3.217483944,4.586587305,2.164352856,2.567026366,3.442479769,4.561101384,3.597695186,0.378397901,1.049218023,3.164352856,5.396199347,0,5.832508913,0.707570176,5.587710965,2.181843588,4.294466226,3.394451681,4.255272505,3.45484486,0.800427645,0,0,0,0,0,0,0,0,0,0,5208,BRADFORD,MOWRY 2 BRA PAD,802,PW,4200,gal,liquid,41554,10/7/13,36400,0,0,16000,13100,0,1300,234,889,10.7,37400,0,5240,0,9.9,651,97600,0,326000,5.4,249000,1230,27100,7530,4990,1240,0,0,0,2013,10,7,MOWRY,2,BRA,PAD,0,802,PW,2009,6,26,015-20123,OGO-65420,41.716487,-76.135691,Yes,Horizontal Well,GAS,Bbl,2012,Yes,0,1225366,361,0,0,2009.5,4.333333333,4.024193548,4.561101384,0,4.204119983,4.117271296,3.113943352,2.369215857,2.948901761,4.572871602,3.719331287,0,0.995635195,2.813580989,4.989449818,0,5.5132176,0.73239376,5.396199347,3.089905111,4.432969291,3.876794976,3.698100546,3.093421685,0.60467886,0,0,0,0,0,0,0,0,0,0,4209,BRADFORD,MOYER BRA PAD,804,Flowback,187325,gal,liquid,41334,3/1/13,70700,0,6.08,10100,21100,0,124,307,1510,8.72,36700,0.261,6090,0,84.7,1070,140000,0,280000,6.2,242000,66.8,36500,9540,11600,1810,0,0,0,2013,3,1,MOYER,BRA,PAD,0,0,802,Flowback,2012,5,31,015-22169,OGO-65420,41.578186,-76.520728,Yes,Horizontal Well,GAS,Bbl,2012,PW,0,955226,343,0,0,2012.416667,0.833333333,6.408839779,4.849419414,0.783903579,4.004321374,4.324282455,2.093421685,2.487138375,3.178976947,4.564666064,3.784617293,0,1.92788341,3.029383778,5.146128036,0,5.447158031,0.792391689,5.383815366,1.824776462,4.562292864,3.979548375,4.064457989,3.257678575,0.806779414,0,0,0,0,0,0,0,0,0,0,5210,BRADFORD,MOYER BRA PAD,802,PW,76879,gal,liquid,41466,7/11/13,75700,0,5.81,10200,22600,0,395,310,1630,12.3,37600,0,5930,0.449,107,760,145000,0,402000,5.9,287000,810,49100,15600,16100,1890,0,0,0,2013,7,11,MOYER,BRA,PAD,0,0,802,PW,2012,5,31,015-22169,OGO-65420,41.578186,-76.520728,Yes,Horizontal Well,GAS,Bbl,2012,Yes,0,955226,343,0,0,2012.416667,1.166666667,8.518518519,4.87909588,0.764176132,4.008600172,4.354108439,2.596597096,2.491361694,3.212187604,4.575187845,3.773054693,-0.347753659,2.029383778,2.880813592,5.161368002,0,5.604226053,0.770852012,5.457881897,2.908485019,4.691081492,4.193124598,4.206825876,3.276461804,0.930364072,0,0,0,0,0,0,0,0,0,0,4211,BRADFORD,NEAL BRA PAD,802,PW,46531,gal,liquid,41487,8/1/13,72400,0,4.29,10500,26400,0,85.5,328,1610,14.6,37600,0,5600,0.415,37,1130,160000,0,472000,5.6,421000,65.3,118000,39800,18000,2230,0,0,0,2013,8,1,NEAL,BRA,PAD,0,0,802,PW,2011,12,15,015-21863,OGO-65420,41.680428,-76.667281,Yes,Horizontal Well,GAS,Bbl,2012,PW,0,918644,352,0,0,2012,4.833333333,8.071748879,4.859738566,0.632457292,4.021189299,4.421603927,1.931966115,2.515873844,3.206825876,4.575187845,3.748188027,-0.381951903,1.568201724,3.053078443,5.204119983,0,5.673941999,0.748188027,5.624282096,1.814913181,5.071882007,4.599883072,4.255272505,3.348304863,0.906967642,0,0,0,0,0,0,0,0,0,0,4212,BRADFORD,NICHOLS BRA PAD,804,Flowback,66848,gal,liquid,41484,7/29/13,34300,0,3.64,10500,9780,0,108,200,732,3.06,34800,0,3840,0,144,489,78200,0,253000,6.2,210000,72.3,33000,5800,7980,659,0,0,0,2013,7,29,NICHOLS,BRA,PAD,0,0,802,Flowback,2011,10,6,015-21866,OGO-65420,41.8669,-76.620425,Yes,Horizontal Well,GAS,Bbl,2012,PW,0,724929,161,0,0,2011.833333,1.75,12.10925645,4.53529412,0.561101384,4.021189299,3.990338855,2.033423755,2.301029996,2.864511081,4.541579244,3.584331224,0,2.158362492,2.689308859,4.893206753,0,5.403120521,0.792391689,5.322219295,1.859138297,4.51851394,3.763427994,3.902002891,2.818885415,1.083117477,0,0,0,0,0,0,0,0,0,0,5213,BRADFORD,NICHOLS BRA PAD,802,PW,74634,gal,liquid,41569,10/22/13,36100,0,0,14700,12700,0,87.3,230,1060,2.73,31000,0,5800,0,68.5,633,147000,0,324000,6.1,161000,93,74200,32500,13300,0,0,0,0,2013,10,22,NICHOLS,BRA,PAD,0,0,802,PW,2011,10,6,015-21866,OGO-65420,41.8669,-76.620425,Yes,Horizontal Well,GAS,Bbl,2012,Yes,0,724929,161,0,0,2011.833333,2,0,4.557507202,0,4.167317335,4.103803721,1.941014244,2.361727836,3.025305865,4.491361694,3.763427994,0,1.835690571,2.80140371,5.167317335,0,5.51054501,0.785329835,5.206825876,1.968482949,4.870403905,4.511883361,4.123851641,0,0,0,0,0,0,0,0,0,0,0,0,4214,BRADFORD,NINA BRA PAD,804,Flowback,34309,gal,liquid,41465,7/10/13,60700,0,9.66,1830,20500,0,118,294,1310,14.3,69700,0,5140,0.716,48.1,978,197000,0,544000,5.8,426000,31.7,19300,16500,10200,2250,0,0,0,2013,7,10,NINA,BRA,PAD,0,0,802,Flowback,2013,2,8,015-22273,OGO-65420,41.674969,-76.391678,Yes,Horizontal Well,GAS,Bbl,Yes,PW,0,1853865,183,0,0,2013.166667,0.416666667,4.533333333,4.783188691,0.984977126,3.26245109,4.311753861,2.071882007,2.46834733,3.117271296,4.843232778,3.710963119,-0.145086978,1.682145076,2.990338855,5.294466226,0,5.7355989,0.763427994,5.629409599,1.501059262,4.285557309,4.217483944,4.008600172,3.352182518,0.656417654,0,0,0,0,0,0,0,0,0,0,5215,BRADFORD,NINA BRA PAD,802,PW,324219,gal,liquid,41541,9/24/13,86800,0,8.13,1770,31700,0,120,391,1820,23.8,78000,0,7530,0,4.9,1280,198000,0,477000,5.3,427000,150,45700,16700,11800,3150,0,0,0,2013,9,24,NINA,BRA,PAD,0,0,802,PW,2013,2,8,015-22273,OGO-65420,41.674969,-76.391678,Yes,Horizontal Well,GAS,Bbl,Yes,Yes,860,1853865,183,0,0,2013.166667,0.583333333,3.746031746,4.938519725,0.910090546,3.247973266,4.501059262,2.079181246,2.592176757,3.260071388,4.892094603,3.876794976,0,0.69019608,3.10720997,5.29666519,0,5.678518379,0.72427587,5.630427875,2.176091259,4.6599162,4.222716471,4.071882007,3.498310554,0.573571454,0,0,0,0,0,0,0,0,0,0,4216,BRADFORD,NORCONK BRA PAD,804,Flowback,8220,gal,liquid,41556,10/9/13,16000,0,6.11,8630,5730,0,194,242,403,5.91,30000,0,2530,0,89.5,469,60100,0,215000,5.9,111000,172,15500,2470,11500,896,0,0,0,2013,10,9,NORCONK,BRA,PAD,0,0,802,Flowback,2011,7,6,015-21540,OGO-65420,41.564553,-76.333475,Yes,Horizontal Well,GAS,Bbl,2012,PW,0,723484,66,0,0,2011.583333,2.25,12.83482143,4.204119983,0.78604121,3.936010796,3.758154622,2.28780173,2.383815366,2.605305046,4.477121255,3.403120521,0,1.951823035,2.671172843,4.778874472,0,5.33243846,0.770852012,5.045322979,2.235528447,4.190331698,3.392696953,4.06069784,2.95230801,1.108389831,0,0,0,0,0,0,0,0,0,0,5217,BRADFORD,NORCONK BRA PAD,802,PW,7560,gal,liquid,41599,11/21/13,22200,0,6.12,8410,8020,0,98.9,239,524,7.11,29200,0,2730,0,83.1,558,82500,38600,217000,6,132000,93.3,17900,2160,13300,914,0,0,0,2013,11,21,NORCONK,BRA,PAD,0,0,802,PW,2011,7,6,015-21540,OGO-65420,41.564553,-76.333475,Yes,Horizontal Well,GAS,Bbl,2012,Yes,0,723484,66,0,0,2011.583333,2.333333333,14.55142232,4.346352974,0.786751422,3.924795996,3.904174368,1.995196292,2.378397901,2.719331287,4.465382851,3.436162647,0,1.919601024,2.746634199,4.916453949,4.586587305,5.336459734,0.77815125,5.120573931,1.969881644,4.252853031,3.334453751,4.123851641,2.960946196,1.162905445,0,0,0,0,0,0,0,0,0,0,4218,BRADFORD,OILCAN BRA PAD,802,PW,32823,gal,liquid,41390,4/26/13,45900,0.124,3.95,10600,10700,0,91.3,201,654,5.49,32600,0.125,4310,0,72.9,581,84500,72200,235000,6.4,169000,140,18800,5310,13200,943,0,0,0,2013,4,26,OILCAN,BRA,PAD,0,0,802,PW,2011,9,23,015-21874,OGO-65420,41.630175,-76.555567,Yes,Horizontal Well,GAS,Bbl,2012,Yes,0,2121939,362,0,0,2011.75,1.583333333,13.99787911,4.661812686,0.596597096,4.025305865,4.029383778,1.960470778,2.303196057,2.815577748,4.5132176,3.63447727,0,1.862727528,2.764176132,4.926856709,4.858537198,5.371067862,0.806179974,5.227886705,2.146128036,4.274157849,3.725094521,4.120573931,2.974511693,1.146062238,0,0,0,0,0,0,0,0,0,0,4219,BRADFORD,PAUL BRA PAD,804,Flowback,78666,gal,liquid,41397,5/3/13,64600,0,3.63,11300,15700,0,85.2,206,1270,3.32,33400,0,4660,1.54,66.1,810,106000,0,296000,6.1,249000,93.2,15000,3210,10800,918,0,0,0,2013,5,3,PAUL,BRA,PAD,0,0,802,Flowback,2011,10,6,015-21878,OGO-65420,41.859447,-76.531961,Yes,Horizontal Well,GAS,Bbl,2012,PW,0,140030,231,0,0,2011.833333,3.166666667,11.76470588,4.810232518,0.559906625,4.053078443,4.195899652,1.930439595,2.31386722,3.103803721,4.523746467,3.668385917,0.187520721,1.820201459,2.908485019,5.025305865,0,5.471291711,0.785329835,5.396199347,1.969415912,4.176091259,3.506505032,4.033423755,2.962842681,1.070581074,0,0,0,0,0,0,0,0,0,0,5220,BRADFORD,PAUL BRA PAD,802,PW,108868,gal,liquid,41537,9/20/13,49900,0,0,12300,17600,0,92,215,1440,3.3,20000,0,5520,0,24.8,915,121000,0,381000,6,293000,82,47300,16100,16100,1240,0,0,0,2013,9,20,PAUL,BRA,PAD,0,0,802,PW,2011,10,6,015-21878,OGO-65420,41.859447,-76.531961,Yes,Horizontal Well,GAS,Bbl,2012,PW,0,140030,231,0,0,2011.833333,3.5,12.98387097,4.698100546,0,4.089905111,4.245512668,1.963787827,2.33243846,3.158362492,4.301029996,3.741939078,0,1.394451681,2.961421094,5.08278537,0,5.580924976,0.77815125,5.46686762,1.913813852,4.674861141,4.206825876,4.206825876,3.093421685,1.113404191,0,0,0,0,0,0,0,0,0,0,4221,BRADFORD,PETTY BRA PAD,802,PW,114971,gal,liquid,41471,7/16/13,65900,0,2.9,13700,16100,0,110,196,1170,6.18,33100,0,4420,0,33.3,854,122000,0,348000,5.8,288000,196,21100,8150,5110,1290,0,0,0,2013,7,16,PETTY,BRA,PAD,0,0,802,PW,2011,2,8,015-21302,OGO-65420,41.662406,-76.716378,Yes,Horizontal Well,GAS,Bbl,2012,Yes,0,1734835,354,0,0,2011.166667,2.416666667,3.96124031,4.818885415,0.462397998,4.136720567,4.206825876,2.041392685,2.292256071,3.068185862,4.519827994,3.645422269,0,1.522444234,2.931457871,5.086359831,0,5.541579244,0.763427994,5.459392488,2.292256071,4.324282455,3.911157609,3.7084209,3.11058971,0.59783119,0,0,0,0,0,0,0,0,0,0,4222,BRADFORD,POPIVCHAK,802,PW,79586,gal,liquid,41540,9/23/13,41800,0,0,14400,14700,0,347,197,1220,6.04,44200,0,4930,0,33.4,802,115000,0,336000,6,257000,824,19400,7000,5320,969,0,0,0,2013,9,23,POPIVCHAK,0,0,0,0,802,PW,2009,12,31,015-20555,OGO-65420,41.804044,-76.566008,Yes,Horizontal Well,GAS,Bbl,Yes,Yes,526,772826,357,0,0,2010,3.75,5.490196078,4.621176282,0,4.158362492,4.167317335,2.540329475,2.294466226,3.086359831,4.645422269,3.692846919,0,1.523746467,2.904174368,5.06069784,0,5.526339277,0.77815125,5.409933123,2.915927212,4.28780173,3.84509804,3.725911632,2.986323777,0.739587855,0,0,0,0,0,0,0,0,0,0,4223,BRADFORD,RAIMO BRA PAD,804,Flowback,72294,gal,liquid,41477,7/22/13,32400,0,5.65,7840,8140,0,76.1,219,587,2.59,31400,0,2840,0.346,128,480,71700,0,220000,6.5,153000,46.9,24100,10800,6720,622,0,0,0,2013,7,22,RAIMO,BRA,PAD,0,0,802,Flowback,2012,5,1,015-22111,OGO-65420,41.673183,-76.524672,Yes,Horizontal Well,GAS,Bbl,2012,PW,0,1626510,170,0,0,2012.416667,1.166666667,10.80385852,4.51054501,0.752048448,3.894316063,3.910624405,1.881384657,2.340444115,2.768638101,4.496929648,3.45331834,-0.460923901,2.10720997,2.681241237,4.855519156,0,5.342422681,0.812913357,5.184691431,1.671172843,4.382017043,4.033423755,3.827369273,2.793790385,1.033578888,0,0,0,0,0,0,0,0,0,0,5224,BRADFORD,RAIMO BRA PAD,802,PW,95083,gal,liquid,41555,10/8/13,19700,0,5.09,8670,7060,0,134,200,517,3.3,30100,0,2750,0,88.9,522,70400,0,218000,6.3,145000,332,10100,1150,8410,652,0,0,0,2013,10,8,RAIMO,BRA,PAD,0,0,802,PW,2012,5,1,015-22111,OGO-65420,41.673183,-76.524672,Yes,Horizontal Well,GAS,Bbl,2012,Yes,0,1626510,170,0,0,2012.416667,1.416666667,12.89877301,4.294466226,0.706717782,3.938019097,3.848804701,2.127104798,2.301029996,2.713490543,4.478566496,3.439332694,0,1.948901761,2.717670503,4.847572659,0,5.338456494,0.799340549,5.161368002,2.521138084,4.004321374,3.06069784,3.924795996,2.814247596,1.1105484,0,0,0,0,0,0,0,0,0,0,4225,BRADFORD,RAMLBLINROSE BRA PAD,804,Flowback,24780,gal,liquid,41527,9/10/13,28500,0,5.2,10500,10100,0,138,232,764,5.19,36200,0,3550,0,83.2,634,85900,0,256000,6.2,152000,296,23700,7000,14800,891,0,0,0,2013,9,10,RAMLBLINROSE,BRA,PAD,0,0,802,Flowback,0,0,0,0,0,0,0,0,0,0,0,0,0,0,0,0,0,0,0,0,16.61054994,4.45484486,0.716003344,4.021189299,4.004321374,2.139879086,2.365487985,2.883093359,4.558708571,3.550228353,0,1.920123326,2.802089258,4.933993164,0,5.408239965,0.792391689,5.181843588,2.471291711,4.374748346,3.84509804,4.170261715,2.949877704,1.220384011,0,0,0,0,0,0,0,0,0,0,5226,BRADFORD,RAMLBLINROSE BRA PAD,802,PW,21727,gal,liquid,41577,10/30/13,26400,0,0,10300,9310,0,135,227,763,4.6,30900,0,3290,0,55.5,445,79900,0,234000,6.1,113000,84,53700,20800,17600,782,0,0,0,2013,10,30,RAMLBLINROSE,BRA,PAD,0,0,802,PW,0,0,0,0,0,0,0,0,0,0,0,0,0,0,0,0,0,0,0,0,22.50639386,4.421603927,0,4.012837225,3.968949681,2.130333768,2.356025857,2.882524538,4.489958479,3.517195898,0,1.744292983,2.648360011,4.902546779,0,5.369215857,0.785329835,5.053078443,1.924279286,4.729974286,4.318063335,4.245512668,2.893206753,1.352305915,0,0,0,0,0,0,0,0,0,0,4227,BRADFORD,READINGER BRA PAD,802,PW,62490,gal,liquid,41516,8/30/13,76200,0,0,14300,27600,0,94.5,253,1750,11.4,51100,0,8410,0,0,1040,144000,0,465000,4.4,337000,136,18300,7790,8000,1810,0,0,0,2013,8,30,READINGER,BRA,PAD,0,0,802,PW,2009,11,14,015-20415,OGO-65420,41.765439,-76.675194,Yes,Horizontal Well,GAS,Bbl,2012,Yes,0,505775,352,0,0,2009.916667,3.75,4.419889503,4.881954971,0,4.155336037,4.440909082,1.975431809,2.403120521,3.243038049,4.7084209,3.924795996,0,0,3.017033339,5.158362492,0,5.667452953,0.643452676,5.527629901,2.133538908,4.26245109,3.891537458,3.903089987,3.257678575,0.645411412,0,0,0,0,0,0,0,0,0,0,4228,BRADFORD,REDBONE BRA PAD,804,Flowback,124289,gal,liquid,41527,9/10/13,24300,0,5.3,13600,8660,0,63,255,638,3.8,35700,0,3370,0,74.8,588,71900,0,248000,6.5,150000,85.5,19500,5830,12500,1030,0,0,0,2013,9,10,REDBONE,BRA,PAD,0,0,802,Flowback,2012,6,13,015-22223,OGO-65420,41.631783,-76.244953,Yes,Horizontal Well,GAS,Bbl,2012,PW,0,932376,117,0,0,2012.5,1.25,12.13592233,4.385606274,0.72427587,4.133538908,3.937517892,1.799340549,2.40654018,2.804820679,4.552668216,3.527629901,0,1.873901598,2.769377326,4.85672889,0,5.394451681,0.812913357,5.176091259,1.931966115,4.290034611,3.765668555,4.096910013,3.012837225,1.084072788,0,0,0,0,0,0,0,0,0,0,5229,BRADFORD,REDBONE BRA PAD,802,PW,150942,gal,liquid,41583,11/5/13,27100,0,0,18100,9660,0,76.2,285,717,4.93,39200,0,3980,0,81,609,95300,0,276000,6.2,178000,135,50800,18500,10500,1030,0,0,0,2013,11,5,REDBONE,BRA,PAD,0,0,802,PW,2012,6,13,015-22223,OGO-65420,41.631783,-76.244953,Yes,Horizontal Well,GAS,Bbl,2012,Yes,0,932376,117,0,0,2012.5,1.416666667,10.19417476,4.432969291,0,4.257678575,3.984977126,1.881954971,2.45484486,2.855519156,4.593286067,3.599883072,0,1.908485019,2.784617293,4.979092901,0,5.440909082,0.792391689,5.250420002,2.130333768,4.705863712,4.267171728,4.021189299,3.012837225,1.008352074,0,0,0,0,0,0,0,0,0,0,4230,BRADFORD,REXFORD BRA PAD,804,Flowback,444772,gal,liquid,41549,10/2/13,58500,0,0,5180,21000,0,75,247,1490,6.86,94800,0,5220,0,6.8,921,203000,0,482000,5.5,342000,229,62000,13200,37300,1790,0,0,0,2013,10,2,REXFORD,BRA,PAD,0,0,802,Flowback,2010,6,7,015-20865,OGO-65420,41.877794,-76.309322,Yes,Horizontal Well,GAS,Bbl,2012,PW,0,233209,90,0,0,2010.5,3.333333333,20.83798883,4.767155866,0,3.71432976,4.322219295,1.875061263,2.392696953,3.173186268,4.976808337,3.717670503,0,0.832508913,2.96425963,5.307496038,0,5.683047038,0.740362689,5.534026106,2.359835482,4.792391689,4.120573931,4.571708832,3.252853031,1.318855801,0,0,0,0,0,0,0,0,0,0,5231,BRADFORD,REXFORD BRA PAD,802,PW,290862,gal,liquid,41599,11/21/13,94300,0,0,6430,34000,0,106,332,2290,10.9,43800,0,7310,0,4.5,1140,201000,0,528000,5,318000,142,30000,9570,25800,2310,0,0,0,2013,11,21,REXFORD,BRA,PAD,0,0,802,PW,2010,6,7,015-20865,OGO-65420,41.877794,-76.309322,Yes,Horizontal Well,GAS,Bbl,2012,Yes,0,233209,90,0,0,2010.5,3.416666667,11.16883117,4.974511693,0,3.808210973,4.531478917,2.025305865,2.521138084,3.359835482,4.641474111,3.863917377,0,0.653212514,3.056904851,5.303196057,0,5.722633923,0.698970004,5.50242712,2.152288344,4.477121255,3.980911938,4.411619706,3.36361198,1.048007726,0,0,0,0,0,0,0,0,0,0,4232,BRADFORD,RGB BRA PAD,804,Flowback,78792,gal,liquid,41494,8/8/13,41200,0,0,7400,13600,0,109,181,899,6.77,37700,0,3380,0,114,758,125000,0,322000,6.1,208000,274,22300,12000,6330,808,0,0,0,2013,8,8,RGB,BRA,PAD,0,0,802,Flowback,2012,3,14,015-22082,OGO-65420,41.843675,-76.571775,Yes,Horizontal Well,GAS,Bbl,2012,PW,0,605470,147,0,0,2012.25,1.416666667,7.834158416,4.614897216,0,3.86923172,4.133538908,2.037426498,2.257678575,2.953759692,4.57634135,3.5289167,0,2.056904851,2.879669206,5.096910013,0,5.507855872,0.785329835,5.318063335,2.437750563,4.348304863,4.079181246,3.80140371,2.907411361,0.893992349,0,0,0,0,0,0,0,0,0,0,5233,BRADFORD,RGB BRA PAD,802,PW,213075,gal,liquid,41540,9/23/13,29100,0,0,12800,10200,0,75,207,871,2.89,39600,0,4380,0,78,656,93900,0,288000,6.4,181000,75.2,23100,9000,10800,834,0,0,0,2013,9,23,RGB,BRA,PAD,0,0,802,PW,2012,3,14,015-22082,OGO-65420,41.843675,-76.571775,Yes,Horizontal Well,GAS,Bbl,2012,Yes,0,605470,147,0,0,2012.25,1.5,12.94964029,4.463892989,0,4.10720997,4.008600172,1.875061263,2.315970345,2.940018155,4.597695186,3.641474111,0,1.892094603,2.816903839,4.972665592,0,5.459392488,0.806179974,5.257678575,1.876217841,4.36361198,3.954242509,4.033423755,2.921166051,1.112257705,0,0,0,0,0,0,0,0,0,0,4234,BRADFORD,RICH BRA PAD,802,PW,256889,gal,liquid,41471,7/16/13,113000,0,4.14,14200,32800,0,120,331,1870,13.6,35900,0,8120,0.62,45.5,1190,186000,0,484000,5.6,429000,68.5,59100,19200,11800,2210,0,0,0,2013,7,16,RICH,BRA,PAD,0,0,802,PW,2010,7,2,015-20942,OGO-65420,41.751711,-76.753028,Yes,Horizontal Well,GAS,Bbl,2012,Yes,0,559448,359,0,0,2010.583333,3,5.339366516,5.053078443,0.617000341,4.152288344,4.515873844,2.079181246,2.519827994,3.271841607,4.555094449,3.909556029,-0.207608311,1.658011397,3.075546961,5.269512944,0,5.684845362,0.748188027,5.632457292,1.835690571,4.771587481,4.283301229,4.071882007,3.344392274,0.727489734,0,0,0,0,0,0,0,0,0,0,4235,BRADFORD,ROBBINS BRA PAD,804,Flowback,228890,gal,liquid,41484,7/29/13,78900,0,3.61,12800,22600,0,93.7,257,1850,3.97,48700,0,6170,0,53.1,743,118000,0,387000,6,329000,137,65000,28600,19600,1410,0,0,0,2013,7,29,ROBBINS,BRA,PAD,0,0,802,Flowback,2012,3,7,015-22065,OGO-65420,41.875983,-76.546442,Yes,Horizontal Well,GAS,Bbl,2012,PW,0,317515,160,0,0,2012.25,1.333333333,13.90070922,4.897077003,0.557507202,4.10720997,4.354108439,1.971739591,2.409933123,3.267171728,4.687528961,3.790285164,0,1.725094521,2.870988814,5.071882007,0,5.587710965,0.77815125,5.517195898,2.136720567,4.812913357,4.456366033,4.292256071,3.149219113,1.143036959,0,0,0,0,0,0,0,0,0,0,5236,BRADFORD,ROBBINS BRA PAD,802,PW,466273,gal,liquid,41569,10/22/13,64500,0,0,11400,22700,0,93.4,263,1910,4.81,38100,0,6860,0,24.9,818,146000,0,421000,5.8,303000,151,97800,32200,17800,1590,0,0,0,2013,10,22,ROBBINS,BRA,PAD,0,0,802,PW,2012,3,7,015-22065,OGO-65420,41.875983,-76.546442,Yes,Horizontal Well,GAS,Bbl,2012,Yes,0,317515,160,0,0,2012.25,1.583333333,11.19496855,4.809559715,0,4.056904851,4.356025857,1.970346876,2.419955748,3.281033367,4.580924976,3.836324116,0,1.396199347,2.912753304,5.164352856,0,5.624282096,0.763427994,5.481442629,2.178976947,4.990338855,4.507855872,4.250420002,3.201397124,1.049022878,0,0,0,0,0,0,0,0,0,0,4237,BRADFORD,ROBINSON BRA PAD,802,PW,386124,gal,liquid,41467,7/12/13,72200,0.143,4.08,2480,20300,0,152,279,1440,11.5,50400,0,3540,0.784,0,1100,150000,0,485000,4.8,380000,27.1,50900,13000,0,1700,0,268000,0,2013,7,12,ROBINSON,BRA,PAD,0,0,802,PW,2010,9,9,015-21117,OGO-65420,41.849631,-76.2944,Yes,Horizontal Well,GAS,Bbl,2012,Yes,0,107470,113,0,0,2010.75,2.833333333,0,4.858537198,0.610660163,3.394451681,4.307496038,2.181843588,2.445604203,3.158362492,4.702430536,3.549003262,-0.105683937,0,3.041392685,5.176091259,0,5.685741739,0.681241237,5.579783597,1.432969291,4.706717782,4.113943352,0,3.230448921,0,0,0,0,0,0,0,0,0,0,0,4238,BRADFORD,ROCKS BRA PAD,802,PW,215728,gal,liquid,41390,4/26/13,58600,0,4.33,12100,13000,0,98.5,219,800,6.17,34900,0.147,4770,0,110,671,94700,55100,279000,6.3,224000,122,21300,7050,13000,1290,0,0,0,2013,4,26,ROCKS,BRA,PAD,0,0,802,PW,2011,5,3,015-21555,OGO-65420,41.616539,-76.561058,Yes,Horizontal Well,GAS,Bbl,2012,Yes,0,2308585,365,0,0,2011.416667,1.916666667,10.07751938,4.767897616,0.636487896,4.08278537,4.113943352,1.99343623,2.340444115,2.903089987,4.542825427,3.678518379,0,2.041392685,2.82672252,4.976349979,4.741151599,5.445604203,0.799340549,5.350248018,2.086359831,4.328379603,3.848189117,4.113943352,3.11058971,1.003353642,0,0,0,0,0,0,0,0,0,0,4239,BRADFORD,ROLAND BRA PAD,804,Flowback,34909,gal,liquid,41422,5/28/13,25900,0,5.86,6660,5610,0,80,230,345,3.43,27900,0.1,2370,1.37,124,464,62200,46800,170000,6.6,141000,247,9360,3160,8550,580,0,0,0,2013,5,28,ROLAND,BRA,PAD,0,0,802,Flowback,2011,3,15,015-21556,OGO-65420,41.556383,-76.222744,Yes,Horizontal Well,GAS,Bbl,2012,PW,0,2270109,229,0,0,2011.25,2.166666667,14.74137931,4.413299764,0.767897616,3.823474229,3.748962861,1.903089987,2.361727836,2.537819095,4.445604203,3.374748346,0.136720567,2.093421685,2.666517981,4.793790385,4.670245853,5.230448921,0.819543936,5.149219113,2.392696953,3.971275849,3.499687083,3.931966115,2.763427994,1.168538121,0,0,0,0,0,0,0,0,0,0,5240,BRADFORD,ROLAND BRA PAD,802,PW,79128,gal,liquid,41493,8/7/13,19200,0,5.8,7900,5660,0,109,223,416,3.88,28200,0,2620,0,94.1,513,91600,0,208000,6.4,128000,294,29400,11200,7080,891,0,0,0,2013,8,7,ROLAND,BRA,PAD,0,0,802,PW,2011,3,15,015-21556,OGO-65420,41.556383,-76.222744,Yes,Horizontal Well,GAS,Bbl,2012,Yes,0,2270109,229,0,0,2011.25,2.416666667,7.946127946,4.283301229,0.763427994,3.897627091,3.752816431,2.037426498,2.348304863,2.619093331,4.450249108,3.418301291,0,1.973589623,2.710117365,4.961895474,0,5.318063335,0.806179974,5.10720997,2.46834733,4.46834733,4.049218023,3.850033258,2.949877704,0.900155554,0,0,0,0,0,0,0,0,0,0,4241,BRADFORD,ROSE BRA WELL,802,PW,569238,gal,liquid,41446,6/21/13,107000,0,2.82,18200,28200,0,114,355,1940,8.99,36000,0,5740,0.412,14.5,1290,175000,0,509000,5.4,418000,432,26100,6240,20000,2300,0,0,0,2013,6,21,ROSE,BRA,WELL,0,0,802,PW,2010,10,12,015-20634,OGO-65420,41.759847,-76.467289,Yes,Horizontal Well,GAS,Bbl,2012,Yes,0,313977,360,0,0,2010.833333,2.666666667,8.695652174,5.029383778,0.450249108,4.260071388,4.450249108,2.056904851,2.550228353,3.28780173,4.556302501,3.758911892,-0.385102784,1.161368002,3.11058971,5.243038049,0,5.706717782,0.73239376,5.621176282,2.635483747,4.416640507,3.79518459,4.301029996,3.361727836,0.93930216,0,0,0,0,0,0,0,0,0,0,4242,BRADFORD,ROWE BRA PAD,802,PW,432446,gal,liquid,41467,7/12/13,100000,0,2.82,18200,24700,0,92.3,283,2230,7.65,44500,0,5940,0.542,36.9,1290,139000,0,472000,5.7,411000,126,32900,11400,19500,1790,0,0,0,2013,7,12,ROWE,BRA,PAD,0,0,802,PW,2011,7,20,015-21101,OGO-65420,41.836133,-76.405258,Yes,Horizontal Well,GAS,Bbl,2012,Yes,0,246323,271,0,0,2011.583333,2,10.89385475,5,0.450249108,4.260071388,4.392696953,1.965201701,2.451786436,3.348304863,4.648360011,3.773786445,-0.266000713,1.567026366,3.11058971,5.1430148,0,5.673941999,0.755874856,5.613841822,2.100370545,4.517195898,4.056904851,4.290034611,3.252853031,1.03718158,0,0,0,0,0,0,0,0,0,0,4243,BRADFORD,SARAH BRA PAD,802,PW,284691,gal,liquid,41486,7/31/13,68900,0,2.81,14600,17900,0,84.9,229,1510,3.9,41200,0,6480,0.428,48.4,732,135000,0,342000,6,291000,189,39300,15900,11000,1270,0,0,0,2013,7,31,SARAH,BRA,PAD,0,0,802,PW,2011,10,4,015-21700,OGO-65420,41.912161,-76.554572,Yes,Horizontal Well,GAS,Bbl,2012,Yes,0,638385,351,0,0,2011.833333,1.75,8.661417323,4.838219222,0.44870632,4.164352856,4.252853031,1.92890769,2.359835482,3.178976947,4.614897216,3.811575006,-0.368556231,1.684845362,2.864511081,5.130333768,0,5.534026106,0.77815125,5.463892989,2.276461804,4.59439255,4.201397124,4.041392685,3.103803721,0.937588964,0,0,0,0,0,0,0,0,0,0,4244,BRADFORD,SCHEFFLER BRA PAD,804,Flowback,249507,gal,liquid,41436,6/11/13,101000,0,2.95,14900,26400,0,80,297,1540,10.6,47600,0,7470,0.421,31.7,1170,166000,0,472000,5.6,345000,91,27900,6380,12300,1770,0,0,0,2013,6,11,SCHEFFLER,BRA,PAD,0,0,802,Flowback,2010,10,21,015-21178,OGO-65420,41.744992,-76.360753,Yes,Horizontal Well,GAS,Bbl,Yes,PW,0,230367,122,0,0,2010.833333,2.666666667,6.949152542,5.004321374,0.469822016,4.173186268,4.421603927,1.903089987,2.472756449,3.187520721,4.677606953,3.873320602,-0.375717904,1.501059262,3.068185862,5.220108088,0,5.673941999,0.748188027,5.537819095,1.959041392,4.445604203,3.804820679,4.089905111,3.247973266,0.841931845,0,0,0,0,0,0,0,0,0,0,5245,BRADFORD,SCHEFFLER BRA PAD,802,PW,307430,gal,liquid,41481,7/26/13,74300,0,2.9,16300,26700,0,77.6,296,1850,11.9,44500,0,7130,0,33.7,668,113000,0,446000,5.7,336000,55,35800,18700,9330,1810,0,0,0,2013,7,26,SCHEFFLER,BRA,PAD,0,0,802,PW,2010,10,21,015-21178,OGO-65420,41.744992,-76.360753,Yes,Horizontal Well,GAS,Bbl,Yes,Yes,2085.88,230367,122,0,0,2010.833333,2.75,5.154696133,4.870988814,0.462397998,4.212187604,4.426511261,1.889861721,2.471291711,3.267171728,4.648360011,3.85308953,0,1.527629901,2.824776462,5.053078443,0,5.649334859,0.755874856,5.526339277,1.740362689,4.553883027,4.271841607,3.969881644,3.257678575,0.712203069,0,0,0,0,0,0,0,0,0,0,4246,BRADFORD,SCHLAPFER BRA PAD,804,Flowback,362476,gal,liquid,41418,5/24/13,35200,0,7.28,8720,8540,0,56.6,246,574,3.19,37400,0,3590,0,99.9,617,84000,0,217000,6.4,198000,90.8,17300,4780,10300,0,0,0,0,2013,5,24,SCHLAPFER,BRA,PAD,0,0,802,Flowback,2012,6,11,015-22202,OGO-65420,41.602181,-76.400728,Yes,Horizontal Well,GAS,Bbl,2012,PW,0,1739725,227,0,0,2012.5,0.916666667,0,4.546542663,0.862131379,3.940516485,3.931457871,1.752816431,2.390935107,2.758911892,4.572871602,3.555094449,0,1.999565488,2.790285164,4.924279286,0,5.336459734,0.806179974,5.29666519,1.958085849,4.238046103,3.679427897,4.012837225,0,0,0,0,0,0,0,0,0,0,0,0,5247,BRADFORD,SCHLAPFER BRA PAD,802,PW,174475,gal,liquid,41564,10/17/13,28000,0,0,8570,10100,0,240,245,680,4.7,18000,0,4000,0,63.3,632,79500,0,299000,6.3,176000,530,47300,20800,11400,1120,0,0,0,2013,10,17,SCHLAPFER,BRA,PAD,0,0,802,PW,2012,6,11,015-22202,OGO-65420,41.602181,-76.400728,Yes,Horizontal Well,GAS,Bbl,2012,Yes,0,1739725,227,0,0,2012.5,1.333333333,10.17857143,4.447158031,0,3.932980822,4.004321374,2.380211242,2.389166084,2.832508913,4.255272505,3.602059991,0,1.80140371,2.800717078,4.900367129,0,5.475671188,0.799340549,5.245512668,2.72427587,4.674861141,4.318063335,4.056904851,3.049218023,1.007686829,0,0,0,0,0,0,0,0,0,0,4248,BRADFORD,SCRIVENER BRA PAD,802,PW,125131,gal,liquid,41530,9/13/13,57400,0,0,12300,20300,0,189,202,1630,7.72,33900,0,5920,0,26.7,2380,132000,0,384000,5.7,256000,608,22100,5180,10300,1310,0,0,0,2013,9,13,SCRIVENER,BRA,PAD,0,0,802,PW,2011,1,14,015-21450,OGO-65420,41.900375,-76.399869,Yes,Horizontal Well,GAS,Bbl,2012,Yes,0,376262,364,0,0,2011.083333,2.666666667,7.86259542,4.758911892,0,4.089905111,4.307496038,2.276461804,2.305351369,3.212187604,4.530199698,3.772321707,0,1.426511261,3.376576957,5.120573931,0,5.584331224,0.755874856,5.408239965,2.783903579,4.344392274,3.71432976,4.012837225,3.117271296,0.895565929,0,0,0,0,0,0,0,0,0,0,4249,BRADFORD,SENSINGER BRA PAD,804,Flowback,325030,gal,liquid,41327,2/22/13,98800,0,4.53,11200,29300,0,98.9,332,1690,19.4,30200,0,5660,0.568,46.3,0,183000,0,460000,5.9,350000,79.2,20700,4190,7220,1960,0,0,0,2013,2,22,SENSINGER,BRA,PAD,0,0,802,Flowback,2011,6,21,015-21702,OGO-65420,41.691489,-76.606733,Yes,Horizontal Well,GAS,Bbl,2012,PW,0,249910,322,0,0,2011.5,1.666666667,3.683673469,4.994756945,0.656098202,4.049218023,4.46686762,1.995196292,2.521138084,3.227886705,4.480006943,3.752816431,-0.245651664,1.665580991,0,5.26245109,0,5.662757832,0.770852012,5.544068044,1.898725182,4.315970345,3.622214023,3.858537198,3.292256071,0.566281126,0,0,0,0,0,0,0,0,0,0,5250,BRADFORD,SENSINGER BRA PAD,802,PW,826347,gal,liquid,41439,6/14/13,108000,0.189,3.74,15300,30700,0,108,355,2070,14.7,55900,0.305,7980,0.469,14.8,1270,193000,0,520000,5.1,361000,107,15300,3920,8700,2050,0,0,0,2013,6,14,SENSINGER,BRA,PAD,0,0,802,PW,2011,6,21,015-21702,OGO-65420,41.691489,-76.606733,Yes,Horizontal Well,GAS,Bbl,2012,Yes,0,249910,322,0,0,2011.5,2,4.243902439,5.033423755,0.572871602,4.184691431,4.487138375,2.033423755,2.550228353,3.315970345,4.747411808,3.902002891,-0.328827157,1.170261715,3.103803721,5.285557309,0,5.716003344,0.707570176,5.557507202,2.029383778,4.184691431,3.593286067,3.939519253,3.311753861,0.627765392,0,0,0,0,0,0,0,0,0,0,4251,BRADFORD,SGL 289A BRA PAD,802,PW,25992,gal,liquid,41439,6/14/13,49400,0,3.23,13200,11500,0,170,223,833,4.95,37700,0,3970,0.346,62.4,748,105000,0,280000,5.9,205000,167,7370,2120,6870,819,0,0,0,2013,6,14,SGL,289A,BRA,PAD,0,802,PW,2010,12,20,015-21205,OGO-65420,41.782428,-76.630875,Yes,Horizontal Well,GAS,Bbl,2012,Yes,0,1224028,360,0,0,2011,2.5,8.388278388,4.693726949,0.509202522,4.120573931,4.06069784,2.230448921,2.348304863,2.920645001,4.57634135,3.598790507,-0.460923901,1.79518459,2.873901598,5.021189299,0,5.447158031,0.770852012,5.311753861,2.222716471,3.867467488,3.326335861,3.836956737,2.913283902,0.923672835,0,0,0,0,0,0,0,0,0,0,4252,BRADFORD,SGL 289B BRA PAD,802,PW,52802,gal,liquid,41439,6/14/13,36600,0,2.87,11400,9160,0,87.5,192,727,3.63,34300,0,3260,0.233,55,608,106000,0,251000,6.1,167000,54.8,6330,1640,4670,634,0,0,0,2013,6,14,SGL,289B,BRA,PAD,0,802,PW,2010,12,20,015-21205,OGO-65420,41.782428,-76.630875,Yes,Horizontal Well,GAS,Bbl,2012,Yes,0,1224028,360,0,0,2011,2.5,7.365930599,4.563481085,0.457881897,4.056904851,3.961895474,1.942008053,2.283301229,2.861534411,4.53529412,3.5132176,-0.632644079,1.740362689,2.783903579,5.025305865,0,5.399673721,0.785329835,5.222716471,1.738780558,3.80140371,3.214843848,3.669316881,2.802089258,0.867227623,0,0,0,0,0,0,0,0,0,0,4253,BRADFORD,SIDONIO BRA PAD,802,PW,237509,gal,liquid,41486,7/31/13,76200,0,3.54,11700,23900,0,107,283,1840,5.12,47400,0,6370,0,48.2,876,139000,0,396000,5.9,312000,61.6,57200,22000,20800,1780,0,0,0,2013,7,31,SIDONIO,BRA,PAD,0,0,802,PW,2011,1,3,015-21360,OGO-65420,41.841686,-76.532719,Yes,Horizontal Well,GAS,Bbl,2012,Yes,0,513494,352,0,0,2011.083333,2.5,11.68539326,4.881954971,0.549003262,4.068185862,4.378397901,2.029383778,2.451786436,3.264817823,4.675778342,3.804139432,0,1.683047038,2.942504106,5.1430148,0,5.597695186,0.770852012,5.494154594,1.789580712,4.757396029,4.342422681,4.318063335,3.250420002,1.067643333,0,0,0,0,0,0,0,0,0,0,4254,BRADFORD,SIMPSON BRA PAD,802,PW,247744,gal,liquid,41501,8/15/13,95100,0,0,7060,34200,0,117,261,2330,10.8,22400,0,6440,0,20.9,1120,167000,0,439000,5.5,352000,119,28800,4150,15000,1600,0,0,0,2013,8,15,SIMPSON,BRA,PAD,0,0,802,PW,2010,9,14,015-21068,OGO-65420,41.775686,-76.659661,Yes,Horizontal Well,GAS,Bbl,2012,Yes,0,1040754,359,0,0,2010.75,2.916666667,9.375,4.978180517,0,3.848804701,4.534026106,2.068185862,2.416640507,3.367355921,4.350248018,3.808885867,0,1.320146286,3.049218023,5.222716471,0,5.64246452,0.740362689,5.546542663,2.075546961,4.459392488,3.618048097,4.176091259,3.204119983,0.971971276,0,0,0,0,0,0,0,0,0,0,4255,BRADFORD,SIVERS BRA PAD,804,Flowback,480007,gal,liquid,41334,3/1/13,59900,0,3.72,18300,14800,0,87.5,298,1310,4.88,41600,0,5420,0,67.6,1140,124000,0,287000,6.2,227000,67,22600,7680,8770,1200,0,0,0,2013,3,1,SIVERS,BRA,PAD,0,0,802,Flowback,2010,3,23,015-20619,OGO-65420,41.720731,-76.160456,Yes,Horizontal Well,GAS,Bbl,2012,PW,0,1631955,359,0,0,2010.25,3,7.308333333,4.777426822,0.57054294,4.26245109,4.170261715,1.942008053,2.474216264,3.117271296,4.619093331,3.733999287,0,1.829946696,3.056904851,5.093421685,0,5.457881897,0.792391689,5.356025857,1.826074803,4.354108439,3.88536122,3.942999593,3.079181246,0.863818347,0,0,0,0,0,0,0,0,0,0,5256,BRADFORD,SIVERS BRA PAD,802,PW,393183,gal,liquid,41479,7/24/13,56500,0,3.01,20500,14700,0,95.8,318,1240,5.41,41400,0,5700,0,51.1,836,121000,0,337000,5.9,276000,71.3,36800,15100,8790,1440,0,0,0,2013,7,24,SIVERS,BRA,PAD,0,0,802,PW,2010,3,23,015-20619,OGO-65420,41.720731,-76.160456,Yes,Horizontal Well,GAS,Bbl,2012,Yes,0,1631955,359,0,0,2010.25,3.333333333,6.104166667,4.752048448,0.478566496,4.311753861,4.167317335,1.981365509,2.50242712,3.093421685,4.617000341,3.755874856,0,1.7084209,2.922206277,5.08278537,0,5.527629901,0.770852012,5.440909082,1.85308953,4.565847819,4.178976947,3.943988875,3.158362492,0.785626383,0,0,0,0,0,0,0,0,0,0,4257,BRADFORD,SJW BRA PAD,804,Flowback,35220,gal,liquid,41334,3/1/13,30600,0,7.48,7500,7570,0,89.4,237,593,3.98,32200,0,2900,0.334,127,0,81200,41500,183000,6.6,149000,30.4,16000,4750,9460,956,0,0,0,2013,3,1,SJW,BRA,PAD,0,0,802,Flowback,2012,3,9,015-21975,OGO-65420,41.574,-76.230817,Yes,Horizontal Well,GAS,Bbl,2012,PW,0,3353121,338,0,0,2012.25,1,9.89539749,4.485721426,0.873901598,3.875061263,3.87909588,1.951337519,2.374748346,2.773054693,4.507855872,3.462397998,-0.476253533,2.103803721,0,4.909556029,4.618048097,5.26245109,0.819543936,5.173186268,1.482873584,4.204119983,3.67669361,3.975891136,2.980457892,0.995433244,0,0,0,0,0,0,0,0,0,0,5258,BRADFORD,SJW BRA PAD,802,PW,136772,gal,liquid,41494,8/8/13,19200,0,5.26,7530,6880,0,131,218,497,4.02,28300,0,3000,0,76.6,338,67900,0,210000,6.4,124000,271,51600,18800,7640,1070,0,0,0,2013,8,8,SJW,BRA,PAD,0,0,802,PW,2012,3,9,015-21975,OGO-65420,41.574,-76.230817,Yes,Horizontal Well,GAS,Bbl,2012,Yes,0,3353121,338,0,0,2012.25,1.416666667,7.140186916,4.283301229,0.720985744,3.876794976,3.837588438,2.117271296,2.338456494,2.696356389,4.451786436,3.477121255,0,1.88422877,2.5289167,4.831869774,0,5.322219295,0.806179974,5.093421685,2.432969291,4.712649702,4.274157849,3.883093359,3.029383778,0.853709581,0,0,0,0,0,0,0,0,0,0,4259,BRADFORD,STEMPEL BRA PAD,804,Flowback,25100,gal,liquid,41485,7/30/13,82700,0,3.84,6960,23600,0,120,312,1430,12.2,57200,0,5660,1.69,38.9,1080,188000,0,501000,5.7,370000,700,62500,25400,17800,2000,0,0,0,2013,7,30,STEMPEL,BRA,PAD,0,0,802,Flowback,2011,10,13,015-21805,OGO-65420,41.757419,-76.386517,Yes,Horizontal Well,GAS,Bbl,2011,DrillFluid,0,0,0,0,0,2011.833333,1.75,8.9,4.91750551,0.584331224,3.84260924,4.372912003,2.079181246,2.494154594,3.155336037,4.757396029,3.752816431,0.227886705,1.589949601,3.033423755,5.274157849,0,5.699837726,0.755874856,5.568201724,2.84509804,4.795880017,4.404833717,4.250420002,3.301029996,0.949390007,0,0,0,0,0,0,0,0,0,0,5260,BRADFORD,STEMPEL BRA PAD,802,PW,48468,gal,liquid,41541,9/24/13,84400,0,4.31,7590,31000,0,146,377,1700,14.4,79700,0,7020,0,4.3,1340,201000,0,462000,4.9,431000,139,69800,33200,25800,2260,0,0,0,2013,9,24,STEMPEL,BRA,PAD,0,0,802,PW,2011,10,13,015-21805,OGO-65420,41.757419,-76.386517,Yes,Horizontal Well,GAS,Bbl,2011,DrillFluid,0,0,0,0,0,2011.833333,1.916666667,11.4159292,4.926342447,0.63447727,3.880241776,4.491361694,2.164352856,2.57634135,3.230448921,4.901458321,3.846337112,0,0.633468456,3.127104798,5.303196057,0,5.664641976,0.69019608,5.63447727,2.1430148,4.843855423,4.521138084,4.411619706,3.354108439,1.057511267,0,0,0,0,0,0,0,0,0,0,4261,BRADFORD,STEVENS BRA PAD,802,PW,434409,gal,liquid,41389,4/25/13,106000,0.102,4.37,9160,34100,0,101,317,1970,17.5,55900,0,7840,0,39.5,1350,177000,0,457000,5.7,399000,40.4,31200,8130,16000,2180,0,0,0,2013,4,25,STEVENS,BRA,PAD,0,0,802,PW,2009,12,13,015-20481,OGO-65420,41.781158,-76.350125,Yes,Horizontal Well,GAS,Bbl,2012,Yes,0,961900,364,0,0,2010,3.333333333,7.339449541,5.025305865,0.640481437,3.961895474,4.532754379,2.004321374,2.501059262,3.294466226,4.747411808,3.894316063,0,1.596597096,3.130333768,5.247973266,0,5.6599162,0.755874856,5.600972896,1.606381365,4.494154594,3.910090546,4.204119983,3.338456494,0.865663489,0,0,0,0,0,0,0,0,0,0,4262,BRADFORD,STONE BRA PAD,804,Flowback,128268,gal,liquid,41374,4/10/13,56700,0,3.23,11600,11900,0,73.8,286,924,2.36,37600,0,4760,0.404,92,0,98000,0,255000,6.3,197000,84.4,22800,11100,7290,1200,0,0,0,2013,4,10,STONE,BRA,PAD,0,0,802,Flowback,2012,1,9,015-22022,OGO-65420,41.694483,-76.176508,Yes,Horizontal Well,GAS,Bbl,2012,PW,0,1727195,284,0,0,2012.083333,1.25,6.075,4.753583059,0.509202522,4.064457989,4.075546961,1.868056362,2.456366033,2.965671971,4.575187845,3.677606953,-0.393618635,1.963787827,0,4.991226076,0,5.40654018,0.799340549,5.294466226,1.926342447,4.357934847,4.045322979,3.862727528,3.079181246,0.783546282,0,0,0,0,0,0,0,0,0,0,5263,BRADFORD,STONE BRA PAD,802,PW,283783,gal,liquid,41479,7/24/13,62100,0,3.34,18700,14700,0,76.2,331,1180,5.28,39500,0,5930,0,74.4,760,121000,0,334000,6.1,243000,146,15000,6470,5970,0,0,0,0,2013,7,24,STONE,BRA,PAD,0,0,802,PW,2012,1,9,015-22022,OGO-65420,41.694483,-76.176508,Yes,Horizontal Well,GAS,Bbl,2012,Yes,0,1727195,284,0,0,2012.083333,1.5,0,4.7930916,0.523746467,4.271841607,4.167317335,1.881954971,2.519827994,3.071882007,4.596597096,3.773054693,0,1.871572936,2.880813592,5.08278537,0,5.523746467,0.785329835,5.385606274,2.164352856,4.176091259,3.810904281,3.775974331,0,0,0,0,0,0,0,0,0,0,0,0,4264,BRADFORD,STROMS BRA PAD,802,PW,86755,gal,liquid,41480,7/25/13,85000,0,3.84,10400,24400,0,127,312,1330,13.3,41100,0,6490,0,14.5,462,136000,0,383000,5.5,367000,124,44300,14700,12600,1990,0,0,0,2013,7,25,STROMS,BRA,PAD,0,0,802,PW,0,0,0,0,0,0,0,0,0,0,0,0,0,0,0,0,0,0,0,0,6.331658291,4.929418926,0.584331224,4.017033339,4.387389826,2.103803721,2.494154594,3.123851641,4.613841822,3.812244697,0,1.161368002,2.664641976,5.133538908,0,5.583198774,0.740362689,5.564666064,2.093421685,4.646403726,4.167317335,4.100370545,3.298853076,0.801517469,0,0,0,0,0,0,0,0,0,0,4265,BRADFORD,STROPE BRA PAD,802,PW,209110,gal,liquid,41478,7/23/13,72700,0,2.79,11900,18300,0,97.2,258,1440,3.96,40400,0,5470,0.23,32.8,847,131000,0,375000,5.9,288000,176,44700,23200,17300,1620,0,0,0,2013,7,23,STROPE,BRA,PAD,0,0,802,PW,2010,9,28,015-21076,OGO-65420,41.809067,-76.529269,Yes,Horizontal Well,GAS,Bbl,2012,PW,0,1395847,362,0,0,2010.75,2.833333333,10.67901235,4.861534411,0.445604203,4.075546961,4.26245109,1.987666265,2.411619706,3.158362492,4.606381365,3.737987326,-0.638272164,1.515873844,2.92788341,5.117271296,0,5.574031268,0.770852012,5.459392488,2.245512668,4.650307523,4.365487985,4.238046103,3.209515015,1.028531089,0,0,0,0,0,0,0,0,0,0,4266,BRADFORD,TAMA BRA PAD,804,Flowback,107239,gal,liquid,41408,5/14/13,40800,0,6.62,7120,10000,0,69.7,169,878,3.72,34000,0,2540,0,94.3,658,79100,0,200000,6.2,154000,135,11400,2590,4530,538,0,0,0,2013,5,14,TAMA,BRA,PAD,0,0,802,Flowback,2011,4,9,015-21564,OGO-65420,41.790714,-76.492019,Yes,Horizontal Well,GAS,Bbl,2012,PW,0,1324829,224,0,0,2011.333333,2.083333333,8.420074349,4.610660163,0.820857989,3.852479994,4,1.843232778,2.227886705,2.943494516,4.531478917,3.404833717,0,1.974511693,2.818225894,4.898176483,0,5.301029996,0.792391689,5.187520721,2.130333768,4.056904851,3.413299764,3.656098202,2.730782276,0.925315926,0,0,0,0,0,0,0,0,0,0,5267,BRADFORD,TAMA BRA PAD,802,PW,140618,gal,liquid,41478,7/23/13,26700,0,3.98,7460,6870,0,62.6,181,556,2.43,30600,0,2130,0.208,99.4,486,87400,0,211000,6.4,142000,63,19900,7280,6770,530,0,0,0,2013,7,23,TAMA,BRA,PAD,0,0,802,PW,2011,4,9,015-21564,OGO-65420,41.790714,-76.492019,Yes,Horizontal Well,GAS,Bbl,2012,Yes,0,1324829,224,0,0,2011.333333,2.25,12.77358491,4.426511261,0.599883072,3.872738827,3.836956737,1.796574333,2.257678575,2.745074792,4.485721426,3.328379603,-0.681936665,1.997386384,2.686636269,4.941511433,0,5.324282455,0.806179974,5.152288344,1.799340549,4.298853076,3.862131379,3.830588669,2.72427587,1.106312799,0,0,0,0,0,0,0,0,0,0,4268,BRADFORD,TAYLOR BRA PAD,804,Flowback,212863,gal,liquid,41381,4/17/13,65000,0,6.79,3620,19900,0,87.9,278,1430,7.71,58400,0,3800,0.38,23.3,1210,272000,0,477000,5.7,370000,107,60700,23700,22200,1670,0,0,0,2013,4,17,TAYLOR,BRA,PAD,0,0,802,Flowback,2011,6,28,015-21388,OGO-65420,41.846856,-76.312972,Yes,Horizontal Well,GAS,Bbl,2012,PW,0,92285,137,0,0,2011.5,2.75,13.29341317,4.812913357,0.831869774,3.558708571,4.298853076,1.943988875,2.444044796,3.155336037,4.766412847,3.579783597,-0.420216403,1.367355921,3.08278537,5.434568904,0,5.678518379,0.755874856,5.568201724,2.029383778,4.783188691,4.374748346,4.346352974,3.222716471,1.123636503,0,0,0,0,0,0,0,0,0,0,5269,BRADFORD,TAYLOR BRA PAD,802,PW,439421,gal,liquid,41537,9/20/13,78700,0,5.55,7310,28500,0,129,333,1800,14.8,35200,0,5980,0,0,1320,181000,0,541000,5.3,411000,553,38500,27700,20200,2150,0,0,0,2013,9,20,TAYLOR,BRA,PAD,0,0,802,PW,2011,6,28,015-21388,OGO-65420,41.846856,-76.312972,Yes,Horizontal Well,GAS,Bbl,2012,PW,0,92285,137,0,0,2011.5,3.166666667,9.395348837,4.895974732,0.744292983,3.863917377,4.45484486,2.11058971,2.522444234,3.255272505,4.546542663,3.776701184,0,0,3.120573931,5.257678575,0,5.733197265,0.72427587,5.613841822,2.742725131,4.58546073,4.442479769,4.305351369,3.33243846,0.97291291,0,0,0,0,0,0,0,0,0,0,4270,BRADFORD,TOWNER BRA PAD,802,PW,233219,gal,liquid,41529,9/12/13,108000,0,0,10600,39100,0,133,294,2590,23.5,74000,0,8190,0,0,1440,203000,0,596000,5.6,460000,97.8,18400,6700,16400,2050,0,0,0,2013,9,12,TOWNER,BRA,PAD,0,0,802,PW,2011,2,21,015-20881,OGO-65420,41.875764,-76.368108,Yes,Horizontal Well,GAS,Bbl,2012,Yes,0,330540,357,0,0,2011.166667,2.583333333,8,5.033423755,0,4.025305865,4.592176757,2.123851641,2.46834733,3.413299764,4.86923172,3.913283902,0,0,3.158362492,5.307496038,0,5.77524626,0.748188027,5.662757832,1.990338855,4.264817823,3.826074803,4.214843848,3.311753861,0.903089987,0,0,0,0,0,0,0,0,0,0,4271,BRADFORD,TREAT BRA PAD,802,PW,321765,gal,liquid,41528,9/11/13,112000,0,0,10100,40400,0,122,340,2600,24.6,37600,0,9460,0,6.4,1570,192000,0,561000,5.6,402000,281,29200,8170,13300,2500,0,0,0,2013,9,11,TREAT,BRA,PAD,0,0,802,PW,2010,8,5,015-20960,OGO-65420,41.879194,-76.359258,Yes,Horizontal Well,GAS,Bbl,2012,Yes,0,0,0,0,0,2010.666667,3.083333333,5.32,5.049218023,0,4.004321374,4.606381365,2.086359831,2.531478917,3.414973348,4.575187845,3.975891136,0,0.806179974,3.195899652,5.283301229,0,5.748962861,0.748188027,5.604226053,2.44870632,4.465382851,3.912222057,4.123851641,3.397940009,0.725911632,0,0,0,0,0,0,0,0,0,0,4272,BRADFORD,UPDIKE BRA PAD,802,PW,39551,gal,liquid,41516,8/30/13,7200,0,0,4220,2560,0,41.4,90.4,194,3.66,16800,0,1180,0,74.8,272,37000,0,110000,6.4,63600,112,3140,898,1350,200,0,0,0,2013,8,30,UPDIKE,BRA,PAD,0,0,802,PW,2010,3,20,015-20479,OGO-65420,41.778119,-76.681639,Yes,Horizontal Well,GAS,Bbl,2012,Yes,0,1201975,346,0,0,2010.25,3.416666667,6.75,3.857332496,0,3.625312451,3.408239965,1.617000341,1.95616843,2.28780173,4.225309282,3.071882007,0,1.873901598,2.434568904,4.568201724,0,5.041392685,0.806179974,4.803457116,2.049218023,3.496929648,2.953276337,3.130333768,2.301029996,0.829303773,0,0,0,0,0,0,0,0,0,0,4273,BRADFORD,WALKER BRA PAD,804,Flowback,34020,gal,liquid,41397,5/3/13,37500,0,5.39,11900,8480,0,137,228,588,4.32,30100,0,3390,0.429,111,563,69000,0,215000,6.3,164000,235,6830,1610,8630,924,0,0,0,2013,5,3,WALKER,BRA,PAD,0,0,802,Flowback,2011,11,3,015-21719,OGO-65420,41.614819,-76.296222,Yes,Horizontal Well,GAS,Bbl,2012,PW,0,0,0,0,0,2011.916667,3,9.33982684,4.574031268,0.731588765,4.075546961,3.928395852,2.136720567,2.357934847,2.769377326,4.478566496,3.530199698,-0.367542708,2.045322979,2.750508395,4.838849091,0,5.33243846,0.799340549,5.214843848,2.371067862,3.834420704,3.206825876,3.936010796,2.965671971,0.970338824,0,0,0,0,0,0,0,0,0,0,5274,BRADFORD,WALKER BRA PAD,802,PW,54161,gal,liquid,41493,8/7/13,24000,0,0,16100,9980,0,134,256,684,5.43,36700,0,3930,0,56.4,645,145000,0,293000,5.8,211000,124,36300,19100,12100,1460,0,0,0,2013,8,7,WALKER,BRA,PAD,0,0,802,PW,2011,11,3,015-21719,OGO-65420,41.614819,-76.296222,Yes,Horizontal Well,GAS,Bbl,2012,PW,0,0,0,0,0,2011.916667,3.25,8.287671233,4.380211242,0,4.206825876,3.999130541,2.127104798,2.408239965,2.835056102,4.564666064,3.59439255,0,1.751279104,2.809559715,5.161368002,0,5.46686762,0.763427994,5.324282455,2.093421685,4.559906625,4.281033367,4.08278537,3.164352856,0.918432515,0,0,0,0,0,0,0,0,0,0,4275,BRADFORD,WALT BRA PAD,802,PW,136061,gal,liquid,41470,7/15/13,57500,0,3.83,10100,14200,0,163,232,955,8.07,36700,0,5070,0.232,56.9,654,109000,0,314000,5.9,250000,160,30700,11100,8500,1300,0,0,0,2013,7,15,WALT,BRA,PAD,0,0,802,PW,2010,5,13,015-20600,OGO-65420,41.621689,-76.449756,Yes,Horizontal Well,GAS,Bbl,2012,Yes,0,2751598,365,0,0,2010.416667,3.166666667,6.538461538,4.759667845,0.583198774,4.004321374,4.152288344,2.212187604,2.365487985,2.980003372,4.564666064,3.705007959,-0.634512015,1.755112266,2.815577748,5.037426498,0,5.496929648,0.770852012,5.397940009,2.204119983,4.487138375,4.045322979,3.929418926,3.113943352,0.815475573,0,0,0,0,0,0,0,0,0,0,4276,BRADFORD,WARD BRA PAD,802,PW,13440,gal,liquid,41501,8/15/13,1790,0,0,949,643,0,102,14.2,43.8,2.24,2760,0,268,0,111,50.1,8230,90600,23400,5.7,14400,208,624,127,617,51.7,0,0,0,2013,8,15,WARD,BRA,PAD,0,0,802,PW,2009,6,28,015-20231,OGO-65420,41.78505,-76.695372,Yes,Horizontal Well,GAS,Bbl,2012,Yes,0,1044680,350,0,0,2009.5,4.166666667,11.93423598,3.252853031,0,2.977266212,2.808210973,2.008600172,1.152288344,1.641474111,3.440909082,2.428134794,0,2.045322979,1.699837726,3.915399835,4.957128198,4.369215857,0.755874856,4.158362492,2.318063335,2.79518459,2.103803721,2.790285164,1.713490543,1.076794621,0,0,0,0,0,0,0,0,0,0,4277,BRADFORD,WASYL BRA PAD,804,Flowback,52563,gal,liquid,41484,7/29/13,58700,0,3.58,11500,15300,0,80.9,246,1180,3.33,42900,0,4470,0.403,65.7,672,100000,0,342000,6.1,276000,238,40100,16900,14900,1030,0,0,0,2013,7,29,WASYL,BRA,PAD,0,0,802,Flowback,2011,2,27,015-21548,OGO-65420,41.811319,-76.511306,Yes,Horizontal Well,GAS,Bbl,2012,PW,0,629333,159,0,0,2011.166667,2.416666667,14.46601942,4.768638101,0.553883027,4.06069784,4.184691431,1.907948522,2.390935107,3.071882007,4.632457292,3.650307523,-0.394694954,1.81756537,2.827369273,5,0,5.534026106,0.785329835,5.440909082,2.376576957,4.603144373,4.227886705,4.173186268,3.012837225,1.160349044,0,0,0,0,0,0,0,0,0,0,5278,BRADFORD,WASYL BRA PAD,802,PW,249464,gal,liquid,41569,10/22/13,62600,0,0,9730,22300,0,77,277,1680,5.63,38600,0,5440,0,24.2,843,154000,0,423000,5.9,222000,66,508000,18900,12000,1480,0,0,0,2013,10,22,WASYL,BRA,PAD,0,0,802,PW,2011,2,27,015-21548,OGO-65420,41.811319,-76.511306,Yes,Horizontal Well,GAS,Bbl,2012,Yes,0,629333,159,0,0,2011.166667,2.666666667,8.108108108,4.796574333,0,3.98811284,4.348304863,1.886490725,2.442479769,3.225309282,4.586587305,3.7355989,0,1.383815366,2.925827575,5.187520721,0,5.626340367,0.770852012,5.346352974,1.819543936,5.705863712,4.276461804,4.079181246,3.170261715,0.908919531,0,0,0,0,0,0,0,0,0,0,4279,BRADFORD,WEISBROD BRA PAD,802,PW,202858,gal,liquid,41395,5/1/13,53500,0,3.48,12700,11800,0,109,243,1060,4.04,27800,0,4020,0,75.9,802,118000,0,281000,6.3,214000,110,21700,9580,10400,974,0,0,0,2013,5,1,WEISBROD,BRA,PAD,0,0,802,PW,2011,4,13,015-21403,OGO-65420,41.815394,-76.456819,Yes,Horizontal Well,GAS,Bbl,2012,Yes,0,1003642,365,0,0,2011.333333,2.083333333,10.67761807,4.728353782,0.541579244,4.103803721,4.071882007,2.037426498,2.385606274,3.025305865,4.444044796,3.604226053,0,1.880241776,2.904174368,5.071882007,0,5.44870632,0.799340549,5.330413773,2.041392685,4.336459734,3.981365509,4.017033339,2.988558957,1.028474382,0,0,0,0,0,0,0,0,0,0,4280,BRADFORD,WELLES 2 BRA PAD,804,Flowback,198885,gal,liquid,41334,3/1/13,63700,0,5.11,11100,17000,0,137,266,1230,6.52,36900,0,5130,0.519,93.7,1010,127000,25600,244000,6.2,215000,150,21600,6850,10200,1390,0,0,0,2013,3,1,WELLES,2,BRA,PAD,0,802,Flowback,2009,6,15,015-20242,OGO-65420,41.649436,-76.307575,Yes,Horizontal Well,GAS,Bbl,2012,PW,0,3053442,339,0,0,2009.5,3.75,7.338129496,4.804139432,0.7084209,4.045322979,4.230448921,2.136720567,2.424881637,3.089905111,4.567026366,3.710117365,-0.284832642,1.971739591,3.004321374,5.103803721,4.408239965,5.387389826,0.792391689,5.33243846,2.176091259,4.334453751,3.835690571,4.008600172,3.1430148,0.865585372,0,0,0,0,0,0,0,0,0,0,5281,BRADFORD,WELLES 5 BRA PAD,804,Flowback,772882,gal,liquid,41568,10/21/13,29700,0,6.08,7030,10700,0,104,206,744,5.22,26400,0,3030,0,55.8,535,77500,0,250000,6.2,132000,285,44500,14900,9030,889,0,0,0,2013,10,21,WELLES,5,BRA,PAD,0,802,Flowback,2009,6,15,015-20242,OGO-65420,41.649436,-76.307575,Yes,Horizontal Well,GAS,Bbl,2012,PW,0,3053442,339,0,0,2009.5,4.333333333,10.15748031,4.472756449,0.783903579,3.846955325,4.029383778,2.017033339,2.31386722,2.871572936,4.421603927,3.481442629,0,1.746634199,2.728353782,4.889301703,0,5.397940009,0.792391689,5.120573931,2.45484486,4.648360011,4.173186268,3.95568775,2.948901761,1.006785989,0,0,0,0,0,0,0,0,0,0,5282,BRADFORD,WELLES 4 BRA PAD,804,Flowback,648929,gal,liquid,41576,10/29/13,32700,0,5.79,9630,11800,0,99,229,795,5.18,35500,0,4060,0,85,604,91900,0,279000,6.1,152000,161,54900,24100,11300,1050,0,0,0,2013,10,29,WELLES,4,BRA,PAD,0,802,Flowback,2009,6,15,015-20242,OGO-65420,41.649436,-76.307575,Yes,Horizontal Well,GAS,Bbl,2012,PW,0,3053442,339,0,0,2009.5,4.333333333,10.76190476,4.514547753,0.762678564,3.983626287,4.071882007,1.995635195,2.359835482,2.900367129,4.550228353,3.608526034,0,1.929418926,2.781036939,4.963315511,0,5.445604203,0.785329835,5.181843588,2.206825876,4.739572344,4.382017043,4.053078443,3.021189299,1.031889144,0,0,0,0,0,0,0,0,0,0,5283,BRADFORD,WELLES 3 BRA PAD,804,Flowback,530086,gal,liquid,41578,10/31/13,23700,0,6.01,7130,8590,0,86.7,184,544,4.36,27600,0,2740,0,122,423,63700,0,209000,6.4,131000,223,41900,15700,5170,627,0,0,0,2013,10,31,WELLES,3,BRA,PAD,0,802,Flowback,2009,6,15,015-20242,OGO-65420,41.649436,-76.307575,Yes,Horizontal Well,GAS,Bbl,2012,PW,0,3053442,339,0,0,2009.5,4.333333333,8.245614035,4.374748346,0.778874472,3.85308953,3.933993164,1.938019097,2.264817823,2.7355989,4.440909082,3.437750563,0,2.086359831,2.626340367,4.804139432,0,5.320146286,0.806179974,5.117271296,2.348304863,4.622214023,4.195899652,3.713490543,2.797267541,0.916223002,0,0,0,0,0,0,0,0,0,0,5284,BRADFORD,WELLES 2 BRA PAD,802,PW,401212,gal,liquid,41411,5/17/13,148000,0,5.21,12400,17900,0,116,318,1120,7.84,42800,0,5110,0.405,48.7,834,125000,0,390000,5.8,278000,375,16900,4280,10600,1590,0,0,0,2013,5,17,WELLES,2,BRA,PAD,0,802,PW,2009,6,15,015-20242,OGO-65420,41.649436,-76.307575,Yes,Horizontal Well,GAS,Bbl,2012,Yes,0,3053442,339,0,0,2009.5,3.916666667,6.666666667,5.170261715,0.716837723,4.093421685,4.252853031,2.064457989,2.50242712,3.049218023,4.631443769,3.7084209,-0.392544977,1.687528961,2.921166051,5.096910013,0,5.591064607,0.763427994,5.444044796,2.574031268,4.227886705,3.631443769,4.025305865,3.201397124,0.823908741,0,0,0,0,0,0,0,0,0,0,4285,BRADFORD,WELLES 3 BRA PAD,802,PW,245082,gal,liquid,41614,12/6/13,35600,0,5.34,10300,12900,0,103,247,820,5.32,31800,0,4090,0,86.7,675,101000,0,346000,6.1,174000,257,12400,5760,9610,1020,0,0,0,2013,12,6,WELLES,3,BRA,PAD,0,802,PW,2009,6,15,015-20242,OGO-65420,41.649436,-76.307575,Yes,Horizontal Well,GAS,Bbl,2012,Yes,0,3053442,339,0,0,2009.5,4.5,9.421568627,4.551449998,0.727541257,4.012837225,4.11058971,2.012837225,2.392696953,2.913813852,4.50242712,3.611723308,0,1.938019097,2.829303773,5.004321374,0,5.539076099,0.785329835,5.240549248,2.409933123,4.093421685,3.760422483,3.982723388,3.008600172,0.974123216,0,0,0,0,0,0,0,0,0,0,4286,BRADFORD,WELLES 4 BRA PAD,802,PW,401493,gal,liquid,41614,12/6/13,44300,0,5.22,10700,15900,0,124,292,1090,6.87,31000,0,4590,0,53.4,783,110000,0,426000,5.8,207000,368,14700,6180,10900,1410,0,0,0,2013,12,6,WELLES,4,BRA,PAD,0,802,PW,2009,6,15,015-20242,OGO-65420,41.649436,-76.307575,Yes,Horizontal Well,GAS,Bbl,2012,Yes,0,3053442,339,0,0,2009.5,4.5,7.730496454,4.646403726,0.717670503,4.029383778,4.201397124,2.093421685,2.465382851,3.037426498,4.491361694,3.661812686,0,1.727541257,2.893761762,5.041392685,0,5.629409599,0.763427994,5.315970345,2.565847819,4.167317335,3.790988475,4.037426498,3.149219113,0.888207385,0,0,0,0,0,0,0,0,0,0,4287,BRADFORD,WELLES 5 BRA PAD,802,PW,370612,gal,liquid,41614,12/6/13,46400,0,5.16,10800,16700,0,101,290,1160,6.86,31600,0,5190,0,27.8,842,107000,0,471000,5.6,190000,249,22300,5940,12900,1530,0,0,0,2013,12,6,WELLES,5,BRA,PAD,0,802,PW,2009,6,15,015-20242,OGO-65420,41.649436,-76.307575,Yes,Horizontal Well,GAS,Bbl,2012,Yes,0,3053442,339,0,0,2009.5,4.5,8.431372549,4.666517981,0.712649702,4.033423755,4.222716471,2.004321374,2.462397998,3.064457989,4.499687083,3.715167358,0,1.444044796,2.925312091,5.029383778,0,5.673020907,0.748188027,5.278753601,2.396199347,4.348304863,3.773786445,4.11058971,3.184691431,0.925898279,0,0,0,0,0,0,0,0,0,0,4288,BRADFORD,WGC BRA PAD,804,Flowback,124304,gal,liquid,41470,7/15/13,22300,0,6.99,5580,5220,0,38,181,373,3.06,25000,0,1850,0,115,387,54200,0,172000,6.3,122000,81.8,16000,6100,5440,661,0,0,0,2013,7,15,WGC,BRA,PAD,0,0,802,Flowback,2012,10,4,015-22238,OGO-65420,41.555583,-76.368575,Yes,Horizontal Well,GAS,Bbl,2012,PW,0,1550063,175,0,0,2012.833333,0.75,8.229954614,4.348304863,0.844477176,3.746634199,3.717670503,1.579783597,2.257678575,2.571708832,4.397940009,3.267171728,0,2.06069784,2.587710965,4.733999287,0,5.235528447,0.799340549,5.086359831,1.912753304,4.204119983,3.785329835,3.7355989,2.820201459,0.91539744,0,0,0,0,0,0,0,0,0,0,5289,BRADFORD,WGC BRA PAD,802,PW,135657,gal,liquid,41572,10/25/13,15900,0,6.04,7730,5580,0,121,206,475,4.84,25500,0,2100,0,124,400,58500,0,195000,6.4,131000,166,30400,15400,7540,708,0,0,0,2013,10,25,WGC,BRA,PAD,0,0,802,PW,2012,10,4,015-22238,OGO-65420,41.555583,-76.368575,Yes,Horizontal Well,GAS,Bbl,2012,Yes,0,1550063,175,0,0,2012.833333,1,10.64971751,4.201397124,0.781036939,3.888179494,3.746634199,2.08278537,2.31386722,2.67669361,4.40654018,3.322219295,0,2.093421685,2.602059991,4.767155866,0,5.290034611,0.806179974,5.117271296,2.220108088,4.482873584,4.187520721,3.877371346,2.850033258,1.027338088,0,0,0,0,0,0,0,0,0,0,4290,BRADFORD,WILDONGER BRA PAD,804,Flowback,241919,gal,liquid,41446,6/21/13,34700,0,4.6,7690,8530,0,65.1,188,649,3.04,30800,0,2980,0.263,79.4,581,75700,0,233000,6.3,166000,210,19600,4770,8410,707,0,0,0,2013,6,21,WILDONGER,BRA,PAD,0,0,802,Flowback,2012,6,20,015-22132,OGO-65420,41.693706,-76.215403,Yes,Horizontal Well,GAS,Bbl,2012,PW,0,1943267,197,0,0,2012.5,1,11.89533239,4.540329475,0.662757832,3.88592634,3.930949031,1.813580989,2.274157849,2.812244697,4.488550717,3.474216264,-0.580044252,1.899820502,2.764176132,4.87909588,0,5.367355921,0.799340549,5.220108088,2.322219295,4.292256071,3.678518379,3.924795996,2.849419414,1.075376582,0,0,0,0,0,0,0,0,0,0,5291,BRADFORD,WILDONGER BRA PAD,802,PW,294634,gal,liquid,41554,10/7/13,38100,0,0,13400,13600,0,179,243,984,5.5,37300,0,4430,0,108,608,83800,0,297000,6.2,231000,206,29000,4350,16000,1080,0,0,0,2013,10,7,WILDONGER,BRA,PAD,0,0,802,PW,2012,6,20,015-22132,OGO-65420,41.693706,-76.215403,Yes,Horizontal Well,GAS,Bbl,2012,Yes,0,1943267,197,0,0,2012.5,1.333333333,14.81481481,4.580924976,0,4.127104798,4.133538908,2.252853031,2.385606274,2.992995098,4.571708832,3.646403726,0,2.033423755,2.783903579,4.923244019,0,5.472756449,0.792391689,5.36361198,2.31386722,4.462397998,3.638489257,4.204119983,3.033423755,1.170696227,0,0,0,0,0,0,0,0,0,0,4292,BRADFORD,WILLIAMS BRA PAD,802,PW,294060,gal,liquid,41537,9/20/13,53200,0,0,14100,18600,0,84.5,223,1660,3.41,24400,0,6860,0,32.9,868,117000,0,415000,6.1,286000,68.8,51900,20200,21200,1220,0,0,0,2013,9,20,WILLIAMS,BRA,PAD,0,0,802,PW,2010,11,29,015-21262,OGO-65420,41.882814,-76.539011,Yes,Horizontal Well,GAS,Bbl,2012,Yes,0,698976,356,0,0,2010.916667,2.833333333,17.37704918,4.725911632,0,4.149219113,4.269512944,1.926856709,2.348304863,3.220108088,4.387389826,3.836324116,0,1.517195898,2.938519725,5.068185862,0,5.618048097,0.785329835,5.456366033,1.837588438,4.715167358,4.305351369,4.326335861,3.086359831,1.23997603,0,0,0,0,0,0,0,0,0,0,4293,BRADFORD,WILLIAMSON BRA PAD,804,Flowback,143566,gal,liquid,41484,7/29/13,53900,0,3.68,10900,14900,0,81,203,1260,3.52,40200,0,4770,0,48.1,640,105000,0,327000,6.1,255000,776,34300,14000,13600,953,0,0,0,2013,7,29,WILLIAMSON,BRA,PAD,0,0,802,Flowback,2012,3,19,015-22140,OGO-65420,41.894814,-76.581389,Yes,Horizontal Well,GAS,Bbl,2012,PW,0,291734,159,0,0,2012.25,1.333333333,14.27072403,4.731588765,0.565847819,4.037426498,4.173186268,1.908485019,2.307496038,3.100370545,4.604226053,3.678518379,0,1.682145076,2.806179974,5.021189299,0,5.514547753,0.785329835,5.40654018,2.889861721,4.53529412,4.146128036,4.133538908,2.979092901,1.154446008,0,0,0,0,0,0,0,0,0,0,5294,BRADFORD,WILLIAMSON BRA PAD,802,PW,333021,gal,liquid,41540,9/23/13,52200,0,0,14600,18300,0,112,222,1560,4.6,40100,0,6090,0,36.7,606,143000,0,365000,6.1,270000,229,27000,12200,14200,1260,0,0,0,2013,9,23,WILLIAMSON,BRA,PAD,0,0,802,PW,2012,3,19,015-22140,OGO-65420,41.894814,-76.581389,Yes,Horizontal Well,GAS,Bbl,2012,Yes,0,291734,159,0,0,2012.25,1.5,11.26984127,4.717670503,0,4.164352856,4.26245109,2.049218023,2.346352974,3.193124598,4.603144373,3.784617293,0,1.564666064,2.782472624,5.155336037,0,5.562292864,0.785329835,5.431363764,2.359835482,4.431363764,4.086359831,4.152288344,3.100370545,1.051917799,0,0,0,0,0,0,0,0,0,0,4295,BRADFORD,WOLF BRA PAD,802,PW,372729,gal,liquid,41537,9/20/13,64600,0,0,12100,22800,0,224,230,1840,9.46,21400,0,6870,0,41.9,1020,146000,0,427000,5.9,311000,391,15900,7930,6800,1600,0,0,0,2013,9,20,WOLF,BRA,PAD,0,0,802,PW,2010,11,3,015-21240,OGO-65420,41.9342,-76.606475,Yes,Horizontal Well,GAS,Bbl,2012,Yes,0,848765,351,0,0,2010.916667,2.833333333,4.25,4.810232518,0,4.08278537,4.357934847,2.350248018,2.361727836,3.264817823,4.330413773,3.836956737,0,1.622214023,3.008600172,5.164352856,0,5.630427875,0.770852012,5.492760389,2.592176757,4.201397124,3.899273187,3.832508913,3.204119983,0.62838893,0,0,0,0,0,0,0,0,0,0,4296,BRADFORD,ACLA WELL,802,PW,0,0,liquid,41183,10/1/12,22300,1.32,0,6470,7990,0,130,113,592,6.54,23200,0,3070,0,28,464,52700,60600,224000,5.77,86000,410,12740,5723,6487,0,0,0,0,2012,10,1,ACLA,WELL,0,0,0,802,PW,2010,4,11,015-20640,OGO-65420,41.681744,-76.343978,Yes,Horizontal Well,GAS,Bbl,Yes,Yes,717.65,1469264,364,0,0,2010.333333,2.5,0,4.348304863,0,3.810904281,3.902546779,2.113943352,2.053078443,2.772321707,4.365487985,3.487138375,0,1.447158031,2.666517981,4.721810615,4.782472624,5.350248018,0.761175813,4.934498451,2.612783857,4.105169428,3.757623746,3.812043898,0,0,0,0,0,0,0,0,0,0,0,0,4297,BRADFORD,ACTON,802,PW,0,0,liquid,41191,10/9/12,96900,1.7,4.14,9790,35000,3.28,118,325,2310,12.9,78000,0,9760,0,28,1300,173000,7690,570000,5.41,279000,335,74730,30090,24050,426.8,0,0,0,2012,10,9,ACTON,0,0,0,0,802,PW,2011,6,3,015-21650,OGO-65420,41.911728,-76.359206,Yes,Horizontal Well,GAS,Bbl,Yes,Yes,217,483130,199,0,0,2011.5,1.333333333,56.34957826,4.986323777,0.617000341,3.990782692,4.544068044,2.071882007,2.511883361,3.36361198,4.892094603,3.989449818,0,1.447158031,3.113943352,5.238046103,3.88592634,5.755874856,0.733197265,5.445604203,2.525044807,4.873494982,4.478422188,4.381115081,2.630224411,1.75089067,0,0,0,0,0,0,0,0,0,0,4298,BRADFORD,AIKENS BRA WELL,802,PW,0,0,liquid,41177,9/25/12,62200,1.75,3.26,9800,21900,3.88,115,186,1850,12.5,52400,0,6380,0.731,62,971,131000,38100,439000,5.66,203000,114,24700,10970,9504,664.1,0,0,0,2012,9,25,AIKENS,BRA,WELL,0,0,802,PW,2011,4,12,015-21139,OGO-65420,41.970708,-76.4738,Yes,Horizontal Well,GAS,Bbl,Yes,Yes,219,463780,175,0,0,2011.333333,1.416666667,14.31109773,4.793790385,0.5132176,3.991226076,4.340444115,2.06069784,2.269512944,3.267171728,4.719331287,3.804820679,-0.136082623,1.792391689,2.98721923,5.117271296,4.580924976,5.64246452,0.752816431,5.307496038,2.056904851,4.392696953,4.040206628,3.977906428,2.82223348,1.155672947,0,0,0,0,0,0,0,0,0,0,4299,BRADFORD,ALBERTSON BRA PAD,802,PW,0,0,liquid,41197,10/15/12,27600,1.88,5.77,11300,9900,3.19,80.3,268,703,4.2,48300,0,4590,0,120,554,91600,39500,164000,5.98,132000,239,27890,12590,9074,0,0,0,0,2012,10,15,ALBERTSON,BRA,PAD,0,0,802,PW,2011,12,14,015-22020,OGO-65420,41.927275,-76.488467,Yes,Horizontal Well,GAS,Bbl,Yes,Yes,0,46424,41,0,0,2012,0.833333333,0,4.440909082,0.761175813,4.053078443,3.995635195,1.904715545,2.428134794,2.846955325,4.683947131,3.661812686,0,2.079181246,2.743509765,4.961895474,4.596597096,5.214843848,0.776701184,5.120573931,2.378397901,4.445448514,4.10002573,3.957798775,0,0,0,0,0,0,0,0,0,0,0,0,4300,BRADFORD,ALBERTSON BRA PAD,802,PW,0,0,liquid,41254,12/11/12,54100,0,3.56,6550,14700,0,68.3,166,1170,5.75,34900,0,4050,0,70.9,0,101000,0,285000,6.5,192000,68.7,0,0,0,0,0,0,0,2012,12,11,ALBERTSON,BRA,PAD,0,0,802,PW,2011,12,14,015-22020,OGO-65420,41.927275,-76.488467,Yes,Horizontal Well,GAS,Bbl,Yes,Yes,0,46424,41,0,0,2012,1,0,4.733197265,0.551449998,3.8162413,4.167317335,1.834420704,2.220108088,3.068185862,4.542825427,3.607455023,0,1.850646235,0,5.004321374,0,5.45484486,0.812913357,5.283301229,1.836956737,0,0,0,0,0,0,0,0,0,0,0,0,0,0,0,4301,BRADFORD,ALDERFER BRA PAD,802,PW,0,0,liquid,41186,10/4/12,49200,1.46,3.5,9280,17100,0.447,86.5,182,1600,5.24,40700,0,4510,0,54,788,109000,10100,431000,6.05,164000,110,31730,8872,11270,2147,0,0,0,2012,10,4,ALDERFER,BRA,PAD,0,0,802,PW,2010,9,14,015-20989,OGO-65420,41.931944,-76.409753,Yes,Horizontal Well,GAS,Bbl,Yes,Yes,110,344264,213,0,0,2010.75,2.083333333,5.249184909,4.691965103,0.544068044,3.967547976,4.23299611,1.937016107,2.260071388,3.204119983,4.609594409,3.654176542,0,1.73239376,2.896526217,5.037426498,4.004321374,5.63447727,0.781755375,5.214843848,2.041392685,4.501470072,3.948021533,4.051923916,3.331832044,0.720091872,0,0,0,0,0,0,0,0,0,0,4302,BRADFORD,ALLEN,802,PW,0,0,liquid,41162,9/10/12,50700,0,0,12300,18000,0,130,221,1420,6.05,49800,0,5420,0,32,1060,136000,30500,555000,5.58,100000,242,63560,17020,22560,3412,0,0,0,2012,9,10,ALLEN,0,0,0,0,802,PW,2011,1,4,015-20860,OGO-65420,41.813225,-76.364458,Yes,Horizontal Well,GAS,Bbl,Yes,Yes,0,1058182,237,0,0,2011.083333,2.916666667,6.611957796,4.705007959,0,4.089905111,4.255272505,2.113943352,2.344392274,3.152288344,4.697229343,3.733999287,0,1.505149978,3.025305865,5.133538908,4.484299839,5.744292983,0.746634199,5,2.383815366,4.803183889,4.230959556,4.353339095,3.533009022,0.820330073,0,0,0,0,0,0,0,0,0,0,4303,BRADFORD,AMMERMAN,804,Flowback,0,0,liquid,41171,9/19/12,37800,2.71,3.54,9700,13200,2.89,72.5,189,1180,3.78,36000,0,4200,0.878,100,797,102000,4010,358000,5.75,162000,539,33220,13160,10250,0,0,0,0,2012,9,19,AMMERMAN,0,0,0,0,802,Flowback,2010,12,3,015-21175,OGO-65420,41.913483,-76.457722,Yes,Horizontal Well,GAS,Bbl,Yes,PW,0,525326,166,0,0,2011,1.75,0,4.5774918,0.549003262,3.986771734,4.120573931,1.860338007,2.276461804,3.071882007,4.556302501,3.62324929,-0.056505484,2,2.901458321,5.008600172,3.603144373,5.553883027,0.759667845,5.209515015,2.731588765,4.521399628,4.119255889,4.010723865,0,0,0,0,0,0,0,0,0,0,0,0,5304,BRADFORD,BALDUZZI,805,Flowback,0,0,liquid,41206,10/24/12,56800,3.2,3.5,16300,20500,0.262,176,280,1350,8.9,52900,0,7440,0,70,732,131000,5780,452000,5.91,198000,420,90090,34370,19590,719,0,0,0,2012,10,24,BALDUZZI,0,0,0,0,802,Flowback,2010,9,20,015-20719,OGO-65420,41.714689,-76.290681,Yes,Horizontal Well,GAS,Bbl,Yes,PW,0,1354436,365,0,0,2010.75,2.083333333,27.24617524,4.754348336,0.544068044,4.212187604,4.311753861,2.245512668,2.447158031,3.130333768,4.723455672,3.871572936,0,1.84509804,2.864511081,5.117271296,3.761927838,5.655138435,0.771587481,5.29666519,2.62324929,4.954676587,4.536179532,4.292034436,2.85672889,1.435305546,0,0,0,0,0,0,0,0,0,0,5305,BRADFORD,BALENT,805,Flowback,0,0,liquid,41162,9/10/12,81400,0,0,12200,29100,0,125,327,2140,19.6,92400,0,8910,0,38,1480,192000,15900,875000,5.2,320000,62,47490,22870,15900,3438,0,0,0,2012,9,10,BALENT,0,0,0,0,802,Flowback,2010,10,25,015-21181,OGO-65420,41.814367,-76.332931,Yes,Horizontal Well,GAS,Bbl,Yes,PW,0,884233,236,0,0,2010.833333,1.916666667,4.62478185,4.910624405,0,4.086359831,4.463892989,2.096910013,2.514547753,3.330413773,4.965671971,3.949877704,0,1.579783597,3.170261715,5.283301229,4.201397124,5.942008053,0.716003344,5.505149978,1.792391689,4.67660217,4.359266165,4.201397124,3.536305872,0.665091252,0,0,0,0,0,0,0,0,0,0,5306,BRADFORD,BALLIBAY,805,Flowback,0,0,liquid,41207,10/25/12,93900,1.5,5.39,8180,34500,0.391,154,384,1890,22.7,81700,0,8510,0,116,1230,192000,10700,666000,5.25,273000,500,120300,39090,33990,2947,0,0,0,2012,10,25,BALLIBAY,0,0,0,0,802,Flowback,2010,10,21,015-20815,OGO-65420,41.750697,-76.283886,Yes,Horizontal Well,GAS,Bbl,Yes,PW,0,788224,245,0,0,2010.833333,2,11.53376315,4.972665592,0.731588765,3.912753304,4.537819095,2.187520721,2.584331224,3.276461804,4.912222057,3.92992956,0,2.064457989,3.089905111,5.283301229,4.029383778,5.823474229,0.720159303,5.436162647,2.698970004,5.080265627,4.59206567,4.531351165,3.469380136,1.061971029,0,0,0,0,0,0,0,0,0,0,5307,BRADFORD,BENNETT,804,Flowback,0,0,liquid,41205,10/23/12,38900,2.92,3.54,15100,13900,0.374,247,256,1010,6.67,38400,0,5220,0,82,495,108000,7870,372000,5.82,161000,850,44700,16240,12840,0,0,0,0,2012,10,23,BENNETT,0,0,0,0,802,Flowback,2010,11,3,015-21213,OGO-65420,41.719147,-76.127739,Yes,Horizontal Well,GAS,Bbl,Yes,PW,0,1887639,361,0,0,2010.916667,1.916666667,0,4.589949601,0.549003262,4.178976947,4.1430148,2.392696953,2.408239965,3.004321374,4.584331224,3.717670503,0,1.913813852,2.694605199,5.033423755,3.895974732,5.57054294,0.764922985,5.206825876,2.929418926,4.650307523,4.210586025,4.108565024,0,0,0,0,0,0,0,0,0,0,0,0,5308,BRADFORD,BLANNARD,804,Flowback,0,0,liquid,41169,9/17/12,78200,0,0,8280,28200,0,145,304,1870,19.4,73000,0,6370,0,60,1570,200000,23100,633000,5.23,270000,350,57080,19370,22340,2024,0,0,0,2012,9,17,BLANNARD,0,0,0,0,802,Flowback,2010,5,8,015-20716,OGO-65420,41.7841,-76.311033,Yes,Horizontal Well,GAS,Bbl,Yes,PW,0,606592,284,0,0,2010.416667,2.333333333,11.03754941,4.893206753,0,3.918030337,4.450249108,2.161368002,2.482873584,3.271841607,4.86332286,3.804139432,0,1.77815125,3.195899652,5.301029996,4.36361198,5.80140371,0.718501689,5.431363764,2.544068044,4.756483964,4.287129621,4.349083169,3.306210508,1.042872661,0,0,0,0,0,0,0,0,0,0,5309,BRADFORD,BO,804,Flowback,0,0,liquid,41205,10/23/12,40900,0,2.58,30300,14600,0.283,114,270,1090,8.23,56700,0,7260,0,120,882,129000,7140,444000,5.89,218000,360,44270,12960,6900,3118,0,0,0,2012,10,23,BO,0,0,0,0,802,Flowback,2011,6,21,015-21673,OGO-65420,41.744792,-76.150328,Yes,Horizontal Well,GAS,Bbl,Yes,PW,0,1040657,360,0,0,2011.5,1.333333333,2.212957024,4.611723308,0.411619706,4.481442629,4.164352856,2.056904851,2.431363764,3.037426498,4.753583059,3.860936621,0,2.079181246,2.945468585,5.11058971,3.853698212,5.64738297,0.770115295,5.338456494,2.556302501,4.646109522,4.112605002,3.838849091,3.493876111,0.34497298,0,0,0,0,0,0,0,0,0,0,5310,BRADFORD,BONNIE,804,Flowback,0,0,liquid,41262,12/19/12,51300,0,4.62,7400,15300,0,123,212,873,9.52,37700,0,4310,0,75.3,0,98200,0,295000,6.3,184000,47.2,0,0,0,0,0,0,0,2012,12,19,BONNIE,0,0,0,0,802,Flowback,2009,10,27,015-20352,OGO-65420,41.634456,-76.404925,Yes,Horizontal Well,GAS,Bbl,Yes,PW,0,1377049,334,0,0,2009.833333,3.166666667,0,4.710117365,0.664641976,3.86923172,4.184691431,2.089905111,2.326335861,2.941014244,4.57634135,3.63447727,0,1.876794976,0,4.992111488,0,5.469822016,0.799340549,5.264817823,1.673941999,0,0,0,0,0,0,0,0,0,0,0,0,0,0,0,5311,BRADFORD,BREEZY,804,Flowback,0,0,liquid,41213,10/31/12,77400,3,3.6,19300,28300,0.315,134,294,1640,10.8,75400,0,7980,0,12,859,164000,7230,588000,4.72,265000,432,48340,19110,0,0,0,0,0,2012,10,31,BREEZY,0,0,0,0,802,Flowback,2010,9,9,015-21094,OGO-65420,41.753783,-76.725378,Yes,Horizontal Well,GAS,Bbl,Yes,PW,0,316484,351,0,0,2010.75,2.083333333,0,4.888740961,0.556302501,4.285557309,4.451786436,2.127104798,2.46834733,3.214843848,4.877371346,3.902002891,0,1.079181246,2.933993164,5.214843848,3.859138297,5.769377326,0.673941999,5.423245874,2.635483747,4.684306646,4.281260687,0,0,0,0,0,0,0,0,0,0,0,0,0,5312,SULLIVAN,BENSPOND SUL PAD,804,Flowback,33096,gal,liquid,41806,6/16/14,73000,0,6.83,4190,26400,0,447,285,1750,19.4,30500,0,5690,0,0,760,172000,0,482000,4.7,322000,1400,87400,34100,24000,2210,0,0,0,2014,6,16,BENSPOND,SUL,PAD,0,0,802,Flowback,2011,6,14,113-20055,OGO-65420,41.557978,-76.681225,Yes,Horizontal Well,GAS,Bbl,2012,PW,0,465704,153,0,0,2011.5,3,10.85972851,4.86332286,0.834420704,3.622214023,4.421603927,2.650307523,2.45484486,3.243038049,4.484299839,3.755112266,0,0,2.880813592,5.235528447,0,5.683047038,0.672097858,5.507855872,3.146128036,4.941511433,4.532754379,4.380211242,3.344392274,1.035818968,0,0,0,0,0,0,0,0,0,0,5313,SULLIVAN,BENSPOND SUL PAD,802,PW,196701,gal,liquid,41841,7/21/14,126000,0,8.92,2190,45500,0,190,424,3100,28.7,26700,0,9210,0,27,1290,233000,0,551000,5.2,458000,181,82800,20500,26400,3600,0,0,0,2014,7,21,BENSPOND,SUL,PAD,0,0,802,PW,2011,6,14,113-20055,OGO-65420,41.557978,-76.681225,Yes,Horizontal Well,GAS,Bbl,2012,Yes,0,465704,153,0,0,2011.5,3.083333333,7.333333333,5.100370545,0.950364854,3.340444115,4.658011397,2.278753601,2.627365857,3.491361694,4.426511261,3.96425963,0,1.431363764,3.11058971,5.367355921,0,5.741151599,0.716003344,5.660865478,2.257678575,4.918030337,4.311753861,4.421603927,3.556302501,0.865301426,0,0,0,0,0,0,0,0,0,0,4314,SULLIVAN,HENDERSON SUL PAD,804,Flowback,49506,gal,liquid,41709,3/11/14,92200,0,6.4,4210,33300,0,190,347,2200,26.4,26300,0,7770,0,25.4,1210,217000,0,580000,5.2,270000,520,31300,11800,15600,2770,0,0,0,2014,3,11,HENDERSON,SUL,PAD,0,0,802,Flowback,2010,9,4,113-20006,OGO-65420,41.565758,-76.726608,Yes,Horizontal Well,GAS,Bbl,2012,PW,0,1197695,305,0,0,2010.75,3.5,5.631768953,4.964730921,0.806179974,3.624282096,4.522444234,2.278753601,2.540329475,3.342422681,4.419955748,3.890421019,0,1.404833717,3.08278537,5.336459734,0,5.763427994,0.716003344,5.431363764,2.716003344,4.495544338,4.071882007,4.193124598,3.442479769,0.750644829,0,0,0,0,0,0,0,0,0,0,5315,SULLIVAN,HENDERSON SUL PAD,802,PW,253754,gal,liquid,41761,5/2/14,127000,0,7.22,3480,45900,0,162,428,2900,43,38000,0,8200,0,9.1,1490,319000,0,582000,5.1,366000,207,21300,6590,8900,2940,0,0,0,2014,5,2,HENDERSON,SUL,PAD,0,0,802,PW,2010,9,4,113-20006,OGO-65420,41.565758,-76.726608,Yes,Horizontal Well,GAS,Bbl,2012,PW,0,1197695,305,0,0,2010.75,3.666666667,3.027210884,5.103803721,0.858537198,3.541579244,4.661812686,2.209515015,2.631443769,3.462397998,4.579783597,3.913813852,0,0.959041392,3.173186268,5.503790683,0,5.764922985,0.707570176,5.563481085,2.315970345,4.328379603,3.818885415,3.949390007,3.46834733,0.481042676,0,0,0,0,0,0,0,0,0,0,4316,SULLIVAN,M&M ESTATES SUL PAD,804,Flowback,53761,gal,liquid,41709,3/11/14,85800,0,5.28,7730,31200,0,221,288,1880,28.2,35500,0,6390,2.24,34.1,1010,255000,0,535000,5.2,263000,262,18200,6860,11700,2110,0,0,0,2014,3,11,M&M,ESTATES,SUL,PAD,0,802,Flowback,2011,2,14,113-20083,OGO-65420,41.552006,-76.7372,Yes,Horizontal Well,GAS,Bbl,2012,PW,0,1391002,306,0,0,2011.166667,3.083333333,5.545023697,4.933487288,0.722633923,3.888179494,4.494154594,2.344392274,2.459392488,3.274157849,4.550228353,3.805500858,0.350248018,1.532754379,3.004321374,5.40654018,0,5.728353782,0.716003344,5.419955748,2.418301291,4.260071388,3.836324116,4.068185862,3.324282455,0.743903406,0,0,0,0,0,0,0,0,0,0,5317,SULLIVAN,M&M ESTATES SUL PAD,802,PW,334849,gal,liquid,41761,5/2/14,106000,0,6.15,4370,38000,0,181,384,2690,42.6,41000,0,8610,0,8,1250,174000,0,548000,5,327000,318,18300,6090,8030,2710,0,0,0,2014,5,2,M&M,ESTATES,SUL,PAD,0,802,PW,2011,2,14,113-20083,OGO-65420,41.552006,-76.7372,Yes,Horizontal Well,GAS,Bbl,2012,Yes,0,1391002,306,0,0,2011.166667,3.25,2.963099631,5.025305865,0.788875116,3.640481437,4.579783597,2.257678575,2.584331224,3.42975228,4.612783857,3.935003151,0,0.903089987,3.096910013,5.240549248,0,5.738780558,0.698970004,5.514547753,2.50242712,4.26245109,3.784617293,3.904715545,3.432969291,0.471746254,0,0,0,0,0,0,0,0,0,0,4318,SULLIVAN,MANNING SUL PAD,804,Flowback,376137,gal,liquid,41877,8/26/14,15300,0,7.34,6590,5510,0,76.1,197,375,2.84,25500,0,1830,0,171,378,64400,0,181000,6.5,113000,194,30600,9590,7990,689,0,0,0,2014,8,26,MANNING,SUL,PAD,0,0,802,Flowback,2012,10,8,113-20161,OGO-65420,41.533686,-76.330406,Yes,Horizontal Well,GAS,Bbl,2012,PW,0,0,0,0,0,2012.833333,1.833333333,11.59651669,4.184691431,0.86569606,3.818885415,3.741151599,1.881384657,2.294466226,2.574031268,4.40654018,3.26245109,0,2.23299611,2.5774918,4.808885867,0,5.257678575,0.812913357,5.053078443,2.28780173,4.485721426,3.981818607,3.902546779,2.838219222,1.064327557,0,0,0,0,0,0,0,0,0,0,5319,SULLIVAN,MANNING SUL PAD,802,PW,517574,gal,liquid,41912,9/30/14,16800,0,6.96,6980,6070,0,94,217,408,3.62,26600,0,2110,0,173,404,66400,0,190000,6.6,106000,66.5,19200,6410,7420,770,0,0,0,2014,9,30,MANNING,SUL,PAD,0,0,802,PW,2012,10,8,113-20161,OGO-65420,41.533686,-76.330406,Yes,Horizontal Well,GAS,Bbl,2012,Yes,0,0,0,0,0,2012.833333,1.916666667,9.636363636,4.225309282,0.84260924,3.843855423,3.783188691,1.973127854,2.336459734,2.610660163,4.424881637,3.324282455,0,2.238046103,2.606381365,4.822168079,0,5.278753601,0.819543936,5.025305865,1.822821645,4.283301229,3.80685803,3.870403905,2.886490725,0.98391318,0,0,0,0,0,0,0,0,0,0,4320,SULLIVAN,QUAIL SUL PAD,804,Flowback,386061,gal,liquid,41817,6/27/14,63700,0,5.18,9000,23300,0,107,239,1370,17.5,52100,0,5750,0,49.8,603,209000,0,612000,5.6,308000,304,21400,8610,9790,1720,0,0,0,2014,6,27,QUAIL,SUL,PAD,0,0,802,Flowback,2011,10,10,113-20113,OGO-65420,41.566044,-76.715631,Yes,Horizontal Well,GAS,Bbl,Yes,PW,0,1885202,187,0,0,2011.833333,2.666666667,5.691860465,4.804139432,0.71432976,3.954242509,4.367355921,2.029383778,2.378397901,3.136720567,4.716837723,3.759667845,0,1.697229343,2.780317312,5.320146286,0,5.786751422,0.748188027,5.488550717,2.482873584,4.330413773,3.935003151,3.990782692,3.235528447,0.755254245,0,0,0,0,0,0,0,0,0,0,5321,SULLIVAN,QUAIL SUL PAD,802,PW,426504,gal,liquid,41852,8/1/14,80300,0,5.02,11200,29500,0,146,273,1630,23.1,31300,0,7510,0,60.3,713,196000,0,566000,5.6,513000,279,40000,13200,14300,2060,0,0,0,2014,8,1,QUAIL,SUL,PAD,0,0,802,PW,2011,10,10,113-20113,OGO-65420,41.566044,-76.715631,Yes,Horizontal Well,GAS,Bbl,Yes,Yes,0,1885202,187,0,0,2011.833333,2.833333333,6.941747573,4.904715545,0.700703717,4.049218023,4.469822016,2.164352856,2.436162647,3.212187604,4.495544338,3.875639937,0,1.780317312,2.85308953,5.292256071,0,5.752816431,0.748188027,5.710117365,2.445604203,4.602059991,4.120573931,4.155336037,3.31386722,0.841468817,0,0,0,0,0,0,0,0,0,0,4322,SULLIVAN,RAIN SUL PAD,802,PW,231800,gal,liquid,41887,9/5/14,94100,0,5.45,9830,34600,0,161,354,1870,25.3,51000,0,8740,2.57,9.5,1050,137000,0,540000,5.3,359000,84.8,55400,26300,20200,2840,0,0,0,2014,9,5,RAIN,SUL,PAD,0,0,802,PW,2011,1,6,113-20047,OGO-65420,41.560681,-76.614542,Yes,Horizontal Well,GAS,Bbl,2012,Yes,0,941984,154,0,0,2011.083333,3.666666667,7.112676056,4.973589623,0.736396502,3.992553518,4.539076099,2.206825876,2.549003262,3.271841607,4.707570176,3.941511433,0.409933123,0.977723605,3.021189299,5.136720567,0,5.73239376,0.72427587,5.555094449,1.928395852,4.743509765,4.419955748,4.305351369,3.45331834,0.852033029,0,0,0,0,0,0,0,0,0,0,4323,SULLIVAN,REILLY SUL PAD,804,Flowback,1384921,gal,liquid,41912,9/30/14,9550,0,7.98,4180,3460,0,34.9,158,224,1.65,19100,0,1140,0,150,229,43700,0,126000,6.9,75400,125,10200,3250,2850,399,0,0,0,2014,9,30,REILLY,SUL,PAD,0,0,802,Flowback,2012,11,1,113-20168,OGO-65420,41.544481,-76.295933,Yes,Horizontal Well,GAS,Bbl,2013,PW,0,0,0,0,0,2012.916667,1.833333333,7.142857143,3.980003372,0.902002891,3.621176282,3.539076099,1.542825427,2.198657087,2.350248018,4.281033367,3.056904851,0,2.176091259,2.359835482,4.640481437,0,5.100370545,0.838849091,4.877371346,2.096910013,4.008600172,3.511883361,3.45484486,2.600972896,0.853871964,0,0,0,0,0,0,0,0,0,0,5324,SULLIVAN,REILLY SUL PAD,802,PW,500343,gal,liquid,41948,11/5/14,10300,0,6.95,4820,3710,0,77.5,171,259,2.47,17200,0,1160,0,182,266,45900,0,154000,6.4,93600,96,0,0,0,0,0,0,0,2014,11,5,REILLY,SUL,PAD,0,0,802,PW,2012,11,1,113-20168,OGO-65420,41.544481,-76.295933,Yes,Horizontal Well,GAS,Bbl,2013,Yes,0,0,0,0,0,2012.916667,2,0,4.012837225,0.841984805,3.683047038,3.56937391,1.889301703,2.23299611,2.413299764,4.235528447,3.064457989,0,2.260071388,2.424881637,4.661812686,0,5.187520721,0.806179974,4.971275849,1.982271233,0,0,0,0,0,0,0,0,0,0,0,0,0,0,0,4325,SULLIVAN,RIDENOUR SUL PAD,804,Flowback,203392,gal,liquid,41948,11/5/14,13700,0,7.9,3270,4930,0,107,157,346,4.69,20900,0,1450,0,164,267,55400,0,157000,6.3,94400,42.3,4210,1160,4890,537,0,0,0,2014,11,5,RIDENOUR,SUL,PAD,0,0,802,Flowback,2012,3,28,113-20145,OGO-65420,41.545189,-76.385325,Yes,Horizontal Well,GAS,Bbl,2012,PW,0,0,0,0,0,2012.25,2.666666667,9.106145251,4.136720567,0.897627091,3.514547753,3.692846919,2.029383778,2.195899652,2.539076099,4.320146286,3.161368002,0,2.214843848,2.426511261,4.743509765,0,5.195899652,0.799340549,4.974971994,1.626340367,3.624282096,3.064457989,3.689308859,2.729974286,0.959334573,0,0,0,0,0,0,0,0,0,0,5326,SULLIVAN,RIDENOUR SUL PAD,802,PW,299535,gal,liquid,41984,12/11/14,3340,0,0,1020,1200,0,53.2,44.7,86.9,1.37,6130,0,419,0,189,419,59700,0,182000,7,106000,562,26200,9610,7790,691,0,0,0,2014,12,11,RIDENOUR,SUL,PAD,0,0,802,PW,2012,3,28,113-20145,OGO-65420,41.545189,-76.385325,Yes,Horizontal Well,GAS,Bbl,2012,Yes,0,0,0,0,0,2012.25,2.75,11.27351664,3.523746467,0,3.008600172,3.079181246,1.725911632,1.650307523,1.939019776,3.787460475,2.622214023,0,2.276461804,2.622214023,4.775974331,0,5.260071388,0.84509804,5.025305865,2.749736316,4.418301291,3.982723388,3.891537458,2.839478047,1.05205941,0,0,0,0,0,0,0,0,0,0,4327,SULLIVAN,RONMARY SUL PAD,804,Flowback,55400,gal,liquid,41869,8/18/14,58500,0,6.16,12000,21200,0,144,290,1360,11.3,46100,0,6320,0,14.5,848,156000,0,361000,5.8,251000,167,66900,17900,15000,1510,0,0,0,2014,8,18,RONMARY,SUL,PAD,0,0,802,Flowback,2013,1,28,113-20192,OGO-65420,41.569078,-76.625314,Yes,Horizontal Well,GAS,Bbl,2013,PW,0,0,0,0,0,2013.083333,1.583333333,9.933774834,4.767155866,0.789580712,4.079181246,4.326335861,2.158362492,2.462397998,3.133538908,4.663700925,3.800717078,0,1.161368002,2.928395852,5.193124598,0,5.557507202,0.763427994,5.399673721,2.222716471,4.825426118,4.252853031,4.176091259,3.178976947,0.997114312,0,0,0,0,0,0,0,0,0,0,5328,SULLIVAN,RONMARY SUL PAD,802,PW,252036,gal,liquid,41884,9/2/14,62900,0,5.71,12300,22900,0,113,279,1370,11.2,39800,0,6490,0,34.4,844,140000,0,397000,5.8,293000,38.3,38500,23800,15300,1670,0,0,0,2014,9,2,RONMARY,SUL,PAD,0,0,802,PW,2013,1,28,113-20192,OGO-65420,41.569078,-76.625314,Yes,Horizontal Well,GAS,Bbl,2013,Yes,0,0,0,0,0,2013.083333,1.666666667,9.161676647,4.798650645,0.756636108,4.089905111,4.359835482,2.053078443,2.445604203,3.136720567,4.599883072,3.812244697,0,1.536558443,2.926342447,5.146128036,0,5.598790507,0.763427994,5.46686762,1.583198774,4.58546073,4.376576957,4.184691431,3.222716471,0.96197496,0,0,0,0,0,0,0,0,0,0,4329,SULLIVAN,BLACK CREEK SUL,804,Flowback,0,0,liquid,41278,1/4/13,67200,0,5.67,9110,17400,0,146,272,1210,10.4,48000,0,5230,1.47,69.6,0,118000,34700,264000,6.2,240000,180,46800,17600,15900,1980,0,0,0,2013,1,4,BLACK,CREEK,SUL,0,0,802,Flowback,2011,4,28,113-20020,OGO-65420,41.545717,-76.49305,Yes,Horizontal Well,GAS,Bbl,2012,PW,0,2100029,364,0,0,2011.333333,1.75,8.03030303,4.827369273,0.753583059,3.959518377,4.240549248,2.164352856,2.434568904,3.08278537,4.681241237,3.718501689,0.167317335,1.84260924,0,5.071882007,4.540329475,5.421603927,0.792391689,5.380211242,2.255272505,4.670245853,4.245512668,4.201397124,3.29666519,0.904731934,0,0,0,0,0,0,0,0,0,0,5330,SULLIVAN,BLACK CREEK SUL,802,PW,248513,gal,liquid,41466,7/11/13,84800,0,4.74,11000,20400,0,195,310,1320,13.6,29400,0,5990,0,25.7,857,149000,0,440000,5.6,337000,315,26800,11400,32100,2340,0,0,0,2013,7,11,BLACK,CREEK,SUL,0,0,802,PW,2011,4,28,113-20020,OGO-65420,41.545717,-76.49305,Yes,Horizontal Well,GAS,Bbl,2012,Yes,0,2100029,364,0,0,2011.333333,2.25,13.71794872,4.928395852,0.675778342,4.041392685,4.309630167,2.290034611,2.491361694,3.120573931,4.46834733,3.777426822,0,1.409933123,2.932980822,5.173186268,0,5.643452676,0.748188027,5.527629901,2.498310554,4.428134794,4.056904851,4.506505032,3.369215857,1.137289175,0,0,0,0,0,0,0,0,0,0,4331,SULLIVAN,BURKHART SUL PAD,804,Flowback,67753,gal,liquid,41523,9/6/13,40800,0,7.72,7860,14600,0,391,220,1030,13.2,24700,0,4080,0,72.5,720,179000,0,308000,6,240000,926,22800,7400,8930,1260,0,0,0,2013,9,6,BURKHART,SUL,PAD,0,0,802,Flowback,2012,5,15,113-20152,OGO-65420,41.531778,-76.511183,Yes,Horizontal Well,GAS,Bbl,2012,PW,0,946722,119,0,0,2012.416667,1.333333333,7.087301587,4.610660163,0.8876173,3.895422546,4.164352856,2.592176757,2.342422681,3.012837225,4.392696953,3.610660163,0,1.860338007,2.857332496,5.252853031,0,5.488550717,0.77815125,5.380211242,2.966610987,4.357934847,3.86923172,3.950851459,3.100370545,0.850480914,0,0,0,0,0,0,0,0,0,0,5332,SULLIVAN,BURKHART SUL PAD,802,PW,220578,gal,liquid,41576,10/29/13,44800,0,6.32,10300,16200,0,154,272,1070,8.27,33400,0,5330,0,60.4,706,110000,0,326000,6.1,181000,289,50700,29400,16100,1550,0,0,0,2013,10,29,BURKHART,SUL,PAD,0,0,802,PW,2012,5,15,113-20152,OGO-65420,41.531778,-76.511183,Yes,Horizontal Well,GAS,Bbl,2012,Yes,0,946722,119,0,0,2012.416667,1.416666667,10.38709677,4.651278014,0.800717078,4.012837225,4.209515015,2.187520721,2.434568904,3.029383778,4.523746467,3.726727209,0,1.781036939,2.848804701,5.041392685,0,5.5132176,0.785329835,5.257678575,2.460897843,4.705007959,4.46834733,4.206825876,3.190331698,1.016494178,0,0,0,0,0,0,0,0,0,0,4333,SULLIVAN,CONNELL SUL PAD,804,Flowback,147540,gal,liquid,41598,11/20/13,16200,0,7.76,6940,5780,0,46.5,206,427,4.57,27300,0,1950,0,99.4,499,63000,0,190000,6.2,105000,89.3,9570,2380,6230,697,0,0,0,2013,11,20,CONNELL,SUL,PAD,0,0,802,Flowback,2011,10,26,113-20122,OGO-65420,41.522339,-76.370442,Yes,Horizontal Well,GAS,Bbl,2012,PW,0,560939,49,0,0,2011.833333,2.083333333,8.93830703,4.209515015,0.889861721,3.84135947,3.761927838,1.667452953,2.31386722,2.630427875,4.436162647,3.290034611,0,1.997386384,2.698100546,4.799340549,0,5.278753601,0.792391689,5.021189299,1.950851459,3.980911938,3.376576957,3.794488047,2.843232778,0.951255269,0,0,0,0,0,0,0,0,0,0,5334,SULLIVAN,CONNELL SUL PAD,802,PW,251370,gal,liquid,41624,12/16/13,13200,0,5.35,5420,4710,0,91.9,164,349,4.18,21400,0,1510,0,126,397,54800,168000,182000,6.5,85800,162,30300,12400,2800,568,0,0,0,2013,12,16,CONNELL,SUL,PAD,0,0,802,PW,2011,10,26,113-20122,OGO-65420,41.522339,-76.370442,Yes,Horizontal Well,GAS,Bbl,2012,Yes,0,560939,49,0,0,2011.833333,2.166666667,4.929577465,4.120573931,0.728353782,3.733999287,3.673020907,1.963315511,2.214843848,2.542825427,4.330413773,3.178976947,0,2.100370545,2.598790507,4.738780558,5.225309282,5.260071388,0.812913357,4.933487288,2.209515015,4.481442629,4.093421685,3.447158031,2.754348336,0.692809696,0,0,0,0,0,0,0,0,0,0,4335,SULLIVAN,CORL SUL PAD,804,Flowback,38304,gal,liquid,41436,6/11/13,22000,0,6.54,7840,4110,0,143,227,320,3.94,24600,0,1730,0,205,414,53700,0,175000,6.5,106000,314,10400,2250,8940,683,0,0,0,2013,6,11,CORL,SUL,PAD,0,0,802,Flowback,2011,10,5,113-20120,OGO-65420,41.529017,-76.245347,Yes,Horizontal Well,GAS,Bbl,2012,PW,0,1626368,192,0,0,2011.833333,1.666666667,13.08931186,4.342422681,0.815577748,3.894316063,3.613841822,2.155336037,2.356025857,2.505149978,4.390935107,3.238046103,0,2.311753861,2.617000341,4.729974286,0,5.243038049,0.812913357,5.025305865,2.496929648,4.017033339,3.352182518,3.951337519,2.834420704,1.116916815,0,0,0,0,0,0,0,0,0,0,5336,SULLIVAN,CORL SUL PAD,802,PW,93402,gal,liquid,41494,8/8/13,27700,0,9.07,9700,6120,0,103,247,424,4.03,28100,0,2440,0,152,556,66900,0,218000,6.5,147000,176,40800,17400,18700,980,0,0,0,2013,8,8,CORL,SUL,PAD,0,0,802,PW,2011,10,5,113-20120,OGO-65420,41.529017,-76.245347,Yes,Horizontal Well,GAS,Bbl,2012,Yes,0,1626368,192,0,0,2011.833333,1.833333333,19.08163265,4.442479769,0.957607287,3.986771734,3.786751422,2.012837225,2.392696953,2.627365857,4.44870632,3.387389826,0,2.181843588,2.745074792,4.825426118,0,5.338456494,0.812913357,5.167317335,2.245512668,4.610660163,4.240549248,4.271841607,2.991226076,1.280615531,0,0,0,0,0,0,0,0,0,0,4337,SULLIVAN,COVEYTOWN SUL,804,Flowback,0,0,liquid,41278,1/4/13,56300,0,5.94,3850,17100,0,134,264,949,9,33300,0,4340,3.39,78.6,0,106000,85800,276000,6.3,203000,101,29900,14200,9330,1780,0,0,0,2013,1,4,COVEYTOWN,SUL,0,0,0,802,Flowback,2010,9,14,113-20011,OGO-65420,41.554994,-76.467794,Yes,Horizontal Well,GAS,Bbl,2012,PW,0,2225582,365,0,0,2010.75,2.333333333,5.241573034,4.750508395,0.773786445,3.58546073,4.23299611,2.127104798,2.421603927,2.977266212,4.522444234,3.63748973,0.530199698,1.895422546,0,5.025305865,4.933487288,5.440909082,0.799340549,5.307496038,2.004321374,4.475671188,4.152288344,3.969881644,3.250420002,0.719461641,0,0,0,0,0,0,0,0,0,0,5338,SULLIVAN,COVEYTOWN SUL,802,PW,254399,gal,liquid,41466,7/11/13,82700,0,5,7590,20000,0,129,344,1320,13,33000,0,6700,0.646,28,905,136000,0,436000,5.6,307000,173,18000,7080,4450,2110,0,0,0,2013,7,11,COVEYTOWN,SUL,0,0,0,802,PW,2010,9,14,113-20011,OGO-65420,41.554994,-76.467794,Yes,Horizontal Well,GAS,Bbl,2012,Yes,0,2225582,365,0,0,2010.75,2.833333333,2.109004739,4.91750551,0.698970004,3.880241776,4.301029996,2.11058971,2.536558443,3.120573931,4.51851394,3.826074803,-0.189767482,1.447158031,2.956648579,5.133538908,0,5.639486489,0.748188027,5.487138375,2.238046103,4.255272505,3.850033258,3.648360011,3.324282455,0.324077556,0,0,0,0,0,0,0,0,0,0,4339,SULLIVAN,FREMAR SUL PAD,802,PW,219185,gal,liquid,41613,12/5/13,107000,0,6.66,8860,39900,0,130,337,1840,43.7,32200,0,10500,0,0,1120,222000,0,599000,5.2,310000,206,11400,5380,7310,1720,0,0,0,2013,12,5,FREMAR,SUL,PAD,0,0,802,PW,2010,11,22,113-20039,OGO-65420,41.534997,-76.754753,Yes,Horizontal Well,GAS,Bbl,2012,Yes,0,101585,87,0,0,2010.916667,3.083333333,4.25,5.029383778,0.823474229,3.947433722,4.600972896,2.113943352,2.527629901,3.264817823,4.507855872,4.021189299,0,0,3.049218023,5.346352974,0,5.777426822,0.716003344,5.491361694,2.31386722,4.056904851,3.730782276,3.863917377,3.235528447,0.62838893,0,0,0,0,0,0,0,0,0,0,4340,SULLIVAN,INSINGER SUL,804,Flowback,0,0,liquid,41278,1/4/13,67000,0,5.88,8080,18000,0,146,277,1310,9.64,39500,0,5220,0.74,60.5,0,115000,0,310000,6.2,239000,238,47900,18000,14000,1910,0,0,0,2013,1,4,INSINGER,SUL,0,0,0,802,Flowback,2010,8,17,113-20019,OGO-65420,41.547714,-76.484389,Yes,Horizontal Well,GAS,Bbl,Yes,PW,0,2236043,365,0,0,2010.666667,2.416666667,7.329842932,4.826074803,0.769377326,3.907411361,4.255272505,2.164352856,2.442479769,3.117271296,4.596597096,3.717670503,-0.13076828,1.781755375,0,5.06069784,0,5.491361694,0.792391689,5.378397901,2.376576957,4.680335513,4.255272505,4.146128036,3.281033367,0.865094668,0,0,0,0,0,0,0,0,0,0,5341,SULLIVAN,INSINGER SUL,802,PW,464616,gal,liquid,41466,7/11/13,81500,0,5.63,12300,22300,0,82.9,352,1270,12.9,38200,0,7400,0,30.2,871,144000,0,430000,5.8,304000,69.6,27300,17200,9350,2220,0,0,0,2013,7,11,INSINGER,SUL,0,0,0,802,PW,2010,8,17,113-20019,OGO-65420,41.547714,-76.484389,Yes,Horizontal Well,GAS,Bbl,Yes,Yes,100,2236043,365,0,0,2010.666667,2.916666667,4.211711712,4.911157609,0.750508395,4.089905111,4.348304863,1.918554531,2.546542663,3.103803721,4.582063363,3.86923172,0,1.480006943,2.940018155,5.158362492,0,5.633468456,0.763427994,5.482873584,1.84260924,4.436162647,4.235528447,3.970811611,3.346352974,0.624458636,0,0,0,0,0,0,0,0,0,0,4342,SULLIVAN,JOANCLARK SUL PAD,804,Flowback,364765,gal,liquid,41556,10/9/13,45100,0,0,2290,16400,0,278,191,1040,15.2,35200,0,3730,0,0,607,115000,0,380000,4.3,266000,304,24500,3970,12200,1610,0,0,0,2013,10,9,JOANCLARK,SUL,PAD,0,0,802,Flowback,2010,12,8,113-20035,OGO-65420,41.537825,-76.766272,Yes,Horizontal Well,GAS,Bbl,2012,PW,0,394814,87,0,0,2011,2.833333333,7.577639752,4.654176542,0,3.359835482,4.214843848,2.444044796,2.281033367,3.017033339,4.546542663,3.571708832,0,0,2.783188691,5.06069784,0,5.579783597,0.633468456,5.424881637,2.482873584,4.389166084,3.598790507,4.086359831,3.206825876,0.879533955,0,0,0,0,0,0,0,0,0,0,5343,SULLIVAN,JOANCLARK SUL PAD,802,PW,363692,gal,liquid,41613,12/5/13,104000,0,6.93,5520,18100,0,138,364,2190,43.8,64000,0,8410,0,0,1260,193000,0,592000,4.9,310000,268,10400,7740,11600,3460,0,0,0,2013,12,5,JOANCLARK,SUL,PAD,0,0,802,PW,2010,12,8,113-20035,OGO-65420,41.537825,-76.766272,Yes,Horizontal Well,GAS,Bbl,2012,Yes,0,394814,87,0,0,2011,3,3.352601156,5.017033339,0.840733235,3.741939078,4.257678575,2.139879086,2.561101384,3.340444115,4.806179974,3.924795996,0,0,3.100370545,5.285557309,0,5.772321707,0.69019608,5.491361694,2.428134794,4.017033339,3.888740961,4.064457989,3.539076099,0.52538189,0,0,0,0,0,0,0,0,0,0,4344,SULLIVAN,LAMBERT FARMS SUL PAD,804,Flowback,138726,gal,liquid,41402,5/8/13,61600,0,6.74,5090,17300,0,106,251,1120,9.05,41100,0,4130,2.05,61.5,765,112000,0,296000,6.1,256000,78.4,42300,12400,12700,1490,0,0,0,2013,5,8,LAMBERT,FARMS,SUL,PAD,0,802,Flowback,2010,9,20,113-20016,OGO-65420,41.525617,-76.538706,Yes,Horizontal Well,GAS,Bbl,2012,PW,0,1493952,246,0,0,2010.75,2.666666667,8.523489933,4.789580712,0.828659897,3.706717782,4.238046103,2.025305865,2.399673721,3.049218023,4.613841822,3.615950052,0.311753861,1.788875116,2.883661435,5.049218023,0,5.471291711,0.785329835,5.408239965,1.894316063,4.626340367,4.093421685,4.103803721,3.173186268,0.930617453,0,0,0,0,0,0,0,0,0,0,5345,SULLIVAN,LAMBERT FARMS SUL PAD,802,PW,269389,gal,liquid,41508,8/22/13,81800,0,5.86,7330,29700,0,130,355,1850,19.3,42200,0,7390,0,11.5,1060,287000,0,497000,5.2,351000,153,40800,18500,10000,2690,0,0,0,2013,8,22,LAMBERT,FARMS,SUL,PAD,0,802,PW,2010,9,20,113-20016,OGO-65420,41.525617,-76.538706,Yes,Horizontal Well,GAS,Bbl,2012,Yes,0,1493952,246,0,0,2010.75,2.916666667,3.717472119,4.912753304,0.767897616,3.865103975,4.472756449,2.113943352,2.550228353,3.267171728,4.625312451,3.868644438,0,1.06069784,3.025305865,5.457881897,0,5.696356389,0.716003344,5.545307116,2.184691431,4.610660163,4.267171728,4,3.42975228,0.57024772,0,0,0,0,0,0,0,0,0,0,4346,SULLIVAN,LW SUL PAD,804,Flowback,312503,gal,liquid,41382,4/18/13,57000,0,6.31,7430,15000,0,101,261,892,5.27,37500,0,3920,0.439,70.5,0,98600,0,258000,6.4,213000,264,15100,3910,14000,1520,0,0,0,2013,4,18,LW,SUL,PAD,0,0,802,Flowback,2012,3,26,113-20137,OGO-65420,41.558903,-76.449947,Yes,Horizontal Well,GAS,Bbl,2012,PW,0,1754425,262,0,0,2012.25,1.083333333,9.210526316,4.755874856,0.800029359,3.870988814,4.176091259,2.004321374,2.416640507,2.950364854,4.574031268,3.593286067,-0.35753548,1.848189117,0,4.993876915,0,5.411619706,0.806179974,5.328379603,2.421603927,4.178976947,3.592176757,4.146128036,3.181843588,0.964284448,0,0,0,0,0,0,0,0,0,0,5347,SULLIVAN,LW SUL PAD,802,PW,118325,gal,liquid,41470,7/15/13,70600,0,6.42,7570,19600,0,116,321,1220,11.1,35500,0,6340,0.289,82.1,776,131000,0,364000,6,298000,70.8,23700,7190,12800,2110,0,0,0,2013,7,15,LW,SUL,PAD,0,0,802,PW,2012,3,26,113-20137,OGO-65420,41.558903,-76.449947,Yes,Horizontal Well,GAS,Bbl,2012,Yes,0,1754425,262,0,0,2012.25,1.333333333,6.066350711,4.848804701,0.807535028,3.87909588,4.292256071,2.064457989,2.506505032,3.086359831,4.550228353,3.802089258,-0.539102157,1.914343157,2.889861721,5.117271296,0,5.561101384,0.77815125,5.474216264,1.850033258,4.374748346,3.85672889,4.10720997,3.324282455,0.782927514,0,0,0,0,0,0,0,0,0,0,4348,SULLIVAN,MATT SUL PAD,804,Flowback,13224,gal,liquid,41353,3/20/13,91300,0,5.84,11200,25900,0,160,305,1770,17.2,30900,0,6700,3.42,54.9,0,145000,35600,385000,6,340000,72,29600,5120,15500,2060,0,0,0,2013,3,20,MATT,SUL,PAD,0,0,802,Flowback,2011,1,16,113-20059,OGO-65420,41.535344,-76.591906,Yes,Horizontal Well,GAS,Bbl,2012,PW,0,1917460,300,0,0,2011.083333,2.166666667,7.524271845,4.960470778,0.766412847,4.049218023,4.413299764,2.204119983,2.484299839,3.247973266,4.489958479,3.826074803,0.534026106,1.739572344,0,5.161368002,4.551449998,5.58546073,0.77815125,5.531478917,1.857332496,4.471291711,3.709269961,4.190331698,3.31386722,0.876464478,0,0,0,0,0,0,0,0,0,0,5349,SULLIVAN,MATT SUL PAD,802,PW,39312,gal,liquid,41551,10/4/13,86500,0,0,14400,31600,0,177,339,1850,27.3,60300,0,7960,0,0,996,183000,0,494000,4.9,322000,103,9410,5710,8070,2380,0,0,0,2013,10,4,MATT,SUL,PAD,0,0,802,PW,2011,1,16,113-20059,OGO-65420,41.535344,-76.591906,Yes,Horizontal Well,GAS,Bbl,2012,Yes,0,1917460,300,0,0,2011.083333,2.75,3.390756303,4.937016107,0,4.158362492,4.499687083,2.247973266,2.530199698,3.267171728,4.780317312,3.900913068,0,0,2.998259338,5.26245109,0,5.693726949,0.69019608,5.507855872,2.012837225,3.973589623,3.756636108,3.906873535,3.376576957,0.530296578,0,0,0,0,0,0,0,0,0,0,4350,SULLIVAN,MPC SUL PAD,804,Flowback,276024,gal,liquid,41612,12/4/13,41300,0,7.59,6090,15000,0,88.8,260,955,14.2,25800,0,3990,0,48.8,509,101000,0,307000,6,159000,178,53400,23400,11000,1540,0,0,0,2013,12,4,MPC,SUL,PAD,0,0,802,Flowback,2011,9,14,113-20109,OGO-65420,41.530944,-76.428967,Yes,Horizontal Well,GAS,Bbl,2012,PW,0,400708,34,0,0,2011.75,2.25,7.142857143,4.615950052,0.880241776,3.784617293,4.176091259,1.948412966,2.414973348,2.980003372,4.411619706,3.600972896,0,1.688419822,2.706717782,5.004321374,0,5.487138375,0.77815125,5.201397124,2.250420002,4.727541257,4.369215857,4.041392685,3.187520721,0.853871964,0,0,0,0,0,0,0,0,0,0,5351,SULLIVAN,MPC SUL PAD,802,PW,0,0,liquid,41638,12/30/13,40500,0,6.99,6150,14700,0,91.8,262,926,13.6,29300,0,4210,0,87.3,611,108000,0,387000,6.1,188000,166,15000,4120,13900,1690,0,0,0,2013,12,30,MPC,SUL,PAD,0,0,802,PW,2011,9,14,113-20109,OGO-65420,41.530944,-76.428967,Yes,Horizontal Well,GAS,Bbl,2012,Yes,0,400708,34,0,0,2011.75,2.25,8.224852071,4.607455023,0.844477176,3.788875116,4.167317335,1.962842681,2.418301291,2.966610987,4.46686762,3.624282096,0,1.941014244,2.78604121,5.033423755,0,5.587710965,0.785329835,5.274157849,2.220108088,4.176091259,3.614897216,4.1430148,3.227886705,0.915128096,0,0,0,0,0,0,0,0,0,0,4352,SULLIVAN,NORTON SUL PAD,804,Flowback,32760,gal,liquid,41358,3/25/13,77000,0,5.81,8840,24600,0,157,357,1560,11.4,40200,0,6310,1.96,60.3,838,174000,43600,361000,6,281000,52,25800,3660,14800,2250,0,0,0,2013,3,25,NORTON,SUL,PAD,0,0,802,Flowback,2011,2,27,113-20094,OGO-65420,41.544744,-76.576542,Yes,Horizontal Well,GAS,Bbl,2012,PW,0,2147740,300,0,0,2011.166667,2.083333333,6.577777778,4.886490725,0.764176132,3.946452265,4.390935107,2.195899652,2.552668216,3.193124598,4.604226053,3.800029359,0.292256071,1.780317312,2.923244019,5.240549248,4.639486489,5.557507202,0.77815125,5.44870632,1.716003344,4.411619706,3.563481085,4.170261715,3.352182518,0.818079197,0,0,0,0,0,0,0,0,0,0,5353,SULLIVAN,NORTON SUL PAD,802,PW,69500,gal,liquid,41508,8/22/13,80800,0,5.01,8470,29400,0,210,347,1770,20.5,36200,0,7360,0,20.6,1040,220000,0,490000,5.1,308000,220,32000,17000,13500,2480,0,0,0,2013,8,22,NORTON,SUL,PAD,0,0,802,PW,2011,2,27,113-20094,OGO-65420,41.544744,-76.576542,Yes,Horizontal Well,GAS,Bbl,2012,Yes,0,2147740,300,0,0,2011.166667,2.5,5.443548387,4.907411361,0.699837726,3.92788341,4.46834733,2.322219295,2.540329475,3.247973266,4.558708571,3.866877814,0,1.31386722,3.017033339,5.342422681,0,5.69019608,0.707570176,5.488550717,2.342422681,4.505149978,4.230448921,4.130333768,3.394451681,0.735882088,0,0,0,0,0,0,0,0,0,0,4354,SULLIVAN,PHILLIPS SUL PAD,804,Flowback,90989,gal,liquid,41358,3/25/13,99500,0,5.28,4910,34200,0,131,276,2110,22.3,36200,0.442,6000,0.977,25.7,1300,265000,31500,458000,5.7,365000,52,16100,6150,4750,2860,0,0,0,2013,3,25,PHILLIPS,SUL,PAD,0,0,802,Flowback,2011,1,13,113-20075,OGO-65420,41.535881,-76.612011,Yes,Horizontal Well,GAS,Bbl,2012,PW,0,1316171,300,0,0,2011.083333,3.416666667,1.660839161,4.997823081,0.722633923,3.691081492,4.534026106,2.117271296,2.440909082,3.324282455,4.558708571,3.77815125,-0.010105436,1.409933123,3.113943352,5.423245874,4.498310554,5.660865478,0.755874856,5.562292864,1.716003344,4.206825876,3.788875116,3.67669361,3.456366033,0.220327576,0,0,0,0,0,0,0,0,0,0,5355,SULLIVAN,PHILLIPS SUL PAD,802,PW,431626,gal,liquid,41551,10/4/13,107000,0,5.53,8630,38900,0,216,400,2360,38.5,76500,0,9090,0,0,1170,178000,0,580000,4.9,418000,472,22700,10000,5500,3130,0,0,0,2013,10,4,PHILLIPS,SUL,PAD,0,0,802,PW,2011,1,13,113-20075,OGO-65420,41.535881,-76.612011,Yes,Horizontal Well,GAS,Bbl,2012,PW,0,1316171,300,0,0,2011.083333,4,1.757188498,5.029383778,0.742725131,3.936010796,4.589949601,2.334453751,2.602059991,3.372912003,4.883661435,3.958563883,0,0,3.068185862,5.250420002,0,5.763427994,0.69019608,5.621176282,2.673941999,4.356025857,4,3.740362689,3.495544338,0.244818352,0,0,0,0,0,0,0,0,0,0,4356,SULLIVAN,ROUNDTOP SUL PAD,802,PW,187008,gal,liquid,41424,5/30/13,22400,0,9.23,8790,5110,0,73.2,253,366,3.03,27600,0,2540,0,95.7,466,64500,0,189000,6.6,165000,128,8470,3840,3750,954,0,0,0,2013,5,30,ROUNDTOP,SUL,PAD,0,0,802,PW,2011,1,18,113-20033,OGO-65420,41.533247,-76.230119,Yes,Horizontal Well,GAS,Bbl,2012,Yes,0,1302135,364,0,0,2011.083333,2.333333333,3.93081761,4.350248018,0.965201701,3.943988875,3.7084209,1.864511081,2.403120521,2.563481085,4.440909082,3.404833717,0,1.980911938,2.668385917,4.809559715,0,5.276461804,0.819543936,5.217483944,2.10720997,3.92788341,3.584331224,3.574031268,2.979548375,0.594482893,0,0,0,0,0,0,0,0,0,0,4357,SULLIVAN,VERA SUL PAD,804,Flowback,147967,gal,liquid,41561,10/14/13,64800,0,5.77,13000,23800,0,145,240,1290,17.5,37300,0,7040,0,5.2,1110,135000,0,454000,5.1,304000,222,24800,3880,29300,2240,0,0,0,2013,10,14,VERA,SUL,PAD,0,0,802,Flowback,2010,9,14,113-20029,OGO-65420,41.53245,-76.71155,Yes,Horizontal Well,GAS,Bbl,2012,PW,0,151384,67,0,0,2010.75,3.083333333,13.08035714,4.811575006,0.761175813,4.113943352,4.376576957,2.161368002,2.380211242,3.11058971,4.571708832,3.847572659,0,0.716003344,3.045322979,5.130333768,0,5.657055853,0.707570176,5.482873584,2.346352974,4.394451681,3.588831726,4.46686762,3.350248018,1.116619602,0,0,0,0,0,0,0,0,0,0,5358,SULLIVAN,VERA SUL PAD,802,PW,231241,gal,liquid,41613,12/5/13,101000,0,6.72,9500,37500,0,144,366,1900,35.4,32700,0,9270,0,0,1200,207000,0,606000,4.9,331000,390,14700,4040,10000,2220,0,0,0,2013,12,5,VERA,SUL,PAD,0,0,802,PW,2010,9,14,113-20029,OGO-65420,41.53245,-76.71155,Yes,Horizontal Well,GAS,Bbl,2012,Yes,0,151384,67,0,0,2010.75,3.25,4.504504505,5.004321374,0.827369273,3.977723605,4.574031268,2.158362492,2.563481085,3.278753601,4.514547753,3.967079734,0,0,3.079181246,5.315970345,0,5.782472624,0.69019608,5.519827994,2.591064607,4.167317335,3.606381365,4,3.346352974,0.653647026,0,0,0,0,0,0,0,0,0,0,4359,SULLIVAN,WARBURTON SUL PAD,804,Flowback,88974,gal,liquid,41346,3/13/13,52400,0,5.44,12200,13300,0,105,254,947,5.61,32500,0,4500,0,103,0,104000,24700,255000,6.4,207000,80.8,25000,10900,7170,1280,0,0,0,2013,3,13,WARBURTON,SUL,PAD,0,0,802,Flowback,2012,7,9,113-20150,OGO-65420,41.547769,-76.514611,Yes,Horizontal Well,GAS,Bbl,2012,PW,0,497086,317,0,0,2012.583333,0.666666667,5.6015625,4.719331287,0.7355989,4.086359831,4.123851641,2.021189299,2.404833717,2.976349979,4.511883361,3.653212514,0,2.012837225,0,5.017033339,4.392696953,5.40654018,0.806179974,5.315970345,1.907411361,4.397940009,4.037426498,3.855519156,3.10720997,0.748309186,0,0,0,0,0,0,0,0,0,0,5360,SULLIVAN,WARBURTON SUL PAD,802,PW,190073,gal,liquid,41466,7/11/13,63000,0,4.55,14300,16000,0.516,484,292,1130,9.09,35800,0,4400,0.978,113,716,118000,0,348000,6.1,230000,1470,35000,11800,12200,1500,0,0,0,2013,7,11,WARBURTON,SUL,PAD,0,0,802,PW,2012,7,9,113-20150,OGO-65420,41.547769,-76.514611,Yes,Horizontal Well,GAS,Bbl,2012,Yes,0,497086,317,0,0,2012.583333,1,8.133333333,4.799340549,0.658011397,4.155336037,4.204119983,2.684845362,2.465382851,3.053078443,4.553883027,3.643452676,-0.009661145,2.053078443,2.854913022,5.071882007,0,5.541579244,0.785329835,5.361727836,3.167317335,4.544068044,4.071882007,4.086359831,3.176091259,0.910268572,0,0,0,0,0,0,0,0,0,0,4361,SULLIVAN,YENGO SUL PAD,802,PW,466170,gal,liquid,41409,5/15/13,16400,0,1.75,4830,2840,0,101,100,194,6.21,14400,0,1340,0,46.1,0,34700,0,87800,6.3,55900,40,6350,2580,3150,402,0,0,0,2013,5,15,YENGO,SUL,PAD,0,0,802,PW,2010,3,18,113-20004,OGO-65420,41.526458,-76.349467,Yes,Horizontal Well,GAS,Bbl,2012,Yes,0,1545626,323,0,0,2010.25,3.166666667,7.835820896,4.214843848,0.243038049,3.683947131,3.45331834,2.004321374,2,2.28780173,4.158362492,3.127104798,0,1.663700925,0,4.540329475,0,4.943494516,0.799340549,4.747411808,1.602059991,3.802773725,3.411619706,3.498310554,2.604226053,0.894084501,0,0,0,0,0,0,0,0,0,0,4362,SUSQUEHANNA,HOOKER SUS PAD,804,Flowback,780523,gal,liquid,42016,1/12/15,4610,0,0,3140,1620,0,39.7,124,134,1.1,12300,0,723,0,181,154,29400,0,101000,6.7,44800,182,8030,2940,1490,214,0,0,0,2015,1,12,HOOKER,SUS,PAD,0,0,802,Flowback,2013,10,23,115-21301,OGO-65420,41.674667,-76.002461,Yes,Horizontal Well,GAS,Bbl,2014,PW,0,1768408,159,0,0,2013.833333,1.25,6.962616822,3.663700925,0,3.496929648,3.209515015,1.598790507,2.093421685,2.127104798,4.089905111,2.859138297,0,2.257678575,2.187520721,4.46834733,0,5.004321374,0.826074803,4.651278014,2.260071388,3.904715545,3.46834733,3.173186268,2.330413773,0.842772495,0,0,0,0,0,0,0,0,0,0,5363,SUSQUEHANNA,HOOKER SUS PAD,802,PW,236977,gal,liquid,42046,2/11/15,2010,0,0,1350,715,0,26.6,46.5,54.5,0.978,5080,0,306,0,152,0,22400,57400,61800,6.8,34000,74,3910,1540,1670,101,0,0,0,2015,2,11,HOOKER,SUS,PAD,0,0,802,PW,2013,10,23,115-21301,OGO-65420,41.674667,-76.002461,Yes,Horizontal Well,GAS,Bbl,2014,Yes,0,1768408,159,0,0,2013.833333,1.333333333,16.53465347,3.303196057,0,3.130333768,2.854306042,1.424881637,1.667452953,1.736396502,3.705863712,2.485721426,0,2.181843588,0,4.350248018,4.758911892,4.790988475,0.832508913,4.531478917,1.86923172,3.592176757,3.187520721,3.222716471,2.004321374,1.218395097,0,0,0,0,0,0,0,0,0,0,4364,SUSQUEHANNA,KIPAR SUS PAD,804,Flowback,346655,gal,liquid,42101,4/7/15,8160,0,0,1420,2920,0,73.3,38.9,209,3.63,6900,0,699,0,74.7,0,19100,0,62600,6.6,30000,184,2480,740,1610,173,0,0,0,2015,4,7,KIPAR,SUS,PAD,0,0,802,Flowback,2010,9,14,115-20424,OGO-65420,41.708772,-76.014872,Yes,Horizontal Well,GAS,Bbl,2012,PW,0,927016,287,0,0,2010.75,4.583333333,9.306358382,3.911690159,0,3.152288344,3.465382851,1.865103975,1.589949601,2.320146286,3.838849091,2.844477176,0,1.873320602,0,4.281033367,0,4.796574333,0.819543936,4.477121255,2.264817823,3.394451681,2.86923172,3.206825876,2.238046103,0.968779773,0,0,0,0,0,0,0,0,0,0,5365,SUSQUEHANNA,LASHER SUS PAD,804,Flowback,707162,gal,liquid,42158,6/3/15,8260,0,0,3100,2910,0,153,132,240,2.59,17200,0,1070,0,193,258,35500,18400,128000,6.9,70000,66.3,6250,1930,2040,277,0,0,0,2015,6,3,LASHER,SUS,PAD,0,0,802,Flowback,2014,10,7,131-20467,OGO-65420,41.641644,-76.015564,Yes,Horizontal Well,GAS,Bbl,2017,PW,0,0,0,0,0,2014.833333,0.666666667,7.364620939,3.916980047,0,3.491361694,3.463892989,2.184691431,2.120573931,2.380211242,4.235528447,3.029383778,0,2.285557309,2.411619706,4.550228353,4.264817823,5.10720997,0.838849091,4.84509804,1.821513528,3.795880017,3.285557309,3.309630167,2.442479769,0.867150398,0,0,0,0,0,0,0,0,0,0,5366,SUSQUEHANNA,LASHER SUS PAD,802,PW,383322,gal,liquid,42192,7/7/15,4390,0,0,2750,1540,0,163,129,131,3.56,13700,0,695,0,230,230,31800,0,96200,6.7,64200,30.5,2930,891,1550,217,0,0,0,2015,7,7,LASHER,SUS,PAD,0,0,802,PW,2014,10,7,131-20467,OGO-65420,41.641644,-76.015564,Yes,Horizontal Well,GAS,Bbl,2017,Yes,249.91,0,0,0,0,2014.833333,0.75,7.142857143,3.64246452,0,3.439332694,3.187520721,2.212187604,2.11058971,2.117271296,4.136720567,2.841984805,0,2.361727836,2.361727836,4.50242712,0,4.983175072,0.826074803,4.807535028,1.484299839,3.46686762,2.949877704,3.190331698,2.336459734,0.853871964,0,0,0,0,0,0,0,0,0,0,4367,SUSQUEHANNA,ODOWD SUS PAD,804,Flowback,3523427,gal,liquid,42032,1/28/15,3770,0,0,2110,1340,0,20.4,86.5,104,0.536,9600,0,532,0,191,163,26600,0,82800,6.8,47200,102,3830,1120,1570,175,0,0,0,2015,1,28,ODOWD,SUS,PAD,0,0,802,Flowback,2013,11,7,115-21489,OGO-65420,41.672733,-75.988611,Yes,Horizontal Well,GAS,Bbl,2014,PW,0,5937960,333,0,0,2013.916667,1.166666667,8.971428571,3.57634135,0,3.324282455,3.127104798,1.309630167,1.937016107,2.017033339,3.982271233,2.725911632,0,2.281033367,2.212187604,4.424881637,0,4.918030337,0.832508913,4.673941999,2.008600172,3.583198774,3.049218023,3.195899652,2.243038049,0.952861604,0,0,0,0,0,0,0,0,0,0,5368,SUSQUEHANNA,ODOWD SUS PAD,802,PW,449981,gal,liquid,42074,3/11/15,5240,0,0,2680,1830,0,112,142,160,1.93,12800,0,789,0,247,254,30800,0,108000,7,80800,132,7440,2740,2520,311,0,0,0,2015,3,11,ODOWD,SUS,PAD,0,0,802,PW,2013,11,7,115-21489,OGO-65420,41.672733,-75.988611,Yes,Horizontal Well,GAS,Bbl,2014,Yes,0,5937960,333,0,0,2013.916667,1.333333333,8.102893891,3.719331287,0,3.428134794,3.26245109,2.049218023,2.152288344,2.204119983,4.10720997,2.897077003,0,2.392696953,2.404833717,4.488550717,0,5.033423755,0.84509804,4.907411361,2.120573931,3.871572936,3.437750563,3.401400541,2.492760389,0.908640152,0,0,0,0,0,0,0,0,0,0,4369,SUSQUEHANNA,ROSIEMAR SUS PAD,804,Flowback,355550,gal,liquid,42074,3/11/15,20300,0,0,3130,7350,0,158,132,479,6.48,11000,0,2030,0,134,503,68500,19700,218000,6.2,129000,211,6920,4950,4330,497,0,0,0,2015,3,11,ROSIEMAR,SUS,PAD,0,0,802,Flowback,2013,11,20,115-21402,OGO-65420,41.691231,-76.019814,Yes,Horizontal Well,GAS,Bbl,Yes,PW,0,2920196,292,0,0,2013.916667,1.333333333,8.712273642,4.307496038,0,3.495544338,3.866287339,2.198657087,2.120573931,2.680335513,4.041392685,3.307496038,0,2.127104798,2.701567985,4.835690571,4.294466226,5.338456494,0.792391689,5.11058971,2.324282455,3.840106094,3.694605199,3.636487896,2.696356389,0.940131508,0,0,0,0,0,0,0,0,0,0,5370,SUSQUEHANNA,ROSIEMAR SUS PAD,802,PW,250175,gal,liquid,42094,3/31/15,9450,0,0,3760,3370,0,178,138,254,5.75,18200,0,1170,0,230,304,36000,0,123000,6.5,78800,83.3,2480,934,2650,233,0,0,0,2015,3,31,ROSIEMAR,SUS,PAD,0,0,802,PW,2013,11,20,115-21402,OGO-65420,41.691231,-76.019814,Yes,Horizontal Well,GAS,Bbl,Yes,Yes,1462.85,2920196,292,0,0,2013.916667,1.333333333,11.37339056,3.975431809,0,3.575187845,3.527629901,2.250420002,2.139879086,2.404833717,4.260071388,3.068185862,0,2.361727836,2.482873584,4.556302501,0,5.089905111,0.812913357,4.896526217,1.920645001,3.394451681,2.970346876,3.423245874,2.367355921,1.055889953,0,0,0,0,0,0,0,0,0,0,4371,SUSQUEHANNA,RYLEE SUS PAD,804,Flowback,251629,gal,liquid,42111,4/17/15,8230,0,0,1540,3000,0,72.8,36.9,178,2.45,6710,0,789,0,35.7,184,19900,0,67300,6.3,40800,208,1920,365,1450,262,0,0,0,2015,4,17,RYLEE,SUS,PAD,0,0,802,Flowback,2011,7,6,115-20592,OGO-65420,41.708486,-76.024139,Yes,Horizontal Well,GAS,Bbl,2012,PW,0,1111336,284,0,0,2011.583333,3.75,5.534351145,3.915399835,0,3.187520721,3.477121255,1.862131379,1.567026366,2.250420002,3.82672252,2.897077003,0,1.552668216,2.264817823,4.298853076,0,4.828015064,0.799340549,4.610660163,2.318063335,3.283301229,2.562292864,3.161368002,2.418301291,0.743066711,0,0,0,0,0,0,0,0,0,0,5372,SUSQUEHANNA,CANNELLA SUS PAD,804,Flowback,195416,gal,liquid,41927,10/15/14,129000,0,40.3,13800,46000,0,352,1340,3490,17.5,205000,0,15700,0,113,309,51400,0,153000,6.5,94000,104,85700,27700,4000,381,0,0,0,2014,10,15,CANNELLA,SUS,PAD,0,0,802,Flowback,2010,9,4,115-20396,OGO-65420,41.739064,-76.053642,Yes,Horizontal Well,GAS,Bbl,2012,PW,0,222592,237,0,0,2010.75,4.083333333,10.49868766,5.11058971,1.605305046,4.139879086,4.662757832,2.546542663,3.127104798,3.542825427,5.311753861,4.195899652,0,2.053078443,2.489958479,4.710963119,0,5.184691431,0.812913357,4.973127854,2.017033339,4.932980822,4.442479769,3.602059991,2.580924976,1.021135016,0,0,0,0,0,0,0,0,0,0,5373,SUSQUEHANNA,DELHAGEN SUS PAD,804,Flowback,871429,gal,liquid,41736,4/7/14,42400,0,0,14000,15200,0,150,256,1090,8.76,45400,0,4840,0,85.4,601,92700,0,256000,6.2,170000,468,26200,6250,8340,991,0,0,0,2014,4,7,DELHAGEN,SUS,PAD,0,0,802,Flowback,2011,1,10,115-20483,OGO-65420,41.750394,-76.078975,Yes,Horizontal Well,GAS,Bbl,2012,PW,0,1442440,275,0,0,2011.083333,3.25,8.415741675,4.627365857,0,4.146128036,4.181843588,2.176091259,2.408239965,3.037426498,4.657055853,3.684845362,0,1.931457871,2.778874472,4.967079734,0,5.408239965,0.792391689,5.230448921,2.670245853,4.418301291,3.795880017,3.921166051,2.996073654,0.925092396,0,0,0,0,0,0,0,0,0,0,5374,SUSQUEHANNA,DELHAGEN SUS PAD,802,PW,734660,gal,liquid,41774,5/15/14,42100,0,0,18700,15000,0,99.1,306,1140,5.43,40100,0,6330,0,57.1,756,123000,0,352000,5.9,205000,151,26000,10600,9270,1400,0,0,0,2014,5,15,DELHAGEN,SUS,PAD,0,0,802,PW,2011,1,10,115-20483,OGO-65420,41.750394,-76.078975,Yes,Horizontal Well,GAS,Bbl,2012,Yes,0,1442440,275,0,0,2011.083333,3.333333333,6.621428571,4.624282096,0,4.271841607,4.176091259,1.996073654,2.485721426,3.056904851,4.603144373,3.80140371,0,1.756636108,2.878521796,5.089905111,0,5.546542663,0.770852012,5.311753861,2.178976947,4.414973348,4.025305865,3.967079734,3.146128036,0.820951698,0,0,0,0,0,0,0,0,0,0,4375,SUSQUEHANNA,LRJ SUS PAD,804,Flowback,864536,gal,liquid,41694,2/24/14,24600,0,0,12600,8610,0,67,225,741,3.63,35600,0,3590,0,83.8,615,92900,0,323000,6.3,144000,55.2,42800,10400,14000,956,0,0,0,2014,2,24,LRJ,SUS,PAD,0,0,802,Flowback,2011,8,31,115-20627,OGO-65420,41.766067,-76.048403,Yes,Horizontal Well,GAS,Bbl,2012,PW,0,1666077,335,0,0,2011.666667,2.5,14.64435146,4.390935107,0,4.100370545,3.935003151,1.826074803,2.352182518,2.869818208,4.551449998,3.555094449,0,1.923244019,2.788875116,4.968015714,0,5.509202522,0.799340549,5.158362492,1.741939078,4.631443769,4.017033339,4.146128036,2.980457892,1.165670143,0,0,0,0,0,0,0,0,0,0,5376,SUSQUEHANNA,MARIS SUS PAD,804,Flowback,268650,gal,liquid,41641,1/2/14,10700,0,0,3440,3750,0,41.8,132,322,1.6,13100,0,1090,0,150,260,41500,0,109000,6.7,69200,61.7,25800,9700,5330,352,0,0,0,2014,1,2,MARIS,SUS,PAD,0,0,802,Flowback,2012,9,19,115-20925,OGO-65420,41.660789,-75.996922,Yes,Horizontal Well,GAS,Bbl,2012,PW,0,3808319,269,0,0,2012.75,1.333333333,15.14204545,4.029383778,0,3.536558443,3.574031268,1.621176282,2.120573931,2.507855872,4.117271296,3.037426498,0,2.176091259,2.414973348,4.618048097,0,5.037426498,0.826074803,4.840106094,1.790285164,4.411619706,3.986771734,3.726727209,2.546542663,1.180184546,0,0,0,0,0,0,0,0,0,0,5377,SUSQUEHANNA,MARIS SUS PAD,802,PW,257723,gal,liquid,41757,4/28/14,7330,0,0,3520,2540,0,158,119,237,4.09,12800,0,974,2.39,172,223,42100,69300,123000,6.5,67000,65,10100,1390,6810,334,0,0,0,2014,4,28,MARIS,SUS,PAD,0,0,802,PW,2012,9,19,115-20925,OGO-65420,41.660789,-75.996922,Yes,Horizontal Well,GAS,Bbl,2012,Yes,0,3808319,269,0,0,2012.75,1.583333333,20.38922156,3.865103975,0,3.546542663,3.404833717,2.198657087,2.075546961,2.374748346,4.10720997,2.988558957,0.378397901,2.235528447,2.348304863,4.624282096,4.840733235,5.089905111,0.812913357,4.826074803,1.812913357,4.004321374,3.1430148,3.833147112,2.523746467,1.309400645,0,0,0,0,0,0,0,0,0,0,4378,SUSQUEHANNA,BALTZLEY SUS WELL,804,Flowback,604510,gal,liquid,41491,8/5/13,28000,0,3.53,10000,9360,0,52.1,194,785,2.67,30900,0,3790,0.564,102,572,75200,0,232000,6.3,168000,337,38600,16500,9610,871,0,0,0,2013,8,5,BALTZLEY,SUS,WELL,0,0,802,Flowback,2011,4,8,115-20495,OGO-65420,41.769739,-76.041139,Yes,Horizontal Well,GAS,Bbl,2012,PW,0,547452,124,0,0,2011.333333,2.333333333,11.03329506,4.447158031,0.547774705,4,3.971275849,1.716837723,2.28780173,2.894869657,4.489958479,3.57863921,-0.248720896,2.008600172,2.757396029,4.876217841,0,5.365487985,0.799340549,5.225309282,2.527629901,4.586587305,4.217483944,3.982723388,2.940018155,1.042705233,0,0,0,0,0,0,0,0,0,0,5379,SUSQUEHANNA,BOREK SUS PAD,804,Flowback,64465,gal,liquid,41477,7/22/13,16600,0,4.52,4070,3690,0,51.3,142,296,2.5,19200,0,1310,0,152,0,38800,0,130000,6.8,84000,48.8,10500,4290,3120,371,0,0,0,2013,7,22,BOREK,SUS,PAD,0,0,802,Flowback,2013,4,1,115-21026,OGO-65420,41.669072,-76.110392,Yes,Horizontal Well,GAS,Bbl,Yes,PW,0,2026219,169,0,0,2013.333333,0.25,8.409703504,4.220108088,0.655138435,3.609594409,3.567026366,1.710117365,2.152288344,2.471291711,4.283301229,3.117271296,0,2.181843588,0,4.588831726,0,5.113943352,0.832508913,4.924279286,1.688419822,4.021189299,3.632457292,3.494154594,2.56937391,0.924780684,0,0,0,0,0,0,0,0,0,0,5380,SUSQUEHANNA,BOREK SUS PAD,804,Flowback,585203,gal,liquid,41558,10/11/13,7480,0,0,3620,2640,0,98.2,117,217,3.29,15500,0,998,0,122,264,32000,109000,108000,6.2,65800,83,5330,810,1640,285,0,0,0,2013,10,11,BOREK,SUS,PAD,0,0,802,Flowback,2013,4,1,115-21026,OGO-65420,41.669072,-76.110392,Yes,Horizontal Well,GAS,Bbl,Yes,PW,0,2026219,169,0,0,2013.333333,0.5,5.754385965,3.873901598,0,3.558708571,3.421603927,1.992111488,2.068185862,2.336459734,4.190331698,2.999130541,0,2.086359831,2.421603927,4.505149978,5.037426498,5.033423755,0.792391689,4.818225894,1.919078092,3.726727209,2.908485019,3.214843848,2.45484486,0.759998988,0,0,0,0,0,0,0,0,0,0,5381,SUSQUEHANNA,COOK SUS PAD,804,Flowback,252813,gal,liquid,41422,5/28/13,30600,0,3.42,8850,7070,0,38.7,182,543,2.56,28300,0.121,2530,0.284,113,473,70000,0,185000,6.5,153000,66,6890,2850,5380,547,0,0,0,2013,5,28,COOK,SUS,PAD,0,0,802,Flowback,2012,4,5,115-20784,OGO-65420,41.76605,-76.075014,Yes,Horizontal Well,GAS,Bbl,2012,PW,0,1063265,225,0,0,2012.333333,1.083333333,9.835466179,4.485721426,0.534026106,3.946943271,3.849419414,1.587710965,2.260071388,2.73479983,4.451786436,3.403120521,-0.54668166,2.053078443,2.674861141,4.84509804,0,5.267171728,0.812913357,5.184691431,1.819543936,3.838219222,3.45484486,3.730782276,2.737987326,0.992794949,0,0,0,0,0,0,0,0,0,0,5382,SUSQUEHANNA,COOK SUS PAD,804,Flowback,243850,gal,liquid,41491,8/5/13,44400,0,2.98,14400,9060,0,87,225,801,3.66,26300,0,3340,0,116,684,91300,0,266000,6.3,194000,150,43300,14400,8480,1050,0,0,0,2013,8,5,COOK,SUS,PAD,0,0,802,Flowback,2012,4,5,115-20784,OGO-65420,41.76605,-76.075014,Yes,Horizontal Well,GAS,Bbl,2012,PW,0,1063265,225,0,0,2012.333333,1.333333333,8.076190476,4.64738297,0.474216264,4.158362492,3.957128198,1.939519253,2.352182518,2.903632516,4.419955748,3.523746467,0,2.064457989,2.835056102,4.960470778,0,5.424881637,0.799340549,5.28780173,2.176091259,4.636487896,4.158362492,3.928395852,3.021189299,0.907206553,0,0,0,0,0,0,0,0,0,0,5383,SUSQUEHANNA,GARY SUS PAD,804,Flowback,1147051,gal,liquid,41446,6/21/13,41400,0,3.95,8420,10600,0,52.1,197,887,3.26,33100,0,3500,0,68.6,619,82200,0,258000,6.1,183000,18.9,13100,3790,10800,763,0,0,0,2013,6,21,GARY,SUS,PAD,0,0,802,Flowback,2011,8,4,115-20610,OGO-65420,41.814544,-76.028553,Yes,Horizontal Well,GAS,Bbl,2012,PW,0,711131,199,0,0,2011.666667,1.833333333,14.15465269,4.617000341,0.596597096,3.925312091,4.025305865,1.716837723,2.294466226,2.94792362,4.519827994,3.544068044,0,1.836324116,2.791690649,4.914871818,0,5.411619706,0.785329835,5.26245109,1.276461804,4.117271296,3.57863921,4.033423755,2.882524538,1.150899218,0,0,0,0,0,0,0,0,0,0,5384,SUSQUEHANNA,GARY SUS PAD,804,Flowback,1960260,gal,liquid,41521,9/4/13,53300,0,0,13800,18900,0,74.7,258,1490,5.8,38400,0,6610,0,35.9,868,124000,0,374000,5.8,315000,52,27500,9180,14800,1480,0,0,0,2013,9,4,GARY,SUS,PAD,0,0,802,Flowback,2011,8,4,115-20610,OGO-65420,41.814544,-76.028553,Yes,Horizontal Well,GAS,Bbl,2012,PW,0,711131,199,0,0,2011.666667,2.083333333,10,4.726727209,0,4.139879086,4.276461804,1.873320602,2.411619706,3.173186268,4.584331224,3.820201459,0,1.555094449,2.938519725,5.093421685,0,5.572871602,0.763427994,5.498310554,1.716003344,4.439332694,3.962842681,4.170261715,3.170261715,1,0,0,0,0,0,0,0,0,0,0,5385,SUSQUEHANNA,GB SUS PAD,804,Flowback,377766,gal,liquid,41437,6/12/13,28600,0,3.98,6790,6770,0,47.5,156,581,2.2,25500,0,2180,0.119,103,398,58600,0,191000,6.5,112000,166,7650,1530,5140,410,0,0,0,2013,6,12,GB,SUS,PAD,0,0,802,Flowback,2011,9,26,115-20647,OGO-65420,41.784031,-76.09615,Yes,Horizontal Well,GAS,Bbl,2012,PW,0,867314,206,0,0,2011.75,1.75,12.53658537,4.456366033,0.599883072,3.831869774,3.830588669,1.67669361,2.193124598,2.764176132,4.40654018,3.338456494,-0.924453039,2.012837225,2.599883072,4.767897616,0,5.281033367,0.812913357,5.049218023,2.220108088,3.883661435,3.184691431,3.710963119,2.612783857,1.098179262,0,0,0,0,0,0,0,0,0,0,5386,SUSQUEHANNA,GB SUS PAD,804,Flowback,276700,gal,liquid,41481,7/26/13,30700,0,3.81,12000,9680,0,80.9,223,828,3.05,33800,0,3710,0,102,422,84800,0,246000,6.3,178000,198,16400,8180,7000,793,0,0,0,2013,7,26,GB,SUS,PAD,0,0,802,Flowback,2011,9,26,115-20647,OGO-65420,41.784031,-76.09615,Yes,Horizontal Well,GAS,Bbl,2012,PW,0,867314,206,0,0,2011.75,1.833333333,8.827238335,4.487138375,0.580924976,4.079181246,3.985875357,1.907948522,2.348304863,2.918030337,4.5289167,3.56937391,0,2.008600172,2.625312451,4.928395852,0,5.390935107,0.799340549,5.250420002,2.29666519,4.214843848,3.912753304,3.84509804,2.899273187,0.945824853,0,0,0,0,0,0,0,0,0,0,5387,SUSQUEHANNA,GREGERSON SUS PAD,804,Flowback,61208,gal,liquid,41431,6/6/13,33000,0,3.94,13500,6840,0,192,244,629,5.9,37700,0,3190,0.428,73.5,596,119000,0,229000,6,152000,230,6870,1800,7270,641,0,0,0,2013,6,6,GREGERSON,SUS,PAD,0,0,802,Flowback,2012,2,23,115-20815,OGO-65420,41.721597,-76.113117,Yes,Horizontal Well,GAS,Bbl,2012,PW,0,1004847,212,0,0,2012.166667,1.333333333,11.34165367,4.51851394,0.595496222,4.130333768,3.835056102,2.283301229,2.387389826,2.798650645,4.57634135,3.503790683,-0.368556231,1.866287339,2.77524626,5.075546961,0,5.359835482,0.77815125,5.181843588,2.361727836,3.836956737,3.255272505,3.861534411,2.80685803,1.054676381,0,0,0,0,0,0,0,0,0,0,5388,SUSQUEHANNA,GREGERSON SUS PAD,804,Flowback,89535,gal,liquid,41481,7/26/13,22800,0,3.46,18000,7690,0,68.9,273,688,2.49,37100,0,3610,0.556,67.7,422,73700,0,279000,6.3,194000,114,29800,11900,6900,858,0,0,0,2013,7,26,GREGERSON,SUS,PAD,0,0,802,Flowback,2012,2,23,115-20815,OGO-65420,41.721597,-76.113117,Yes,Horizontal Well,GAS,Bbl,2012,PW,0,1004847,212,0,0,2012.166667,1.416666667,8.041958042,4.357934847,0.539076099,4.255272505,3.88592634,1.838219222,2.436162647,2.837588438,4.56937391,3.557507202,-0.254925208,1.830588669,2.625312451,4.867467488,0,5.445604203,0.799340549,5.28780173,2.056904851,4.474216264,4.075546961,3.838849091,2.933487288,0.905361803,0,0,0,0,0,0,0,0,0,0,5389,SUSQUEHANNA,JUSER SUS PAD,804,Flowback,1616076,gal,liquid,41396,5/2/13,125000,0,2.72,19400,12900,0,146,300,978,5.92,43400,0,4940,0,80.5,828,114000,0,307000,5.9,249000,173,12900,3230,14200,1330,0,0,0,2013,5,2,JUSER,SUS,PAD,0,0,802,Flowback,2011,4,9,115-20507,OGO-65420,41.765692,-76.060811,Yes,Horizontal Well,GAS,Bbl,2012,PW,0,613649,236,0,0,2011.333333,2.083333333,10.67669173,5.096910013,0.434568904,4.28780173,4.11058971,2.164352856,2.477121255,2.990338855,4.63748973,3.693726949,0,1.90579588,2.918030337,5.056904851,0,5.487138375,0.770852012,5.396199347,2.238046103,4.11058971,3.509202522,4.152288344,3.123851641,1.028436703,0,0,0,0,0,0,0,0,0,0,5390,SUSQUEHANNA,NICKOLYN SUS PAD,804,Flowback,118712,gal,liquid,41453,6/28/13,10100,0,4.74,3360,2260,0.148,27.8,116,185,1.92,15500,0,906,0.104,164,0,33900,0,102000,6.8,60400,4,3010,653,2920,242,0,0,0,2013,6,28,NICKOLYN,SUS,PAD,0,0,802,Flowback,2010,6,5,115-20296,OGO-65420,41.666794,-76.094814,Yes,Horizontal Well,GAS,Bbl,2012,PW,0,2642867,286,0,0,2010.5,3,12.0661157,4.004321374,0.675778342,3.526339277,3.354108439,1.444044796,2.064457989,2.267171728,4.190331698,2.957128198,-0.982966661,2.214843848,0,4.530199698,0,5.008600172,0.832508913,4.781036939,0.602059991,3.478566496,2.814913181,3.465382851,2.383815366,1.081567485,0,0,0,0,0,0,0,0,0,0,5391,SUSQUEHANNA,RICHARD SUS PAD,804,Flowback,239280,gal,liquid,41446,6/21/13,54900,0,3.87,8760,13800,0,63.1,206,1010,3.8,37400,0,4390,0,52.1,755,100000,0,308000,5.9,228000,160,24400,6100,12800,994,0,0,0,2013,6,21,RICHARD,SUS,PAD,0,0,802,Flowback,2012,2,7,115-20795,OGO-65420,41.808886,-76.039061,Yes,Horizontal Well,GAS,Bbl,2012,PW,0,684636,198,0,0,2012.166667,1.333333333,12.87726358,4.739572344,0.587710965,3.942504106,4.139879086,1.800029359,2.31386722,3.004321374,4.572871602,3.64246452,0,1.716837723,2.877946952,5,0,5.488550717,0.770852012,5.357934847,2.204119983,4.387389826,3.785329835,4.10720997,2.997386384,1.109823585,0,0,0,0,0,0,0,0,0,0,5392,SUSQUEHANNA,RICHARD SUS PAD,804,Flowback,363435,gal,liquid,41568,10/21/13,59700,0,0,12100,21200,0,166,273,1640,6.36,32400,0,6610,0,27.7,853,134000,0,400000,5.8,195000,276,75700,32300,20800,1650,0,0,0,2013,10,21,RICHARD,SUS,PAD,0,0,802,Flowback,2012,2,7,115-20795,OGO-65420,41.808886,-76.039061,Yes,Horizontal Well,GAS,Bbl,2012,PW,0,684636,198,0,0,2012.166667,1.666666667,12.60606061,4.775974331,0,4.08278537,4.326335861,2.220108088,2.436162647,3.214843848,4.51054501,3.820201459,0,1.442479769,2.930949031,5.127104798,0,5.602059991,0.763427994,5.290034611,2.440909082,4.87909588,4.509202522,4.318063335,3.217483944,1.100579391,0,0,0,0,0,0,0,0,0,0,5393,SUSQUEHANNA,ROGER SUS PAD,804,Flowback,21840,gal,liquid,41491,8/5/13,25200,0,1.19,8360,5110,0,148,144,420,7.18,17400,0,1890,0,118,395,47400,0,150000,6.3,112000,185,7290,2220,1750,579,0,0,0,2013,8,5,ROGER,SUS,PAD,0,0,802,Flowback,2009,12,2,115-20230,OGO-65420,41.735194,-76.095431,Yes,Horizontal Well,GAS,Bbl,2012,PW,0,1172584,328,0,0,2010,3.666666667,3.022452504,4.401400541,0.075546961,3.922206277,3.7084209,2.170261715,2.158362492,2.62324929,4.240549248,3.276461804,0,2.071882007,2.596597096,4.675778342,0,5.176091259,0.799340549,5.049218023,2.267171728,3.862727528,3.346352974,3.243038049,2.762678564,0.480359485,0,0,0,0,0,0,0,0,0,0,5394,SUSQUEHANNA,SUSAN SUS PAD,804,Flowback,108500,gal,liquid,41527,9/10/13,42600,0,5.03,10900,15100,0,175,255,1180,5.47,38500,0,5290,2.9,112,787,101000,0,317000,6.3,245000,249,29400,8550,30400,1290,0,0,0,2013,9,10,SUSAN,SUS,PAD,0,0,802,Flowback,2011,11,15,115-20705,OGO-65420,41.696744,-76.107583,Yes,Horizontal Well,GAS,Bbl,2012,PW,0,699991,119,0,0,2011.916667,1.833333333,23.56589147,4.629409599,0.701567985,4.037426498,4.178976947,2.243038049,2.40654018,3.071882007,4.58546073,3.723455672,0.462397998,2.049218023,2.895974732,5.004321374,0,5.501059262,0.799340549,5.389166084,2.396199347,4.46834733,3.931966115,4.482873584,3.11058971,1.372283873,0,0,0,0,0,0,0,0,0,0,5395,SUSQUEHANNA,SUSAN SUS PAD,804,Flowback,157625,gal,liquid,41577,10/30/13,49300,0,0,12900,17500,0,92.5,323,1370,4.18,30100,0,6940,0,48.6,694,128000,0,376000,6.1,172000,174,54500,22200,13900,1550,0,0,0,2013,10,30,SUSAN,SUS,PAD,0,0,802,Flowback,2011,11,15,115-20705,OGO-65420,41.696744,-76.107583,Yes,Horizontal Well,GAS,Bbl,2012,PW,0,699991,119,0,0,2011.916667,1.916666667,8.967741935,4.692846919,0,4.11058971,4.243038049,1.966141733,2.509202522,3.136720567,4.478566496,3.84135947,0,1.686636269,2.84135947,5.10720997,0,5.575187845,0.785329835,5.235528447,2.240549248,4.736396502,4.346352974,4.1430148,3.190331698,0.952683102,0,0,0,0,0,0,0,0,0,0,5396,SUSQUEHANNA,TYLER SUS,804,Flowback,0,gal,liquid,41277,1/3/13,20500,0,3.71,4980,4000,0,63.5,181,320,2.22,24600,0,1680,0.241,159,0,52700,29000,150000,6.6,100000,138,21200,1720,1650,364,0,0,0,2013,1,3,TYLER,SUS,0,0,0,802,Flowback,2012,1,26,115-20708,OGO-65420,41.653219,-76.084467,Yes,Horizontal Well,GAS,Bbl,2012,PW,0,1316150,365,0,0,2012.083333,1,4.532967033,4.311753861,0.56937391,3.697229343,3.602059991,1.802773725,2.257678575,2.505149978,4.390935107,3.225309282,-0.617982957,2.201397124,0,4.721810615,4.462397998,5.176091259,0.819543936,5,2.139879086,4.326335861,3.235528447,3.217483944,2.561101384,0.656382561,0,0,0,0,0,0,0,0,0,0,5397,SUSQUEHANNA,TYLER SUS,804,Flowback,133258,gal,liquid,41446,6/21/13,24500,0,3.54,7210,5210,0,71.9,237,463,3.08,29600,0,2410,0,135,473,65200,0,207000,6.3,138000,92.4,5090,1840,2150,576,0,0,0,2013,6,21,TYLER,SUS,0,0,0,802,Flowback,2012,1,26,115-20708,OGO-65420,41.653219,-76.084467,Yes,Horizontal Well,GAS,Bbl,2012,PW,0,1316150,365,0,0,2012.083333,1.416666667,3.732638889,4.389166084,0.549003262,3.857935265,3.716837723,1.85672889,2.374748346,2.665580991,4.471291711,3.382017043,0,2.130333768,2.674861141,4.814247596,0,5.315970345,0.799340549,5.139879086,1.965671971,3.706717782,3.264817823,3.33243846,2.760422483,0.572015976,0,0,0,0,0,0,0,0,0,0,5398,SUSQUEHANNA,YVONNE SUS PAD,804,Flowback,146642,gal,liquid,41437,6/12/13,56200,0,2.55,24900,10200,0,76.5,263,914,4.45,41300,0,4340,0.414,86.9,789,104000,0,320000,6.2,201000,179,7130,2380,5920,1120,0,0,0,2013,6,12,YVONNE,SUS,PAD,0,0,802,Flowback,2011,7,28,115-20605,OGO-65420,41.765658,-76.095994,Yes,Horizontal Well,GAS,Bbl,2012,PW,0,1566686,365,0,0,2011.583333,1.916666667,5.285714286,4.749736316,0.40654018,4.396199347,4.008600172,1.883661435,2.419955748,2.960946196,4.615950052,3.63748973,-0.382999659,1.939019776,2.897077003,5.017033339,0,5.505149978,0.792391689,5.303196057,2.252853031,3.85308953,3.376576957,3.772321707,3.049218023,0.723103684,0,0,0,0,0,0,0,0,0,0,5399,WYOMING,BREWER WYO PAD,802,PW,37002,gal,liquid,42675,11/1/16,4480,0,0,2670,1570,0,95.8,111,134,5.49,11700,0,798,0,128,193,28800,0,73100,6,49600,100,1760,541,1050,325,0,22,0,2016,11,1,BREWER,WYO,PAD,0,0,802,PW,2014,1,8,131-20340,OGO-65420,41.597656,-76.039811,Yes,Horizontal Well,GAS,Bbl,2017,PW,0,0,0,0,0,2014.083333,5.333333333,3.230769231,3.651278014,0,3.426511261,3.195899652,1.981365509,2.045322979,2.127104798,4.068185862,2.902002891,0,2.10720997,2.285557309,4.459392488,0,4.863917377,0.77815125,4.695481676,2,3.245512668,2.733197265,3.021189299,2.511883361,0.509305938,0,0,0,0,0,0,0,0,0,0,4400,WYOMING,DPH WYO PAD,805,Flowback,5586,gal,liquid,42579,7/28/16,5910,0,6.53,4190,2080,0,191,174,176,5.27,16900,0,966,0,217,269,37100,0,122000,6,57200,334,12400,3150,3680,468,0,21.7,0,2016,7,28,DPH,WYO,PAD,0,0,802,Flowback,2011,7,17,131-20172,OGO-65420,41.565664,-76.142964,Yes,Horizontal Well,GAS,Bbl,2012,PW,0,989561,243,0,0,2011.583333,5,7.863247863,3.771587481,0.814913181,3.622214023,3.318063335,2.281033367,2.240549248,2.245512668,4.227886705,2.984977126,0,2.336459734,2.42975228,4.56937391,0,5.086359831,0.77815125,4.757396029,2.523746467,4.093421685,3.498310554,3.565847819,2.670245853,0.895601966,0,0,0,0,0,0,0,0,0,0,5401,WYOMING,GARRISON WYO PAD,805,Flowback,25788,gal,liquid,42535,6/14/16,16200,0,5.21,7630,5740,0,69.3,214,453,4.02,19500,0,2110,0,179,426,56900,0,181000,6.5,117000,125,6300,1890,5840,738,0,23.2,0,2016,6,14,GARRISON,WYO,PAD,0,0,802,Flowback,2014,10,27,131-20438,OGO-65420,41.625408,-75.960431,Yes,Horizontal Well,GAS,Bbl,2018,PW,0,0,0,0,0,2014.833333,1.666666667,7.913279133,4.209515015,0.716837723,3.882524538,3.758911892,1.840733235,2.330413773,2.656098202,4.290034611,3.324282455,0,2.252853031,2.629409599,4.755112266,0,5.257678575,0.812913357,5.068185862,2.096910013,3.799340549,3.276461804,3.766412847,2.868056362,0.898356485,0,0,0,0,0,0,0,0,0,0,5402,WYOMING,GARRISON WYO PAD,802,PW,85848,gal,liquid,42675,11/1/16,9450,0,0,5740,3340,0,123,176,271,6.62,19000,0,1390,0,101,311,51100,0,120000,7,80800,62,4020,1100,2980,589,0,22.8,0,2016,11,1,GARRISON,WYO,PAD,0,0,802,PW,2014,10,27,131-20438,OGO-65420,41.625408,-75.960431,Yes,Horizontal Well,GAS,Bbl,2018,Yes,0,0,0,0,0,2014.833333,2.083333333,5.05942275,3.975431809,0,3.758911892,3.523746467,2.089905111,2.245512668,2.432969291,4.278753601,3.1430148,0,2.004321374,2.492760389,4.7084209,0,5.079181246,0.84509804,4.907411361,1.792391689,3.604226053,3.041392685,3.474216264,2.770115295,0.704100969,0,0,0,0,0,0,0,0,0,0,4403,WYOMING,MCGRAW WYO PAD,805,Flowback,11046,gal,liquid,42564,7/13/16,10200,0,0,4140,3620,0,224,168,289,6.25,19100,0,1260,0,294,311,45600,0,129000,6.6,92800,260,11800,3580,2570,378,0,23.6,0,2016,7,13,MCGRAW,WYO,PAD,0,0,802,Flowback,2010,8,24,131-20033,OGO-65420,41.639275,-75.973297,Yes,Horizontal Well,GAS,Bbl,2012,PW,0,1543634,252,0,0,2010.666667,5.916666667,6.798941799,4.008600172,0,3.617000341,3.558708571,2.350248018,2.225309282,2.460897843,4.281033367,3.100370545,0,2.46834733,2.492760389,4.658964843,0,5.11058971,0.819543936,4.967547976,2.414973348,4.071882007,3.553883027,3.409933123,2.5774918,0.832441323,0,0,0,0,0,0,0,0,0,0,5404,WYOMING,PORTER WYO PAD,805,Flowback,22974,gal,liquid,42605,8/23/16,8160,0,0,3630,2930,0,71.7,214,201,5.57,14200,0,1210,0,71.5,271,35300,0,90900,6.3,64000,177,3470,778,2690,456,0,23.4,0,2016,8,23,PORTER,WYO,PAD,0,0,802,Flowback,2014,5,14,131-20389,OGO-65420,41.557278,-76.188711,Yes,Horizontal Well,GAS,Bbl,Yes,PW,0,0,0,0,0,2014.416667,2.25,5.899122807,3.911690159,0,3.559906625,3.46686762,1.855519156,2.330413773,2.303196057,4.152288344,3.08278537,0,1.854306042,2.432969291,4.547774705,0,4.958563883,0.799340549,4.806179974,2.247973266,3.540329475,2.890979597,3.42975228,2.658964843,0.770787437,0,0,0,0,0,0,0,0,0,0,5405,WYOMING,PORTER WYO PAD,802,PW,34974.66,gal,liquid,42718,12/14/16,12900,0,0,7280,4620,0,213,216,339,6.99,17700,0,2090,2.63,63.1,426,66900,0,139000,6.4,58800,207,24500,9880,4320,858,0,22.6,0,2016,12,14,PORTER,WYO,PAD,0,0,802,PW,2014,5,14,131-20389,OGO-65420,41.557278,-76.188711,Yes,Horizontal Well,GAS,Bbl,Yes,Yes,832.73,0,0,0,0,2014.416667,2.583333333,5.034965035,4.11058971,0,3.862131379,3.664641976,2.328379603,2.334453751,2.530199698,4.247973266,3.320146286,0.419955748,1.800029359,2.629409599,4.825426118,0,5.1430148,0.806179974,4.769377326,2.315970345,4.389166084,3.994756945,3.635483747,2.933487288,0.701996459,0,0,0,0,0,0,0,0,0,0,4406,WYOMING,SHARPE WYO PAD,805,Flowback,4200,gal,liquid,42487,4/27/16,31000,0,6,8530,11100,0,133,274,776,6.67,26900,0,4770,0,66.4,635,101000,0,291000,6.1,163000,274,22200,12800,16800,1560,0,22,0,2016,4,27,SHARPE,WYO,PAD,0,0,802,Flowback,2013,10,15,131-20287,OGO-65420,41.597453,-76.195192,Yes,Horizontal Well,GAS,Bbl,Yes,PW,0,0,0,0,0,2013.833333,2.5,10.76923077,4.491361694,0.77815125,3.930949031,4.045322979,2.123851641,2.437750563,2.889861721,4.42975228,3.678518379,0,1.822168079,2.802773725,5.004321374,0,5.463892989,0.785329835,5.212187604,2.437750563,4.346352974,4.10720997,4.225309282,3.193124598,1.032184683,0,0,0,0,0,0,0,0,0,0,5407,WYOMING,SHARPE WYO PAD,802,PW,225078,gal,liquid,42535,6/14/16,44700,0,6.51,11800,16100,0,83,367,1090,8.96,29100,0,7290,0,37.5,809,121000,0,351000,6.1,231000,645,19900,4880,9650,1980,0,23.4,0,2016,6,14,SHARPE,WYO,PAD,0,0,802,PW,2013,10,15,131-20287,OGO-65420,41.597453,-76.195192,Yes,Horizontal Well,GAS,Bbl,Yes,Yes,2679.5,0,0,0,0,2013.833333,2.666666667,4.873737374,4.650307523,0.813580989,4.071882007,4.206825876,1.919078092,2.564666064,3.037426498,4.463892989,3.862727528,0,1.574031268,2.907948522,5.08278537,0,5.545307116,0.785329835,5.36361198,2.809559715,4.298853076,3.688419822,3.984527313,3.29666519,0.687862123,0,0,0,0,0,0,0,0,0,0,4408,WYOMING,MCDONOUGH WYO PAD,804,Flowback,273654,gal,liquid,42166,6/11/15,179,0,0.127,3.36,61.4,0.145,118,0.344,6.18,1.46,143,0,3.78,0,121,0,286,1590,1200,6.8,931,49.3,5.71,8.41,60.4,0,0,0,0,2015,6,11,MCDONOUGH,WYO,PAD,0,0,802,Flowback,2014,10,7,131-20465,OGO-65420,41.641628,-76.015514,Yes,Horizontal Well,GAS,Bbl,2014,PW,0,4041,2,0,0,2014.833333,0.666666667,0,2.252853031,-0.896196279,0.526339277,1.788168371,2.071882007,-0.463441557,0.790988475,2.155336037,0.5774918,0,2.08278537,0,2.456366033,3.201397124,3.079181246,0.832508913,2.968949681,1.692846919,0.756636108,0.924795996,1.781036939,0,0,0,0,0,0,0,0,0,0,0,0,5409,WYOMING,ROUNDWOOD WYO PAD,804,Flowback,282850,gal,liquid,42309,11/1/15,5610,0,0,2940,1960,0,24.9,85.4,174,1.9,11500,0,796,0,196,177,26300,0,81600,7,55700,138,2130,910,35.1,257,0,0,0,2015,11,1,ROUNDWOOD,WYO,PAD,0,0,802,Flowback,2015,1,13,131-20478,OGO-65420,41.629281,-76.129511,Yes,Horizontal Well,GAS,Bbl,Yes,PW,0,749643,82,0,0,2015.083333,0.833333333,0.136575875,3.748962861,0,3.46834733,3.292256071,1.396199347,1.931457871,2.240549248,4.06069784,2.900913068,0,2.292256071,2.247973266,4.419955748,0,4.911690159,0.84509804,4.745855195,2.139879086,3.328379603,2.959041392,1.545307116,2.409933123,-0.864626007,0,0,0,0,0,0,0,0,0,0,5410,WYOMING,ROUNDWOOD WYO PAD,802,PW,100034,gal,liquid,42355,12/17/15,5530,0,0,3100,1950,0,161,115,162,4.77,13100,0,873,0,256,216,31200,204000,95100,6.5,47000,168,4200,1410,2140,245,0,0,0,2015,12,17,ROUNDWOOD,WYO,PAD,0,0,802,PW,2015,1,13,131-20478,OGO-65420,41.629281,-76.129511,Yes,Horizontal Well,GAS,Bbl,Yes,Yes,748.67,749643,82,0,0,2015.083333,0.916666667,8.734693878,3.742725131,0,3.491361694,3.290034611,2.206825876,2.06069784,2.209515015,4.117271296,2.941014244,0,2.408239965,2.334453751,4.494154594,5.309630167,4.978180517,0.812913357,4.672097858,2.225309282,3.62324929,3.149219113,3.330413773,2.389166084,0.941247689,0,0,0,0,0,0,0,0,0,0,4411,WYOMING,SHAMROCK WYO PAD,802,PW,644668,gal,liquid,42016,1/12/15,12300,0,0,5670,4430,0,110,167,303,4.28,12100,0,1630,0,125,384,63700,44600,179000,6.3,104000,82.3,10700,4410,5850,637,0,0,0,2015,1,12,SHAMROCK,WYO,PAD,0,0,802,PW,2014,1,13,131-20378,OGO-65420,41.601658,-76.134522,Yes,Horizontal Well,GAS,Bbl,2014,Yes,0,517982,84,0,0,2014.083333,1,9.183673469,4.089905111,0,3.753583059,3.646403726,2.041392685,2.222716471,2.481442629,4.08278537,3.212187604,0,2.096910013,2.584331224,4.804139432,4.649334859,5.252853031,0.799340549,5.017033339,1.915399835,4.029383778,3.644438589,3.767155866,2.804139432,0.963016434,0,0,0,0,0,0,0,0,0,0,4412,WYOMING,TINNA WYO PAD,804,Flowback,1014010,gal,liquid,42151,5/27/15,5070,0,6.49,2770,1820,0,38.1,128,125,0.873,14200,0,725,0,212,255,33100,0,90900,6.9,58000,45.2,7230,2460,2570,211,0,0,0,2015,5,27,TINNA,WYO,PAD,0,0,802,Flowback,2013,10,2,131-20331,OGO-65420,41.586725,-76.089614,Yes,Horizontal Well,GAS,Bbl,2014,PW,0,0,0,0,0,2013.833333,1.583333333,12.18009479,3.705007959,0.812244697,3.442479769,3.260071388,1.580924976,2.10720997,2.096910013,4.152288344,2.860338007,0,2.326335861,2.40654018,4.519827994,0,4.958563883,0.838849091,4.763427994,1.655138435,3.859138297,3.390935107,3.409933123,2.324282455,1.085650668,0,0,0,0,0,0,0,0,0,0,5413,WYOMING,TINNA WYO PAD,802,PW,209483,gal,liquid,42192,7/7/15,5350,0,5.93,2790,1910,0,169,140,143,3.59,14000,0,740,0,241,241,31000,0,103000,6.6,60600,126,7460,1440,3070,225,0,0,0,2015,7,7,TINNA,WYO,PAD,0,0,802,PW,2013,10,2,131-20331,OGO-65420,41.586725,-76.089614,Yes,Horizontal Well,GAS,Bbl,2014,Yes,0,0,0,0,0,2013.833333,1.75,13.64444444,3.728353782,0.773054693,3.445604203,3.281033367,2.227886705,2.146128036,2.155336037,4.146128036,2.86923172,0,2.382017043,2.382017043,4.491361694,0,5.012837225,0.819543936,4.782472624,2.100370545,3.872738827,3.158362492,3.487138375,2.352182518,1.134955857,0,0,0,0,0,0,0,0,0,0,4414,WYOMING,VISNESKI WYO PAD,804,Flowback,1117516,gal,liquid,42074,3/11/15,4770,0,6.57,2670,1690,0,36.6,129,132,0.976,14600,0,644,0,182,229,28100,0,96400,7.1,53200,107,9110,3070,480,233,0,0,0,2015,3,11,VISNESKI,WYO,PAD,0,0,802,Flowback,2013,8,12,131-20299,OGO-65420,41.579408,-76.076389,Yes,Horizontal Well,GAS,Bbl,2014,PW,0,2395169,199,0,0,2013.666667,1.583333333,2.060085837,3.678518379,0.81756537,3.426511261,3.227886705,1.563481085,2.11058971,2.120573931,4.164352856,2.808885867,0,2.260071388,2.359835482,4.44870632,0,4.984077034,0.851258349,4.725911632,2.029383778,3.959518377,3.487138375,2.681241237,2.367355921,0.313885316,0,0,0,0,0,0,0,0,0,0,5415,WYOMING,VISNESKI WYO PAD,802,PW,251328,gal,liquid,42100,4/6/15,5550,0,5.53,2520,1980,0,109,120,146,3.43,12400,0,697,0,264,224,27500,35900,90300,6.7,51600,151,3980,1180,3900,145,0,0,0,2015,4,6,VISNESKI,WYO,PAD,0,0,802,PW,2013,8,12,131-20299,OGO-65420,41.579408,-76.076389,Yes,Horizontal Well,GAS,Bbl,2014,Yes,0,2395169,199,0,0,2013.666667,1.666666667,26.89655172,3.744292983,0.742725131,3.401400541,3.29666519,2.037426498,2.079181246,2.164352856,4.093421685,2.843232778,0,2.421603927,2.350248018,4.439332694,4.555094449,4.95568775,0.826074803,4.712649702,2.178976947,3.599883072,3.071882007,3.591064607,2.161368002,1.429696605,0,0,0,0,0,0,0,0,0,0,4416,WYOMING,AMCOR WYO PAD,804,Flowback,511028,gal,liquid,41810,6/20/14,6580,0,0,2600,2320,0,68.4,107,187,1.65,11700,0,718,0,214,184,33700,0,96100,6.6,57500,168,13200,4730,3230,199,0,0,0,2014,6,20,AMCOR,WYO,PAD,0,0,802,Flowback,0,0,0,0,0,0,0,0,0,0,0,0,0,0,0,0,0,0,0,0,16.23115578,3.818225894,0,3.414973348,3.365487985,1.835056102,2.029383778,2.271841607,4.068185862,2.856124444,0,2.330413773,2.264817823,4.527629901,0,4.982723388,0.819543936,4.759667845,2.225309282,4.120573931,3.674861141,3.509202522,2.298853076,1.210349446,0,0,0,0,0,0,0,0,0,0,5417,WYOMING,AMCOR WYO PAD,802,PW,246828,gal,liquid,41837,7/17/14,5600,0,0,3070,1970,0,99.8,117,164,2.95,13600,0,804,0,212,183,36700,0,90500,6.7,54000,196,6690,1010,3480,244,0,0,0,2014,7,17,AMCOR,WYO,PAD,0,0,802,PW,0,0,0,0,0,0,0,0,0,0,0,0,0,0,0,0,0,0,0,0,14.26229508,3.748188027,0,3.487138375,3.294466226,1.999130541,2.068185862,2.214843848,4.133538908,2.905256049,0,2.326335861,2.26245109,4.564666064,0,4.956648579,0.826074803,4.73239376,2.292256071,3.825426118,3.004321374,3.541579244,2.387389826,1.154189418,0,0,0,0,0,0,0,0,0,0,4418,WYOMING,BOYANOWSKI WYO PAD,804,Flowback,277294,gal,liquid,41948,11/5/14,13600,0,0,4170,4880,0,309,149,344,9.63,18700,0,1340,0,141,253,50900,0,149000,6.2,121000,584,3610,927,4170,474,0,0,0,2014,11,5,BOYANOWSKI,WYO,PAD,0,0,802,Flowback,0,0,0,0,0,0,0,0,0,0,0,0,0,0,0,0,0,0,0,0,8.797468354,4.133538908,0,3.620136055,3.688419822,2.489958479,2.173186268,2.536558443,4.271841607,3.127104798,0,2.149219113,2.403120521,4.706717782,0,5.173186268,0.792391689,5.08278537,2.766412847,3.557507202,2.967079734,3.620136055,2.675778342,0.944357713,0,0,0,0,0,0,0,0,0,0,5419,WYOMING,BOYANOWSKI WYO PAD,802,PW,598964,gal,liquid,41988,12/15/14,3920,0,0,1890,1390,0,81.9,68.3,105,2.3,8390,0,511,0,179,188,31500,33100,111000,6.1,53600,204,6700,2870,2090,303,0,0,0,2014,12,15,BOYANOWSKI,WYO,PAD,0,0,802,PW,0,0,0,0,0,0,0,0,0,0,0,0,0,0,0,0,0,0,0,0,6.897689769,3.593286067,0,3.276461804,3.1430148,1.913283902,1.834420704,2.021189299,3.923761961,2.7084209,0,2.252853031,2.274157849,4.498310554,4.519827994,5.045322979,0.785329835,4.72916479,2.309630167,3.826074803,3.457881897,3.320146286,2.481442629,0.838703658,0,0,0,0,0,0,0,0,0,0,4420,WYOMING,DUNNY WYO PAD,804,Flowback,145172,gal,liquid,41921,10/9/14,9570,0,6.03,4220,3410,0,63.6,160,258,2.04,18900,0,1270,0,142,272,40200,0,142000,6.6,91200,139,10100,2650,4150,426,0,0,0,2014,10,9,DUNNY,WYO,PAD,0,0,802,Flowback,2013,1,10,131-20124,OGO-65420,41.595847,-76.120322,Yes,Horizontal Well,GAS,Bbl,2013,PW,0,0,0,0,0,2013.083333,1.75,9.741784038,3.980911938,0.780317312,3.625312451,3.532754379,1.803457116,2.204119983,2.411619706,4.276461804,3.103803721,0,2.152288344,2.434568904,4.604226053,0,5.152288344,0.819543936,4.959994838,2.1430148,4.004321374,3.423245874,3.618048097,2.629409599,0.988638498,0,0,0,0,0,0,0,0,0,0,5421,WYOMING,DUNNY WYO PAD,802,PW,228134,gal,liquid,41948,11/5/14,9310,0,5.47,4220,3310,0,93.9,153,257,2.38,17600,0,1270,0,85.2,244,43400,55600,150000,6,80800,84.8,5520,809,4910,418,0,0,0,2014,11,5,DUNNY,WYO,PAD,0,0,802,PW,2013,1,10,131-20124,OGO-65420,41.595847,-76.120322,Yes,Horizontal Well,GAS,Bbl,2013,Yes,0,0,0,0,0,2013.083333,1.833333333,11.74641148,3.968949681,0.737987326,3.625312451,3.519827994,1.972665592,2.184691431,2.409933123,4.245512668,3.103803721,0,1.930439595,2.387389826,4.63748973,4.745074792,5.176091259,0.77815125,4.907411361,1.928395852,3.741939078,2.907948522,3.691081492,2.621176282,1.06990521,0,0,0,0,0,0,0,0,0,0,4422,WYOMING,FRANCLAIRE WYO PAD,804,Flowback,173204,gal,liquid,41936,10/24/14,8570,0,0,3740,3070,0,214,125,220,4.94,15800,0,1080,0,248,207,38000,33300,118000,6.2,71600,181,3680,1640,2730,238,0,0,0,2014,10,24,FRANCLAIRE,WYO,PAD,0,0,802,Flowback,2011,2,14,131-20125,OGO-65420,41.633842,-76.117614,Yes,Horizontal Well,GAS,Bbl,2012,PW,0,1464915,169,0,0,2011.166667,3.666666667,11.47058824,3.932980822,0,3.572871602,3.487138375,2.330413773,2.096910013,2.342422681,4.198657087,3.033423755,0,2.394451681,2.315970345,4.579783597,4.522444234,5.071882007,0.792391689,4.854913022,2.257678575,3.565847819,3.214843848,3.436162647,2.376576957,1.05958569,0,0,0,0,0,0,0,0,0,0,5423,WYOMING,PIESZALA WYO PAD,804,Flowback,360382,gal,liquid,41949,11/6/14,30600,0,0,4360,11100,0,306,189,700,12.7,26100,0,2820,0,0,453,82400,0,255000,4.6,147000,156,11100,2320,9860,1020,0,0,0,2014,11,6,PIESZALA,WYO,PAD,0,0,802,Flowback,0,0,0,0,0,0,0,0,0,0,0,0,0,0,0,0,0,0,0,0,9.666666667,4.485721426,0,3.639486489,4.045322979,2.485721426,2.276461804,2.84509804,4.416640507,3.450249108,0,0,2.656098202,4.915927212,0,5.40654018,0.662757832,5.167317335,2.193124598,4.045322979,3.365487985,3.993876915,3.008600172,0.985276743,0,0,0,0,0,0,0,0,0,0,5424,WYOMING,PIESZALA WYO PAD,802,PW,346233,gal,liquid,41988,12/15/14,6130,0,0,2300,2210,0,66.7,80.9,150,1.57,6370,0,854,0,96.2,469,73400,58500,193000,5.8,107000,148,30900,12700,6660,839,0,0,0,2014,12,15,PIESZALA,WYO,PAD,0,0,802,PW,0,0,0,0,0,0,0,0,0,0,0,0,0,0,0,0,0,0,0,0,7.938021454,3.787460475,0,3.361727836,3.344392274,1.824125834,1.907948522,2.176091259,3.804139432,2.931457871,0,1.983175072,2.671172843,4.86569606,4.767155866,5.285557309,0.763427994,5.029383778,2.170261715,4.489958479,4.103803721,3.823474229,2.923761961,0.899712268,0,0,0,0,0,0,0,0,0,0,4425,WYOMING,PIESZALA WYO PAD,802,PW,346233,gal,liquid,41988,12/15/14,6130,0,0,2300,2210,0,66.7,80.9,150,1.57,6370,0,854,0,96.2,469,73400,58500,193000,5.8,107000,148,30900,12700,6660,839,0,0,0,2014,12,15,PIESZALA,WYO,PAD,0,0,802,PW,0,0,0,0,0,0,0,0,0,0,0,0,0,0,0,0,0,0,0,0,7.938021454,3.787460475,0,3.361727836,3.344392274,1.824125834,1.907948522,2.176091259,3.804139432,2.931457871,0,1.983175072,2.671172843,4.86569606,4.767155866,5.285557309,0.763427994,5.029383778,2.170261715,4.489958479,4.103803721,3.823474229,2.923761961,0.899712268,0,0,0,0,0,0,0,0,0,0,4426,WYOMING,SHAMROCK WYO PAD,804,Flowback,601670,gal,liquid,41988,12/15/14,3700,0,0,1590,1330,0,0,49.3,95.8,1.37,6520,0,466,0,80.3,359,69800,0,167000,6,85000,154,20800,7920,4630,590,0,0,0,2014,12,15,SHAMROCK,WYO,PAD,0,0,802,Flowback,2014,1,13,131-20378,OGO-65420,41.601658,-76.134522,Yes,Horizontal Well,GAS,Bbl,Yes,PW,0,199630,24,0,0,2014.083333,0.916666667,7.847457627,3.568201724,0,3.201397124,3.123851641,0,1.692846919,1.981365509,3.814247596,2.668385917,0,1.904715545,2.555094449,4.843855423,0,5.222716471,0.77815125,4.929418926,2.187520721,4.318063335,3.898725182,3.665580991,2.770852012,0.894728979,0,0,0,0,0,0,0,0,0,0,5427,WYOMING,WOOTTEN WYO PAD,802,PW,65297,gal,liquid,41757,4/28/14,8610,0,6.87,5770,2990,0,124,203,276,6.1,19000,0,1210,0,59.1,270,41700,81900,136000,6.3,72000,95.5,7340,1050,5170,539,0,0,0,2014,4,28,WOOTTEN,WYO,PAD,0,0,802,PW,2011,9,6,131-20207,OGO-65420,41.549767,-76.057497,Yes,Horizontal Well,GAS,Bbl,2012,Yes,0,2288687,320,0,0,2011.75,2.583333333,9.591836735,3.935003151,0.836956737,3.761175813,3.475671188,2.093421685,2.307496038,2.440909082,4.278753601,3.08278537,0,1.771587481,2.431363764,4.620136055,4.913283902,5.133538908,0.799340549,4.857332496,1.980003372,3.86569606,3.021189299,3.713490543,2.731588765,0.981901778,0,0,0,0,0,0,0,0,0,0,4428,WYOMING,ADAMS WYO PAD,804,Flowback,12894,gal,liquid,41402,5/8/13,31900,0,4.77,7130,6540,0,106,166,503,4.92,23600,0,2190,1.08,103,0,54400,0,163000,6.4,115000,99.6,18100,6280,8250,788,0,0,0,2013,5,8,ADAMS,WYO,PAD,0,0,802,Flowback,2012,1,9,131-20226,OGO-65420,41.587278,-76.202878,Yes,Horizontal Well,GAS,Bbl,2012,PW,0,3019094,248,0,0,2012.083333,1.333333333,10.46954315,4.503790683,0.678518379,3.85308953,3.815577748,2.025305865,2.220108088,2.701567985,4.372912003,3.340444115,0.033423755,2.012837225,0,4.7355989,0,5.212187604,0.806179974,5.06069784,1.998259338,4.257678575,3.797959644,3.916453949,2.896526217,1.019927731,0,0,0,0,0,0,0,0,0,0,5429,WYOMING,ADAMS WYO PAD,804,Flowback,69910,gal,liquid,41492,8/6/13,16800,0,3.62,4520,5150,0,34.6,146,362,3.94,16800,0,1690,0.226,48.1,354,41900,109000,154000,6.4,95600,135,25000,11100,9310,636,0,0,0,2013,8,6,ADAMS,WYO,PAD,0,0,802,Flowback,2012,1,9,131-20226,OGO-65420,41.587278,-76.202878,Yes,Horizontal Well,GAS,Bbl,2012,PW,0,3019094,248,0,0,2012.083333,1.583333333,14.63836478,4.225309282,0.558708571,3.655138435,3.711807229,1.539076099,2.164352856,2.558708571,4.225309282,3.227886705,-0.645891561,1.682145076,2.549003262,4.622214023,5.037426498,5.187520721,0.806179974,4.980457892,2.130333768,4.397940009,4.045322979,3.968949681,2.803457116,1.165492565,0,0,0,0,0,0,0,0,0,0,5430,WYOMING,CAPPUCCI WYO,804,Flowback,0,gal,liquid,41453,6/28/13,10300,0,5.65,3050,2320,0,83.5,110,163,2.44,13400,0,859,0,216,0,30200,0,94400,6.5,54600,135,3740,789,4240,815,0,0,0,2013,6,28,CAPPUCCI,WYO,0,0,0,802,Flowback,2010,3,9,131-20023,OGO-65420,41.565636,-76.101008,Yes,Horizontal Well,GAS,Bbl,2012,PW,0,1793397,188,0,0,2010.25,3.25,5.202453988,4.012837225,0.752048448,3.484299839,3.365487985,1.921686475,2.041392685,2.212187604,4.127104798,2.933993164,0,2.334453751,0,4.480006943,0,4.974971994,0.812913357,4.737192643,2.130333768,3.572871602,2.897077003,3.627365857,2.911157609,0.716208248,0,0,0,0,0,0,0,0,0,0,5431,WYOMING,CAPPUCCI WYO,804,Flowback,261606,gal,liquid,41492,8/6/13,7440,0,6.13,2990,2110,0,118,139,165,2.7,12500,0,714,0.18,273,248,32900,38400,110000,6.7,62600,214,16400,6030,2100,315,0,0,0,2013,8,6,CAPPUCCI,WYO,0,0,0,802,Flowback,2010,3,9,131-20023,OGO-65420,41.565636,-76.101008,Yes,Horizontal Well,GAS,Bbl,2012,PW,0,1793397,188,0,0,2010.25,3.416666667,6.666666667,3.871572936,0.787460475,3.475671188,3.324282455,2.071882007,2.1430148,2.217483944,4.096910013,2.853698212,-0.744727495,2.436162647,2.394451681,4.517195898,4.584331224,5.041392685,0.826074803,4.796574333,2.330413773,4.214843848,3.780317312,3.322219295,2.498310554,0.823908741,0,0,0,0,0,0,0,0,0,0,5432,WYOMING,COLCAM WYO PAD,804,Flowback,21183,gal,liquid,41477,7/22/13,15700,0,4.65,4090,3180,0,63,141,275,2.63,17400,0,1190,1.45,128,0,37600,0,119000,6.7,80800,94.5,6890,2460,2230,366,0,0,0,2013,7,22,COLCAM,WYO,PAD,0,0,802,Flowback,2011,12,22,131-20216,OGO-65420,41.614858,-76.021011,Yes,Horizontal Well,GAS,Bbl,2012,PW,0,1963864,174,0,0,2012,1.583333333,6.092896175,4.195899652,0.667452953,3.611723308,3.50242712,1.799340549,2.149219113,2.439332694,4.240549248,3.075546961,0.161368002,2.10720997,0,4.575187845,0,5.075546961,0.826074803,4.907411361,1.975431809,3.838219222,3.390935107,3.348304863,2.563481085,0.784823778,0,0,0,0,0,0,0,0,0,0,5433,WYOMING,COLCAM WYO PAD,804,Flowback,74696,gal,liquid,41558,10/11/13,7010,0,0,3610,2480,0,50.6,117,196,3.41,14100,0,945,0,94.4,271,31200,90600,101000,6.4,57800,74.7,3370,608,2770,284,0,0,0,2013,10,11,COLCAM,WYO,PAD,0,0,802,Flowback,2011,12,22,131-20216,OGO-65420,41.614858,-76.021011,Yes,Horizontal Well,GAS,Bbl,2012,PW,0,1963864,174,0,0,2012,1.833333333,9.753521127,3.845718018,0,3.557507202,3.394451681,1.704150517,2.068185862,2.292256071,4.149219113,2.975431809,0,1.974971994,2.432969291,4.494154594,4.957128198,5.004321374,0.806179974,4.761927838,1.873320602,3.527629901,2.783903579,3.442479769,2.45331834,0.989161429,0,0,0,0,0,0,0,0,0,0,5434,WYOMING,CURTIN WYO PAD,804,Flowback,95303,gal,liquid,41397,5/3/13,37200,0,5.54,9040,8460,0,67.5,231,637,3.15,32800,0,3080,0,103,577,71400,0,214000,6.3,157000,176,9100,1770,8670,865,0,0,0,2013,5,3,CURTIN,WYO,PAD,0,0,802,Flowback,2012,10,3,131-20069,OGO-65420,41.619714,-76.195597,Yes,Horizontal Well,GAS,Bbl,2012,PW,0,2343716,247,0,0,2012.833333,0.583333333,10.02312139,4.57054294,0.743509765,3.95616843,3.927370363,1.829303773,2.36361198,2.804139432,4.515873844,3.488550717,0,2.012837225,2.761175813,4.853698212,0,5.330413773,0.799340549,5.195899652,2.245512668,3.959041392,3.247973266,3.938019097,2.937016107,1.00100299,0,0,0,0,0,0,0,0,0,0,5435,WYOMING,CURTIN WYO PAD,804,Flowback,173502,gal,liquid,41492,8/6/13,29500,0,4.99,9240,10200,0,101,234,773,4.14,28400,0,3440,0,109,601,118000,0,266000,6.2,174000,50.8,34500,14100,10700,979,0,0,0,2013,8,6,CURTIN,WYO,PAD,0,0,802,Flowback,2012,10,3,131-20069,OGO-65420,41.619714,-76.195597,Yes,Horizontal Well,GAS,Bbl,2012,PW,0,2343716,247,0,0,2012.833333,0.833333333,10.92951992,4.469822016,0.698100546,3.965671971,4.008600172,2.004321374,2.369215857,2.888179494,4.45331834,3.536558443,0,2.037426498,2.778874472,5.071882007,0,5.424881637,0.792391689,5.240549248,1.705863712,4.537819095,4.149219113,4.029383778,2.990782692,1.038601086,0,0,0,0,0,0,0,0,0,0,5436,WYOMING,DPH WYO PAD,804,Flowback,217110,gal,liquid,41446,6/21/13,20400,0,6.8,5840,4590,0,28.9,178,347,1.86,23600,0,1760,0,114,437,53200,0,170000,6.5,102000,210,6510,1870,6360,652,0,0,0,2013,6,21,DPH,WYO,PAD,0,0,802,Flowback,2011,7,17,131-20172,OGO-65420,41.565664,-76.142964,Yes,Horizontal Well,GAS,Bbl,2012,PW,0,1678787,197,0,0,2011.583333,1.916666667,9.754601227,4.309630167,0.832508913,3.766412847,3.661812686,1.460897843,2.250420002,2.540329475,4.372912003,3.245512668,0,2.056904851,2.640481437,4.725911632,0,5.230448921,0.812913357,5.008600172,2.322219295,3.813580989,3.271841607,3.803457116,2.814247596,0.98920952,0,0,0,0,0,0,0,0,0,0,5437,WYOMING,DPH WYO PAD,804,Flowback,223874,gal,liquid,41498,8/12/13,19000,0,6.62,6860,4790,0,106,206,380,2.75,24600,0,2010,0,166,434,64300,0,174000,6.4,101000,129,22700,10800,4260,760,0,0,0,2013,8,12,DPH,WYO,PAD,0,0,802,Flowback,2011,7,17,131-20172,OGO-65420,41.565664,-76.142964,Yes,Horizontal Well,GAS,Bbl,2012,PW,0,1678787,197,0,0,2011.583333,2.083333333,5.605263158,4.278753601,0.820857989,3.836324116,3.680335513,2.025305865,2.31386722,2.579783597,4.390935107,3.303196057,0,2.220108088,2.63748973,4.808210973,0,5.240549248,0.806179974,5.004321374,2.11058971,4.356025857,4.033423755,3.629409599,2.880813592,0.748596007,0,0,0,0,0,0,0,0,0,0,5438,WYOMING,EDF WYO,804,Flowback,75313,gal,liquid,41406,5/12/13,10900,0,5.8,4190,3170,0,131,155,228,4.49,16300,0,1120,0,218,322,44600,28200,123000,6.7,75600,175,14900,7010,2700,410,0,0,0,2013,5,12,EDF,WYO,0,0,0,802,Flowback,2010,11,15,131-20112,OGO-65420,41.562061,-76.111453,Yes,Horizontal Well,GAS,Bbl,2012,PW,0,1942143,190,0,0,2010.916667,2.5,6.585365854,4.037426498,0.763427994,3.622214023,3.501059262,2.117271296,2.190331698,2.357934847,4.212187604,3.049218023,0,2.338456494,2.507855872,4.649334859,4.450249108,5.089905111,0.826074803,4.878521796,2.243038049,4.173186268,3.845718018,3.431363764,2.612783857,0.818579907,0,0,0,0,0,0,0,0,0,0,5439,WYOMING,EDF WYO,804,Flowback,0,gal,liquid,41453,6/28/13,26500,0,6.35,4970,7020,0.211,184,170,444,6.74,24700,0,2000,0.122,180,484,58600,0,196000,6.2,121000,343,6760,2430,51470,672,0,0,0,2013,6,28,EDF,WYO,0,0,0,802,Flowback,2010,11,15,131-20112,OGO-65420,41.562061,-76.111453,Yes,Horizontal Well,GAS,Bbl,2012,PW,0,1942143,190,0,0,2010.916667,2.583333333,76.5922619,4.423245874,0.802773725,3.696356389,3.846337112,2.264817823,2.230448921,2.64738297,4.392696953,3.301029996,-0.913640169,2.255272505,2.684845362,4.767897616,0,5.292256071,0.792391689,5.08278537,2.53529412,3.829946696,3.385606274,4.711554168,2.827369273,1.884184895,0,0,0,0,0,0,0,0,0,0,5440,WYOMING,GEORGE WYO PAD,804,Flowback,62286,gal,liquid,41418,5/24/13,27300,0,5.2,5200,6970,0,78.6,207,458,3.66,27300,0,2380,0.132,120,525,69600,0,179000,6.6,150000,298,9260,2680,6140,632,0,0,0,2013,5,24,GEORGE,WYO,PAD,0,0,802,Flowback,2012,10,23,131-20075,OGO-65420,41.633847,-76.161106,Yes,Horizontal Well,GAS,Bbl,2012,PW,0,2365212,229,0,0,2012.833333,0.583333333,9.715189873,4.436162647,0.716003344,3.716003344,3.843232778,1.895422546,2.315970345,2.660865478,4.436162647,3.376576957,-0.879426069,2.079181246,2.720159303,4.84260924,0,5.252853031,0.819543936,5.176091259,2.474216264,3.966610987,3.428134794,3.788168371,2.800717078,0.987451293,0,0,0,0,0,0,0,0,0,0,5441,WYOMING,GEORGE WYO PAD,804,Flowback,141068,gal,liquid,41498,8/12/13,23800,0,0,5480,5770,0,148,174,426,4.76,23900,0,2180,0,111,447,75200,67900,171000,6.2,109000,546,34800,13600,4660,624,0,0,0,2013,8,12,GEORGE,WYO,PAD,0,0,802,Flowback,2012,10,23,131-20075,OGO-65420,41.633847,-76.161106,Yes,Horizontal Well,GAS,Bbl,2012,PW,0,2365212,229,0,0,2012.833333,0.833333333,7.467948718,4.376576957,0,3.738780558,3.761175813,2.170261715,2.240549248,2.629409599,4.378397901,3.338456494,0,2.045322979,2.650307523,4.876217841,4.831869774,5.23299611,0.792391689,5.037426498,2.737192643,4.541579244,4.133538908,3.668385917,2.79518459,0.873201327,0,0,0,0,0,0,0,0,0,0,5442,WYOMING,JACK WYO PAD,804,Flowback,14700,gal,liquid,41436,6/11/13,26600,0,3.55,4420,6770,0.569,342,133,481,8.88,22200,0,2270,3.07,29.9,392,57200,0,171000,5.7,110000,1470,8770,2260,4760,643,0,0,0,2013,6,11,JACK,WYO,PAD,0,0,802,Flowback,2010,8,22,131-20036,OGO-65420,41.596836,-76.16225,Yes,Horizontal Well,GAS,Bbl,2012,PW,0,2488683,210,0,0,2010.666667,2.833333333,7.402799378,4.424881637,0.550228353,3.645422269,3.830588669,2.534026106,2.123851641,2.682145076,4.346352974,3.356025857,0.487138375,1.475671188,2.593286067,4.757396029,0,5.23299611,0.755874856,5.041392685,3.167317335,3.942999593,3.354108439,3.677606953,2.808210973,0.86939598,0,0,0,0,0,0,0,0,0,0,5443,WYOMING,JACK WYO PAD,804,Flowback,42680,gal,liquid,41498,8/12/13,17100,0,0,3840,5050,0,166,122,363,4.63,17700,0,1900,0,76.9,348,53100,146000,136000,6.4,85400,493,20100,11200,5580,579,0,0,0,2013,8,12,JACK,WYO,PAD,0,0,802,Flowback,2010,8,22,131-20036,OGO-65420,41.596836,-76.16225,Yes,Horizontal Well,GAS,Bbl,2012,PW,0,2488683,210,0,0,2010.666667,3,9.637305699,4.23299611,0,3.584331224,3.703291378,2.220108088,2.086359831,2.559906625,4.247973266,3.278753601,0,1.88592634,2.541579244,4.725094521,5.164352856,5.133538908,0.806179974,4.931457871,2.692846919,4.303196057,4.049218023,3.746634199,2.762678564,0.983955635,0,0,0,0,0,0,0,0,0,0,5444,WYOMING,JOKAH WYO PAD,804,Flowback,105582,gal,liquid,41453,6/28/13,39400,0,8.28,10300,9510,0,53,268,722,3.57,37500,0,3900,0.254,80.8,610,87000,0,269000,6.3,184000,169,17700,4600,14000,1350,0,0,0,2013,6,28,JOKAH,WYO,PAD,0,0,802,Flowback,2011,11,29,131-20155,OGO-65420,41.590122,-76.182025,Yes,Horizontal Well,GAS,Bbl,2012,PW,0,1750750,194,0,0,2011.916667,1.583333333,10.37037037,4.595496222,0.918030337,4.012837225,3.978180517,1.72427587,2.428134794,2.858537198,4.574031268,3.591064607,-0.595166283,1.907411361,2.785329835,4.939519253,0,5.42975228,0.799340549,5.264817823,2.227886705,4.247973266,3.662757832,4.146128036,3.130333768,1.015794267,0,0,0,0,0,0,0,0,0,0,5445,WYOMING,JOKAH WYO PAD,804,Flowback,266749,gal,liquid,41500,8/14/13,27800,0,6.54,11900,9910,0,89.1,276,733,4.63,38300,0,4330,0,78.5,660,95600,0,266000,6.2,187000,106,21400,7110,12700,1520,0,0,0,2013,8,14,JOKAH,WYO,PAD,0,0,802,Flowback,2011,11,29,131-20155,OGO-65420,41.590122,-76.182025,Yes,Horizontal Well,GAS,Bbl,2012,PW,0,1750750,194,0,0,2011.916667,1.75,8.355263158,4.444044796,0.815577748,4.075546961,3.996073654,1.949877704,2.440909082,2.865103975,4.583198774,3.636487896,0,1.894869657,2.819543936,4.980457892,0,5.424881637,0.792391689,5.271841607,2.025305865,4.330413773,3.851869601,4.103803721,3.181843588,0.921960133,0,0,0,0,0,0,0,0,0,0,5446,WYOMING,KUPETSKY WYO PAD,804,Flowback,819303,gal,liquid,41598,11/20/13,18800,0,9.44,5170,6580,0,49.1,241,576,1.87,27400,0,2690,0,87.4,431,69000,0,202000,6.2,114000,70,11900,2650,10600,998,0,0,0,2013,11,20,KUPETSKY,WYO,PAD,0,0,802,Flowback,2013,3,11,131-20244,OGO-65420,41.628836,-75.878097,Yes,Horizontal Well,GAS,Bbl,Yes,PW,0,347373,53,0,0,2013.25,0.666666667,10.62124248,4.274157849,0.974971994,3.713490543,3.818225894,1.691081492,2.382017043,2.760422483,4.437750563,3.42975228,0,1.941511433,2.63447727,4.838849091,0,5.305351369,0.792391689,5.056904851,1.84509804,4.075546961,3.423245874,4.025305865,2.999130541,1.026175324,0,0,0,0,0,0,0,0,0,0,5447,WYOMING,KUPETSKY WYO PAD,804,Flowback,371388,gal,liquid,41624,12/16/13,20800,0,8.21,5840,7280,0,65.5,258,646,2.01,30900,0,2890,0,119,437,77000,0,239000,6.5,100000,66,42000,21900,14200,1120,0,0,0,2013,12,16,KUPETSKY,WYO,PAD,0,0,802,Flowback,2013,3,11,131-20244,OGO-65420,41.628836,-75.878097,Yes,Horizontal Well,GAS,Bbl,Yes,PW,0,347373,53,0,0,2013.25,0.75,12.67857143,4.318063335,0.914343157,3.766412847,3.862131379,1.8162413,2.411619706,2.810232518,4.489958479,3.460897843,0,2.075546961,2.640481437,4.886490725,0,5.378397901,0.812913357,5,1.819543936,4.62324929,4.340444115,4.152288344,3.049218023,1.103070322,0,0,0,0,0,0,0,0,0,0,5448,WYOMING,LOPATOFSKY WYO PAD,804,Flowback,92726,gal,liquid,41389,4/25/13,8070,0,4.84,2650,1480,0,46.5,106,137,1.61,11800,0,630,0.113,207,0,23900,30100,70700,6.9,48800,152,962,510,763,153,0,0,0,2013,4,25,LOPATOFSKY,WYO,PAD,0,0,802,Flowback,2011,1,3,117-20874,OGO-67805,41.773653,-77.243336,Yes,Vertical Well,GAS,Bbl,2012,PW,0,0,0,0,0,2011.083333,2.25,4.986928105,3.906873535,0.684845362,3.423245874,3.170261715,1.667452953,2.025305865,2.136720567,4.071882007,2.799340549,-0.946921557,2.315970345,0,4.378397901,4.478566496,4.849419414,0.838849091,4.688419822,2.181843588,2.983175072,2.707570176,2.882524538,2.184691431,0.697833107,0,0,0,0,0,0,0,0,0,0,5449,WYOMING,MCGRAW WYO PAD,804,Flowback,26231,gal,liquid,41403,5/9/13,3570,0,1.76,1130,610,0.0167,69.4,56.2,60.6,7.39,5850,0,297,0.137,174,0,11500,50300,37600,6.7,22900,171,1840,708,864,89.6,0,0,0,2013,5,9,MCGRAW,WYO,PAD,0,0,802,Flowback,2010,8,24,131-20033,OGO-65420,41.639275,-75.973297,Yes,Horizontal Well,GAS,Bbl,2012,PW,0,4089936,365,0,0,2010.666667,2.75,9.642857143,3.552668216,0.245512668,3.053078443,2.785329835,1.84135947,1.749736316,1.782472624,3.767155866,2.472756449,-0.863279433,2.240549248,0,4.06069784,4.701567985,4.575187845,0.826074803,4.359835482,2.23299611,3.264817823,2.850033258,2.936513742,1.95230801,0.984205733,0,0,0,0,0,0,0,0,0,0,5450,WYOMING,NICHOLSON WYO PAD,804,Flowback,21924,gal,liquid,41403,5/9/13,21000,0,5.87,5390,5120,0,61.1,201,458,5.13,25600,0,2120,0.251,91.8,0,52400,0,151000,6.5,109000,80.8,5180,2460,1840,656,0,0,0,2013,5,9,NICHOLSON,WYO,PAD,0,0,802,Flowback,2012,4,12,131-20234,OGO-65420,41.634503,-75.873264,Yes,Horizontal Well,GAS,Bbl,2012,PW,0,1758926,325,0,0,2012.333333,1.083333333,2.804878049,4.322219295,0.768638101,3.731588765,3.709269961,1.78604121,2.303196057,2.660865478,4.408239965,3.326335861,-0.600326279,1.962842681,0,4.719331287,0,5.178976947,0.812913357,5.037426498,1.907411361,3.71432976,3.390935107,3.264817823,2.816903839,0.447913984,0,0,0,0,0,0,0,0,0,0,5451,WYOMING,PENECALE WYO PAD,804,Flowback,1470,gal,liquid,41463,7/8/13,2860,0,1.98,889,667,0,47.9,38.8,47,1.27,4690,0,254,0.844,98.4,0,10400,92800,32800,6.8,18000,181,2260,1190,861,40.2,0,0,0,2013,7,8,PENECALE,WYO,PAD,0,0,802,Flowback,2011,4,19,131-20123,OGO-65420,41.568625,-76.181561,Yes,Horizontal Well,GAS,Bbl,2012,PW,0,607312,51,0,0,2011.333333,2.25,21.41791045,3.456366033,0.29666519,2.948901761,2.824125834,1.680335513,1.588831726,1.672097858,3.671172843,2.404833717,-0.073657553,1.992995098,0,4.017033339,4.967547976,4.515873844,0.832508913,4.255272505,2.257678575,3.354108439,3.075546961,2.935003151,1.604226053,1.330777098,0,0,0,0,0,0,0,0,0,0,5452,WYOMING,PENECALE WYO PAD,804,Flowback,4620,gal,liquid,41498,8/12/13,3350,0,0,1830,1200,0,53.7,67.5,84.2,2.3,7980,0,478,0,149,136,16900,81500,56000,7,31400,101,17.6,3.48,1390,169,0,0,0,2013,8,12,PENECALE,WYO,PAD,0,0,802,Flowback,2011,4,19,131-20123,OGO-65420,41.568625,-76.181561,Yes,Horizontal Well,GAS,Bbl,2012,PW,0,607312,51,0,0,2011.333333,2.333333333,8.224852071,3.525044807,0,3.26245109,3.079181246,1.729974286,1.829303773,1.925312091,3.902002891,2.679427897,0,2.173186268,2.133538908,4.227886705,4.911157609,4.748188027,0.84509804,4.496929648,2.004321374,1.245512668,0.541579244,3.1430148,2.227886705,0.915128096,0,0,0,0,0,0,0,0,0,0,5453,WYOMING,ROSALIE WYO PAD,804,Flowback,11340,gal,liquid,41436,6/11/13,34700,0,3.37,6580,8660,0.159,232,168,389,16.2,27700,0,2760,0.218,23,472,68600,0,209000,5.6,172000,63.2,8260,1960,6240,698,0,0,0,2013,6,11,ROSALIE,WYO,PAD,0,0,802,Flowback,2010,6,22,131-20030,OGO-65420,41.597944,-76.143172,Yes,Horizontal Well,GAS,Bbl,2012,PW,0,2364205,210,0,0,2010.5,3,8.93982808,4.540329475,0.527629901,3.818225894,3.937517892,2.365487985,2.225309282,2.589949601,4.442479769,3.440909082,-0.661543506,1.361727836,2.673941999,4.836324116,0,5.320146286,0.748188027,5.235528447,1.800717078,3.916980047,3.292256071,3.79518459,2.843855423,0.951329167,0,0,0,0,0,0,0,0,0,0,5454,WYOMING,ROSALIE WYO PAD,804,Flowback,79742,gal,liquid,41492,8/6/13,16400,0,3.93,3900,3630,0,272,135,240,3.6,12800,0,1080,0.508,74,300,42700,116000,134000,6.3,78400,454,11000,3940,2350,363,0,0,0,2013,8,6,ROSALIE,WYO,PAD,0,0,802,Flowback,2010,6,22,131-20030,OGO-65420,41.597944,-76.143172,Yes,Horizontal Well,GAS,Bbl,2012,PW,0,2364205,210,0,0,2010.5,3.166666667,6.473829201,4.214843848,0.59439255,3.591064607,3.559906625,2.434568904,2.130333768,2.380211242,4.10720997,3.033423755,-0.294136288,1.86923172,2.477121255,4.630427875,5.064457989,5.127104798,0.799340549,4.894316063,2.657055853,4.041392685,3.595496222,3.371067862,2.559906625,0.811161237,0,0,0,0,0,0,0,0,0,0,5455,WYOMING,SHAW WYO PAD,804,Flowback,114576,gal,liquid,41397,5/3/13,34700,0,6,7780,9140,0,87.8,221,687,3.23,31100,0,3380,0,101,620,71600,0,215000,6.4,164000,0,16500,2970,13700,1020,0,0,0,2013,5,3,SHAW,WYO,PAD,0,0,802,Flowback,2012,10,31,131-20077,OGO-65420,41.631133,-76.16805,Yes,Horizontal Well,GAS,Bbl,2012,PW,0,2891040,248,0,0,2012.833333,2.25,13.43137255,4.540329475,0.77815125,3.890979597,3.960946196,1.943494516,2.344392274,2.836956737,4.492760389,3.5289167,0,2.004321374,2.792391689,4.854913022,0,5.33243846,0.806179974,5.214843848,0,4.217483944,3.472756449,4.136720567,3.008600172,1.128120395,0,0,0,0,0,0,0,0,0,0,5456,WYOMING,SHAW WYO PAD,804,Flowback,217368,gal,liquid,41500,8/14/13,22900,0,0,7930,8150,0,141,200,615,4.8,29300,0,3130,0,80.5,573,74700,0,220000,6.1,152000,514,27100,6310,15300,946,0,0,0,2013,8,14,SHAW,WYO,PAD,0,0,802,Flowback,2012,10,31,131-20077,OGO-65420,41.631133,-76.16805,Yes,Horizontal Well,GAS,Bbl,2012,PW,0,2891040,248,0,0,2012.833333,2.5,16.17336152,4.359835482,0,3.899273187,3.911157609,2.149219113,2.301029996,2.788875116,4.46686762,3.495544338,0,1.90579588,2.758154622,4.873320602,0,5.342422681,0.785329835,5.181843588,2.710963119,4.432969291,3.800029359,4.184691431,2.975891136,1.208800294,0,0,0,0,0,0,0,0,0,0,5457,WYOMING,SLLUMBER VALLEY WYO PAD,804,Flowback,175864,gal,liquid,41410,5/16/13,7640,0,2.14,2720,1550,0,53.4,87.5,134,5.65,10100,0,719,0,149,0,23200,0,62400,6.8,42500,69.2,7560,3250,2860,219,0,0,0,2013,5,16,SLLUMBER,VALLEY,WYO,PAD,0,802,Flowback,0,0,0,0,0,0,0,0,0,0,0,0,0,0,0,0,0,0,0,0,13.05936073,3.883093359,0.330413773,3.434568904,3.190331698,1.727541257,1.942008053,2.127104798,4.004321374,2.85672889,0,2.173186268,0,4.365487985,0,4.79518459,0.832508913,4.62838893,1.840106094,3.878521796,3.511883361,3.456366033,2.340444115,1.115921918,0,0,0,0,0,0,0,0,0,0,5458,WYOMING,SMURKOSKI WYO PAD,804,Flowback,0,gal,liquid,41277,1/3/13,14900,0,4.18,4770,2660,0,86.9,141,245,3.14,16300,0,1140,4.26,189,0,40800,91500,95700,6.8,70200,88,3200,947,3490,293,0,0,0,2013,1,3,SMURKOSKI,WYO,PAD,0,0,802,Flowback,2012,2,20,131-20231,OGO-65420,41.632114,-76.063419,Yes,Horizontal Well,GAS,Bbl,2012,PW,0,2120786,322,0,0,2012.166667,0.916666667,11.9112628,4.173186268,0.621176282,3.678518379,3.424881637,1.939019776,2.149219113,2.389166084,4.212187604,3.056904851,0.629409599,2.276461804,0,4.610660163,4.961421094,4.980911938,0.832508913,4.846337112,1.944482672,3.505149978,2.976349979,3.542825427,2.46686762,1.075957807,0,0,0,0,0,0,0,0,0,0,5459,WYOMING,SMURKOSKI WYO PAD,804,Flowback,565378,gal,liquid,41446,6/21/13,4410,0,1.1,1620,903,0,14.1,50.9,77.3,2.67,5870,0,441,0,91,0,8630,0,46300,6.6,25200,24.8,869,265,953,91.7,0,0,0,2013,6,21,SMURKOSKI,WYO,PAD,0,0,802,Flowback,2012,2,20,131-20231,OGO-65420,41.632114,-76.063419,Yes,Horizontal Well,GAS,Bbl,2012,PW,0,2120786,322,0,0,2012.166667,1.333333333,10.39258451,3.644438589,0.041392685,3.209515015,2.95568775,1.149219113,1.706717782,1.888179494,3.768638101,2.644438589,0,1.959041392,0,3.936010796,0,4.665580991,0.819543936,4.401400541,1.394451681,2.939019776,2.423245874,2.979092901,1.962369336,1.016723565,0,0,0,0,0,0,0,0,0,0,5460,WYOMING,TIFFANY WYO WELL,804,Flowback,83682,gal,liquid,41397,5/3/13,43200,0,6.26,8440,9950,0,89.1,255,755,4.1,34500,0,3770,0,113,686,85700,0,238000,6.4,203000,144,11200,2390,8900,1090,0,0,0,2013,5,3,TIFFANY,WYO,WELL,0,0,802,Flowback,2012,7,5,131-20051,OGO-65420,41.626953,-76.177425,Yes,Horizontal Well,GAS,Bbl,2012,PW,0,2532572,248,0,0,2012.583333,0.833333333,8.165137615,4.635483747,0.796574333,3.926342447,3.997823081,1.949877704,2.40654018,2.877946952,4.537819095,3.57634135,0,2.053078443,2.836324116,4.932980822,0,5.376576957,0.806179974,5.307496038,2.158362492,4.049218023,3.378397901,3.949390007,3.037426498,0.911963509,0,0,0,0,0,0,0,0,0,0,5461,WYOMING,TIFFANY WYO WELL,804,Flowback,221829,gal,liquid,41492,8/6/13,46300,0,5.41,11400,11300,0,176,290,827,6.33,35600,0,4700,0,115,728,153000,0,305000,6.1,186000,377,25700,15900,8900,1330,0,0,0,2013,8,6,TIFFANY,WYO,WELL,0,0,802,Flowback,2012,7,5,131-20051,OGO-65420,41.626953,-76.177425,Yes,Horizontal Well,GAS,Bbl,2012,PW,0,2532572,248,0,0,2012.583333,1.083333333,6.691729323,4.665580991,0.733197265,4.056904851,4.053078443,2.245512668,2.462397998,2.91750551,4.551449998,3.672097858,0,2.06069784,2.862131379,5.184691431,0,5.484299839,0.785329835,5.269512944,2.57634135,4.409933123,4.201397124,3.949390007,3.123851641,0.825538366,0,0,0,0,0,0,0,0,0,0,5462,WYOMING,VANDEMARK WYO PAD,804,Flowback,293704,gal,liquid,41583,11/5/13,14600,0,6.05,5220,5210,0,52.5,177,381,3.55,24700,0,1990,0,113,417,55000,0,170000,6.5,110000,338,19500,5530,3260,638,0,0,0,2013,11,5,VANDEMARK,WYO,PAD,0,0,802,Flowback,2010,7,31,131-20060,OGO-65420,41.626261,-76.188025,Yes,Horizontal Well,GAS,Bbl,2012,PW,0,564867,60,0,0,2010.583333,3.333333333,5.109717868,4.164352856,0.781755375,3.717670503,3.716837723,1.720159303,2.247973266,2.580924976,4.392696953,3.298853076,0,2.053078443,2.620136055,4.740362689,0,5.230448921,0.812913357,5.041392685,2.5289167,4.290034611,3.742725131,3.5132176,2.804820679,0.708396921,0,0,0,0,0,0,0,0,0,0,5463,WYOMING,VANDEMARK WYO PAD,804,Flowback,66515,gal,liquid,41614,12/6/13,26900,0,6.23,7540,9660,0,57.9,273,673,5.5,24500,0,3140,0,73.2,717,86000,0,297000,6.2,140000,79,11900,5350,5250,1090,0,0,0,2013,12,6,VANDEMARK,WYO,PAD,0,0,802,Flowback,2010,7,31,131-20060,OGO-65420,41.626261,-76.188025,Yes,Horizontal Well,GAS,Bbl,2012,PW,0,564867,60,0,0,2010.583333,3.416666667,4.816513761,4.42975228,0.794488047,3.877371346,3.984977126,1.762678564,2.436162647,2.828015064,4.389166084,3.496929648,0,1.864511081,2.855519156,4.934498451,0,5.472756449,0.792391689,5.146128036,1.897627091,4.075546961,3.728353782,3.720159303,3.037426498,0.682732805,0,0,0,0,0,0,0,0,0,0,5464,WYOMING,WARREN WYO PAD,804,Flowback,88974,gal,liquid,41436,6/11/13,75000,0,4.43,10400,18700,0.669,269,272,1140,12.7,31700,0,5340,0.9,88.1,850,128000,0,388000,6.1,281000,563,16700,5060,12300,1650,0,0,0,2013,6,11,WARREN,WYO,PAD,0,0,802,Flowback,2010,12,20,131-20082,OGO-65420,41.596897,-76.174358,Yes,Horizontal Well,GAS,Bbl,Yes,PW,0,2538632,209,0,0,2011,2.5,7.454545455,4.875061263,0.646403726,4.017033339,4.271841607,2.42975228,2.434568904,3.056904851,4.501059262,3.727541257,-0.045757491,1.944975908,2.929418926,5.10720997,0,5.588831726,0.785329835,5.44870632,2.750508395,4.222716471,3.704150517,4.089905111,3.217483944,0.872421167,0,0,0,0,0,0,0,0,0,0,5465,ARMSTRONG,EDWIN C Rosborough,802,Drill pit fluid,0,0,liquid,40403,8/13/10,640,0.0466,0.74,26.7,213,0.02,3.15,12.4,11.3,1.03,13000,0.0043,5.17,0.0025,554,10,22800,2520,69400,7.7,33500,2,170,390,0,0,0,0,0,2010,8,13,EDWIN,C,ROSBOROUGH,0,0,803,DrillFluid,2010,5,9,005-30588,OGO-61555,40.677947,-79.381414,Yes,Horizontal Well,GAS,Bbl,Yes,PW,0,167707,85,0,85,2010.416667,0.25,0,2.806179974,-0.13076828,1.426511261,2.328379603,0.498310554,1.093421685,1.053078443,4.113943352,0.713490543,-2.602059991,2.743509765,1,4.357934847,3.401400541,4.84135947,0.886490725,4.525044807,0.301029996,2.230448921,2.591064607,0,0,0,0,0,0,0,0,0,0,0,0,0,3466,ARMSTRONG,EDWIN C Rosborough,802,PW,0,0,liquid,40499,11/17/10,25000,0.1,21.6,1220,6870,0.25,189,92.2,613,3.56,25000,0.05,1500,0.432,220,503,56300,11800,201000,6.6,100000,725,12300,1440,0,0,0,0,0,2010,11,17,EDWIN,C,ROSBOROUGH,0,0,802,PW,2010,5,9,005-30588,OGO-61555,40.677947,-79.381414,Yes,Horizontal Well,GAS,Bbl,Yes,Yes,410,167707,85,0,85,2010.416667,0.5,0,4.397940009,1.334453751,3.086359831,3.836956737,2.276461804,1.964730921,2.787460475,4.397940009,3.176091259,-0.364516253,2.342422681,2.701567985,4.750508395,4.071882007,5.303196057,0.819543936,5,2.860338007,4.089905111,3.158362492,0,0,0,0,0,0,0,0,0,0,0,0,0,4468,ARMSTRONG,EDWIN C Rosborough,802,Drill pit fluid,0,0,liquid,40113,10/27/09,3400,0.663,1.28,1200,1140,3.07,319,10.3,0.961,62.9,0.0192,0.0107,91,22,5,7.5,25300,3620,17000000,6.1,893,0.0089,0,0,0,0,0,0,0,2009,10,27,EDWIN,C,ROSBOROUGH,0,0,803,DrillFluid,2010,5,9,005-30588,OGO-61555,40.677947,-79.381414,Yes,Horizontal Well,GAS,Bbl,2010,PW,0,0,0,0,0,2010.416667,-0.583333333,0,3.531478917,0.10720997,3.079181246,3.056904851,2.503790683,1.012837225,-0.017276612,-1.716698771,1.959041392,1.342422681,0.698970004,0.875061263,4.403120521,3.558708571,7.230448921,0.785329835,2.950851459,-2.050609993,0,0,0,0,0,0,0,0,0,0,0,0,0,0,0,3469,CAMERON,Whippoorwill,802,Brine,2890902,gal,liquid,41957,11/14/14,96700,0.622,19.1,4300,35000,3.64,111,208,2250,17.9,67800,7.09,6020,2.62,32,1570,240000,10700,236000,5.71,311000,1280,83620,22130,23800,2590,24.1,16.2,0,2014,11,14,WHIPPOORWILL,0,0,0,0,802,Brine,2013,12,12,023-20139,OGO-61555,41.425239,-78.299089,Yes,Horizontal Well,GAS,Bbl,Yes,PW,0,346125,84,0,0,2014,0.916666667,9.189189189,4.985426474,1.281033367,3.633468456,4.544068044,2.045322979,2.318063335,3.352182518,4.831229694,3.779596491,0.418301291,1.505149978,3.195899652,5.380211242,4.029383778,5.372912003,0.756636108,5.492760389,3.10720997,4.922310163,4.344981414,4.376576957,3.413299764,0.963277193,0,0,0,0,0,0,0,0,0,0,1470,CLEARFIELD,Frano,802,Brine,0,0,liquid,41962,11/19/14,65200,0.445,17.3,3950,23400,2.98,148,147,1660,6.81,49500,4.06,5150,0,106,1270,154000,12700,223000,6.04,186000,1230,24490,4245,16400,2250,121,0,0,2014,11,19,FRANO,0,0,0,0,802,Brine,0,0,0,0,0,0,0,0,0,0,0,0,0,0,0,0,0,0,0,0,7.288888889,4.814247596,1.238046103,3.596597096,4.369215857,2.170261715,2.167317335,3.220108088,4.694605199,3.711807229,0,2.025305865,3.103803721,5.187520721,4.103803721,5.348304863,0.781036939,5.269512944,3.089905111,4.388988785,3.627877695,4.214843848,3.352182518,0.86266133,0,0,0,0,0,0,0,0,0,0,1471,CLEARFIELD,Hurd,802,Brine,787710,gal,liquid,41962,11/19/14,63700,0.531,19.9,3180,22900,2.85,181,124,1610,6.3,46800,4.01,0,0,90,1240,166000,17700,228000,5.69,211000,1720,14490,4399,9410,2260,134,0,0,2014,11,19,HURD,0,0,0,0,802,Brine,2009,9,18,033-26828,OGO-61555,40.850322,-78.659939,Yes,Horizontal Well,GAS,Bbl,2011,PW,0,177918,365,0,0,2009.75,5.166666667,4.163716814,4.804139432,1.298853076,3.50242712,4.359835482,2.257678575,2.093421685,3.206825876,4.670245853,0,0,1.954242509,3.093421685,5.220108088,4.247973266,5.357934847,0.755112266,5.324282455,3.235528447,4.161068385,3.643353962,3.973589623,3.354108439,0.619481184,0,0,0,0,0,0,0,0,0,0,1472,CLEARFIELD,Monarch,802,Brine,0,0,liquid,41962,11/19/14,93200,0.824,12.3,2570,3350,3.76,99.5,171,2340,12.7,50700,6.57,6880,0,56,1440,188000,13800,227000,5.96,212000,1810,25920,3796,15100,2120,40,0,0,2014,11,19,MONARCH,0,0,0,0,802,Brine,0,0,0,0,0,0,0,0,0,0,0,0,0,0,0,0,0,0,0,0,7.122641509,4.969415912,1.089905111,3.409933123,3.525044807,1.997823081,2.23299611,3.369215857,4.705007959,3.837588438,0,1.748188027,3.158362492,5.274157849,4.139879086,5.356025857,0.77524626,5.326335861,3.257678575,4.413634997,3.579326204,4.178976947,3.326335861,0.852641086,0,0,0,0,0,0,0,0,0,0,1473,CLEARFIELD,Turkey,802,Brine,0,0,liquid,41962,11/19/14,76100,0.595,13.3,6170,27700,3.11,131,161,1680,16.1,43600,4.88,5860,1.06,104,1460,181000,16900,223000,5.91,245000,1130,40320,6154,22300,2340,41.8,0,0,2014,11,19,TURKEY,0,0,0,0,802,Brine,2011,9,25,033-27049,OGO-61555,41.173775,-78.572831,Yes,Horizontal Well,GAS,Bbl,2013,PW,0,420927,137,0,0,2011.75,3.166666667,9.52991453,4.881384657,1.123851641,3.790285164,4.442479769,2.117271296,2.206825876,3.225309282,4.639486489,3.767897616,0.025305865,2.017033339,3.164352856,5.257678575,4.227886705,5.348304863,0.771587481,5.389166084,3.053078443,4.605520523,3.789157492,4.348304863,3.369215857,0.979089006,0,0,0,0,0,0,0,0,0,0,1474,CLEARFIELD,Drill pit fluid,802,Drill pit fluid,0,0,liquid,40499,11/17/10,580,0.0335,0.362,5.18,186,0.25,1,0.242,15.1,4.76,8030,0.05,5.2,0.0756,568,5.1,13200,1420,45300,7.1,21700,13.2,80,170,0,0,0,0,0,2010,11,17,DRILL,PIT,FLUID,0,0,803,DrillFluid,0,0,0,0,0,0,0,0,0,0,0,0,0,0,0,0,0,0,0,0,0,2.763427994,-0.441291429,0.71432976,2.269512944,0,-0.616184634,1.178976947,3.904715545,0.716003344,-1.121478204,2.754348336,0.707570176,4.120573931,3.152288344,4.656098202,0.851258349,4.336459734,1.120573931,1.903089987,2.230448921,0,0,0,0,0,0,0,0,0,0,0,0,0,3475,CLEARFIELD,Flow back,802,Flow back,0,0,liquid,40499,11/17/10,1320,0.1,1.51,9.92,373,0.25,6.8,3.2,44.3,0.646,1570,0.05,117,0.0662,103,28,3490,286,12300,7.4,6740,25.6,49,21,0,0,0,0,0,2010,11,17,FLOW,BACK,0,0,0,802,Flowback,0,0,0,0,0,0,0,0,0,0,0,0,0,0,0,0,0,0,0,0,0,3.120573931,0.178976947,0.996511672,2.571708832,0.832508913,0.505149978,1.646403726,3.195899652,2.068185862,-1.179142011,2.012837225,1.447158031,3.542825427,2.456366033,4.089905111,0.86923172,3.828659897,1.408239965,1.69019608,1.322219295,0,0,0,0,0,0,0,0,0,0,0,0,0,5476,CLEARFIELD,Drill pit fluid,802,Drill pit fluid,0,0,liquid,40113,10/27/09,3400,0.663,1.28,1200,1140,0.5,319,10.3,0.961,62.9,0.0192,0.0107,91,22,5,7.1,25300,3620,1700000,6.1,893,0.0089,0,0,0,0,0,0,0,2009,10,27,DRILL,PIT,FLUID,0,0,803,DrillFluid,0,0,0,0,0,0,0,0,0,0,0,0,0,0,0,0,0,0,0,0,0,3.531478917,0.10720997,3.079181246,3.056904851,2.503790683,1.012837225,-0.017276612,-1.716698771,1.959041392,1.342422681,0.698970004,0.851258349,4.403120521,3.558708571,6.230448921,0.785329835,2.950851459,-2.050609993,0,0,0,0,0,0,0,0,0,0,0,0,0,0,0,3477,GREENE,Adamson B,802,Flowback,0,0,liquid,39856,2/12/09,230,0.01,0.109,0.11,52.7,0.0286,1.72,0.0175,16.7,0.146,321,0.005,0.789,0.0436,120,1,234,3450,1970,7.1,1410,16,0,0,0,0,0,0,0,2012,2,12,ADAMSON,B,0,0,0,802,Flowback,2011,3,28,059-25619,OGO-61555,39.968861,-80.118194,Yes,Horizontal Well,GAS,Bbl,2011,PW,0,0,0,0,0,2011.25,0.916666667,0,2.361727836,-0.962573502,-0.958607315,1.721810615,0.235528447,-1.756961951,1.222716471,2.506505032,-0.102922997,-1.360513511,2.079181246,0,2.369215857,3.537819095,3.294466226,0.851258349,3.149219113,1.204119983,0,0,0,0,0,0,0,0,0,0,0,0,0,0,0,5478,GREENE,Adamson B,802,Flowback,0,0,liquid,39857,2/13/09,1500,0.0175,5.42,7.62,297,0.0225,14.7,4.35,40.8,1.15,2860,0.0043,24.1,0.248,577,35.5,4900,1290,19200,7.7,9020,23.2,0,0,0,0,0,0,0,2012,2,13,ADAMSON,B,0,0,0,802,Flowback,2011,3,28,059-25619,OGO-61555,39.968861,-80.118194,Yes,Horizontal Well,GAS,Bbl,2011,PW,0,0,0,0,0,2011.25,0.916666667,0,3.176091259,0.733999287,0.881954971,2.472756449,1.167317335,0.638489257,1.610660163,3.456366033,1.382017043,-0.605548319,2.761175813,1.550228353,3.69019608,3.11058971,4.283301229,0.886490725,3.955206538,1.365487985,0,0,0,0,0,0,0,0,0,0,0,0,0,0,0,5479,GREENE,Adamson B,802,Flowback,0,0,liquid,39861,2/17/09,8400,0.0929,12.2,165,2260,2.28,140,21.4,291,3.29,12900,0.025,345,2.93,266,242,26800,6970,122000,6.6,40700,3220,0,0,0,0,0,0,0,2012,2,17,ADAMSON,B,0,0,0,802,Flowback,2011,3,28,059-25619,OGO-61555,39.968861,-80.118194,Yes,Horizontal Well,GAS,Bbl,2011,PW,0,0,0,0,0,2011.25,0.916666667,0,3.924279286,1.086359831,2.217483944,3.354108439,2.146128036,1.330413773,2.463892989,4.11058971,2.537819095,0.46686762,2.424881637,2.383815366,4.428134794,3.843232778,5.086359831,0.819543936,4.609594409,3.507855872,0,0,0,0,0,0,0,0,0,0,0,0,0,0,0,5480,GREENE,Adamson B,802,Flowback,0,0,liquid,39896,3/24/09,140,0.1,6.23,0.6,33.1,0.0901,4.6,0.0436,7.82,0.191,0,0,0,0,1230,0.2,338,705,1630,50,108,83,0,0,0,0,0,0,0,2012,3,24,ADAMSON,B,0,0,0,802,Flowback,2011,3,28,059-25619,OGO-61555,39.968861,-80.118194,Yes,Horizontal Well,GAS,Bbl,2011,PW,0,0,0,0,0,2011.25,1,0,2.146128036,0.794488047,-0.22184875,1.519827994,0.662757832,-1.360513511,0.893206753,0,0,0,3.089905111,-0.698970004,2.5289167,2.848189117,3.212187604,1.698970004,2.033423755,1.919078092,0,0,0,0,0,0,0,0,0,0,0,0,0,0,0,5481,GREENE,Adamson B,802,Flowback,0,0,liquid,39900,3/28/09,140,0.1,12.8,0.15,32.5,0.25,30.2,0.0363,8.53,0.598,0,0,0,0,1010,0.2,39.6,506,532,50,181,25,0,0,0,0,0,0,0,2012,3,28,ADAMSON,B,0,0,0,802,Flowback,2011,3,28,059-25619,OGO-61555,39.968861,-80.118194,Yes,Horizontal Well,GAS,Bbl,2011,PW,0,0,0,0,0,2011.25,1,0,2.146128036,1.10720997,-0.823908741,1.511883361,1.480006943,-1.440093375,0.930949031,0,0,0,3.004321374,-0.698970004,1.597695186,2.704150517,2.725911632,1.698970004,2.257678575,1.397940009,0,0,0,0,0,0,0,0,0,0,0,0,0,0,0,5482,GREENE,Adamson B,802,Flowback,0,0,liquid,39904,4/1/09,1060,0.1,0.414,2.21,227,0.25,1.18,0.808,49.4,0.189,1460,0.05,23.2,0.2,308,32.8,3580,996,4980,7,5910,1040,0,0,0,0,0,0,0,2012,4,1,ADAMSON,B,0,0,0,802,Flowback,2011,3,28,059-25619,OGO-61555,39.968861,-80.118194,Yes,Horizontal Well,GAS,Bbl,2011,PW,0,0,0,0,0,2011.25,1.083333333,0,3.025305865,-0.382999659,0.344392274,2.356025857,0.071882007,-0.092588639,1.693726949,3.164352856,1.365487985,-0.698970004,2.488550717,1.515873844,3.553883027,2.998259338,3.697229343,0.84509804,3.771587481,3.017033339,0,0,0,0,0,0,0,0,0,0,0,0,0,0,0,5483,GREENE,Adamson B,802,Flowback,0,0,liquid,39904,4/1/09,6700,0.0262,16.8,13,1860,0.25,17.5,19.2,201,1.16,0,0,0,0,40400,262,24900,1380,223000,50,148,15,0,0,0,0,0,0,0,2012,4,1,ADAMSON,B,0,0,0,802,Flowback,2011,3,28,059-25619,OGO-61555,39.968861,-80.118194,Yes,Horizontal Well,GAS,Bbl,2011,PW,0,0,0,0,0,2011.25,1.083333333,0,3.826074803,1.225309282,1.113943352,3.269512944,1.243038049,1.283301229,2.303196057,0,0,0,4.606381365,2.418301291,4.396199347,3.139879086,5.348304863,1.698970004,2.170261715,1.176091259,0,0,0,0,0,0,0,0,0,0,0,0,0,0,0,5484,GREENE,Adamson B,802,Flowback,0,0,liquid,39906,4/3/09,4700,0.1,8.36,26.7,1030,0.25,12.4,11.8,131,0.782,7540,0.05,139,0.406,278,172,16900,1330,68400,6.9,28900,7,0,0,0,0,0,0,0,2012,4,3,ADAMSON,B,0,0,0,802,Flowback,2011,3,28,059-25619,OGO-61555,39.968861,-80.118194,Yes,Horizontal Well,GAS,Bbl,2011,PW,0,0,0,0,0,2011.25,1.083333333,0,3.672097858,0.922206277,1.426511261,3.012837225,1.093421685,1.071882007,2.117271296,3.877371346,2.1430148,-0.391473966,2.444044796,2.235528447,4.227886705,3.123851641,4.835056102,0.838849091,4.460897843,0.84509804,0,0,0,0,0,0,0,0,0,0,0,0,0,0,0,5485,GREENE,Adamson B,802,Flowback,0,0,liquid,39910,4/7/09,20000,0.0354,14.4,434,4950,0.25,28.2,34.6,559,2.63,21300,0.05,650,0.264,135,536,48900,17700,183000,6.5,55100,47,0,0,0,0,0,0,0,2012,4,7,ADAMSON,B,0,0,0,802,Flowback,2011,3,28,059-25619,OGO-61555,39.968861,-80.118194,Yes,Horizontal Well,GAS,Bbl,2011,PW,0,0,0,0,0,2011.25,1.083333333,0,4.301029996,1.158362492,2.63748973,3.694605199,1.450249108,1.539076099,2.747411808,4.328379603,2.812913357,-0.578396073,2.130333768,2.72916479,4.689308859,4.247973266,5.26245109,0.812913357,4.741151599,1.672097858,0,0,0,0,0,0,0,0,0,0,0,0,0,0,0,5486,GREENE,Adamson B,802,Flowback,0,0,liquid,39920,4/17/09,39200,0.0508,16.8,1010,9600,0.25,74.8,56.1,1000,5.17,32600,0.0301,1370,0.2,87.9,880,76800,4670,256000,6,124000,1100,0,0,0,0,0,0,0,2012,4,17,ADAMSON,B,0,0,0,802,Flowback,2011,3,28,059-25619,OGO-61555,39.968861,-80.118194,Yes,Horizontal Well,GAS,Bbl,2011,PW,0,0,0,0,0,2011.25,1.083333333,0,4.593286067,1.225309282,3.004321374,3.982271233,1.873901598,1.748962861,3,4.5132176,3.136720567,-0.698970004,1.943988875,2.944482672,4.88536122,3.669316881,5.408239965,0.77815125,5.093421685,3.041392685,0,0,0,0,0,0,0,0,0,0,0,0,0,0,0,5487,GREENE,Adamson B,802,PW,0,0,liquid,39912,4/9/09,20000,0.1,16.9,306,4490,0.25,34,34.9,472,2.41,0,0,0,0,83100,522,46500,3040,635000,29,131,14,0,0,0,0,0,0,0,2012,4,9,ADAMSON,B,0,0,0,802,PW,2011,3,28,059-25619,OGO-61555,39.968861,-80.118194,Yes,Horizontal Well,GAS,Bbl,2011,Yes,0,0,0,0,0,2011.25,1.083333333,0,4.301029996,1.227886705,2.485721426,3.652246341,1.531478917,1.542825427,2.673941999,0,0,0,4.919601024,2.717670503,4.667452953,3.482873584,5.802773725,1.462397998,2.117271296,1.146128036,0,0,0,0,0,0,0,0,0,0,0,0,0,0,0,4488,GREENE,Adamson B,802,PW,0,0,liquid,39920,4/17/09,106000,0.1,18.6,2110,19400,0.25,144,112,1810,10.4,47700,0.05,2870,0.147,40.3,1430,121000,8570,468000,5.9,199000,237,0,0,0,0,0,0,0,2012,4,17,ADAMSON,B,0,0,0,802,PW,2011,3,28,059-25619,OGO-61555,39.968861,-80.118194,Yes,Horizontal Well,GAS,Bbl,2011,Yes,0,0,0,0,0,2011.25,1.083333333,0,5.025305865,1.269512944,3.324282455,4.28780173,2.158362492,2.049218023,3.257678575,4.678518379,3.457881897,-0.832682665,1.605305046,3.155336037,5.08278537,3.932980822,5.670245853,0.770852012,5.298853076,2.374748346,0,0,0,0,0,0,0,0,0,0,0,0,0,0,0,4489,GREENE,Adamson B,802,PW,0,0,liquid,39946,5/13/09,40000,0.054,13,1440,8500,0.25,87.8,44.5,933,4.72,26900,0.05,1220,0.0293,75.2,766,78300,8590,249000,6.2,155000,153,0,0,0,0,0,0,0,2012,5,13,ADAMSON,B,0,0,0,802,PW,2011,3,28,059-25619,OGO-61555,39.968861,-80.118194,Yes,Horizontal Well,GAS,Bbl,2011,Yes,0,0,0,0,0,2011.25,1.166666667,0,4.602059991,1.113943352,3.158362492,3.929418926,1.943494516,1.648360011,2.969881644,4.42975228,3.086359831,-1.53313238,1.876217841,2.88422877,4.893761762,3.933993164,5.396199347,0.792391689,5.190331698,2.184691431,0,0,0,0,0,0,0,0,0,0,0,0,0,0,0,4490,INDIANA,B.R. Loughry,802,PW,0,0,liquid,40499,11/17/10,36000,0.1,16.3,2610,10300,0.25,121,89.9,914,3.78,28000,0.05,2440,0.11,0.141,624,68900,7770,245000,6.6,94400,97,16600,4790,0,0,0,0,0,2012,11,17,B.R.,LOUGHRY,0,0,0,802,PW,0,0,0,0,0,0,0,0,0,0,0,0,0,0,0,0,0,0,0,0,0,4.556302501,1.212187604,3.416640507,4.012837225,2.08278537,1.953759692,2.960946196,4.447158031,3.387389826,-0.958607315,-0.850780887,2.79518459,4.838219222,3.890421019,5.389166084,0.819543936,4.974971994,1.986771734,4.220108088,3.680335513,0,0,0,0,0,0,0,0,0,0,0,0,0,4491,TIOGA,Phoenix E,802,Brine,2185260,gal,liquid,42276,9/29/15,55000,2.19,6.29,14900,19600,0,86.1,196,1490,5.13,45000,0,5530,0,42,1160,134000,10500,212000,5.99,206000,246,44350,0,33023,1696.3,11.2,26.3,0,2015,9,29,PHOENIX,E,0,0,0,802,Brine,2011,4,11,117-20725,OGO-61555,41.645292,-77.290619,Yes,Horizontal Well,GAS,Bbl,2012,PW,0,347259,231,0,0,2011.333333,4.416666667,19.46766492,4.740362689,0.798650645,4.173186268,4.292256071,1.935003151,2.292256071,3.173186268,4.653212514,3.742725131,0,1.62324929,3.064457989,5.127104798,4.021189299,5.326335861,0.777426822,5.31386722,2.390935107,4.646893624,0,4.518816525,3.229502662,1.289313862,0,0,0,0,0,0,0,0,0,0,1492,TIOGA,Phoenix C,802,Brine,0,0,liquid,41957,11/14/14,63100,0.747,0,13400,22700,2.38,138,161,1570,7.63,42200,3.79,6100,0,86,1070,127000,7460,205000,6.11,182000,944,44210,11730,14800,1800,16.7,0.4,0,2014,11,14,PHOENIX,C,0,0,0,802,Brine,2011,4,11,117-20725,OGO-61555,41.645292,-77.290619,Yes,Horizontal Well,GAS,Bbl,2012,PW,0,543009,365,0,0,2011.333333,3.583333333,8.222222222,4.800029359,0,4.127104798,4.356025857,2.139879086,2.206825876,3.195899652,4.625312451,3.785329835,0,1.934498451,3.029383778,5.103803721,3.872738827,5.311753861,0.78604121,5.260071388,2.974971994,4.645520515,4.069298012,4.170261715,3.255272505,0.91498921,0,0,0,0,0,0,0,0,0,0,1493,TIOGA,Phoenix R,802,Brine,0,0,liquid,41957,11/14/14,75500,1.28,6.59,16600,26800,2.78,147,194,2120,9.44,44000,5.43,6970,0,38,1070,126000,7140,213000,5.82,214000,560,100500,27110,31100,1840,33.3,2.3,0,2014,11,14,PHOENIX,R,0,0,0,802,Brine,2011,4,11,117-20725,OGO-61555,41.645292,-77.290619,Yes,Horizontal Well,GAS,Bbl,2012,PW,0,543009,365,0,0,2011.333333,3.583333333,16.90217391,4.877946952,0.818885415,4.220108088,4.428134794,2.167317335,2.28780173,3.326335861,4.643452676,3.843232778,0,1.579783597,3.029383778,5.100370545,3.853698212,5.328379603,0.764922985,5.330413773,2.748188027,5.002166062,4.433129518,4.492760389,3.264817823,1.227942566,0,0,0,0,0,0,0,0,0,0,1494,TIOGA,Phoenix S,802,Brine,8003973,gal,liquid,41957,11/14/14,62200,1.11,5.07,17100,22100,2.42,111,184,1730,7.2,43100,3.45,6150,0,72,1090,131000,10300,212000,6.02,225000,896,86170,27140,28500,2080,45.7,2.4,0,2014,11,14,PHOENIX,S,0,0,0,802,Brine,2011,4,11,117-20725,OGO-61555,41.645292,-77.290619,Yes,Horizontal Well,GAS,Bbl,2012,PW,0,543009,365,0,0,2011.333333,3.583333333,13.70192308,4.793790385,0.705007959,4.23299611,4.344392274,2.045322979,2.264817823,3.238046103,4.63447727,3.788875116,0,1.857332496,3.037426498,5.117271296,4.012837225,5.326335861,0.779596491,5.352182518,2.95230801,4.935356093,4.433609843,4.45484486,3.318063335,1.136781525,0,0,0,0,0,0,0,0,0,0,1495,WASHINGTON,0,802,Flowback,0,0,liquid,39839,1/26/09,9500,0.0091,2.14,9.81,2990,0.021,11.6,14.9,235,3.64,6190,0.005,439,0.117,121,107,10700,1730,34600,7.6,27800,790,0,0,0,0,0,0,0,2009,1,26,0,0,0,0,0,802,Flowback,0,0,0,0,0,0,0,0,0,0,0,0,0,0,0,0,0,0,0,0,0,3.977723605,0.330413773,0.991669007,3.475671188,1.064457989,1.173186268,2.371067862,3.791690649,2.64246452,-0.931814138,2.08278537,2.029383778,4.029383778,3.238046103,4.539076099,0.880813592,4.444044796,2.897627091,0,0,0,0,0,0,0,0,0,0,0,0,0,0,0,5496,WASHINGTON,0,802,Flowback,0,0,liquid,39842,1/29/09,4700,0.0135,9.26,3.57,1370,0.025,6.03,13.9,153,1.06,6370,0.005,167,0.0869,226,120,10500,1340,48800,7.8,22400,81,0,0,0,0,0,0,0,2009,1,29,0,0,0,0,0,802,Flowback,0,0,0,0,0,0,0,0,0,0,0,0,0,0,0,0,0,0,0,0,0,3.672097858,0.966610987,0.552668216,3.136720567,0.780317312,1.1430148,2.184691431,3.804139432,2.222716471,-1.060980224,2.354108439,2.079181246,4.021189299,3.127104798,4.688419822,0.892094603,4.350248018,1.908485019,0,0,0,0,0,0,0,0,0,0,0,0,0,0,0,5497,WASHINGTON,0,802,Flowback,0,0,liquid,39846,2/2/09,26400,0.05,14.3,21.4,7630,0.125,20.4,49.1,817,4.22,22000,0.025,1080,0.0849,97.6,544,50000,6120,175000,6.6,87800,35.6,0,0,0,0,0,0,0,2009,2,2,0,0,0,0,0,802,Flowback,0,0,0,0,0,0,0,0,0,0,0,0,0,0,0,0,0,0,0,0,0,4.421603927,1.155336037,1.330413773,3.882524538,1.309630167,1.691081492,2.912222057,4.342422681,3.033423755,-1.07109231,1.989449818,2.7355989,4.698970004,3.786751422,5.243038049,0.819543936,4.943494516,1.551449998,0,0,0,0,0,0,0,0,0,0,0,0,0,0,0,5498,WASHINGTON,0,802,Flowback,0,0,liquid,39854,2/10/09,43500,0.0126,16.2,74.2,12500,0.125,54.2,73.7,1330,7.09,32500,0.025,1850,0.0668,53.2,849,78600,4340,284000,5.5,112000,17,0,0,0,0,0,0,0,2009,2,10,0,0,0,0,0,802,Flowback,0,0,0,0,0,0,0,0,0,0,0,0,0,0,0,0,0,0,0,0,0,4.638489257,1.209515015,1.870403905,4.096910013,1.733999287,1.867467488,3.123851641,4.511883361,3.267171728,-1.175223538,1.725911632,2.92890769,4.895422546,3.63748973,5.45331834,0.740362689,5.049218023,1.230448921,0,0,0,0,0,0,0,0,0,0,0,0,0,0,0,5499,WASHINGTON,0,802,Flowback,0,0,liquid,39896,3/24/09,190,0.1,0.122,0.09,59.5,0.0493,2.44,0.0301,7.91,0.14,25.7,0.05,0.303,0.0595,126,0.2,30.7,851,476,7,462,90,0,0,0,0,0,0,0,2009,3,24,0,0,0,0,0,802,Flowback,0,0,0,0,0,0,0,0,0,0,0,0,0,0,0,0,0,0,0,0,0,2.278753601,-0.913640169,-1.045757491,1.774516966,0.387389826,-1.521433504,0.898176483,1.409933123,-0.518557371,-1.225483034,2.100370545,-0.698970004,1.487138375,2.92992956,2.677606953,0.84509804,2.664641976,1.954242509,0,0,0,0,0,0,0,0,0,0,0,0,0,0,0,5500,WASHINGTON,0,802,Flowback,0,0,liquid,39899,3/27/09,12300,0.0369,12.6,19.2,3980,0.0621,12.2,33.9,394,2.39,14700,0.05,539,0.132,157,376,31500,2470,124000,6.4,61200,6.8,0,0,0,0,0,0,0,2009,3,27,0,0,0,0,0,802,Flowback,0,0,0,0,0,0,0,0,0,0,0,0,0,0,0,0,0,0,0,0,0,4.089905111,1.100370545,1.283301229,3.599883072,1.086359831,1.530199698,2.595496222,4.167317335,2.731588765,-0.879426069,2.195899652,2.575187845,4.498310554,3.392696953,5.093421685,0.806179974,4.786751422,0.832508913,0,0,0,0,0,0,0,0,0,0,0,0,0,0,0,5501,WASHINGTON,0,802,Flowback,0,0,liquid,39904,4/1/09,34000,0.0784,12.2,77.1,8880,0.116,49.6,55.9,881,4.68,23700,0.05,1350,0.106,54,826,72000,5170,233000,6.4,116000,204,0,0,0,0,0,0,0,2009,4,1,0,0,0,0,0,802,Flowback,0,0,0,0,0,0,0,0,0,0,0,0,0,0,0,0,0,0,0,0,0,4.531478917,1.086359831,1.887054378,3.948412966,1.695481676,1.747411808,2.944975908,4.374748346,3.130333768,-0.974694135,1.73239376,2.916980047,4.857332496,3.713490543,5.367355921,0.806179974,5.064457989,2.309630167,0,0,0,0,0,0,0,0,0,0,0,0,0,0,0,5502,WASHINGTON,0,802,Flowback,0,0,liquid,39912,4/9/09,53000,0.0828,14.7,83.1,14000,0.0733,75.2,86,1380,7.32,34000,0.05,2100,0.123,60.2,1040,100000,8370,288000,6.2,157000,209,0,0,0,0,0,0,0,2009,4,9,0,0,0,0,0,802,Flowback,0,0,0,0,0,0,0,0,0,0,0,0,0,0,0,0,0,0,0,0,0,4.72427587,1.167317335,1.919601024,4.146128036,1.876217841,1.934498451,3.139879086,4.531478917,3.322219295,-0.910094889,1.779596491,3.017033339,5,3.922725458,5.459392488,0.792391689,5.195899652,2.320146286,0,0,0,0,0,0,0,0,0,0,0,0,0,0,0,5503,WASHINGTON,0,802,Flowback,0,0,liquid,39919,4/16/09,84,0.1,0.0426,0.06,23.5,0.25,0.105,0.5,5.54,0.0104,0,0,0,0,80,0.2,19.6,32.6,208,50,2.8,15,0,0,0,0,0,0,0,2009,4,16,0,0,0,0,0,802,Flowback,0,0,0,0,0,0,0,0,0,0,0,0,0,0,0,0,0,0,0,0,0,1.924279286,-1.370590401,-1.22184875,1.371067862,-0.978810701,-0.301029996,0.743509765,0,0,0,1.903089987,-0.698970004,1.292256071,1.5132176,2.318063335,1.698970004,0.447158031,1.176091259,0,0,0,0,0,0,0,0,0,0,0,0,0,0,0,5504,WASHINGTON,0,802,Flowback,0,0,liquid,39919,4/16/09,110,0.1,0.0871,0.11,29.7,0.25,0.293,0.0275,6.2,0.064,0,0,0,0,657,1,75.5,1740,564,50,50,3.3,0,0,0,0,0,0,0,2009,4,16,0,0,0,0,0,802,Flowback,0,0,0,0,0,0,0,0,0,0,0,0,0,0,0,0,0,0,0,0,0,2.041392685,-1.059981845,-0.958607315,1.472756449,-0.53313238,-1.560667306,0.792391689,0,0,0,2.81756537,0,1.877946952,3.240549248,2.751279104,1.698970004,1.698970004,0.51851394,0,0,0,0,0,0,0,0,0,0,0,0,0,0,0,5505,WASHINGTON,0,802,Flowback,0,0,liquid,39921,4/18/09,1660,0.1,6.52,2.52,465,0.25,7.66,8.73,45.1,0.681,0,0,0,0,12900,82.9,7430,1080,53800,50,17.6,15,0,0,0,0,0,0,0,2009,4,18,0,0,0,0,0,802,Flowback,0,0,0,0,0,0,0,0,0,0,0,0,0,0,0,0,0,0,0,0,0,3.220108088,0.814247596,0.401400541,2.667452953,0.88422877,0.941014244,1.654176542,0,0,0,4.11058971,1.918554531,3.870988814,3.033423755,4.730782276,1.698970004,1.245512668,1.176091259,0,0,0,0,0,0,0,0,0,0,0,0,0,0,0,5506,WASHINGTON,0,802,PW,0,0,liquid,39925,4/22/09,11000,0.0571,15.7,249,3400,0.25,27.2,34.4,329,1.68,0,0,0,0,64700,386,35600,2820,477000,50,107,15,0,0,0,0,0,0,0,2009,4,22,0,0,0,0,0,802,PW,0,0,0,0,0,0,0,0,0,0,0,0,0,0,0,0,0,0,0,0,0,4.041392685,1.195899652,2.396199347,3.531478917,1.434568904,1.536558443,2.517195898,0,0,0,4.810904281,2.586587305,4.551449998,3.450249108,5.678518379,1.698970004,2.029383778,1.176091259,0,0,0,0,0,0,0,0,0,0,0,0,0,0,0,4507,WASHINGTON,0,802,PW,0,0,liquid,39932,4/29/09,85000,0.114,13.5,133,18000,0.0272,69.7,88.6,1710,8.83,34000,0.044,2520,0.0738,43.1,1380,122000,36600,440000,6.1,194000,150,0,0,0,0,0,0,0,2009,4,29,0,0,0,0,0,802,PW,0,0,0,0,0,0,0,0,0,0,0,0,0,0,0,0,0,0,0,0,0,4.929418926,1.130333768,2.123851641,4.255272505,1.843232778,1.947433722,3.23299611,4.531478917,3.401400541,-1.131943638,1.63447727,3.139879086,5.086359831,4.563481085,5.643452676,0.785329835,5.28780173,2.176091259,0,0,0,0,0,0,0,0,0,0,0,0,0,0,0,4508,WASHINGTON,0,802,PW,0,0,liquid,39993,6/29/09,77000,0.109,12.7,87.2,20000,0.25,68.7,105,2000,8.99,40000,0.0499,3000,0.218,11.5,1600,138000,18400,480000,5.9,200000,83,0,0,0,0,0,0,0,2009,6,29,0,0,0,0,0,802,PW,0,0,0,0,0,0,0,0,0,0,0,0,0,0,0,0,0,0,0,0,0,4.886490725,1.103803721,1.940516485,4.301029996,1.836956737,2.021189299,3.301029996,4.602059991,3.477121255,-0.661543506,1.06069784,3.204119983,5.139879086,4.264817823,5.681241237,0.770852012,5.301029996,1.919078092,0,0,0,0,0,0,0,0,0,0,0,0,0,0,0,4510,BRADFORD,MITCHELL 456,802,PW,246905274,lb,liquid (avrg),41640,1/1/14,76290,0.3928,6.652,8492,27560,1.102,164.9,189.2,2068,13.91,51510,1.22,5872,4.34,99.38,930.7,126800,82670,210400,5.66,215900,373.9,37800,11350,12400,1410,0,0,0,2014,1,1,MITCHELL,456,0,0,0,802,PW,2010,8,16,117-20473,OGO-67805,41.92609,-76.954167,Yes,Horizontal Well,GAS,Bbl,2013,Yes,0,292411.12,233,0,0,2010.666667,3.416666667,8.794326241,4.882467615,0.822952241,3.929009985,4.440279213,2.217220656,2.276921132,3.315550534,4.71189155,3.768786047,0.63748973,1.997298992,2.968809714,5.103119254,4.917347938,5.323045735,0.752816431,5.334252642,2.572755465,4.5774918,4.054995862,4.093421685,3.149219113,0.944202573,0,0,0,0,0,0,0,0,0,0,4511,BRADFORD,CASTLE 113 D,802,Brine,56159,lb,liquid,41135,8/14/12,104000,0,23.6,32900,37200,0,649,312,2720,44.5,80000,0,11400,2.14,0,1110,165000,79000,171000,3.51,366000,1450,7207,2116,4573,113,0,0,0,2012,8,14,CASTLE,113,D,0,0,802,Brine,2008,9,2,015-20094,OGO-67805,41.624423,-76.825561,Yes,Horizontal Well,GAS,Bbl,Yes,PW,0,8301.08,182,0,0,2008.75,3.916666667,40.46902655,5.017033339,1.372912003,4.517195898,4.57054294,2.812244697,2.494154594,3.434568904,4.903089987,4.056904851,0.330413773,0,3.045322979,5.217483944,4.897627091,5.23299611,0.545307116,5.563481085,3.161368002,3.857754522,3.325515663,3.660201201,2.053078443,1.607122758,0,0,0,0,0,0,0,0,0,0,1512,BRADFORD,GROFF 720,810,Drill cuttings,25019259,lb,liquid,40722,6/28/11,12300,0,0,7180,3820,8.35,3700,0,669,73.2,30500,0,317,14.6,2400,89,58200,104000,296000,9.57,129000,88000,590.3,778.8,72.53,408.9,0,0,EPA,2011,6,28,GROFF,720,0,0,0,803,DrillFluid,2011,1,22,015-20622,OGO-67805,41.610612,-76.841098,Yes,Horizontal Well,GAS,Bbl,2012,PW,0,92048.23,16,0,0,2011.083333,0.416666667,0.177378332,4.089905111,0,3.856124444,3.582063363,3.568201724,0,2.825426118,4.484299839,2.501059262,1.164352856,3.380211242,1.949390007,4.764922985,5.017033339,5.471291711,0.980911938,5.11058971,4.944482672,2.771072783,2.891425943,1.860517677,2.611617111,-0.751099433,0,0,0,0,0,0,0,0,0,0,3514,LYCOMING,Greenwood 427,802,Brine,110862945,lb,liquid,41491,8/5/13,180000,0,27,33,68000,0,110,160,2400,9.3,40000,0,3500,0,50,1100,120000,2700,200000,5.74,200000,1400,5310,765,4240,767,0,0,0,2013,8,5,GREENWOOD,427,0,0,0,802,Brine,2010,5,22,081-20222,OGO-67805,41.534397,-77.004137,Yes,Horizontal Well,GAS,Bbl,2017,PW,0,0,0,0,0,2010.416667,3.25,5.528031291,5.255272505,1.431363764,1.51851394,4.832508913,2.041392685,2.204119983,3.380211242,4.602059991,3.544068044,0,1.698970004,3.041392685,5.079181246,3.431363764,5.301029996,0.758911892,5.301029996,3.146128036,3.725094521,2.883661435,3.627365857,2.884795364,0.742570493,0,0,0,0,0,0,0,0,0,0,1515,LYCOMING,CLEGG #722 4H,802,Brine,5816964,lb,liquid,41086,6/26/12,89400,0,4.13,19800,32700,0.51,187,293,1880,23,65700,0,6510,2.9,98,684,171000,16000,187000,5.85,298000,151,170600,52350,14510,1562,0,0,0,2012,6,26,CLEGG,#722,4H,0,0,802,Brine,2010,8,6,081-20221,OGO-67805,41.586986,-76.859964,Yes,Horizontal Well,GAS,Bbl,Yes,PW,0,766445.02,366,0,0,2010.666667,1.833333333,9.289372599,4.951337519,0.615950052,4.29666519,4.514547753,2.271841607,2.46686762,3.274157849,4.81756537,3.813580989,0.462397998,1.991226076,2.835056102,5.23299611,4.204119983,5.271841607,0.767155866,5.474216264,2.178976947,5.231979027,4.718916686,4.161667412,3.19368103,0.967986383,0,0,0,0,0,0,0,0,0,0,1516,LYCOMING,CLEGG #722 COMPRESSOR CS,802,Frac tank,232758,lb,liquid,41179,9/27/12,101000,1.28,0,5290,21600,0,129,215,1070,16,24100,0,5110,0,28.8,1570,206000,45000,187000,5.87,323000,326,33870,8009,10980,674,0,0,0,2012,9,27,CLEGG,#722,COMPRESSOR,CS,0,805,FracingFluid,2010,8,6,081-20221,OGO-67805,41.586986,-76.859964,Yes,Horizontal Well,GAS,Bbl,Yes,PW,0,766445.02,366,0,0,2010.666667,2.083333333,16.29080119,5.004321374,0,3.723455672,4.334453751,2.11058971,2.33243846,3.029383778,4.382017043,3.7084209,0,1.459392488,3.195899652,5.31386722,4.653212514,5.271841607,0.768638101,5.509202522,2.5132176,4.529815197,3.903578294,4.04060234,2.828659897,1.211942444,0,0,0,0,0,0,0,0,0,0,6517,LYCOMING,DEDWIN COTTO 2,422,Emulsions only wastewaters,5110,lb,liquid,41086,6/26/12,21200,0,9.79,970,7680,0,1360,52.2,489,17.6,11800,0,1380,6.78,681,183,31100,38000,66400,5.28,72400,114,31220,9357,1086,14.6,0,0,0,2012,6,26,DEDWIN,COTTO,2,0,0,802,Flowback,0,0,0,0,0,0,0,0,0,0,0,0,0,0,0,0,0,0,0,0,74.38356164,4.326335861,0.990782692,2.986771734,3.88536122,3.133538908,1.717670503,2.689308859,4.071882007,3.139879086,0.831229694,2.833147112,2.26245109,4.492760389,4.579783597,4.822168079,0.722633923,4.859738566,2.056904851,4.494432899,3.971136629,3.035829825,1.164352856,1.871476969,0,0,0,0,0,0,0,0,0,0,5518,LYCOMING,FOTI 721,802,Brine,1099412025,lb,liquid,41086,6/26/12,85700,0,4.75,16300,31400,0.19,146,281,1800,20.7,62000,0,6090,1.3,53,1050,156000,28000,202000,5.74,282000,98,153300,68150,17130,1286,0,0,0,2012,6,26,FOTI,721,0,0,0,802,Brine,2010,9,16,081-20344,OGO-67805,41.590508,-76.849378,Yes,Horizontal Well,GAS,Bbl,Yes,PW,0,831368.14,366,0,0,2010.75,1.75,13.32037325,4.932980822,0.67669361,4.212187604,4.496929648,2.164352856,2.44870632,3.255272505,4.792391689,3.784617293,0.113943352,1.72427587,3.021189299,5.193124598,4.447158031,5.305351369,0.758911892,5.450249108,1.991226076,5.185542155,4.83346586,4.233757363,3.109240969,1.124516394,0,0,0,0,0,0,0,0,0,0,1519,LYCOMING,GRAHAM 2,802,Brine,39012875,lb,liquid,41192,10/10/12,705,0,0,161,256,0,635,2.15,16.3,12.7,972,0,33.3,2.97,620,8.1,1790,3400,7160,5.76,4900,420,160,175,43.1,11.5,0,0,0,2012,10,10,GRAHAM,2,0,0,0,802,Brine,2008,6,23,081-20099,OGO-67805,41.573951,-76.911403,No,Vertical Well,GAS,Bbl,-,PW,0,74339.47,366,0,0,2008.5,4.333333333,3.747826087,2.848189117,0,2.206825876,2.408239965,2.802773725,0.33243846,1.212187604,2.987666265,1.522444234,0.472756449,2.792391689,0.908485019,3.252853031,3.531478917,3.854913022,0.760422483,3.69019608,2.62324929,2.204119983,2.243038049,1.63447727,1.06069784,0.57377943,0,0,0,0,0,0,0,0,0,0,1520,LYCOMING,GRAHAM 2,802,PW,53849649,lb,liquid,41086,6/26/12,21200,0,9.79,970,7680,0,1360,52.2,489,17.6,11800,0,1380,6.78,681,183,31100,38000,66400,5.28,72400,114,31220,9357,1086,14.6,0,0,0,2012,6,26,GRAHAM,2,0,0,0,802,PW,2008,6,23,081-20099,OGO-67805,41.573951,-76.911403,No,Vertical Well,GAS,Bbl,-,Yes,0,74339.47,366,0,0,2008.5,4,74.38356164,4.326335861,0.990782692,2.986771734,3.88536122,3.133538908,1.717670503,2.689308859,4.071882007,3.139879086,0.831229694,2.833147112,2.26245109,4.492760389,4.579783597,4.822168079,0.722633923,4.859738566,2.056904851,4.494432899,3.971136629,3.035829825,1.164352856,1.871476969,0,0,0,0,0,0,0,0,0,0,4521,LYCOMING,CLEGG 722,803,Drilling fluid waste,347486,lb,liquid,40721,6/27/11,6790,0,0,869,2460,0,42.7,26.3,158,1.81,5690,0,515,5.58,124,104,17700,3960,59000,6.95,21800,1200,2050,638.8,664.9,13.67,0,0,0,2011,6,27,CLEGG,722,0,0,0,803,DrillFluid,2010,8,6,081-20221,OGO-67805,41.586986,-76.859964,Yes,Horizontal Well,GAS,Bbl,2012,PW,0,514865.28,118,0,0,2010.666667,0.833333333,48.63935625,3.831869774,0,2.939019776,3.390935107,1.630427875,1.419955748,2.198657087,3.755112266,2.711807229,0.746634199,2.093421685,2.017033339,4.247973266,3.597695186,4.770852012,0.841984805,4.338456494,3.079181246,3.311753861,2.805364907,2.822756333,1.135768515,1.686987818,0,0,0,0,0,0,0,0,0,0,3522,LYCOMING,CLEGG 722,804,Fracing fluid waste,762370702,lb,liquid,40721,6/27/11,6790,0,0,869,2460,0,42.7,26.3,158,1.81,5690,0,515,5.58,124,104,17700,3960,59000,6.95,21800,1200,2050,638.8,664.9,13.67,0,0,0,2011,6,27,CLEGG,722,0,0,0,805,FracingFluid,2010,8,6,081-20221,OGO-67805,41.586986,-76.859964,Yes,Horizontal Well,GAS,Bbl,2012,PW,0,514865.28,118,0,0,2010.666667,0.833333333,48.63935625,3.831869774,0,2.939019776,3.390935107,1.630427875,1.419955748,2.198657087,3.755112266,2.711807229,0.746634199,2.093421685,2.017033339,4.247973266,3.597695186,4.770852012,0.841984805,4.338456494,3.079181246,3.311753861,2.805364907,2.822756333,1.135768515,1.686987818,0,0,0,0,0,0,0,0,0,0,6523,LYCOMING,CLEGG 722,804,Fracing fluid waste,0,0,liquid,40822,10/6/11,26700,0.0382,1.87,4910,9740,0.352,33.8,101,569,5.31,22000,0.495,2390,0.17,20,400,49700,23000,110000,6.32,85700,353,31020,14310,3796,816.8,0,0,0,2011,10,6,CLEGG,722,0,0,0,805,FracingFluid,2010,8,6,081-20221,OGO-67805,41.586986,-76.859964,Yes,Horizontal Well,GAS,Bbl,2012,PW,0,514865.28,118,0,0,2010.666667,1.166666667,4.647404505,4.426511261,0.271841607,3.691081492,3.988558957,1.5289167,2.004321374,2.755112266,4.342422681,3.378397901,-0.769551079,1.301029996,2.602059991,4.696356389,4.361727836,5.041392685,0.800717078,4.932980822,2.547774705,4.491641793,4.155639634,3.579326204,2.912115729,0.667210475,0,0,0,0,0,0,0,0,0,0,6524,POTTER,BUTTON B 901,802,Brine,228997949,lb,liquid,41921,10/9/14,85800,0,0,16700,30700,0,138,241,2210,11.7,66300,0,10600,0,42,1160,184000,12500,223000,5.8,277000,3660,13710,1133,14598,2194.7,0,0,0,2014,10,9,BUTTON,B,901,0,0,802,Brine,2009,10,13,105-21606,OGO-67805,41.672928,-77.605579,Yes,Horizontal Well,GAS,Bbl,2015,PW,0,157373.57,175,0,0,2009.833333,5,6.651478562,4.933487288,0,4.222716471,4.487138375,2.139879086,2.382017043,3.344392274,4.821513528,4.025305865,0,1.62324929,3.064457989,5.264817823,4.096910013,5.348304863,0.763427994,5.442479769,3.563481085,4.137037455,3.05422991,4.164293359,3.341375164,0.822918196,0,0,0,0,0,0,0,0,0,0,1525,POTTER,KEN TON 902,802,PW,402478,lb,liquid,41921,10/9/14,32700,0,0,5230,11600,0,104,98.6,900,3.64,27000,0,3450,0,94,428,72100,3140,137000,5.8,115000,390,7084,340,6842.2,797.63,0,0,0,2014,10,9,KEN,TON,902,0,0,802,PW,2010,3,3,105-21613,OGO-67805,41.685283,-77.603437,Yes,Horizontal Well,GAS,Bbl,2015,Yes,0,186728.54,175,0,0,2010.25,4.583333333,8.578162807,4.514547753,0,3.718501689,4.064457989,2.017033339,1.993876915,2.954242509,4.431363764,3.537819095,0,1.973127854,2.631443769,4.857935265,3.496929648,5.136720567,0.763427994,5.06069784,2.591064607,3.850278553,2.531478917,3.835195765,2.90180148,0.933394285,0,0,0,0,0,0,0,0,0,0,4526,POTTER,ALLEGANY 900,422,Emulsions only wastewaters,137167072,lb,liquid,41584,11/6/13,44000,0,3.41,1870,14900,0.285,60.5,125,1640,3.9,25600,0,2580,0.463,26,833,90600,1430,188000,5.8,149000,1360,14690,5605,5663.7,1439.2,0,0,0,2013,11,6,ALLEGANY,900,0,0,0,802,Flowback,2010,3,23,105-21633,OGO-67805,41.87201,-77.916805,Yes,Horizontal Well,GAS,Bbl,2012,PW,0,251179.71,325,0,0,2010.25,3.666666667,3.935311284,4.643452676,0.532754379,3.271841607,4.173186268,1.781755375,2.096910013,3.214843848,4.408239965,3.411619706,-0.334419009,1.414973348,2.920645001,4.957128198,3.155336037,5.274157849,0.763427994,5.173186268,3.133538908,4.167021796,3.748575617,3.753100241,3.15812115,0.594979091,0,0,0,0,0,0,0,0,0,0,5527,POTTER,ALLEGANY 900,802,Brine,110154,lb,liquid,41177,9/25/12,63400,0,3.63,2880,21700,0,67.3,146,2230,6.88,48700,0,3770,3.09,11,904,92700,7300,163000,5.99,153000,95,11500,2671,4823,701,0,0,0,2012,9,25,ALLEGANY,900,0,0,0,802,Brine,2010,3,23,105-21633,OGO-67805,41.87201,-77.916805,Yes,Horizontal Well,GAS,Bbl,Yes,PW,0,131593,184,0,0,2010.25,2.5,6.880171184,4.802089258,0.559906625,3.459392488,4.336459734,1.828015064,2.164352856,3.348304863,4.687528961,3.57634135,0.489958479,1.041392685,2.95616843,4.967079734,3.86332286,5.212187604,0.777426822,5.184691431,1.977723605,4.06069784,3.426673888,3.683317262,2.845718018,0.837599244,0,0,0,0,0,0,0,0,0,0,1529,TIOGA,COLE R 495,804,Unconventional tank bottom liquids,0,0,liquid (avrg),42768,2/2/17,55990,0.1781,14.14,179,24730,0.1924,101.7,80.03,1177,8.071,29100,1.393,1484,0.4491,127.9,831.6,81440,24720,201000,7.09,130000,588,3392,828.5,2528,395.7,0,0,0,2017,2,2,COLE,R,495,0,0,802,Flowback,2009,8,21,117-20307,OGO-67805,41.8054,-76.953934,Yes,Horizontal Well,GAS,Bbl,2012,PW,0,89359.18,147,0,0,2009.666667,7.5,6.388678292,4.748110467,1.150449409,2.252853031,4.393224116,2.007320953,1.903252817,3.070776463,4.463892989,3.171433901,-0.347656945,2.106870544,2.919914481,4.910837765,4.393048466,5.303196057,0.850646235,5.113943352,2.769377326,3.530455844,2.918292513,3.40277707,2.59736605,0.805411019,0,0,0,0,0,0,0,0,0,0,5532,TIOGA,KJELGAARD 802,804,Unconventional tank bottom liquids,49260,lb,liquid,42494,5/4/16,17600,0.072,35,2290,6120,0.205,62.8,58.9,556,5.66,14000,0.0805,1370,0,26,0,39000,90500,76400,5.8,102000,64,7887,2763,3548.1,415.72,0,0,0,2016,5,4,KJELGAARD,802,0,0,0,802,Flowback,2009,7,27,117-20319,OGO-67805,41.699156,-77.548494,Yes,Horizontal Well,GAS,Bbl,2015,PW,0,119674.91,328,0,0,2009.583333,6.833333333,8.534831136,4.245512668,1.544068044,3.359835482,3.786751422,1.797959644,1.770115295,2.745074792,4.146128036,3.136720567,0,1.414973348,0,4.591064607,4.956648579,4.883093359,0.763427994,5.008600172,1.806179974,3.896911841,3.441380885,3.549995852,2.618800919,0.931194933,0,0,0,0,0,0,0,0,0,0,5533,TIOGA,LAWTON W8,899,Other wastes (CS dump tank liquids),282300,lb,liquid,42563,7/12/16,3680,0,1.05,15.3,1300,0,276,9.75,101,11.1,3200,0,369,1.01,314,64.3,6980,28500,21300,6.2,14900,950,1128,179,1069.8,146.53,0,0,0,2016,7,12,LAWTON,W8,0,0,0,802,Flowback,0,0,0,0,0,0,0,0,0,0,0,0,0,0,0,0,0,0,0,0,7.300894015,3.565847819,0.021189299,1.184691431,3.113943352,2.440909082,0.989004616,2.004321374,3.505149978,2.567026366,0.004321374,2.496929648,1.808210973,3.843855423,4.45484486,4.328379603,0.792391689,4.173186268,2.977723605,3.0523091,2.252853031,3.029302594,2.16592655,0.863376044,0,0,0,0,0,0,0,0,0,0,5534,TIOGA,LOVELL PVR WATER TANK METER MS,899,Other wastes (CS dump tank liquids),610,lb,liquid,42481,4/21/16,8610,0,0,22300,3090,0,210,20.8,218,15.4,5610,0,662,0.265,40,24.9,24400,5210,65800,5.9,77000,137,72140,20370,47388,8426,0,0,0,2016,4,21,LOVELL,PVR,WATER,TANK,METER,802,Flowback,2012,10,3,117-21563,OGO-67805,41.576378,-77.020869,Yes,Horizontal Well,GAS,Bbl,2012,FracingFluid,0,0,0,0,0,2012.833333,3.5,5.624020888,3.935003151,0,4.348304863,3.489958479,2.322219295,1.318063335,2.338456494,3.748962861,2.820857989,-0.576754126,1.602059991,1.396199347,4.387389826,3.716837723,4.818225894,0.770852012,4.886490725,2.136720567,4.858176138,4.308991029,4.67566838,3.925621455,0.750046925,0,0,0,0,0,0,0,0,0,0,5535,TIOGA,NEAL 134,899,Other wastes (CS dump tank liquids),610,lb,liquid,42557,7/6/16,15500,0,0,836,5420,0,375,34.5,477,26.7,14100,0,1040,3.03,760,220,39.8,104000,69300,5.4,65200,105,1495,469,1630.7,449.62,0,0,0,2016,7,6,NEAL,134,0,0,0,802,Flowback,2008,10,24,117-20206,OGO-67805,41.781425,-77.130154,Yes,Vertical Well,GAS,Bbl,2012,PW,0,0,0,0,0,2008.833333,7.75,3.626840443,4.190331698,0,2.922206277,3.733999287,2.574031268,1.537819095,2.678518379,4.149219113,3.017033339,0.481442629,2.880813592,2.342422681,1.599883072,5.017033339,4.840733235,0.73239376,4.814247596,2.021189299,3.174641193,2.671172843,3.212374071,2.652845621,0.55952845,0,0,0,0,0,0,0,0,0,0,5536,TIOGA,PIERSON T 801,804,Unconventional tank bottom solids,18360,lb,liquid,42614,9/1/16,0,0,0,1.1,0,0,0,0,0,0,0,0,116,0,0,0,4800,0,0,7.3,0,0,13.9,27.5,6.705,1.321,0,0,TCLP,2016,9,1,PIERSON,T,801,0,0,802,Flowback,2010,8,30,117-20616,OGO-67805,41.689317,-77.560869,Yes,Horizontal Well,GAS,Bbl,2015,PW,0,411613.37,304,0,0,2010.666667,6.083333333,5.075700227,0,0,0.041392685,0,0,0,0,0,2.064457989,0,0,0,3.681241237,0,0,0.86332286,0,0,1.1430148,1.439332694,0.826398782,0.120902818,0.705495965,0,0,0,0,0,0,0,0,0,0,5537,TIOGA,TC GREEN WET PPL,899,Other wastes (CS dump tank liquids),55,lb,liquid,42557,7/6/16,30600,0.0521,1.11,2610,11000,0,167,111,758,13.1,21100,0,2290,0,536,1070,75.8,48800,140000,5,131000,154,8235,1037,6600,884.79,0,0,0,2016,7,6,TC,GREEN,WET,PPL,0,802,Flowback,0,0,0,0,0,0,0,0,0,0,0,0,0,0,0,0,0,0,0,0,7.459397145,4.485721426,0.045322979,3.416640507,4.041392685,2.222716471,2.045322979,2.879669206,4.324282455,3.359835482,0,2.72916479,3.029383778,1.879669206,4.688419822,5.146128036,0.698970004,5.117271296,2.187520721,3.915663604,3.015778756,3.819543936,2.946840206,0.87270373,0,0,0,0,0,0,0,0,0,0,5540,TIOGA,BREON K3 COMPRESSOR CS,802,PW,247772,lb,liquid (avrg),41640,1/1/14,54150,0.387,4.311,5658,16200,0.5601,215.8,135.6,1282,8.83,28920,0.1115,4081,2.364,92.73,784,97940,25040,150000,5.869,165700,868.1,19240,4924,9432,988.5,0,0,0,2014,1,1,BREON,K3,COMPRESSOR,CS,0,802,PW,2010,6,19,117-20728,OGO-67805,41.797883,-77.012897,Yes,Vertical Well,GAS,Bbl,2012,FracingFluid,0,0,0,0,0,2010.5,3.583333333,9.541729894,4.733598461,0.634578023,3.752662943,4.209515015,2.33405144,2.13225969,3.107888025,4.461198289,3.610766595,0.373647472,1.96722026,2.894316063,4.9909601,4.398634325,5.176091259,0.76856411,5.219322508,2.938569756,4.284205068,3.692318044,3.974603792,2.994976674,0.979627118,0,0,0,0,0,0,0,0,0,0,4541,TIOGA,BREON K3 COMPRESSOR CS,802,PW,218174,lb,liquid (avrg),41640,1/1/14,49350,0.387,4.245,4256,13780,0.5601,225.9,115.1,1064,9.261,22130,0.1115,3055,2.364,110.7,671.5,84890,32360,132100,5.948,150600,705.6,23090,5398,9432,782.7,0,0,0,2014,1,1,BREON,K3,COMPRESSOR,CS,0,802,PW,2010,6,19,117-20728,OGO-67805,41.797883,-77.012897,Yes,Vertical Well,GAS,Bbl,2012,FracingFluid,0,0,0,0,0,2010.5,3.583333333,12.0505941,4.693287157,0.627877695,3.629001619,4.139249218,2.353916231,2.061075324,3.026941628,4.344981414,3.485011215,0.373647472,2.044147621,2.827046017,4.928856534,4.510008513,5.120902818,0.77437096,5.177824972,2.848558572,4.363423933,3.73223288,3.974603792,2.893595334,1.081008458,0,0,0,0,0,0,0,0,0,0,4542,TIOGA,CRUTTENDEN 846,803,Drilling fluid,228871,lb,liquid (avrg),41640,1/1/14,23890,0.3129,1.767,22.8,1798,0.2919,43.61,3.859,137.8,3.245,20260,0.04783,66.52,0.5607,296.7,110.1,30120,2965,67660,8.716,47320,17360,545.7,497,335.9,173.3,0,0,0,2015,1,1,CRUTTENDEN,846,0,0,0,803,DrillFluid,2014,8,29,117-21724,OGO-67805,41.863867,-77.312819,Yes,Horizontal Well,GAS,Bbl,2015,PW,0,0,0,0,0,2014.666667,0.416666667,1.938257357,4.37821615,0.24723655,1.357934847,3.254789687,1.639586087,0.586474779,2.139249218,4.306639441,1.822952241,-0.251269444,2.472317546,2.041787319,4.478854968,3.472024698,4.830331993,0.940317222,4.675044736,4.239549721,2.736953954,2.696356389,2.526210004,2.238798563,0.287411441,0,0,0,0,0,0,0,0,0,0,3543,TIOGA,DELANEY 651,805,Flowback,690347,lb,liquid (avrg),41640,1/1/14,51430,14.02,139.7,4161,16700,33.32,412.4,3933,1278,65,38030,105.7,3396,2.716,137.7,905.1,92130,45660,181100,6.092,0,1195,21300,5364,6467,781.2,0,0,0,2014,1,1,DELANEY,651,0,0,0,802,Flowback,2013,1,11,117-21599,OGO-67805,41.793719,-76.984575,Yes,Horizontal Well,GAS,Bbl,2013,PW,0,1254584.56,360,0,0,2013.083333,1,8.278289811,4.711216524,2.145196406,3.619197716,4.222716471,2.615318657,3.594723946,3.106530854,4.580126325,3.530967682,0.433929766,2.13893394,2.956696565,4.964401071,4.659535907,5.25791845,0.784759895,0,3.077367905,4.328379603,3.729488769,3.810702861,2.892762235,0.917940626,0,0,0,0,0,0,0,0,0,0,5544,TIOGA,KJELGAARD 802,802,PW,167949,lb,liquid,41920,10/8/14,68600,0,0,8120,24000,0,161,202,2080,7.35,49700,0,5230,0,52,660,145000,8780,207000,5.6,216000,1380,13670,692,14063,1612.9,0,0,0,2014,10,8,KJELGAARD,802,0,0,0,802,PW,2009,7,27,117-20319,OGO-67805,41.699156,-77.548494,Yes,Horizontal Well,GAS,Bbl,2015,Yes,0,64915.71,117,0,0,2009.583333,5.25,8.719077438,4.836324116,0,3.909556029,4.380211242,2.206825876,2.305351369,3.318063335,4.696356389,3.718501689,0,1.716003344,2.819543936,5.161368002,3.943494516,5.315970345,0.748188027,5.334453751,3.139879086,4.135768515,2.840106094,4.148077977,3.207607442,0.940470535,0,0,0,0,0,0,0,0,0,0,4545,TIOGA,LICK RUN 803,802,Brine,810030514,lb,liquid,41920,10/8/14,31400,0,0,3820,11000,0,322,88.4,955,9.03,22800,0,2440,0,148,0,57800,6820,124000,5.8,99600,113,6384,140,5600.5,632.99,0,0,0,2014,10,8,LICK,RUN,803,0,0,802,Brine,2010,1,27,117-20345,OGO-67805,41.705442,-77.531539,Yes,Horizontal Well,GAS,Bbl,2015,PW,0,64927.66,106,0,0,2010.083333,4.75,8.847691117,4.496929648,0,3.582063363,4.041392685,2.507855872,1.946452265,2.980003372,4.357934847,3.387389826,0,2.170261715,0,4.761927838,3.833784375,5.093421685,0.763427994,4.998259338,2.053078443,3.805092878,2.146128036,3.748226802,2.801396849,0.946829952,0,0,0,0,0,0,0,0,0,0,1546,TIOGA,LICK RUN 6668,802,PW,129243,lb,liquid,41920,10/8/14,31400,0,0,3820,11000,0,322,88.4,955,9.03,22800,0,2440,0,148,0,57800,6820,124000,5.8,99600,113,6384,140,5600.5,632.99,0,0,0,2014,10,8,LICK,RUN,6668,0,0,802,PW,2010,1,27,117-20345,OGO-67805,41.705442,-77.531539,Yes,Horizontal Well,GAS,Bbl,2015,Yes,0,64927.66,106,0,0,2010.083333,4.75,8.847691117,4.496929648,0,3.582063363,4.041392685,2.507855872,1.946452265,2.980003372,4.357934847,3.387389826,0,2.170261715,0,4.761927838,3.833784375,5.093421685,0.763427994,4.998259338,2.053078443,3.805092878,2.146128036,3.748226802,2.801396849,0.946829952,0,0,0,0,0,0,0,0,0,0,4547,TIOGA,PIERSON 810,802,PW,189497,lb,liquid,41921,10/9/14,45000,0,0,7770,15700,0,291,152,1390,6.54,33500,0,6340,0,54,896,91500,10700,172000,5.4,159000,286,12650,415,13897,1087.4,0,0,0,2014,10,9,PIERSON,810,0,0,0,802,PW,2010,8,30,117-20616,OGO-67805,41.689317,-77.560869,Yes,Horizontal Well,GAS,Bbl,2015,Yes,0,256171.57,174,0,0,2010.666667,4.166666667,12.78002575,4.653212514,0,3.890421019,4.195899652,2.463892989,2.181843588,3.1430148,4.525044807,3.802089258,0,1.73239376,2.95230801,4.961421094,4.029383778,5.235528447,0.73239376,5.201397124,2.456366033,4.102090526,2.618048097,4.142921058,3.036389329,1.106531729,0,0,0,0,0,0,0,0,0,0,4548,TIOGA,PIERSON T 801,802,PW,405015,lb,liquid,41921,10/9/14,55100,0,0,8600,19600,0,103,161,1530,6.56,46600,0,5870,0,36,855,135000,12100,200000,6,203000,793,5296,235,5134.4,1436.9,0,0,0,2014,10,9,PIERSON,T,801,0,0,802,PW,2010,8,30,117-20616,OGO-67805,41.689317,-77.560869,Yes,Horizontal Well,GAS,Bbl,2015,Yes,0,256171.57,174,0,0,2010.666667,4.166666667,3.573247964,4.741151599,0,3.934498451,4.292256071,2.012837225,2.206825876,3.184691431,4.668385917,3.768638101,0,1.556302501,2.931966115,5.130333768,4.08278537,5.301029996,0.77815125,5.307496038,2.899273187,3.723947976,2.371067862,3.7104897,3.157426545,0.553063155,0,0,0,0,0,0,0,0,0,0,4550,TIOGA,SHERMAN 492,803,Drilling fluid,138267252,lb,liquid,41751,4/22/14,4410,0.0135,0.191,106,1710,0.139,4.9,8.1,31.9,0.167,2120,0.024,176,0.188,192,0,6700,11100,18700,10.5,10600,220,304,85.3,204.6,61.784,0,0,0,2014,4,22,SHERMAN,492,0,0,0,803,DrillFluid,2009,8,4,117-20277,OGO-67805,41.788625,-77.018886,Yes,Horizontal Well,GAS,Bbl,2012,PW,0,215325.81,323,0,0,2009.666667,4.666666667,3.311536967,3.644438589,-0.718966633,2.025305865,3.23299611,0.69019608,0.908485019,1.503790683,3.326335861,2.245512668,-0.725842151,2.283301229,0,3.826074803,4.045322979,4.271841607,1.021189299,4.025305865,2.342422681,2.482873584,1.930949031,2.310905629,1.790876022,0.520029608,0,0,0,0,0,0,0,0,0,0,3551,TIOGA,SYNNESTVEDT 878,803,Drilling fluid,1007784,lb,liquid,41694,2/24/14,6280,0,0.256,83.7,2480,1.11,12.1,4,20.1,0.461,1910,0.0223,97.6,0.251,294,0,7180,9450,24600,10.3,13200,13300,48.7,40.1,9.537,8.676,0,0,0,2014,2,24,SYNNESTVEDT,878,0,0,0,803,DrillFluid,2010,10,14,117-20707,OGO-67805,41.989036,-77.353175,Yes,Vertical Well,GAS,Bbl,2012,FracingFluid,0,0,0,0,0,2010.833333,3.333333333,1.099239281,3.797959644,-0.591760035,1.922725458,3.394451681,1.08278537,0.602059991,1.303196057,3.281033367,1.989449818,-0.600326279,2.46834733,0,3.856124444,3.975431809,4.390935107,1.012837225,4.120573931,4.123851641,1.687528961,1.603144373,0.979411783,0.938319543,0.041092239,0,0,0,0,0,0,0,0,0,0,3552,TIOGA,THOMAS 808,802,Brine,30187516,lb,liquid,41921,10/9/14,94400,0,5.18,12600,33600,0,234,273,2550,12.2,49800,0,10000,0,20,2290,177000,13200,224000,5.8,300000,0.482,20040,617,18295,2090.8,0,0,0,2014,10,9,THOMAS,808,0,0,0,802,Brine,2010,7,23,117-20474,OGO-67805,41.679697,-77.580675,Yes,Horizontal Well,GAS,Bbl,2015,PW,0,82649.98,177,0,0,2010.583333,4.25,8.750239143,4.974971994,0.71432976,4.100370545,4.526339277,2.369215857,2.436162647,3.40654018,4.697229343,4,0,1.301029996,3.359835482,5.247973266,4.120573931,5.350248018,0.763427994,5.477121255,-0.316952962,4.301897717,2.790285164,4.262332414,3.320312491,0.942019922,0,0,0,0,0,0,0,0,0,0,1553,TIOGA,THOMAS 808,802,PW,1554721,lb,liquid,41921,10/9/14,94400,0,5.18,12600,33600,0,234,273,2550,12.2,49800,0,10000,0,20,2290,177000,13200,224000,5.8,300000,482,20040,617,18295,2090.8,0,0,0,2014,10,9,THOMAS,808,0,0,0,802,PW,2010,7,23,117-20474,OGO-67805,41.679697,-77.580675,Yes,Horizontal Well,GAS,Bbl,2015,Yes,0,82649.98,177,0,0,2010.583333,4.25,8.750239143,4.974971994,0.71432976,4.100370545,4.526339277,2.369215857,2.436162647,3.40654018,4.697229343,4,0,1.301029996,3.359835482,5.247973266,4.120573931,5.350248018,0.763427994,5.477121255,2.683047038,4.301897717,2.790285164,4.262332414,3.320312491,0.942019922,0,0,0,0,0,0,0,0,0,0,4554,TIOGA,TRACT 839 815,802,PW,230155,lb,liquid,41920,10/8/14,63300,0,0,7670,22200,0,211,197,1920,6.74,44300,0,5140,0,98,888,130000,15900,198000,5.5,199000,2440,13620,1128,17943,1348.3,0,0,0,2014,10,8,TRACT,839,815,0,0,802,PW,2010,5,3,117-20481,OGO-67805,41.688066,-77.528159,Yes,Horizontal Well,GAS,Bbl,2017,OtherWaste,0,0,0,0,0,2010.416667,4.416666667,13.30786917,4.80140371,0,3.884795364,4.346352974,2.324282455,2.294466226,3.283301229,4.646403726,3.710963119,0,1.991226076,2.948412966,5.113943352,4.201397124,5.29666519,0.740362689,5.298853076,3.387389826,4.134177108,3.0523091,4.253895057,3.129786535,1.124108523,0,0,0,0,0,0,0,0,0,0,4556,TIOGA,APPOLD 493,802,Brine,13611877,lb,liquid (avrg),41306,2/1/13,82388,0.38,4.59,12258.8,29335.6,0.66,133.15,234.22,2203.96,13.86,55361,0.6,7152.4,4.82,40.91,887.42,146896,125623.6,208152,5.44,252828,254.54,40491.33,10631.84,10984.68,932.35,0,0,0,2013,2,1,APPOLD,493,0,0,0,802,Brine,2010,9,14,117-20671,OGO-67805,41.796844,-76.996172,Yes,Vertical Well,GAS,Bbl,Yes,PW,0,0,0,0,0,2010.75,2.416666667,11.78171288,4.91586396,0.661812686,4.08844796,4.467394975,2.124341171,2.369623977,3.343203708,4.743203926,3.854451795,0.683047038,1.611829479,2.948129212,5.16700997,5.099071235,5.318380588,0.7355989,5.402825169,2.40575604,4.607362042,4.026608432,4.04078741,2.969578975,1.071208435,0,0,0,0,0,0,0,0,0,0,1557,TIOGA,APPOLD 493,804,Fracing fluid waste,0,0,liquid (avrg),41306,2/1/13,59243.75,3.3,4.86,6826.6,21168.17,24.76,110.17,188.92,1603.21,8.59,48677.61,19.18,4909.39,2.33,56.21,1007.83,119736.37,35630.85,184958.83,5.87,211009.76,2103.37,28156.03,7347.76,8505.89,884.06,0,0,0,2013,2,1,APPOLD,493,0,0,0,805,FracingFluid,2010,9,14,117-20671,OGO-67805,41.796844,-76.996172,Yes,Vertical Well,GAS,Bbl,Yes,PW,0,0,0,0,0,2010.75,2.416666667,9.621394475,4.772642541,0.686636269,3.834204456,4.325683315,2.042063349,2.276277937,3.204990413,4.687329247,3.691027534,0.367355921,1.749813585,3.003387282,5.078226088,4.551826183,5.26707507,0.768638101,5.324302544,3.322915675,4.449571419,3.866154962,3.929719762,2.946481741,0.983238021,0,0,0,0,0,0,0,0,0,0,6558,TIOGA,BRADFORD 481,803,Drilling fluid,552615,lb,liquid,41593,11/15/13,590,0.0331,0.12,1.25,203,0.0377,50.1,0.173,20.3,7.36,145,0,0.608,0.19,30,0,297,34.3,1250,9.1,548,25300,177,346,0,2.377,0,0,0,2013,11,15,BRADFORD,481,0,0,0,803,DrillFluid,2013,11,11,117-21663,OGO-67805,41.806367,-76.922056,Yes,Horizontal Well,GAS,Bbl,2014,PW,0,0,0,0,0,2013.916667,0,0,2.770852012,-0.920818754,0.096910013,2.307496038,1.699837726,-0.761953897,1.307496038,2.161368002,-0.216096421,-0.721246399,1.477121255,0,2.472756449,1.53529412,3.096910013,0.959041392,2.738780558,4.403120521,2.247973266,2.539076099,0,0.376029182,0,0,0,0,0,0,0,0,0,0,0,3559,TIOGA,BREON K3 COMPRESSOR CS,802,Brine,10980798,lb,liquid,41354,3/21/13,34700,0,1.86,6760,12400,0,179,87.6,877,5.97,23200,0,3140,1.4,56,361,51800,61000,111000,6.21,67100,184,16620,3015,6593,208,0,0,0,2013,3,21,BREON,K3,COMPRESSOR,CS,0,802,Brine,2010,6,19,117-20728,OGO-67805,41.797883,-77.012897,Yes,Vertical Well,GAS,Bbl,2012,FracingFluid,0,0,0,0,0,2010.5,2.75,31.69711538,4.540329475,0.269512944,3.829946696,4.093421685,2.252853031,1.942504106,2.942999593,4.365487985,3.496929648,0.146128036,1.748188027,2.557507202,4.71432976,4.785329835,5.045322979,0.7930916,4.82672252,2.264817823,4.220631019,3.479287316,3.819083076,2.318063335,1.501019741,0,0,0,0,0,0,0,0,0,0,1560,TIOGA,EDKIN 499,803,Drilling fluid,397800,lb,liquid,41592,11/14/13,3660,0.0068,0.118,35.4,1450,0.0401,3.25,1.72,9.44,0.101,491,0,42.2,0.101,50,0,3320,2310,10600,10,5750,224,59.3,29.1,0,0,0,0,0,2013,11,14,EDKIN,499,0,0,0,803,DrillFluid,2013,8,22,117-21637,OGO-67805,41.825169,-77.0105,Yes,Horizontal Well,GAS,Bbl,Yes,PW,0,0,0,0,0,2013.666667,0.25,0,3.563481085,-0.928117993,1.549003262,3.161368002,0.511883361,0.235528447,0.974971994,2.691081492,1.625312451,-0.995678626,1.698970004,0,3.521138084,3.36361198,4.025305865,1,3.759667845,2.350248018,1.773054693,1.463892989,0,0,0,0,0,0,0,0,0,0,0,0,0,3561,TIOGA,FLACK 502,804,Fracing fluid waste,9101995,lb,liquid,41561,10/14/13,0,0,0,377,0,0,0,0,0,0,0,0,157,0.33,0,0,3170,0,0,6.7,0,0,366,75.1,83.64,8.496,0,0,TCLP,2013,10,14,FLACK,502,0,0,0,805,FracingFluid,2013,6,5,117-21632,OGO-67805,41.828944,-76.976389,Yes,Horizontal Well,GAS,Bbl,2014,PW,0,75016.97,18,0,0,2013.5,0.333333333,9.844632768,0,0,2.57634135,0,0,0,0,0,2.195899652,-0.48148606,0,0,3.501059262,0,0,0.826074803,0,0,2.563481085,1.875639937,1.922414024,0.929214504,0.99319952,0,0,0,0,0,0,0,0,0,0,6562,TIOGA,GEE 832,804,Fracing fluid waste,3820898,lb,liquid,41386,4/22/13,26900,0,20.2,1320,9280,0.18,77.7,63.2,903,4.27,42800,0,8250,0.28,141,1140,87200,2100,152000,6.36,147000,531,3655,1544,1957,907,0,0,0,2013,4,22,GEE,832,0,0,0,805,FracingFluid,2010,5,4,117-20562,OGO-67805,41.852412,-77.293791,Yes,Vertical Well,GAS,Bbl,2012,DrillFluid,0,0,0,0,0,2010.416667,2.916666667,2.157662624,4.42975228,1.305351369,3.120573931,3.967547976,1.890421019,1.800717078,2.95568775,4.631443769,3.916453949,-0.552841969,2.149219113,3.056904851,4.940516485,3.322219295,5.181843588,0.803457116,5.167317335,2.725094521,3.562887381,3.188647296,3.291590826,2.957607287,0.333983539,0,0,0,0,0,0,0,0,0,0,6563,TIOGA,GUILLAUME 715,804,Fracing fluid waste,7138025,lb,liquid,41626,12/18/13,19800,0,0,3450,7070,0,55.2,0,523,3.31,17600,0,1920,0,0,0,62300,0,137000,6,111000,212,0,0,5092.1,664.8,0,0,0,2013,12,18,GUILLAUME,715,0,0,0,805,FracingFluid,2010,11,2,117-20783,OGO-67805,41.580219,-77.063131,Yes,Vertical Well,GAS,Bbl,2012,PW,0,0,0,0,0,2010.916667,3.083333333,7.659596871,4.29666519,0,3.537819095,3.849419414,1.741939078,0,2.718501689,4.245512668,3.283301229,0,0,0,4.794488047,0,5.136720567,0.77815125,5.045322979,2.326335861,0,0,3.706896924,2.822691011,0.884205913,0,0,0,0,0,0,0,0,0,0,6564,TIOGA,JACKSON TX 6 COMPRESSOR CS,802,PW,187191,lb,liquid,41540,9/23/13,6470,0.0203,3.27,1230,2320,0.021,219,24.6,165,7.22,5420,0.065,660,2.79,130,0,17600,81000,38100,6.1,50100,178,2461,152,1787,184,0,0,0,2013,9,23,JACKSON,TX,6,COMPRESSOR,CS,802,PW,0,0,0,0,0,0,0,0,0,0,0,0,0,0,0,0,0,0,0,0,9.711956522,3.810904281,0.514547753,3.089905111,3.365487985,2.340444115,1.390935107,2.217483944,3.733999287,2.819543936,0.445604203,2.113943352,0,4.245512668,4.908485019,4.580924976,0.785329835,4.699837726,2.250420002,3.391111614,2.181843588,3.252124553,2.264817823,0.987306729,0,0,0,0,0,0,0,0,0,0,4566,TIOGA,LAWTON CS,802,Brine,353109549,lb,liquid,41353,3/20/13,68300,0,2.8,10000,24300,0,93.7,147,1830,9.53,41900,0,6710,1.42,45,881,115000,9500,199000,6.11,92500,308,23470,3954,12118,1711.6,0,0,0,2013,3,20,LAWTON,CS,0,0,0,802,Brine,0,0,0,0,0,0,0,0,0,0,0,0,0,0,0,0,0,0,0,0,7.079925216,4.834420704,0.447158031,4,4.385606274,1.971739591,2.167317335,3.26245109,4.622214023,3.82672252,0.152288344,1.653212514,2.944975908,5.06069784,3.977723605,5.298853076,0.78604121,4.966141733,2.488550717,4.37051309,3.597036665,4.083430948,3.233402278,0.85002867,0,0,0,0,0,0,0,0,0,0,1567,TIOGA,LAWTON W8 CS,422,Emulsions only wastewaters,222915,lb,liquid,41353,3/20/13,68300,0,2.8,10000,24300,0,93.7,147,1830,9.53,41900,0,6710,1.42,45,881,115000,9500,199000,6.11,92500,308,23470,3954,12118,1711.6,0,0,0,2013,3,20,LAWTON,W8,CS,0,0,802,Flowback,0,0,0,0,0,0,0,0,0,0,0,0,0,0,0,0,0,0,0,0,7.079925216,4.834420704,0.447158031,4,4.385606274,1.971739591,2.167317335,3.26245109,4.622214023,3.82672252,0.152288344,1.653212514,2.944975908,5.06069784,3.977723605,5.298853076,0.78604121,4.966141733,2.488550717,4.37051309,3.597036665,4.083430948,3.233402278,0.85002867,0,0,0,0,0,0,0,0,0,0,5568,TIOGA,LAWTON W8,802,PW,403257,lb,liquid,41353,3/20/13,68300,0,2.8,10000,24300,0,93.7,147,1830,9.53,41900,0,6710,1.42,45,881,115000,9500,199000,6.11,92500,308,23470,3954,12118,1711.6,0,0,0,2013,3,20,LAWTON,W8,0,0,0,802,PW,0,0,0,0,0,0,0,0,0,0,0,0,0,0,0,0,0,0,0,0,7.079925216,4.834420704,0.447158031,4,4.385606274,1.971739591,2.167317335,3.26245109,4.622214023,3.82672252,0.152288344,1.653212514,2.944975908,5.06069784,3.977723605,5.298853076,0.78604121,4.966141733,2.488550717,4.37051309,3.597036665,4.083430948,3.233402278,0.85002867,0,0,0,0,0,0,0,0,0,0,4569,TIOGA,LOVELL CS,802,Brine,851792306,lb,liquid,41381,4/17/13,51000,0,7.03,8580,18500,0.29,49.3,141,1140,10.1,37100,0,4730,4.65,33,759,102000,75000,136000,6.38,181000,1380,21000,2732,7453,2249,0,0,0,2013,4,17,LOVELL,CS,0,0,0,802,Brine,2012,10,3,117-21563,OGO-67805,41.576378,-77.020869,Yes,Horizontal Well,GAS,Bbl,2012,FracingFluid,0,0,0,0,0,2012.833333,0.5,3.313917297,4.707570176,0.846955325,3.933487288,4.267171728,1.692846919,2.149219113,3.056904851,4.56937391,3.674861141,0.667452953,1.51851394,2.880241776,5.008600172,4.875061263,5.133538908,0.804820679,5.257678575,3.139879086,4.322219295,3.436480695,3.872331121,3.351989455,0.520341666,0,0,0,0,0,0,0,0,0,0,1571,TIOGA,LOVELL TX 4 COMPRESSOR CS,802,PW,457312,lb,liquid,41381,4/17/13,51000,0,7.03,8580,18500,0.29,49.3,141,1140,10.1,37100,0,4730,4.65,33,759,102000,75000,136000,6.38,181000,1380,21000,2732,7453,2249,0,0,0,2013,4,17,LOVELL,TX,4,COMPRESSOR,CS,802,PW,2012,10,3,117-21563,OGO-67805,41.576378,-77.020869,Yes,Horizontal Well,GAS,Bbl,2012,FracingFluid,0,0,0,0,0,2012.833333,0.5,3.313917297,4.707570176,0.846955325,3.933487288,4.267171728,1.692846919,2.149219113,3.056904851,4.56937391,3.674861141,0.667452953,1.51851394,2.880241776,5.008600172,4.875061263,5.133538908,0.804820679,5.257678575,3.139879086,4.322219295,3.436480695,3.872331121,3.351989455,0.520341666,0,0,0,0,0,0,0,0,0,0,4573,TIOGA,NEAL 815,803,Drilling fluid,3834100,lb,liquid,41589,11/11/13,4950,0.0094,0.118,34,1980,0.164,7.12,1.1,2.94,0.264,2360,0,18.7,0.0636,598,0,7030,2020,23700,11.6,14000,308,0,114,5.985,0,0,0,0,2013,11,11,NEAL,815,0,0,0,803,DrillFluid,2008,10,24,117-20206,OGO-67805,41.781425,-77.130154,Yes,Vertical Well,GAS,Bbl,2012,PW,0,302.81,282,0,0,2008.833333,5.083333333,0,3.694605199,-0.928117993,1.531478917,3.29666519,0.852479994,0.041392685,0.46834733,3.372912003,1.271841607,-1.196542884,2.776701184,0,3.846955325,3.305351369,4.374748346,1.064457989,4.146128036,2.488550717,0,2.056904851,0.777064155,0,0,0,0,0,0,0,0,0,0,0,0,3574,TIOGA,RIEPPEL METER PPL,801,"Drilling fluids, residuals",426965,lb,liquid,41549,10/2/13,1680,2.79,0.367,1.4,445,10.8,1450,12,137,22.4,4330,0.038,19,0.477,72,0,22200,35900,26900,4.7,45300,16,6.04,56.4,6.22,22.2,0,0,0,2013,10,2,RIEPPEL,METER,PPL,0,0,803,DrillFluid,0,0,0,0,0,0,0,0,0,0,0,0,0,0,0,0,0,0,0,0,0.28018018,3.225309282,-0.435333936,0.146128036,2.648360011,3.161368002,1.079181246,2.136720567,3.636487896,1.278753601,-0.321481621,1.857332496,0,4.346352974,4.555094449,4.42975228,0.672097858,4.656098202,1.204119983,0.781036939,1.751279104,0.793790385,1.346352974,-0.55256259,0,0,0,0,0,0,0,0,0,0,3575,TIOGA,TRIMBLEDWIN C,802,Brine,432525598,lb,liquid,41354,3/21/13,23500,0,2.08,3340,8500,0,52,66.9,555,6.97,15700,0,2160,1,63,271,40000,16000,90400,6.42,38400,124,5147,1315,2765,349,0,0,0,2013,3,21,TRIMBLEDWIN,C,0,0,0,802,Brine,0,0,0,0,0,0,0,0,0,0,0,0,0,0,0,0,0,0,0,0,7.922636103,4.371067862,0.318063335,3.523746467,3.929418926,1.716003344,1.825426118,2.744292983,4.195899652,3.334453751,0,1.799340549,2.432969291,4.602059991,4.204119983,4.95616843,0.807535028,4.584331224,2.093421685,3.711554168,3.118925753,3.441695136,2.542825427,0.898869709,0,0,0,0,0,0,0,0,0,0,1576,TIOGA,YAGGIE  TX 2 COMPRESSOR CS,802,PW,212297,lb,liquid,41381,4/17/13,14600,0,0.73,393,5230,1.02,163,39.4,374,7.12,15000,0,990,6.39,51,187,31700,47000,68900,6.1,57000,3960,8499,1953,2065,249,0,0,0,2013,4,17,YAGGIE,0,TX,2,COMPRESSOR,802,PW,2010,7,1,117-20697,OGO-67805,41.585242,-76.980439,Yes,Vertical Well,GAS,Bbl,2012,Yes,0,0,0,0,0,2010.583333,2.75,8.293172691,4.164352856,-0.13667714,2.59439255,3.718501689,2.212187604,1.595496222,2.572871602,4.176091259,2.995635195,0.805500858,1.707570176,2.271841607,4.501059262,4.672097858,4.838219222,0.785329835,4.755874856,3.597695186,3.929367829,3.290702243,3.314920056,2.396199347,0.918720709,0,0,0,0,0,0,0,0,0,0,4577,TIOGA,AVERY 212,802,Brine,325455,lb,liquid,41107,7/17/12,102000,0,3.6,9790,36400,0.86,150,253,2620,25.7,53000,0,9520,6.15,8,0,165000,8700,191000,5.06,305000,126,11890,5058,13890,16.3,0,0,0,2012,7,17,AVERY,212,0,0,0,802,Brine,2008,3,4,117-20264,OGO-67805,41.786842,-77.18475,Yes,Horizontal Well,GAS,Bbl,Yes,PW,0,97720.74,366,0,0,2008.25,4.333333333,852.1472393,5.008600172,0.556302501,3.990782692,4.561101384,2.176091259,2.403120521,3.418301291,4.72427587,3.978636948,0.788875116,0.903089987,0,5.217483944,3.939519253,5.281033367,0.704150517,5.484299839,2.100370545,4.075181855,3.703978825,4.142702246,1.212187604,2.930514641,0,0,0,0,0,0,0,0,0,0,1578,TIOGA,BARBINE 292,802,Brine,9306232,lb,liquid,41156,9/4/12,92000,0,5.82,12500,32900,0,117,263,2410,11.7,60600,0,8380,9.49,71,1150,147000,33000,205000,6.05,264000,366,52050,12070,10240,484,0,0,0,2012,9,4,BARBINE,292,0,0,0,802,Brine,2010,6,15,117-20631,OGO-67805,41.789326,-77.277533,Yes,Vertical Well,GAS,Bbl,2013,PW,0,0,0,0,0,2010.5,2.25,21.15702479,4.963787827,0.764922985,4.096910013,4.517195898,2.068185862,2.419955748,3.382017043,4.782472624,3.923244019,0.977266212,1.851258349,3.06069784,5.167317335,4.51851394,5.311753861,0.781755375,5.421603927,2.563481085,4.716420734,4.08170727,4.010299957,2.684845362,1.325454595,0,0,0,0,0,0,0,0,0,0,1579,TIOGA,BARBINE 292,804,Fracing fluid waste,39307814585,lb,liquid,41107,7/17/12,73500,0,5.31,9880,26200,0,80.5,239,1940,8.57,53700,0,6960,4.98,22,1220,149000,7300,186000,5.71,258000,116,8846,6025,236,20.8,0,0,0,2012,7,17,BARBINE,292,0,0,0,805,FracingFluid,2010,6,15,117-20631,OGO-67805,41.789326,-77.277533,Yes,Vertical Well,GAS,Bbl,2013,PW,0,0,0,0,0,2010.5,2.083333333,11.34615385,4.866287339,0.725094521,3.994756945,4.418301291,1.90579588,2.378397901,3.28780173,4.729974286,3.84260924,0.697229343,1.342422681,3.086359831,5.173186268,3.86332286,5.269512944,0.756636108,5.411619706,2.064457989,3.946746935,3.779957051,2.372912003,1.318063335,1.054848668,0,0,0,0,0,0,0,0,0,0,6580,TIOGA,BARNER 709 5H M,804,Fracing fluid waste,6178699,lb,liquid,41248,12/5/12,84200,0,0,3770,29900,0,95.6,264,2320,21.8,76300,0,5910,0.82,22,1110,172000,7200,212000,5.5,308000,82,57540,12110,3823,981,0,0,0,2012,12,5,BARNER,709,5H,M,0,805,FracingFluid,2012,2,10,117-21437,OGO-67805,41.559311,-77.029189,Yes,Horizontal Well,GAS,Bbl,Yes,PW,0,113990.69,29,0,0,2012.166667,0.833333333,3.897043833,4.925312091,0,3.57634135,4.475671188,1.980457892,2.421603927,3.365487985,4.882524538,3.771587481,-0.086186148,1.342422681,3.045322979,5.235528447,3.857332496,5.326335861,0.740362689,5.488550717,1.913813852,4.759969858,4.083144143,3.582404298,2.991669007,0.590735291,0,0,0,0,0,0,0,0,0,0,6581,TIOGA,BROADBENT 466,804,Fracing fluid waste,737636624,lb,liquid,41129,8/8/12,63400,0,4.08,5190,22300,0,280,141,1870,18.5,57100,0,4200,3.26,113,830,103000,21000,173000,5.9,201000,507,7.15,2.33,854,1207,0,0,0,2012,8,8,BROADBENT,466,0,0,0,805,FracingFluid,2010,6,24,117-20737,OGO-67805,41.645956,-77.327672,Yes,Vertical Well,GAS,Bbl,Yes,PW,0,0,0,0,0,2010.5,2.166666667,0.707539354,4.802089258,0.610660163,3.715167358,4.348304863,2.447158031,2.149219113,3.271841607,4.756636108,3.62324929,0.5132176,2.053078443,2.919078092,5.012837225,4.322219295,5.238046103,0.770852012,5.303196057,2.705007959,0.854306042,0.367355921,2.931457871,3.08170727,-0.150249399,0,0,0,0,0,0,0,0,0,0,6582,TIOGA,BUCKWALTER 429,804,Fracing fluid waste,2473972795,lb,liquid,41163,9/11/12,57100,0,6.56,8790,20200,0,111,186,1610,10.7,48500,0,5400,1.97,35,879,110000,7200,159000,5.7,207000,154,6248,1263,7182,747,0,0,0,2012,9,11,BUCKWALTER,429,0,0,0,805,FracingFluid,2011,1,19,117-20857,OGO-67805,41.668464,-77.415683,Yes,Vertical Well,GAS,Bbl,Yes,PW,0,0,0,0,0,2011.083333,1.666666667,9.614457831,4.756636108,0.816903839,3.943988875,4.305351369,2.045322979,2.269512944,3.206825876,4.685741739,3.73239376,0.294466226,1.544068044,2.943988875,5.041392685,3.857332496,5.201397124,0.755874856,5.315970345,2.187520721,3.795741021,3.101403351,3.856245401,2.873320602,0.982924799,0,0,0,0,0,0,0,0,0,0,6583,TIOGA,BUCKWALTER 429,804,Fracing fluid waste,0,0,liquid,41193,10/11/12,88800,0,4.12,11900,31700,0,100,226,2360,13.3,58300,0,9090,0.72,21,1120,144000,14000,215000,5.67,266000,305,62800,19650,21300,1870,0,0,0,2012,10,11,BUCKWALTER,429,0,0,0,805,FracingFluid,2011,1,19,117-20857,OGO-67805,41.668464,-77.415683,Yes,Vertical Well,GAS,Bbl,Yes,PW,0,0,0,0,0,2011.083333,1.75,11.39037433,4.948412966,0.614897216,4.075546961,4.501059262,2,2.354108439,3.372912003,4.765668555,3.958563883,-0.142667504,1.322219295,3.049218023,5.158362492,4.146128036,5.33243846,0.753583059,5.424881637,2.484299839,4.797959644,4.293362555,4.328379603,3.271841607,1.056537997,0,0,0,0,0,0,0,0,0,0,6584,TIOGA,BURLEIGH 508 5H,802,Brine,1745861,lb,liquid,41116,7/26/12,116000,0,4.08,19300,41400,0,157,283,3110,17.2,63600,0,12000,4.91,13,1420,185000,1400000,173000,5.31,313000,329,2177,1094,13340,1551,0,0,0,2012,7,26,BURLEIGH,508,5H,0,0,802,Brine,2009,10,8,117-20383,OGO-67805,41.850617,-76.918672,Yes,Horizontal Well,GAS,Bbl,Yes,PW,0,90723.74,366,0,0,2009.833333,2.75,8.600902643,5.064457989,0.610660163,4.285557309,4.617000341,2.195899652,2.451786436,3.492760389,4.803457116,4.079181246,0.691081492,1.113943352,3.152288344,5.267171728,6.146128036,5.238046103,0.725094521,5.495544338,2.517195898,3.337858429,3.039017322,4.12515583,3.190611798,0.934544032,0,0,0,0,0,0,0,0,0,0,1585,TIOGA,BUTLER 127,802,Brine,51395186,lb,liquid,40940,2/1/12,27500,0,5.3,5220,9580,0.12,81,127,876,2.99,32600,0,2780,0.19,111,621,65100,4100,114000,6.14,109000,1380,14990,1784,7965,320,0,0,0,2012,2,1,BUTLER,127,0,0,0,802,Brine,2011,2,20,117-20467,OGO-67805,41.755025,-77.368364,Yes,Horizontal Well,GAS,Bbl,Yes,PW,0,576635.17,366,0,0,2011.166667,1,24.890625,4.439332694,0.72427587,3.717670503,3.981365509,1.908485019,2.103803721,2.942504106,4.5132176,3.444044796,-0.721246399,2.045322979,2.7930916,4.813580989,3.612783857,5.056904851,0.788168371,5.037426498,3.139879086,4.175801633,3.25139485,3.90118578,2.505149978,1.396035802,0,0,0,0,0,0,0,0,0,0,1586,TIOGA,CHAPMAN 237,802,Brine,459133555,lb,liquid,41108,7/18/12,106000,0,3.2,13600,38100,0,179,292,2600,16.3,61200,0,8380,3.53,21,0,204000,13000,201000,5.35,319000,147,39850,0,19950,1355,0,0,0,2012,7,18,CHAPMAN,237,0,0,0,802,Brine,2009,11,29,117-20334,OGO-67805,41.808292,-76.933453,Yes,Horizontal Well,GAS,Bbl,Yes,PW,0,127243.52,366,0,0,2009.916667,2.666666667,14.72324723,5.025305865,0.505149978,4.133538908,4.580924976,2.252853031,2.465382851,3.414973348,4.786751422,3.923244019,0.547774705,1.322219295,0,5.309630167,4.113943352,5.303196057,0.728353782,5.503790683,2.167317335,4.600428326,0,4.2999429,3.131939295,1.168003605,0,0,0,0,0,0,0,0,0,0,1587,TIOGA,CHAPPELL 855,804,Fracing fluid waste,5971795455,lb,liquid,41051,5/22/12,63500,0,5.64,8580,22800,0,60.5,197,1590,8.49,48700,0,6040,3.5,42,973,119000,8900,160000,6.02,224000,133,11710,1996,9493,1162,0,0,0,2012,5,22,CHAPPELL,855,0,0,0,805,FracingFluid,2011,11,28,117-21372,OGO-67805,41.898994,-77.221878,Yes,Horizontal Well,GAS,Bbl,Yes,Yes,0,0,0,0,0,2011.916667,0.5,8.169535284,4.802773725,0.751279104,3.933487288,4.357934847,1.781755375,2.294466226,3.201397124,4.687528961,3.781036939,0.544068044,1.62324929,2.98811284,5.075546961,3.949390007,5.204119983,0.779596491,5.350248018,2.123851641,4.068556895,3.300160537,3.977403481,3.065206128,0.912197353,0,0,0,0,0,0,0,0,0,0,6588,TIOGA,COCHRAN 705,802,Brine,47453008,lb,liquid,41157,9/5/12,136000,0,6.2,2330,48100,0,112,356,3360,25.3,70100,0,7120,4.57,0,1160,149000,25000,195000,4.21,288000,351,17990,563,16680,1803,0,0,0,2012,9,5,COCHRAN,705,0,0,0,802,Brine,2010,7,22,117-20710,OGO-67805,41.584992,-76.997783,Yes,Vertical Well,GAS,Bbl,Yes,PW,0,0,0,0,0,2010.583333,2.166666667,9.25124792,5.133538908,0.792391689,3.367355921,4.682145076,2.049218023,2.551449998,3.526339277,4.845718018,3.852479994,0.6599162,0,3.064457989,5.173186268,4.397940009,5.290034611,0.624282096,5.459392488,2.545307116,4.255031163,2.750508395,4.222196046,3.255995727,0.96620032,0,0,0,0,0,0,0,0,0,0,1589,TIOGA,COLE 236,802,Brine,4341844,lb,liquid,41106,7/16/12,46600,0,0,8730,16700,0,25.4,118,1180,9.36,31300,0,3620,3.66,6,638,88300,5500,143000,5.31,146000,40,4608,1271,5444,429,0,0,0,2012,7,16,COLE,236,0,0,0,802,Brine,2009,8,21,117-20307,OGO-67805,41.8054,-76.953934,Yes,Horizontal Well,GAS,Bbl,Yes,PW,0,120590.33,366,0,0,2009.666667,2.916666667,12.68997669,4.668385917,0,3.941014244,4.222716471,1.404833717,2.071882007,3.071882007,4.495544338,3.558708571,0.563481085,0.77815125,2.804820679,4.945960704,3.740362689,5.155336037,0.725094521,5.164352856,1.602059991,3.66351247,3.104145551,3.735918117,2.632457292,1.103460824,0,0,0,0,0,0,0,0,0,0,1590,TIOGA,COURTNEY 129,802,Brine,9751967,lb,liquid,41092,7/2/12,73500,0,0,22500,26200,0,68,203,1980,15,58700,0,7740,10.3,14,1020,148000,10000,190000,4.81,258000,89,16970,2552,5770,1029,0,0,0,2012,7,2,COURTNEY,129,0,0,0,802,Brine,2009,6,1,117-20272,OGO-67805,41.776148,-77.145002,Yes,Horizontal Well,GAS,Bbl,Yes,PW,0,451518.58,366,0,0,2009.5,3.083333333,5.607385811,4.866287339,0,4.352182518,4.418301291,1.832508913,2.307496038,3.29666519,4.768638101,3.888740961,1.012837225,1.146128036,3.008600172,5.170261715,4,5.278753601,0.682145076,5.411619706,1.949390007,4.229681842,3.40688067,3.761175813,3.012415375,0.748760438,0,0,0,0,0,0,0,0,0,0,1591,TIOGA,COURTNEY 255,802,Brine,320089165,lb,liquid,41107,7/17/12,109000,0,3.48,12900,39200,0,100,287,2690,25.2,63600,0,9800,5.59,0,0,193000,13000,195000,3.8,337000,45,4649,4033,6406,12.8,0,0,0,2012,7,17,COURTNEY,255,0,0,0,802,Brine,2009,6,1,117-20272,OGO-67805,41.776148,-77.145002,Yes,Horizontal Well,GAS,Bbl,Yes,PW,0,451518.58,366,0,0,2009.5,3.083333333,500.46875,5.037426498,0.541579244,4.11058971,4.593286067,2,2.457881897,3.42975228,4.803457116,3.991226076,0.747411808,0,0,5.285557309,4.113943352,5.290034611,0.579783597,5.527629901,1.653212514,3.667359546,3.605628222,3.806586934,1.10720997,2.699376965,0,0,0,0,0,0,0,0,0,0,1592,TIOGA,CUMMINGS 823,802,Brine,11038390475,lb,liquid,41093,7/3/12,131000,0,6.18,4560,44800,0.16,95.8,294,4660,8.96,71300,0,6630,8.97,28,1180,172000,12000,189000,5.51,285000,96,37870,9045,9102,404,0,0,0,2012,7,3,CUMMINGS,823,0,0,0,802,Brine,2010,3,31,117-20610,OGO-67805,41.895727,-77.379674,Yes,Horizontal Well,GAS,Bbl,Yes,PW,0,138605.16,366,0,0,2010.25,2.333333333,22.52970297,5.117271296,0.790988475,3.658964843,4.651278014,1.981365509,2.46834733,3.668385917,4.85308953,3.821513528,0.952792443,1.447158031,3.071882007,5.235528447,4.079181246,5.276461804,0.741151599,5.45484486,1.982271233,4.578295305,3.956408571,3.959136831,2.606381365,1.352755466,0,0,0,0,0,0,0,0,0,0,1593,TIOGA,DANDOIS 482,802,Brine,2966612,lb,liquid,41108,7/18/12,56900,0,2.93,20100,20400,0,120,258,1460,5.46,49300,0,6030,2.51,70,1330,147000,11000,191000,5.98,250000,87,14970,4301,14750,805,0,0,0,2012,7,18,DANDOIS,482,0,0,0,802,Brine,2010,6,12,117-20558,OGO-67805,41.812422,-76.911711,Yes,Horizontal Well,GAS,Bbl,Yes,PW,0,1029866.15,366,0,0,2010.5,2.083333333,18.32298137,4.755112266,0.46686762,4.303196057,4.309630167,2.079181246,2.411619706,3.164352856,4.692846919,3.780317312,0.399673721,1.84509804,3.123851641,5.167317335,4.041392685,5.281033367,0.776701184,5.397940009,1.939519253,4.1752218,3.633569443,4.16879202,2.90579588,1.26299614,0,0,0,0,0,0,0,0,0,0,1594,TIOGA,DEDWIN COTTO 2,802,Brine,132616344,lb,liquid,41086,6/26/12,21200,0,9.79,970,7680,0,1360,52.2,489,17.6,11800,0,1380,6.78,681,183,31100,38000,66400,5.28,72400,114,31220,9357,1086,14.6,0,0,0,2012,6,26,DEDWIN,COTTO,2,0,0,802,Brine,0,0,0,0,0,0,0,0,0,0,0,0,0,0,0,0,0,0,0,0,74.38356164,4.326335861,0.990782692,2.986771734,3.88536122,3.133538908,1.717670503,2.689308859,4.071882007,3.139879086,0.831229694,2.833147112,2.26245109,4.492760389,4.579783597,4.822168079,0.722633923,4.859738566,2.056904851,4.494432899,3.971136629,3.035829825,1.164352856,1.871476969,0,0,0,0,0,0,0,0,0,0,1595,TIOGA,DEDWIN COTTO 1,802,Brine,98262375,lb,liquid,41192,10/10/12,91800,0,18.4,3120,32800,4.38,453,208,2400,93.3,44000,0,5600,7,0,714,124000,78000,174000,2.98,231000,86,4675,3289,2534,1920,0,0,0,2012,10,10,DEDWIN,COTTO,1,0,0,802,Brine,0,0,0,0,0,0,0,0,0,0,0,0,0,0,0,0,0,0,0,0,1.319791667,4.962842681,1.264817823,3.494154594,4.515873844,2.656098202,2.318063335,3.380211242,4.643452676,3.748188027,0.84509804,0,2.853698212,5.093421685,4.892094603,5.240549248,0.474216264,5.36361198,1.934498451,3.669781615,3.517063873,3.403806611,3.283301229,0.120505382,0,0,0,0,0,0,0,0,0,0,1596,TIOGA,DEDWIN COTTO 2,802,Brine,16690,lb,liquid,41192,10/10/12,16100,0,90.2,795,5850,0,1030,37.6,364,14.7,8110,0,1060,2.72,855,141,23000,400000,27400,5.63,13900,1640,2342,311,692,408,0,0,0,2012,10,10,DEDWIN,COTTO,2,0,0,802,Brine,0,0,0,0,0,0,0,0,0,0,0,0,0,0,0,0,0,0,0,0,1.696078431,4.206825876,1.955206538,2.900367129,3.767155866,3.012837225,1.575187845,2.561101384,3.909020854,3.025305865,0.434568904,2.931966115,2.149219113,4.361727836,5.602059991,4.437750563,0.750508395,4.1430148,3.214843848,3.369586891,2.492760389,2.840106094,2.610660163,0.229445931,0,0,0,0,0,0,0,0,0,0,1597,TIOGA,DETWEILER 235A,802,Brine,1661637,lb,liquid,41108,7/18/12,54800,0,0,17200,19400,2.21,137,152,1540,5.95,49200,0,5980,7.49,41,899,134000,8600,184000,5.8,39000,79,7232,2110,8128,833,0,0,0,2012,7,18,DETWEILER,235A,0,0,0,802,Brine,2009,1,31,117-20262,OGO-67805,41.796811,-76.976538,Yes,Horizontal Well,GAS,Bbl,Yes,PW,0,263430.29,366,0,0,2009.083333,3.5,9.757503001,4.738780558,0,4.235528447,4.28780173,2.136720567,2.181843588,3.187520721,4.691965103,3.776701184,0.874481818,1.612783857,2.953759692,5.127104798,3.934498451,5.264817823,0.763427994,4.591064607,1.897627091,3.859258417,3.324282455,3.909983695,2.920645001,0.989338694,0,0,0,0,0,0,0,0,0,0,1598,TIOGA,DOAN 870,804,Fracing fluid waste,5368730145,lb,liquid,41128,8/7/12,31000,0,7.99,2910,10700,0,132,118,1050,2.4,27200,0,2350,4.01,153,546,62600,11000,114000,6.44,117000,1070,4023,4981,7541,379,0,0,0,2012,8,7,DOAN,870,0,0,0,805,FracingFluid,2012,3,2,117-21466,OGO-67805,41.955386,-77.421731,Yes,Horizontal Well,GAS,Bbl,Yes,Yes,204.28,0,0,0,0,2012.25,0.416666667,19.89709763,4.491361694,0.902546779,3.463892989,4.029383778,2.120573931,2.071882007,3.021189299,4.434568904,3.371067862,0.603144373,2.184691431,2.737192643,4.796574333,4.041392685,5.056904851,0.808885867,5.068185862,3.029383778,3.604550033,3.697316542,3.877428941,2.57863921,1.298789731,0,0,0,0,0,0,0,0,0,0,6599,TIOGA,EMPSON 235,802,Brine,1371918,lb,liquid,41106,7/16/12,46400,0,2.66,15200,16400,0,127,147,1300,6.1,44600,0,4600,7.69,30,756,109000,4700,167000,5.68,192000,51,7378,481,6783,943,0,0,0,2012,7,16,EMPSON,235,0,0,0,802,Brine,2009,9,2,117-20278,OGO-67805,41.800094,-76.96821,Yes,Horizontal Well,GAS,Bbl,Yes,PW,0,643646.88,366,0,0,2009.75,2.833333333,7.19300106,4.666517981,0.424881637,4.181843588,4.214843848,2.103803721,2.167317335,3.113943352,4.649334859,3.662757832,0.88592634,1.477121255,2.878521796,5.037426498,3.672097858,5.222716471,0.754348336,5.283301229,1.707570176,3.867938651,2.682145076,3.831421817,2.974511693,0.856910124,0,0,0,0,0,0,0,0,0,0,1600,TIOGA,ERICKSON 448,802,Brine,13515623,lb,liquid,41128,8/7/12,102000,0,4.93,16800,36500,0,145,258,2680,16.2,68000,0,11800,16.7,41,1260,162000,12000,194000,5.91,301000,174,38480,12830,15970,2133,0,0,0,2012,8,7,ERICKSON,448,0,0,0,802,Brine,2010,6,12,117-20601,OGO-67805,41.682127,-77.380628,Yes,Vertical Well,GAS,Bbl,2013,PW,0,0,0,0,0,2010.5,2.166666667,7.487107361,5.008600172,0.692846919,4.225309282,4.562292864,2.161368002,2.411619706,3.428134794,4.832508913,4.071882007,1.222716471,1.612783857,3.100370545,5.209515015,4.079181246,5.28780173,0.771587481,5.478566496,2.240549248,4.585235063,4.108226656,4.203304916,3.328990855,0.874314061,0,0,0,0,0,0,0,0,0,0,1601,TIOGA,ERICKSON 448,804,Fracing fluid waste,87273,lb,liquid,41065,6/5/12,72500,0.31,4.08,9520,25900,2.1,925,181,1900,11.9,49400,0,7110,3.42,116,799,108000,13000,177000,5.88,193000,45100,16680,1801,13740,1014,0,0,0,2012,6,5,ERICKSON,448,0,0,0,805,FracingFluid,2010,6,12,117-20601,OGO-67805,41.682127,-77.380628,Yes,Vertical Well,GAS,Bbl,2013,PW,0,0,0,0,0,2010.5,2,13.55029586,4.860338007,0.610660163,3.978636948,4.413299764,2.966141733,2.257678575,3.278753601,4.693726949,3.851869601,0.534026106,2.064457989,2.902546779,5.033423755,4.113943352,5.247973266,0.769377326,5.285557309,4.654176542,4.222196046,3.255513713,4.137986733,3.006037955,1.131948778,0,0,0,0,0,0,0,0,0,0,6602,TIOGA,ERICKSON 448,804,Fracing fluid waste,0,0,liquid,41082,6/22/12,60220,0,2.1,6989,21300,0,48,0,1708,7,25094,0,5939,0,31,2220,128516,3565,214726,5.83,359800,349,16680,1801,13740,1014,0,0,0,2012,6,22,ERICKSON,448,0,0,0,805,FracingFluid,2010,6,12,117-20601,OGO-67805,41.682127,-77.380628,Yes,Vertical Well,GAS,Bbl,2013,PW,0,0,0,0,0,2010.5,2,13.55029586,4.779740751,0.322219295,3.84441504,4.328379603,1.681241237,0,3.232487866,4.399569894,3.773713325,0,1.491361694,3.346352974,5.1089572,3.552059534,5.331884634,0.765668555,5.556061159,2.542825427,4.222196046,3.255513713,4.137986733,3.006037955,1.131948778,0,0,0,0,0,0,0,0,0,0,6603,TIOGA,FISH 301 4-6 H,802,Brine,45748959,lb,liquid,41085,6/25/12,31400,0,1.95,6240,11300,0,22,99.2,777,3.96,22200,0,2900,0.8,7,384,55800,6500,107000,5.79,99100,18,58110,15150,9277,493,0,0,0,2012,6,25,FISH,301,6-Apr,H,0,802,Brine,2011,5,25,117-20900,OGO-67805,41.766492,-77.176006,Yes,Horizontal Well,GAS,Bbl,Yes,PW,0,0,0,0,0,2011.416667,1.083333333,18.81744422,4.496929648,0.290034611,3.79518459,4.053078443,1.342422681,1.996511672,2.890421019,4.346352974,3.462397998,-0.096910013,0.84509804,2.584331224,4.746634199,3.812913357,5.029383778,0.762678564,4.996073654,1.255272505,4.764250875,4.180412633,3.967407557,2.692846919,1.274560637,0,0,0,0,0,0,0,0,0,0,1604,TIOGA,FISH 301 4-6 H,804,Fracing fluid waste,0,0,liquid,41025,4/26/12,53300,0,4.7,9820,19200,0.42,132,210,1320,6.1,46400,0,4620,2.34,57,919,117000,17000,181000,5.64,191000,4140,65700,17090,1654,1292,0,0,0,2012,4,26,FISH,301,6-Apr,H,0,805,FracingFluid,2011,5,25,117-20900,OGO-67805,41.766492,-77.176006,Yes,Horizontal Well,GAS,Bbl,Yes,PW,0,0,0,0,0,2011.416667,0.916666667,1.280185759,4.726727209,0.672097858,3.992111488,4.283301229,2.120573931,2.322219295,3.120573931,4.666517981,3.664641976,0.369215857,1.755874856,2.963315511,5.068185862,4.230448921,5.257678575,0.751279104,5.281033367,3.617000341,4.81756537,4.232742063,3.218535505,3.111262514,0.107272992,0,0,0,0,0,0,0,0,0,0,6605,TIOGA,GEE 832,804,Fracing fluid waste,425539878,lb,liquid,41115,7/25/12,41800,0,5.94,8560,14800,0,93.2,188,1170,3.96,42100,0,4110,3.06,108,783,92400,1100000,163000,6.01,178000,726,22610,5301,9423,846,0,0,0,2012,7,25,GEE,832,0,0,0,805,FracingFluid,2010,5,4,117-20562,OGO-67805,41.852412,-77.293791,Yes,Vertical Well,GAS,Bbl,Yes,DrillFluid,0,0,0,0,0,2010.416667,2.166666667,11.13829787,4.621176282,0.773786445,3.932473765,4.170261715,1.969415912,2.274157849,3.068185862,4.624282096,3.613841822,0.485721426,2.033423755,2.893761762,4.965671971,6.041392685,5.212187604,0.778874472,5.250420002,2.860936621,4.354300562,3.724357804,3.974189191,2.927370363,1.046818828,0,0,0,0,0,0,0,0,0,0,6606,TIOGA,HEDRICK 702,804,Fracing fluid waste,728077568,lb,liquid,41191,10/9/12,67200,0,8.05,11500,24200,0,114,233,1640,12.8,59200,0,6480,1.31,31,1060,142000,8900,205000,5.73,120000,1100,44510,9359,15800,1480,0,0,0,2012,10,9,HEDRICK,702,0,0,0,805,FracingFluid,2010,8,4,117-20733,OGO-67805,41.611281,-76.980156,Yes,Vertical Well,GAS,Bbl,Yes,PW,0,0,0,0,0,2010.666667,2.166666667,10.67567568,4.827369273,0.90579588,4.06069784,4.383815366,2.056904851,2.367355921,3.214843848,4.772321707,3.811575006,0.117271296,1.491361694,3.025305865,5.152288344,3.949390007,5.311753861,0.758154622,5.079181246,3.041392685,4.648457594,3.971229447,4.198657087,3.170261715,1.028395372,0,0,0,0,0,0,0,0,0,0,6607,TIOGA,HEGE 426,804,Fracing fluid waste,28861737285,lb,liquid,41191,10/9/12,75800,0,6.67,11200,27200,0,93.4,221,1930,13.2,57200,0,7620,0.74,21,1240,153000,7600,204000,5.77,256000,508,33810,8976,14400,1480,0,0,0,2012,10,9,HEGE,426,0,0,0,805,FracingFluid,2010,6,13,117-20632,OGO-67805,41.684857,-77.418204,Yes,Vertical Well,GAS,Bbl,Yes,PW,0,0,0,0,0,2010.5,2.333333333,9.72972973,4.879669206,0.824125834,4.049218023,4.434568904,1.970346876,2.344392274,3.285557309,4.757396029,3.881954971,-0.13076828,1.322219295,3.093421685,5.184691431,3.880813592,5.309630167,0.761175813,5.408239965,2.705863712,4.529045171,3.953082844,4.158362492,3.170261715,0.988100777,0,0,0,0,0,0,0,0,0,0,6608,TIOGA,HOUCK 433,804,Fracing fluid waste,6217025,lb,liquid,41249,12/6/12,34400,0,5.15,4570,11900,0,110,136,1130,3.59,33200,0,3140,1.71,106,662,77600,9300,143000,6.02,141000,300,18980,3256,5810,548,0,0,0,2012,12,6,HOUCK,433,0,0,0,805,FracingFluid,2009,11,29,117-20367,OGO-67805,41.725515,-77.405711,Yes,Horizontal Well,GAS,Bbl,2013,PW,0,101632.2,29,0,0,2009.916667,3.083333333,10.60218978,4.536558443,0.711807229,3.6599162,4.075546961,2.041392685,2.133538908,3.053078443,4.521138084,3.496929648,0.23299611,2.025305865,2.820857989,4.889861721,3.968482949,5.155336037,0.779596491,5.149219113,2.477121255,4.278296208,3.512684396,3.764176132,2.738780558,1.025395574,0,0,0,0,0,0,0,0,0,0,6609,TIOGA,JOHNSON 435,802,Brine,1962744,lb,liquid,41157,9/5/12,25800,0,5.89,4680,8690,0,93.4,118,1000,3.43,28700,0,2540,1.26,80,452,49000,4900,91600,6.45,98300,192,7202,430.123,2891,105,0,0,0,2012,9,5,JOHNSON,435,0,0,0,802,Brine,2009,10,22,117-20368,OGO-67805,41.733813,-77.399627,Yes,Horizontal Well,GAS,Bbl,Yes,PW,0,364643.6,125,0,0,2009.833333,2.916666667,27.53333333,4.411619706,0.770115295,3.670245853,3.939019776,1.970346876,2.071882007,3,4.457881897,3.404833717,0.100370545,1.903089987,2.655138435,4.69019608,3.69019608,4.961895474,0.809559715,4.992553518,2.283301229,3.857453117,2.633592666,3.461048092,2.021189299,1.439858793,0,0,0,0,0,0,0,0,0,0,1610,TIOGA,KNOWLTON,802,Brine,113814117,lb,liquid,41064,6/4/12,94100,0,5.07,19100,33800,0.08,113,293,2360,12.1,73000,0,0,0.63,36,401,166000,17000,212000,5.73,302000,468,75370,9824,23140,1922,0,0,0,2012,6,4,KNOWLTON,0,0,0,0,802,Brine,2011,2,20,117-21174,OGO-67805,41.748322,-77.188872,Yes,Horizontal Well,GAS,Bbl,Yes,PW,0,535826.49,361,0,0,2011.166667,1.333333333,12.03954214,4.973589623,0.705007959,4.281033367,4.5289167,2.053078443,2.46686762,3.372912003,4.86332286,0,-0.200659451,1.556302501,2.603144373,5.220108088,4.230448921,5.326335861,0.758154622,5.480006943,2.670245853,4.877198515,3.992288354,4.364363355,3.283753383,1.080609971,0,0,0,0,0,0,0,0,0,0,1611,TIOGA,KNOWLTON,804,Fracing fluid waste,44882472615,lb,liquid,41002,4/3/12,99700,0,5.94,17800,36000,0,114,299,2370,13,64000,0,8260,0.5,28,1220,176000,13000,210000,5.59,287000,38,22690,3960,21150,486,0,0,0,2012,4,3,KNOWLTON,0,0,0,0,805,FracingFluid,2011,2,20,117-21174,OGO-67805,41.748322,-77.188872,Yes,Horizontal Well,GAS,Bbl,Yes,PW,0,535826.49,361,0,0,2011.166667,1.166666667,43.51851852,4.998695158,0.773786445,4.250420002,4.556302501,2.056904851,2.475671188,3.374748346,4.806179974,3.916980047,-0.301029996,1.447158031,3.086359831,5.245512668,4.113943352,5.322219295,0.747411808,5.457881897,1.579783597,4.355834496,3.597695186,4.325310372,2.686636269,1.638674102,0,0,0,0,0,0,0,0,0,0,6616,TIOGA,KRAUSE K1 COMPRESSOR CS,802,PW,0,0,liquid,40982,3/14/12,28000,0.017,1.5,4900,9100,0.39,280,59,510,9.3,16000,0.068,2200,0.5,55,270,41000,0,130000,6.11,89000,720,0,0,0,0,0,0,0,2012,3,14,KRAUSE,K1,COMPRESSOR,CS,0,802,PW,1992,10,17,117-20159,OGO-67805,41.775333,-76.990988,No,Vertical Well,GAS,Bbl,2011,FracingFluid,0,0,0,0,0,1992.833333,0,0,4.447158031,0.176091259,3.69019608,3.959041392,2.447158031,1.770852012,2.707570176,4.204119983,3.342422681,-0.301029996,1.740362689,2.431363764,4.612783857,0,5.113943352,0.78604121,4.949390007,2.857332496,0,0,0,0,0,0,0,0,0,0,0,0,0,0,0,4617,TIOGA,KRAUSEDWIN C,802,Brine,159526754,lb,liquid,40982,3/14/12,24000,0.033,1.4,4400,7900,0.47,350,57,620,12,14000,0.083,1900,0.65,110,270,40000,0,140000,6.24,91000,730,0,0,0,0,0,0,0,2012,3,14,KRAUSEDWIN,C,0,0,0,802,Brine,0,0,0,0,0,0,0,0,0,0,0,0,0,0,0,0,0,0,0,0,0,4.380211242,0.146128036,3.643452676,3.897627091,2.544068044,1.755874856,2.792391689,4.146128036,3.278753601,-0.187086643,2.041392685,2.431363764,4.602059991,0,5.146128036,0.79518459,4.959041392,2.86332286,0,0,0,0,0,0,0,0,0,0,0,0,0,0,0,1618,TIOGA,KRAUSEDWIN C,802,Brine,0,0,liquid,40982,3/14/12,28000,0.017,1.5,4900,9100,0.39,280,59,510,9.3,16000,0.068,2200,0.5,55,270,41000,0,130000,6.11,89000,720,0,0,0,0,0,0,0,2012,3,14,KRAUSEDWIN,C,0,0,0,802,Brine,0,0,0,0,0,0,0,0,0,0,0,0,0,0,0,0,0,0,0,0,0,4.447158031,0.176091259,3.69019608,3.959041392,2.447158031,1.770852012,2.707570176,4.204119983,3.342422681,-0.301029996,1.740362689,2.431363764,4.612783857,0,5.113943352,0.78604121,4.949390007,2.857332496,0,0,0,0,0,0,0,0,0,0,0,0,0,0,0,1619,TIOGA,LOPATOFSKY 287,804,Fracing fluid waste,7104409785,lb,liquid,41228,11/15/12,67500,0,4.72,6610,23900,0,114,199,1870,12.8,69100,0,5710,0.84,18,496,87000,9700,219000,5.44,270000,2200,62740,20170,18400,1370,0,0,0,2012,11,15,LOPATOFSKY,287,0,0,0,805,FracingFluid,2011,1,3,117-20874,OGO-67805,41.773653,-77.243336,Yes,Vertical Well,GAS,Bbl,Yes,PW,0,0,0,0,0,2011.083333,1.833333333,13.43065693,4.829303773,0.673941999,3.820201459,4.378397901,2.056904851,2.298853076,3.271841607,4.839478047,3.756636108,-0.075720714,1.255272505,2.695481676,4.939519253,3.986771734,5.340444115,0.7355989,5.431363764,3.342422681,4.797544514,4.304705898,4.264817823,3.136720567,1.128097256,0,0,0,0,0,0,0,0,0,0,6620,TIOGA,MANEVAL 296,802,Brine,12205397,lb,liquid,41141,8/20/12,82800,0,5.63,12000,29600,0,102,237,2180,10.3,57200,0,7630,2.64,74,1130,148000,8100,201000,6.14,249000,178,28610,6070,19680,980,0,0,0,2012,8,20,MANEVAL,296,0,0,0,802,Brine,2010,8,8,117-20678,OGO-67805,41.786708,-77.287028,Yes,Vertical Well,GAS,Bbl,Yes,PW,0,0,0,0,0,2010.666667,2,20.08163265,4.918030337,0.750508395,4.079181246,4.471291711,2.008600172,2.374748346,3.338456494,4.757396029,3.882524538,0.421603927,1.86923172,3.053078443,5.170261715,3.908485019,5.303196057,0.788168371,5.396199347,2.250420002,4.456517858,3.783188691,4.294025094,2.991226076,1.302799018,0,0,0,0,0,0,0,0,0,0,1621,TIOGA,MANEVAL 296,804,Fracing fluid waste,48133957095,lb,liquid,41078,6/18/12,60400,0,6.07,9890,21500,0.13,67.3,194,1650,5.65,39700,0,4980,3.72,55,970,114000,390,171000,5.92,207000,332,59310,8371,14560,802,0,0,0,2012,6,18,MANEVAL,296,0,0,0,805,FracingFluid,2010,8,8,117-20678,OGO-67805,41.786708,-77.287028,Yes,Vertical Well,GAS,Bbl,Yes,PW,0,0,0,0,0,2010.666667,1.833333333,18.15461347,4.781036939,0.783188691,3.995196292,4.33243846,1.828015064,2.28780173,3.217483944,4.598790507,3.697229343,0.57054294,1.740362689,2.986771734,5.056904851,2.591064607,5.23299611,0.772321707,5.315970345,2.521138084,4.773127924,3.922777342,4.163161375,2.904174368,1.258987007,0,0,0,0,0,0,0,0,0,0,6622,TIOGA,MATZ 824,802,Brine,661826929,lb,liquid,41093,7/3/12,93000,0,2.85,6890,32400,0,103,229,2920,9.05,63900,0,7160,4.15,22,1110,162000,13000,194000,5.04,268000,112,18620,4503,11300,572,0,0,0,2012,7,3,MATZ,824,0,0,0,802,Brine,2010,7,9,117-20600,OGO-67805,41.897328,-77.368216,Yes,Horizontal Well,GAS,Bbl,Yes,PW,0,147643.13,366,0,0,2010.583333,2,19.75524476,4.968482949,0.45484486,3.838219222,4.51054501,2.012837225,2.359835482,3.465382851,4.805500858,3.854913022,0.618048097,1.342422681,3.045322979,5.209515015,4.113943352,5.28780173,0.702430536,5.428134794,2.049218023,4.269979677,3.653501947,4.053078443,2.757396029,1.295682415,0,0,0,0,0,0,0,0,0,0,1623,TIOGA,MATZ CS,802,Brine,278187983,lb,liquid,40980,3/12/12,50000,0.077,4.3,2300,17000,0.3,140,130,1800,6.4,30000,0.23,2800,0.83,31,680,84000,0,280000,5.77,220000,300,0,0,0,0,0,0,0,2012,3,12,MATZ,CS,0,0,0,802,Brine,2010,7,9,117-20600,OGO-67805,41.897328,-77.368216,Yes,Horizontal Well,GAS,Bbl,Yes,PW,0,147643.13,366,0,0,2010.583333,1.666666667,0,4.698970004,0.633468456,3.361727836,4.230448921,2.146128036,2.113943352,3.255272505,4.477121255,3.447158031,-0.080921908,1.491361694,2.832508913,4.924279286,0,5.447158031,0.761175813,5.342422681,2.477121255,0,0,0,0,0,0,0,0,0,0,0,0,0,0,0,1624,TIOGA,MATZ DTI MS,422,Emulsions only wastewaters,350,lb,liquid,40980,3/12/12,50000,0.077,4.3,2300,17000,0.3,140,130,1800,6.4,30000,0.23,2800,0.83,31,680,84000,0,280000,5.77,220000,300,0,0,0,0,0,0,0,2012,3,12,MATZ,DTI,MS,0,0,802,Flowback,2010,7,9,117-20600,OGO-67805,41.897328,-77.368216,Yes,Horizontal Well,GAS,Bbl,Yes,PW,0,147643.13,366,0,0,2010.583333,1.666666667,0,4.698970004,0.633468456,3.361727836,4.230448921,2.146128036,2.113943352,3.255272505,4.477121255,3.447158031,-0.080921908,1.491361694,2.832508913,4.924279286,0,5.447158031,0.761175813,5.342422681,2.477121255,0,0,0,0,0,0,0,0,0,0,0,0,0,0,0,5625,TIOGA,NEAL 375,802,Brine,115232767,lb,liquid,41050,5/21/12,13100,0,4.63,10800,2590,0,74.8,251,1610,11.8,54900,0,6700,1.59,33,1000,135000,11000,196000,5.7,253000,13,27960,759,15620,1263,0,0,0,2012,5,21,NEAL,375,0,0,0,802,Brine,2008,10,24,117-20206,OGO-67805,41.781425,-77.130154,Yes,Vertical Well,GAS,Bbl,Yes,PW,0,9379.67,182,0,0,2008.833333,3.583333333,12.36737926,4.117271296,0.665580991,4.033423755,3.413299764,1.873901598,2.399673721,3.206825876,4.739572344,3.826074803,0.201397124,1.51851394,3,5.130333768,4.041392685,5.292256071,0.755874856,5.403120521,1.113943352,4.446537167,2.880241776,4.19368103,3.101403351,1.092277679,0,0,0,0,0,0,0,0,0,0,1626,TIOGA,NEAL 134,802,Brine,7819265,lb,liquid,41092,7/2/12,91700,0,2.98,13400,32500,0,39.6,236,2560,12.6,52600,0,7740,7.95,0,816,138000,13000,177000,4.23,242000,79,11560,2880,8493,981,0,0,0,2012,7,2,NEAL,134,0,0,0,802,Brine,2008,10,24,117-20206,OGO-67805,41.781425,-77.130154,Yes,Vertical Well,GAS,Bbl,Yes,PW,0,9379.67,182,0,0,2008.833333,3.75,8.657492355,4.962369336,0.474216264,4.127104798,4.511883361,1.597695186,2.372912003,3.408239965,4.720985744,3.888740961,0.900367129,0,2.911690159,5.139879086,4.113943352,5.247973266,0.626340367,5.383815366,1.897627091,4.062957834,3.459392488,3.929061124,2.991669007,0.937392117,0,0,0,0,0,0,0,0,0,0,1627,TIOGA,NEAL 815,802,Brine,71798711,lb,liquid,41093,7/3/12,80400,0,4.1,4070,27900,0,61.6,199,2600,8.67,56500,0,4510,6.98,60,1130,137000,11000,189000,5.82,270000,68,32050,6146,12490,490,0,0,0,2012,7,3,NEAL,815,0,0,0,802,Brine,2008,10,24,117-20206,OGO-67805,41.781425,-77.130154,Yes,Vertical Well,GAS,Bbl,Yes,PW,0,9379.67,182,0,0,2008.833333,3.75,25.48979592,4.905256049,0.612783857,3.609594409,4.445604203,1.789580712,2.298853076,3.414973348,4.752048448,3.654176542,0.843855423,1.77815125,3.053078443,5.136720567,4.041392685,5.276461804,0.764922985,5.431363764,1.832508913,4.505828034,3.788592556,4.096562438,2.69019608,1.406366358,0,0,0,0,0,0,0,0,0,0,1628,TIOGA,NEAL 375,804,Fracing fluid waste,21848152985,lb,liquid,40989,3/21/12,61300,0,5.48,9000,22300,0,64.7,226,1340,8.53,54400,0.17,5480,0.33,45,860,120000,10000,187000,5.42,221000,221,46940,14320,13430,812,0,0,0,2012,3,21,NEAL,375,0,0,0,805,FracingFluid,2008,10,24,117-20206,OGO-67805,41.781425,-77.130154,Yes,Vertical Well,GAS,Bbl,Yes,PW,0,9379.67,182,0,0,2008.833333,3.416666667,16.53940887,4.787460475,0.738780558,3.954242509,4.348304863,1.810904281,2.354108439,3.127104798,4.7355989,3.738780558,-0.48148606,1.653212514,2.934498451,5.079181246,4,5.271841607,0.733999287,5.344392274,2.344392274,4.671543085,4.155943018,4.128076013,2.909556029,1.218519983,0,0,0,0,0,0,0,0,0,0,6629,TIOGA,NESTOR 551,804,Fracing fluid waste,1908377307,lb,liquid,41176,9/24/12,80800,0,6.49,5680,28400,0,70.6,264,2380,12.3,78000,0,7150,3.77,26,974,168000,9600,220000,5.77,561000,488,20790,3738,18220,1582,0,0,0,2012,9,24,NESTOR,551,0,0,0,805,FracingFluid,2011,10,8,117-21319,OGO-67805,41.769147,-77.298169,Yes,Horizontal Well,GAS,Bbl,Yes,PW,0,110035.03,101,0,0,2011.833333,0.916666667,11.517067,4.907411361,0.812244697,3.754348336,4.45331834,1.848804701,2.421603927,3.376576957,4.892094603,3.854306042,0.57634135,1.414973348,2.988558957,5.225309282,3.982271233,5.342422681,0.761175813,5.748962861,2.688419822,4.317854489,3.572639297,4.260548373,3.199206479,1.061341893,0,0,0,0,0,0,0,0,0,0,6630,TIOGA,PARTHEMER 284,802,Brine,789512,lb,liquid,41079,6/19/12,47900,0,3.49,2070,16500,8.8,319,112,1650,11,28300,0,3660,13.8,18,578,79300,170,134000,5.17,134000,172,40260,3800,9314,659,0,0,0,2012,6,19,PARTHEMER,284,0,0,0,802,Brine,2010,3,5,117-20506,OGO-67805,41.788014,-77.215237,Yes,Horizontal Well,GAS,Bbl,Yes,PW,0,405351.88,366,0,0,2010.25,2.25,14.13353566,4.680335513,0.542825427,3.315970345,4.217483944,2.503790683,2.049218023,3.217483944,4.451786436,3.563481085,1.139879086,1.255272505,2.761927838,4.899273187,2.230448921,5.127104798,0.713490543,5.127104798,2.235528447,4.604873771,3.579783597,3.969136234,2.818885415,1.150250819,0,0,0,0,0,0,0,0,0,0,1631,TIOGA,PARTHEMER W2 COMPRESSOR CS,802,PW,466888,lb,liquid,41171,9/19/12,58700,0,5.49,3170,18100,0,451,142,1370,6.72,14800,0,2100,0,141,739,104000,19600,149000,5.06,194000,272,29770,5911,14540,644,0,0,0,2012,9,19,PARTHEMER,W2,COMPRESSOR,CS,0,802,PW,2010,3,5,117-20506,OGO-67805,41.788014,-77.215237,Yes,Horizontal Well,GAS,Bbl,Yes,Yes,203.46,405351.88,366,0,0,2010.25,2.5,22.57763975,4.768638101,0.739572344,3.501059262,4.257678575,2.654176542,2.152288344,3.136720567,4.170261715,3.322219295,0,2.149219113,2.868644438,5.017033339,4.292256071,5.173186268,0.704150517,5.28780173,2.434568904,4.473778835,3.771660959,4.162564407,2.808885867,1.353678539,0,0,0,0,0,0,0,0,0,0,4632,TIOGA,PHILLIPS 504,804,Fracing fluid waste,720478446,lb,liquid,41198,10/16/12,62200,0,0,7340,22000,0,98.5,122,1770,23.7,53100,0,4610,0.69,54,710,102000,5200,156000,6.02,197000,506,2466,1573,6353,890,0,0,0,2012,10,16,PHILLIPS,504,0,0,0,805,FracingFluid,2009,10,14,117-20384,OGO-67805,41.843667,-76.958728,Yes,Horizontal Well,GAS,Bbl,Yes,PW,0,274767.06,366,0,0,2009.833333,3,7.138202247,4.793790385,0,3.86569606,4.342422681,1.99343623,2.086359831,3.247973266,4.725094521,3.663700925,-0.161150909,1.73239376,2.851258349,5.008600172,3.716003344,5.193124598,0.779596491,5.294466226,2.704150517,3.391993072,3.196728723,3.802978855,2.949390007,0.853588849,0,0,0,0,0,0,0,0,0,0,6633,TIOGA,SAMPSON 147,802,Brine,483445878,lb,liquid,41079,6/19/12,87400,0,3.09,9350,31200,0.21,118,195,2320,19.8,40800,0,8560,10.3,5,1110,147000,320,204000,5.03,267000,148,22350,8230,6514,833,0,0,0,2012,6,19,SAMPSON,147,0,0,0,802,Brine,2009,7,9,117-20273,OGO-67805,41.789587,-77.204709,Yes,Horizontal Well,GAS,Bbl,Yes,PW,0,204247.94,366,0,0,2009.583333,2.916666667,7.819927971,4.941511433,0.489958479,3.970811611,4.494154594,2.071882007,2.290034611,3.365487985,4.610660163,3.932473765,1.012837225,0.698970004,3.045322979,5.167317335,2.505149978,5.309630167,0.701567985,5.426511261,2.170261715,4.349277527,3.915399835,3.813847754,2.920645001,0.893202753,0,0,0,0,0,0,0,0,0,0,1634,TIOGA,SANCHIS 1129,804,Fracing fluid waste,430433025,lb,liquid,41058,5/29/12,59200,0,4.37,4310,20400,0,70.1,159,1990,5.42,46900,0,3510,5.54,68,1020,113000,4400,160000,6.2,201000,48,19060,2017,7226,612,0,0,0,2012,5,29,SANCHIS,1129,0,0,0,805,FracingFluid,2011,11,22,117-21367,OGO-67805,41.953261,-77.265742,Yes,Horizontal Well,GAS,Bbl,Yes,Yes,190,0,0,0,0,2011.916667,0.5,11.80718954,4.772321707,0.640481437,3.63447727,4.309630167,1.845718018,2.201397124,3.298853076,4.671172843,3.545307116,0.743509765,1.832508913,3.008600172,5.053078443,3.643452676,5.204119983,0.792391689,5.303196057,1.681241237,4.280122896,3.304705898,3.858897957,2.786751422,1.072146535,0,0,0,0,0,0,0,0,0,0,6635,TIOGA,SAWYER 376,802,Brine,78599886,lb,liquid,41085,6/25/12,115000,0,8.21,8740,41500,0,99.8,388,2750,23.7,82600,0,9300,1.12,0,347,262000,12000,208000,2.38,312000,91,209400,85990,13170,966,0,0,0,2012,6,25,SAWYER,376,0,0,0,802,Brine,2010,12,1,117-20847,OGO-67805,41.603661,-76.917594,Yes,Horizontal Well,GAS,Bbl,Yes,PW,0,586023.9,260,0,0,2011,1.5,13.63354037,5.06069784,0.914343157,3.941511433,4.618048097,1.999130541,2.588831726,3.439332694,4.916980047,3.968482949,0.049218023,0,2.540329475,5.418301291,4.079181246,5.318063335,0.376576957,5.494154594,1.959041392,5.320976677,4.934447949,4.119585775,2.984977126,1.134608649,0,0,0,0,0,0,0,0,0,0,1636,TIOGA,SAWYER 376,472,Waste water,81495,lb,liquid,41025,4/26/12,93200,0,4.45,7050,33600,0.47,126,338,2230,11.8,70600,0,7880,1.54,26,1180,175000,22000,210000,5.47,254000,12800,56160,13850,15040,11.8,0,0,0,2012,4,26,SAWYER,376,0,0,0,802,PW,2010,12,1,117-20847,OGO-67805,41.603661,-76.917594,Yes,Horizontal Well,GAS,Bbl,Yes,Yes,124.18,586023.9,260,0,0,2011,1.333333333,1274.576271,4.969415912,0.648360011,3.848189117,4.526339277,2.100370545,2.5289167,3.348304863,4.848804701,3.896526217,0.187520721,1.414973348,3.071882007,5.243038049,4.342422681,5.322219295,0.737987326,5.404833717,4.10720997,4.749427099,4.141449773,4.177247836,1.071882007,3.105365829,0,0,0,0,0,0,0,0,0,0,4637,TIOGA,SCHEIBLE 898,804,Fracing fluid waste,62047114,lb,liquid,41059,5/30/12,76600,0,6.53,5230,26900,1.03,121,227,2280,6.74,54600,0,5440,4.07,73,1070,130000,11000,158000,6.01,208000,495,17660,2195,1630,1525,0,0,0,2012,5,30,SCHEIBLE,898,0,0,0,805,FracingFluid,2012,1,9,117-21415,OGO-67805,41.913758,-77.433806,Yes,Horizontal Well,GAS,Tons,Yes,DrillCuttings,0,0,0,0,0,2012.083333,0.333333333,1.068852459,4.88422877,0.814913181,3.718501689,4.42975228,2.08278537,2.356025857,3.357934847,4.737192643,3.7355989,0.609594409,1.86332286,3.029383778,5.113943352,4.041392685,5.198657087,0.778874472,5.318063335,2.694605199,4.246990699,3.341434525,3.212187604,3.183269844,0.028917761,0,0,0,0,0,0,0,0,0,0,6638,TIOGA,SCHMELZLE 703,803,Drilling fluid,2927555,lb,liquid,41270,12/27/12,2630,0,0,5.18,977,0,2.7,0,3.7,0,238,0,4.61,0.4,114,0,1690,3000,5610,11.2,4120,280,1.95,34.2,0.559,1.34,0,0,0,2012,12,27,SCHMELZLE,703,0,0,0,803,DrillFluid,2010,10,3,117-20782,OGO-67805,41.601472,-76.992733,Yes,Vertical Well,GAS,Bbl,Yes,Yes,278.42,0,0,0,0,2010.833333,2.166666667,0.417164179,3.419955748,0,0.71432976,2.989894564,0.431363764,0,0.568201724,2.376576957,0.663700925,-0.397940009,2.056904851,0,3.227886705,3.477121255,3.748962861,1.049218023,3.614897216,2.447158031,0.290034611,1.534026106,-0.252588192,0.127104798,-0.37969299,0,0,0,0,0,0,0,0,0,0,3639,TIOGA,SHARRETTS 805,472,Waste water,4000,lb,liquid,41002,4/3/12,53300,0,3.58,2670,18500,0,59.8,133,1730,8.74,47700,0,2840,2.51,44,817,102000,3200,168000,5.9,164000,47,2160,826,3005,939,0,0,0,2012,4,3,SHARRETTS,805,0,0,0,802,PW,2011,10,22,117-21337,OGO-67805,41.829033,-77.503331,Yes,Horizontal Well,GAS,Bbl,2015,Yes,0,0,0,0,0,2011.833333,0.5,3.200212993,4.726727209,0.553883027,3.426511261,4.267171728,1.776701184,2.123851641,3.238046103,4.678518379,3.45331834,0.399673721,1.643452676,2.912222057,5.008600172,3.505149978,5.225309282,0.770852012,5.214843848,1.672097858,3.334453751,2.916980047,3.477844476,2.972665592,0.505178884,0,0,0,0,0,0,0,0,0,0,4640,TIOGA,SHAW 500,802,Brine,154696272,lb,liquid,41078,6/18/12,112000,0,4.28,3070,39800,0.15,142,280,2940,12.1,40800,0,8540,3.37,75,1090,152000,290,204000,5.88,278000,330,98290,29920,15850,1194,0,0,0,2012,6,18,SHAW,500,0,0,0,802,Brine,2011,2,12,117-21021,OGO-67805,41.8253,-76.992028,Yes,Horizontal Well,GAS,Bbl,Yes,PW,0,31592.16,366,0,0,2011.166667,1.333333333,13.27470687,5.049218023,0.631443769,3.487138375,4.599883072,2.152288344,2.447158031,3.46834733,4.610660163,3.931457871,0.527629901,1.875061263,3.037426498,5.181843588,2.462397998,5.309630167,0.769377326,5.444044796,2.51851394,4.992509335,4.475961589,4.200029267,3.077004327,1.12302494,0,0,0,0,0,0,0,0,0,0,1641,TIOGA,SHAW K4 COMPRESSOR CS,802,PW,106933,lb,liquid,41179,9/27/12,105000,1.19,0,9060,22800,0,225,211,1500,16.4,34400,0,4740,0,44.1,1140,149000,40000,185000,5.59,317000,588,37760,6270,11150,564,0,0,0,2012,9,27,SHAW,K4,COMPRESSOR,CS,0,802,PW,2011,2,12,117-21021,OGO-67805,41.8253,-76.992028,Yes,Horizontal Well,GAS,Bbl,Yes,Yes,1051.39,31592.16,366,0,0,2011.166667,1.583333333,19.76950355,5.021189299,0,3.957128198,4.357934847,2.352182518,2.324282455,3.176091259,4.536558443,3.675778342,0,1.644438589,3.056904851,5.173186268,4.602059991,5.267171728,0.747411808,5.501059262,2.769377326,4.577031986,3.797267541,4.047274867,2.751279104,1.295995763,0,0,0,0,0,0,0,0,0,0,4642,TIOGA,SHELMAN 291,802,Brine,23184079,lb,liquid,41192,10/10/12,97000,0,4.75,12100,34600,0,155,247,2570,13.6,59100,0,8310,1.49,43,1200,150000,10000,202000,5.85,261000,444,51530,10240,17400,1430,0,0,0,2012,10,10,SHELMAN,291,0,0,0,802,Brine,2010,6,26,117-20633,OGO-67805,41.791206,-77.265722,Yes,Vertical Well,GAS,Bbl,Yes,PW,0,0,0,0,0,2010.5,2.333333333,12.16783217,4.986771734,0.67669361,4.08278537,4.539076099,2.190331698,2.392696953,3.409933123,4.771587481,3.919601024,0.173186268,1.633468456,3.079181246,5.176091259,4,5.305351369,0.767155866,5.416640507,2.64738297,4.712060142,4.010299957,4.240549248,3.155336037,1.085213211,0,0,0,0,0,0,0,0,0,0,1643,TIOGA,SHELMAN CS,802,Brine,232053891,lb,liquid,41176,9/24/12,104000,0,5.36,9130,28800,0,134,258,2140,12.5,44600,0,7820,0,25.9,1320,190000,11200,299000,5.95,336000,354,0,0,0,0,0,0,0,2012,9,24,SHELMAN,CS,0,0,0,802,Brine,2010,6,26,117-20633,OGO-67805,41.791206,-77.265722,Yes,Vertical Well,GAS,Bbl,Yes,PW,0,0,0,0,0,2010.5,2.25,0,5.017033339,0.72916479,3.960470778,4.459392488,2.127104798,2.411619706,3.330413773,4.649334859,3.893206753,0,1.413299764,3.120573931,5.278753601,4.049218023,5.475671188,0.774516966,5.526339277,2.549003262,0,0,0,0,0,0,0,0,0,0,0,0,0,0,0,1644,TIOGA,SHERMAN 234,802,Brine,64408379,lb,liquid,41106,7/16/12,53900,0,2.85,14100,19000,0,68.6,157,1570,5.89,48300,0,5460,7.22,12,912,125000,5300,174000,5.54,213000,43,353,1.23,3913,810,0,0,0,2012,7,16,SHERMAN,234,0,0,0,802,Brine,2009,8,4,117-20277,OGO-67805,41.788625,-77.018886,Yes,Horizontal Well,GAS,Bbl,Yes,PW,0,504109.27,366,0,0,2009.666667,2.916666667,4.830864198,4.731588765,0.45484486,4.149219113,4.278753601,1.836324116,2.195899652,3.195899652,4.683947131,3.737192643,0.858537198,1.079181246,2.959994838,5.096910013,3.72427587,5.240549248,0.743509765,5.328379603,1.633468456,2.547774705,0.089905111,3.592509848,2.908485019,0.684024829,0,0,0,0,0,0,0,0,0,0,1645,TIOGA,SHOWALTER 822,802,Brine,67425931,lb,liquid,41059,5/30/12,88200,0,5.84,4270,30600,0,80.5,221,2840,12.1,57200,0,4730,5.49,61,1170,135000,14000,175000,5.95,235000,97,40520,7151,5026,1482,0,0,0,2012,5,30,SHOWALTER,822,0,0,0,802,Brine,2011,9,6,117-21263,OGO-67805,41.8952,-77.391606,Yes,Horizontal Well,GAS,Bbl,Yes,PW,0,238277.43,289,0,0,2011.75,0.666666667,3.391363023,4.945468585,0.766412847,3.630427875,4.485721426,1.90579588,2.344392274,3.45331834,4.757396029,3.674861141,0.739572344,1.785329835,3.068185862,5.130333768,4.146128036,5.243038049,0.774516966,5.371067862,1.986771734,4.607669437,3.854366778,3.701222484,3.170848204,0.530374281,0,0,0,0,0,0,0,0,0,0,1646,TIOGA,SHOWALTER 822,804,Fracing fluid waste,27555891555,lb,liquid,40995,3/27/12,57300,0,2.43,2330,19900,0,47.2,126,1860,13.6,53400,0,2700,0.19,78,978,103000,11000,173000,5.81,176000,260,17030,3988,2964,808,0,0,0,2012,3,27,SHOWALTER,822,0,0,0,805,FracingFluid,2011,9,6,117-21263,OGO-67805,41.8952,-77.391606,Yes,Horizontal Well,GAS,Bbl,Yes,PW,0,238277.43,289,0,0,2011.75,0.5,3.668316832,4.758154622,0.385606274,3.367355921,4.298853076,1.673941999,2.100370545,3.269512944,4.727541257,3.431363764,-0.721246399,1.892094603,2.990338855,5.012837225,4.041392685,5.238046103,0.764176132,5.245512668,2.414973348,4.231214648,3.60075515,3.471878199,2.907411361,0.564466839,0,0,0,0,0,0,0,0,0,0,6647,TIOGA,SMITH 253,802,Brine,1028104,lb,liquid,41106,7/16/12,59700,0,3.35,16200,21300,0,157,175,1590,9.04,49300,0,5790,4.86,6,862,130000,7000,181000,4.89,226000,52,4809,1473,9252,992,0,0,0,2012,7,16,SMITH,253,0,0,0,802,Brine,2009,8,23,117-20268,OGO-67805,41.785311,-76.987285,Yes,Horizontal Well,GAS,Bbl,Yes,PW,0,257671.72,366,0,0,2009.666667,2.916666667,9.326612903,4.775974331,0.525044807,4.209515015,4.328379603,2.195899652,2.243038049,3.201397124,4.692846919,3.762678564,0.686636269,0.77815125,2.935507266,5.113943352,3.84509804,5.257678575,0.689308859,5.354108439,1.716003344,3.682054777,3.168202747,3.966235624,2.996511672,0.969723952,0,0,0,0,0,0,0,0,0,0,1648,TIOGA,SODERBURG 501,802,Brine,10082429,lb,liquid,41078,6/18/12,105000,0,3.31,3100,37600,0.71,244,293,2620,14.4,41100,0,9360,6.03,72,1130,164000,310,204000,5.42,322000,22,208200,51700,10750,72.3,0,0,0,2012,6,18,SODERBURG,501,0,0,0,802,Brine,2009,10,27,117-20388,OGO-67805,41.82625,-76.984057,Yes,Horizontal Well,GAS,Bbl,Yes,PW,0,535352.9,366,0,0,2009.833333,2.666666667,148.6860304,5.021189299,0.519827994,3.491361694,4.575187845,2.387389826,2.46686762,3.418301291,4.613841822,3.971275849,0.780317312,1.857332496,3.053078443,5.214843848,2.491361694,5.309630167,0.733999287,5.507855872,1.342422681,5.318480725,4.713490543,4.031408464,1.859138297,2.172270167,0,0,0,0,0,0,0,0,0,0,1649,TIOGA,STANLEY 1106,804,Fracing fluid waste,54382696,lb,liquid,41011,4/12/12,0,0,0,5110,24000,1.37,335,173,2040,7.2,47600,0,4550,3.39,35,1800,115000,14000,187000,5.25,188000,1750,93040,26170,9923,701,0,0,0,2012,4,12,STANLEY,1106,0,0,0,805,FracingFluid,2011,8,29,117-21045,OGO-67805,41.943047,-77.356383,Yes,Horizontal Well,GAS,Bbl,2016,PW,0,0,0,0,0,2011.666667,0.666666667,14.15549215,0,0,3.7084209,4.380211242,2.525044807,2.238046103,3.309630167,4.677606953,3.658011397,0.530199698,1.544068044,3.255272505,5.06069784,4.146128036,5.271841607,0.720159303,5.274157849,3.243038049,4.968669702,4.417803723,3.996642991,2.845718018,1.150924973,0,0,0,0,0,0,0,0,0,0,6650,TIOGA,STARKS 461,802,Brine,642565,lb,liquid,41107,7/17/12,75900,0,3.9,15500,27100,0,55,247,1980,8.56,50800,0,7430,3.78,6,0,151000,7800,193000,5.11,267000,63,18890,0,17660,11.2,0,0,0,2012,7,17,STARKS,461,0,0,0,802,Brine,2009,11,18,117-20386,OGO-67805,41.765006,-77.094272,Yes,Horizontal Well,GAS,Bbl,Yes,PW,0,582721.57,351,0,0,2009.916667,2.666666667,1576.785714,4.880241776,0.591064607,4.190331698,4.432969291,1.740362689,2.392696953,3.29666519,4.705863712,3.870988814,0.5774918,0.77815125,0,5.178976947,3.892094603,5.285557309,0.7084209,5.426511261,1.799340549,4.276231958,0,4.246990699,1.049218023,3.197772677,0,0,0,0,0,0,0,0,0,0,1651,TIOGA,STARKS 460,802,Brine,682111955,lb,liquid,41169,9/17/12,73800,0,4.18,14400,26300,0,118,255,1950,6.59,53000,0,6940,0.89,58,863,125000,6800,194000,6.07,230000,111,124,121,12740,820,0,0,0,2012,9,17,STARKS,460,0,0,0,802,Brine,2009,11,18,117-20386,OGO-67805,41.765006,-77.094272,Yes,Horizontal Well,GAS,Bbl,Yes,PW,0,582721.57,351,0,0,2009.916667,2.833333333,15.53658537,4.868056362,0.621176282,4.158362492,4.419955748,2.071882007,2.40654018,3.290034611,4.72427587,3.84135947,-0.050609993,1.763427994,2.936010796,5.096910013,3.832508913,5.28780173,0.783188691,5.361727836,2.045322979,2.093421685,2.08278537,4.105169428,2.913813852,1.191355576,0,0,0,0,0,0,0,0,0,0,1652,TIOGA,STOCK 144,802,Brine,103506373,lb,liquid,41079,6/19/12,68000,0,4.02,9920,24100,0.18,141,173,1870,8.22,40300,0,6420,6.23,69,968,122000,350,180000,5.95,224000,632,67900,12860,17280,1176,0,0,0,2012,6,19,STOCK,144,0,0,0,802,Brine,2011,5,14,117-21139,OGO-67805,41.772019,-77.319289,Yes,Horizontal Well,GAS,Bbl,Yes,PW,0,408886.88,316,0,0,2011.416667,1.083333333,14.69387755,4.832508913,0.604226053,3.996511672,4.382017043,2.149219113,2.238046103,3.271841607,4.605305046,3.807535028,0.794488047,1.838849091,2.985875357,5.086359831,2.544068044,5.255272505,0.774516966,5.350248018,2.800717078,4.831869774,4.109240969,4.237543738,3.070407322,1.167136416,0,0,0,0,0,0,0,0,0,0,1653,TIOGA,STOCK W4,422,Compressor dump line tank,525590,lb,liquid,40927,1/19/12,16000,0.0914,12.9,2450,3850,1.43,830,83.3,432,10.6,16900,0,1270,0,365,400,43400,50600,83700,5.6,58600,677,13400,565,4439,203,0,0,0,2012,1,19,STOCK,W4,0,0,0,802,Flowback,2011,5,14,117-21139,OGO-67805,41.772019,-77.319289,Yes,Horizontal Well,GAS,Bbl,Yes,PW,0,408886.88,316,0,0,2011.416667,0.666666667,21.86699507,4.204119983,1.11058971,3.389166084,3.58546073,2.919078092,1.920645001,2.635483747,4.227886705,3.103803721,0,2.562292864,2.602059991,4.63748973,4.704150517,4.922725458,0.748188027,4.767897616,2.830588669,4.127104798,2.752048448,3.647285145,2.307496038,1.339789107,0,0,0,0,0,0,0,0,0,0,5654,TIOGA,STOCK W4 COMPRESSOR CS,802,PW,0,0,liquid,41171,9/19/12,71400,0.075,6.46,3540,18400,1,295,165,1580,9.33,17700,1,2130,4.22,128,1140,133000,38700,169000,5.46,270000,1110,20040,2672,10430,720,0,0,0,2012,9,19,STOCK,W4,COMPRESSOR,CS,0,802,PW,2011,5,14,117-21139,OGO-67805,41.772019,-77.319289,Yes,Horizontal Well,GAS,Bbl,Yes,Yes,275.97,408886.88,316,0,0,2011.416667,1.333333333,14.48611111,4.853698212,0.810232518,3.549003262,4.264817823,2.469822016,2.217483944,3.198657087,4.247973266,3.328379603,0.625312451,2.10720997,3.056904851,5.123851641,4.587710965,5.227886705,0.737192643,5.431363764,3.045322979,4.301897717,3.426836454,4.018284308,2.857332496,1.160951812,0,0,0,0,0,0,0,0,0,0,4656,TIOGA,TRIMBLEDWIN C,802,Brine,0,0,liquid,41193,10/11/12,500,0,0,15,136,0.0454,0.175,1.15,0,0,1310,0.0175,7.22,0.0342,383,18,2330,928,7890,10.73,4870,0,0,0,0,0,0,0,0,2012,10,11,TRIMBLEDWIN,C,0,0,0,802,Brine,0,0,0,0,0,0,0,0,0,0,0,0,0,0,0,0,0,0,0,0,0,2.698970004,0,1.176091259,2.133538908,-0.756961951,0.06069784,0,3.117271296,0.858537198,-1.465973894,2.583198774,1.255272505,3.367355921,2.967547976,3.897077003,1.030599722,3.687528961,0,0,0,0,0,0,0,0,0,0,0,0,0,0,0,0,1657,TIOGA,TRIMBLEDWIN C,802,Brine,0,0,liquid,41193,10/11/12,6150,0,0,2060,1680,0,24.7,14.4,0,2.01,3310,0,420,2.15,159,83.9,9730,7970,82.2,6.19,24400,79,0,0,0,0,0,0,0,2012,10,11,TRIMBLEDWIN,C,0,0,0,802,Brine,0,0,0,0,0,0,0,0,0,0,0,0,0,0,0,0,0,0,0,0,0,3.788875116,0,3.31386722,3.225309282,1.392696953,1.158362492,0,3.519827994,2.62324929,0.33243846,2.201397124,1.923761961,3.98811284,3.901458321,1.914871818,0.791690649,4.387389826,1.897627091,0,0,0,0,0,0,0,0,0,0,0,0,0,0,0,1658,TIOGA,VANDERGRIFT 290,802,Brine,53780187,lb,liquid,41115,7/25/12,85700,0,4.23,13700,30700,0,123,226,2220,12.6,58700,0,8470,8.17,56,1400,144000,4000000,201000,5.77,294000,218,38790,15600,5144,1695,0,0,0,2012,7,25,VANDERGRIFT,290,0,0,0,802,Brine,2010,4,24,117-20505,OGO-67805,41.797228,-77.244308,Yes,Horizontal Well,GAS,Bbl,Yes,PW,0,0,0,0,0,2010.333333,2.25,3.03480826,4.932980822,0.626340367,4.136720567,4.487138375,2.089905111,2.354108439,3.346352974,4.768638101,3.92788341,0.912222057,1.748188027,3.146128036,5.158362492,6.602059991,5.303196057,0.761175813,5.46834733,2.338456494,4.58871978,4.193124598,3.71130096,3.229169703,0.482131257,0,0,0,0,0,0,0,0,0,0,1659,TIOGA,VIOLET BIESER 833,804,Fracing fluid waste,445149275,lb,liquid,40996,3/28/12,63600,0,5.95,6190,22600,0.99,68.1,208,1750,5.05,53200,0,5360,1.07,65,1260,111000,12000,184000,6.02,193000,95,12920,3177,12330,4351,0,0,0,2012,3,28,VIOLET,BIESER,833,0,0,805,FracingFluid,2011,4,16,117-21041,OGO-67805,41.864606,-77.372375,Yes,Vertical Well,GAS,Tons,Yes,DrillCuttings,0,0,0,0,0,2011.333333,0.916666667,2.833831303,4.803457116,0.774516966,3.791690649,4.354108439,1.833147112,2.318063335,3.243038049,4.725911632,3.72916479,0.029383778,1.812913357,3.100370545,5.045322979,4.079181246,5.264817823,0.779596491,5.285557309,1.977723605,4.111262514,3.502017215,4.090963077,3.638589083,0.452373993,0,0,0,0,0,0,0,0,0,0,6660,TIOGA,WATKINS 820,802,Brine,96877105,lb,liquid,41093,7/3/12,91900,0,3.86,4060,31800,0,50.8,203,3050,15.4,69800,0,4700,6.36,47,992,142000,6400,182000,5.8,246000,86,0,0,0,0,0,0,0,2012,7,3,WATKINS,820,0,0,0,802,Brine,2011,10,3,117-21317,OGO-67805,41.893481,-77.410436,Yes,Horizontal Well,GAS,Bbl,Yes,PW,0,140764.33,327,0,0,2011.833333,0.75,0,4.963315511,0.586587305,3.608526034,4.50242712,1.705863712,2.307496038,3.484299839,4.843855423,3.672097858,0.803457116,1.672097858,2.996511672,5.152288344,3.806179974,5.260071388,0.763427994,5.390935107,1.934498451,0,0,0,0,0,0,0,0,0,0,0,0,0,0,0,1661,TIOGA,WATKINS 820,804,Fracing fluid waste,2018877347,lb,liquid,41036,5/7/12,64500,0,2.92,2920,22300,0,46.5,141,2120,12.4,53600,0,3690,0.2,44,1000,113000,3900,176000,5.83,172000,57,48480,14240,5895,1291,0,0,0,2012,5,7,WATKINS,820,0,0,0,805,FracingFluid,2011,10,3,117-21317,OGO-67805,41.893481,-77.410436,Yes,Horizontal Well,GAS,Bbl,Yes,PW,0,140764.33,327,0,0,2011.833333,0.583333333,4.56622773,4.809559715,0.465382851,3.465382851,4.348304863,1.667452953,2.149219113,3.326335861,4.72916479,3.567026366,-0.698970004,1.643452676,3,5.053078443,3.591064607,5.245512668,0.765668555,5.235528447,1.755874856,4.685562611,4.153509989,3.770483809,3.110926242,0.659557567,0,0,0,0,0,0,0,0,0,0,6662,TIOGA,WELLSBORO W1 COMPRESSOR CS,802,PW,279190,lb,liquid,41017,4/18/12,59000,0,2.9,8800,18000,1.1,110,0,1000,6.3,30000,0,3700,2.3,48,710,4600,0,320000,5.47,190000,1000,0,0,0,0,0,0,0,2012,4,18,WELLSBORO,W1,COMPRESSOR,CS,0,802,PW,0,0,0,0,0,0,0,0,0,0,0,0,0,0,0,0,0,0,0,0,0,4.770852012,0.462397998,3.944482672,4.255272505,2.041392685,0,3,4.477121255,3.568201724,0.361727836,1.681241237,2.851258349,3.662757832,0,5.505149978,0.737987326,5.278753601,3,0,0,0,0,0,0,0,0,0,0,0,0,0,0,0,4663,TIOGA,WEST 299,804,Fracing fluid waste,323265742,lb,liquid,41218,11/5/12,44900,0,4.44,9530,15800,0,218,151,1310,7.33,37100,0,3490,0.85,55,757,90800,8000,162000,5.9,148000,1130,14900,2351,5058,142,0,0,0,2012,11,5,WEST,299,0,0,0,805,FracingFluid,2009,10,9,117-20394,OGO-67805,41.771328,-77.15583,Yes,Horizontal Well,GAS,Bbl,Yes,PW,0,519901.25,366,0,0,2009.833333,3.083333333,35.61971831,4.652246341,0.64738297,3.979092901,4.198657087,2.338456494,2.178976947,3.117271296,4.56937391,3.542825427,-0.070581074,1.740362689,2.87909588,4.958085849,3.903089987,5.209515015,0.770852012,5.170261715,3.053078443,4.173186268,3.371252629,3.703978825,2.152288344,1.551690481,0,0,0,0,0,0,0,0,0,0,6664,TIOGA,WILSON 283,802,Brine,86075337,lb,liquid,40996,3/28/12,93800,0,4.72,11400,33600,0,69.1,59.8,2380,11.4,81000,0.2,10200,1.15,33,1390,164000,19000,213000,5.63,285000,113,20160,3588,17510,970,0,0,0,2012,3,28,WILSON,283,0,0,0,802,Brine,2011,5,28,117-21185,OGO-67805,41.792889,-77.195414,Yes,Horizontal Well,GAS,Bbl,Yes,PW,0,1385130.74,360,0,0,2011.416667,0.833333333,18.05154639,4.972202838,0.673941999,4.056904851,4.526339277,1.839478047,1.776701184,3.376576957,4.908485019,4.008600172,0.06069784,1.51851394,3.1430148,5.214843848,4.278753601,5.328379603,0.750508395,5.45484486,2.053078443,4.304490528,3.554852434,4.243286146,2.986771734,1.256514412,0,0,0,0,0,0,0,0,0,0,1665,TIOGA,YAGGIE  704,802,Waste water,42000,lb,liquid,41082,6/22/12,66256,0,2.5,1237.1,22910.1,0,82.2,158.3,2197.5,14,71027,0,3315,3.2,0,1820,169308,4155,233546,5.43,438700,3785,15950,2335,10769,1297.7,0,0,0,2012,6,22,YAGGIE,0,704,0,0,802,PW,2010,7,1,117-20697,OGO-67805,41.585242,-76.980439,Yes,Vertical Well,GAS,Bbl,Yes,Yes,89.68,0,0,0,0,2010.583333,1.916666667,8.298528165,4.821225213,0.397940009,3.092404807,4.360026985,1.914871818,2.199480915,3.341928884,4.851423472,3.520483533,0.505149978,0,3.260071388,5.22867748,3.618571028,5.368372433,0.73479983,5.642167634,3.578065884,4.202760687,3.368286885,4.032175377,3.113174305,0.919001072,0,0,0,0,0,0,0,0,0,0,4666,TIOGA,YORK 480,802,Brine,66883506,lb,liquid,41134,8/13/12,121000,0,4.72,23300,43500,0,201,321,3060,15.3,74900,0,9410,0,52,1110,166000,11000,207000,5.94,299000,363,46360,5825,17200,187,0,0,0,2012,8,13,YORK,480,0,0,0,802,Brine,2009,11,12,117-20402,OGO-67805,41.810788,-76.945751,Yes,Horizontal Well,GAS,Bbl,Yes,PW,0,261365.1,366,0,0,2009.916667,2.75,91.97860963,5.08278537,0.673941999,4.367355921,4.638489257,2.303196057,2.506505032,3.485721426,4.874481818,3.973589623,0,1.716003344,3.045322979,5.220108088,4.041392685,5.315970345,0.773786445,5.475671188,2.559906625,4.666143427,3.76529593,4.235528447,2.271841607,1.96368684,0,0,0,0,0,0,0,0,0,0,1669,TIOGA,DANDOIS 482,804,Fracing fluid waste,711524742,lb,liquid,40742,7/18/11,59600,0,0,6300,22800,1.28,74.9,127,677,3.26,30400,0,2340,7.92,168,617,72100,3930,272000,6.31,121000,192,23130,10070,2599,531.5,0,0,0,2011,7,18,DANDOIS,482,0,0,0,805,FracingFluid,2010,6,12,117-20558,OGO-67805,41.812422,-76.911711,Yes,Horizontal Well,GAS,Bbl,2012,PW,0,448694.9,105,0,0,2010.5,1.083333333,4.889934149,4.77524626,0,3.799340549,4.357934847,1.874481818,2.103803721,2.830588669,4.482873584,3.369215857,0.898725182,2.225309282,2.790285164,4.857935265,3.59439255,5.434568904,0.800029359,5.08278537,2.283301229,4.364175633,4.003029471,3.41480628,2.725503269,0.689303011,0,0,0,0,0,0,0,0,0,0,6670,TIOGA,FISH 301,810,Drill cuttings,0,0,liquid,40735,7/11/11,52200,13.2,0,98.1,15200,17,18900,0,3470,608,3830,0,261,89,1280,15.6,2070,2530,22500,12.03,4680,102000,2952,2174,552.6,1019,0,0,0,2011,7,11,FISH,301,0,0,0,803,DrillFluid,2011,5,25,117-20900,OGO-67805,41.766492,-77.176006,Yes,Horizontal Well,GAS,Bbl,2012,PW,0,0,0,0,0,2011.416667,0.166666667,0.542296369,4.717670503,0,1.991669007,4.181843588,4.276461804,0,3.540329475,3.583198774,2.416640507,1.949390007,3.10720997,1.193124598,3.315970345,3.403120521,4.352182518,1.080265627,3.670245853,5.008600172,3.470116353,3.33725954,2.742410881,3.008174184,-0.265763303,0,0,0,0,0,0,0,0,0,0,3671,TIOGA,KNOWLTON 303,804,Late flowback,1075829,lb,liquid,40722,6/28/11,25500,5.55,0,3470,8660,27.5,7090,0,942,78,26000,0,578,47.2,10000,126,45500,82300,138000,9.57,122000,84000,1977,1800,503.8,27.93,0,0,EPA,2011,6,28,KNOWLTON,303,0,0,0,802,PW,2011,2,20,117-21174,OGO-67805,41.748322,-77.188872,Yes,Horizontal Well,GAS,Bbl,2012,Yes,0,0,0,0,0,2011.166667,0.333333333,18.03795202,4.40654018,0,3.540329475,3.937517892,3.850646235,0,2.974050903,4.414973348,2.761927838,1.673941999,4,2.100370545,4.658011397,4.915399835,5.139879086,0.980911938,5.086359831,4.924279286,3.296006669,3.255272505,2.702258163,1.446070936,1.256187227,0,0,0,0,0,0,0,0,0,0,4672,TIOGA,MATZ 824,804,Fracing fluid waste,1239517899,lb,liquid,40717,6/23/11,60000,0,5.98,4080,21100,1.29,64.9,173,1800,6.56,40000,0,3830,0.567,30,1160,123000,9200,455000,5.93,191000,1160,17080,6949,2404,386.7,0,0,0,2011,6,23,MATZ,824,0,0,0,805,FracingFluid,2010,7,9,117-20600,OGO-67805,41.897328,-77.368216,Yes,Horizontal Well,GAS,Bbl,2012,PW,0,117684.62,182,0,0,2010.583333,0.916666667,6.216705456,4.77815125,0.776701184,3.610660163,4.324282455,1.812244697,2.238046103,3.255272505,4.602059991,3.583198774,-0.246416941,1.477121255,3.064457989,5.089905111,3.963787827,5.658011397,0.773054693,5.281033367,3.064457989,4.232487866,3.841922312,3.380934463,2.587374172,0.793560291,0,0,0,0,0,0,0,0,0,0,6673,TIOGA,MATZ 824,804,Fracing fluid waste,1218249,lb,liquid,40717,6/23/11,69700,0,6.29,3780,24500,1.39,76,218,2090,6.5,47400,0,4750,0,68,1290,135000,11800,485000,5.87,209000,825,25190,7567,3313,638,0,0,EPA,2011,6,23,MATZ,824,0,0,0,805,FracingFluid,2010,7,9,117-20600,OGO-67805,41.897328,-77.368216,Yes,Horizontal Well,GAS,Bbl,2012,PW,0,117684.62,182,0,0,2010.583333,0.916666667,5.192789969,4.843232778,0.798650645,3.5774918,4.389166084,1.880813592,2.338456494,3.320146286,4.675778342,3.67669361,0,1.832508913,3.11058971,5.130333768,4.071882007,5.685741739,0.768638101,5.320146286,2.916453949,4.401228167,3.878923734,3.520221436,2.804820679,0.715400757,0,0,0,0,0,0,0,0,0,0,6675,TIOGA,PAZZAGLIA 507,804,Fracing fluid waste,1792697935,lb,liquid,40855,11/8/11,61900,0,4.99,10800,22000,0.515,130,208,1660,6.18,39300,0.134,5540,0.38,51,935,119000,8200,186000,6.04,212000,208,40070,6965,13200,1100,0,0,0,2011,11,8,PAZZAGLIA,507,0,0,0,805,FracingFluid,2009,9,25,117-20385,OGO-67805,41.847564,-76.924083,Yes,Horizontal Well,GAS,Bbl,2012,PW,0,73304.58,225,0,0,2009.75,2.166666667,12,4.791690649,0.698100546,4.033423755,4.342422681,2.113943352,2.318063335,3.220108088,4.59439255,3.743509765,-0.420216403,1.707570176,2.970811611,5.075546961,3.913813852,5.269512944,0.781036939,5.326335861,2.318063335,4.602819342,3.842921121,4.120573931,3.041392685,1.079181246,0,0,0,0,0,0,0,0,0,0,6676,TIOGA,SAMPSON 147,804,Fracing fluid waste,1123337,lb,liquid,40717,6/23/11,52600,0,6.13,4530,19000,1.37,185,168,1270,10.1,48400,0,4630,0.484,62,899,189000,11800,495000,5.83,206000,831,21760,7564,2815,322.2,0,0,0,2011,6,23,SAMPSON,147,0,0,0,805,FracingFluid,2009,7,9,117-20273,OGO-67805,41.789587,-77.204709,Yes,Horizontal Well,GAS,Bbl,2012,PW,0,255185.76,309,0,0,2009.583333,1.916666667,8.736809435,4.720985744,0.787460475,3.656098202,4.278753601,2.267171728,2.225309282,3.103803721,4.684845362,3.665580991,-0.315154638,1.792391689,2.953759692,5.276461804,4.071882007,5.694605199,0.765668555,5.31386722,2.919601024,4.337658891,3.87875152,3.449478399,2.508125536,0.941352863,0,0,0,0,0,0,0,0,0,0,6677,TIOGA,SAMPSON 147,804,Fracing fluid waste,0,0,liquid,40721,6/27/11,66100,0,0,7590,23600,2.89,153,182,1730,10.1,42900,0,6010,6.64,72,1180,137000,10500,481000,5.55,202000,528,34990,9290,1956,410.9,0,0,0,2011,6,27,SAMPSON,147,0,0,0,805,FracingFluid,2009,7,9,117-20273,OGO-67805,41.789587,-77.204709,Yes,Horizontal Well,GAS,Bbl,2012,PW,0,255185.76,309,0,0,2009.583333,1.916666667,4.760282307,4.820201459,0,3.880241776,4.372912003,2.184691431,2.260071388,3.238046103,4.632457292,3.778874472,0.822168079,1.857332496,3.071882007,5.136720567,4.021189299,5.682145076,0.744292983,5.305351369,2.722633923,4.543943942,3.968015714,3.29136885,2.613736141,0.677632709,0,0,0,0,0,0,0,0,0,0,6678,TIOGA,SHAW 500,804,Fracing fluid waste,576619,lb,liquid,40864,11/17/11,82700,0,5.78,1090,29600,0.128,76.1,261,2110,11.4,54400,0.122,5710,0.27,31,922,140000,8200,178000,5.72,189000,174,27410,7446,7624,108,0,0,0,2011,11,17,SHAW,500,0,0,0,805,FracingFluid,2011,2,12,117-21021,OGO-67805,41.8253,-76.992028,Yes,Horizontal Well,GAS,Bbl,2012,PW,0,21045.66,21,0,0,2011.166667,0.75,70.59259259,4.91750551,0.761927838,3.037426498,4.471291711,1.881384657,2.416640507,3.324282455,4.7355989,3.756636108,-0.568636236,1.491361694,2.964730921,5.146128036,3.913813852,5.250420002,0.757396029,5.276461804,2.240549248,4.437909036,3.871923032,3.882182888,2.033423755,1.848759132,0,0,0,0,0,0,0,0,0,0,6679,TIOGA,SODERBURG 501,804,Fracing fluid waste,328468,lb,liquid,40717,6/23/11,66900,0,0,15500,23900,2.21,135,180,1730,7.84,53600,0,6550,0,70,1200,152000,43300,529000,5.76,235000,625,33990,10800,745.1,244.5,0,0,0,2011,6,23,SODERBURG,501,0,0,0,805,FracingFluid,2009,10,27,117-20388,OGO-67805,41.82625,-76.984057,Yes,Horizontal Well,GAS,Bbl,2012,PW,0,872818.32,345,0,0,2009.833333,1.666666667,3.047443763,4.825426118,0,4.190331698,4.378397901,2.130333768,2.255272505,3.238046103,4.72916479,3.8162413,0,1.84509804,3.079181246,5.181843588,4.636487896,5.723455672,0.760422483,5.371067862,2.795880017,4.531351165,4.033423755,2.872214563,2.388278863,0.4839357,0,0,0,0,0,0,0,0,0,0,6681,TIOGA,DETWEILER 235A,804,Fracing fluid waste,0,0,liquid,39934,5/1/09,1300,0,0.156,87.1,241,0,3.08,2.05,21,0.395,884,0,47.9,0.0768,191,36.6,2180,47400,9280,7.2,4840,230,0,0,54,8,0,0,0,2009,5,1,DETWEILER,235A,0,0,0,805,FracingFluid,2009,1,31,117-20262,OGO-67805,41.796811,-76.976538,Yes,Horizontal Well,GAS,Bbl,2012,PW,0,0,0,0,0,2009.083333,0.333333333,6.75,3.113943352,-0.806875402,1.940018155,2.382017043,0.488550717,0.311753861,1.322219295,2.946452265,1.680335513,-1.11463878,2.281033367,1.563481085,3.338456494,4.675778342,3.967547976,0.857332496,3.684845362,2.361727836,0,0,1.73239376,0.903089987,0.829303773,0,0,0,0,0,0,0,0,0,0,6682,TIOGA,DETWEILER 235A,804,Fracing fluid waste,0,0,liquid,39937,5/4/09,1060,0.0343,1.12,121,305,0.0413,55.2,4.06,25.9,1.29,1090,0,56.7,0.665,107,39.1,2460,397,8740,7.4,5090,330,0,0,0,0,0,0,0,2009,5,4,DETWEILER,235A,0,0,0,805,FracingFluid,2009,1,31,117-20262,OGO-67805,41.796811,-76.976538,Yes,Horizontal Well,GAS,Bbl,2012,PW,0,0,0,0,0,2009.083333,0.333333333,0,3.025305865,0.049218023,2.08278537,2.484299839,1.741939078,0.608526034,1.413299764,3.037426498,1.753583059,-0.177178355,2.029383778,1.592176757,3.390935107,2.598790507,3.941511433,0.86923172,3.706717782,2.51851394,0,0,0,0,0,0,0,0,0,0,0,0,0,0,0,6683,TIOGA,DETWEILER 235A,804,Fracing fluid waste,0,0,liquid,39941,5/8/09,7800,0.0321,3.14,1210,1790,0,39,37,154,1.1,10700,0,443,0.091,187,233,26400,4870,90500,6.6,48700,68.8,0,0,0,0,0,0,0,2009,5,8,DETWEILER,235A,0,0,0,805,FracingFluid,2009,1,31,117-20262,OGO-67805,41.796811,-76.976538,Yes,Horizontal Well,GAS,Bbl,2012,PW,0,0,0,0,0,2009.083333,0.333333333,0,3.892094603,0.496929648,3.08278537,3.252853031,1.591064607,1.568201724,2.187520721,4.029383778,2.646403726,-1.040958608,2.271841607,2.367355921,4.421603927,3.687528961,4.956648579,0.819543936,4.687528961,1.837588438,0,0,0,0,0,0,0,0,0,0,0,0,0,0,0,6684,TIOGA,SAMPSON 147 & NEAL 134,803,Drilling pit fluid,0,0,liquid,40031,8/6/09,1400,0,0.46,20.9,516,0.04,4.24,1.21,27.6,3.11,12200,0,20.8,0.04,497,205,17500,947,0,6.8,36100,168,40880,750,16920,1125,0,0,0,2009,8,6,SAMPSON,147,&,NEAL,134,803,DrillFluid,2009,7,9,117-20273,OGO-67805,41.789587,-77.204709,Yes,Horizontal Well,GAS,Bbl,2012,PW,0,0,0,0,0,2009.583333,0.083333333,15.04,3.146128036,-0.337242168,1.320146286,2.712649702,0.627365857,0.08278537,1.440909082,4.086359831,1.318063335,-1.397940009,2.696356389,2.311753861,4.243038049,2.976349979,0,0.832508913,4.557507202,2.225309282,4.611510887,2.875061263,4.228400359,3.051152522,1.177247836,0,0,0,0,0,0,0,0,0,0,3685,TIOGA,SAMPSON 147 & NEAL 134,803,Flowback,0,0,liquid,40031,8/6/09,16900,0,2.28,2270,6140,0,35.2,53.6,384,2.81,18400,0,1330,0.09,0,517,44700,202,0,5.4,86500,148,21960,980,11120,1287,0,0,0,2009,8,6,SAMPSON,147,&,NEAL,134,802,Flowback,2009,7,9,117-20273,OGO-67805,41.789587,-77.204709,Yes,Horizontal Well,GAS,Bbl,2012,PW,0,0,0,0,0,2009.583333,0.083333333,8.64024864,4.227886705,0.357934847,3.356025857,3.788168371,1.546542663,1.72916479,2.584331224,4.264817823,3.123851641,-1.045757491,0,2.713490543,4.650307523,2.305351369,0,0.73239376,4.937016107,2.170261715,4.341632336,2.991226076,4.046104787,3.109578547,0.93652624,0,0,0,0,0,0,0,0,0,0,5686,TIOGA,SAMPSON 147 & NEAL 134,803,Flowback,0,0,liquid,40031,8/6/09,46000,0,4.36,9360,16600,0,77.2,115,1100,8.19,74900,0,3410,0.12,0,857,60500,3020,0,5.2,135000,113,40880,750,16920,1125,0,0,0,2009,8,6,SAMPSON,147,&,NEAL,134,802,Flowback,2009,7,9,117-20273,OGO-67805,41.789587,-77.204709,Yes,Horizontal Well,GAS,Bbl,2012,PW,0,0,0,0,0,2009.583333,0.083333333,15.04,4.662757832,0.639486489,3.971275849,4.220108088,1.8876173,2.06069784,3.041392685,4.874481818,3.532754379,-0.920818754,0,2.932980822,4.781755375,3.480006943,0,0.716003344,5.130333768,2.053078443,4.611510887,2.875061263,4.228400359,3.051152522,1.177247836,0,0,0,0,0,0,0,0,0,0,5687,TIOGA,SAMPSON 147 & NEAL 134,803,Flowback,0,0,liquid,40031,8/6/09,20900,0,2.37,2660,7630,0,43.2,65.2,453,2.89,18300,0,1670,0.08,1,461,37100,1170,0,5.4,74600,142,21960,980,11120,1287,0,0,0,2009,8,6,SAMPSON,147,&,NEAL,134,802,Flowback,2009,7,9,117-20273,OGO-67805,41.789587,-77.204709,Yes,Horizontal Well,GAS,Bbl,2012,PW,0,0,0,0,0,2009.583333,0.083333333,8.64024864,4.320146286,0.374748346,3.424881637,3.882524538,1.635483747,1.814247596,2.656098202,4.26245109,3.222716471,-1.096910013,0,2.663700925,4.56937391,3.068185862,0,0.73239376,4.872738827,2.152288344,4.341632336,2.991226076,4.046104787,3.109578547,0.93652624,0,0,0,0,0,0,0,0,0,0,51295,Marcellus Shale Coalition ,"LOCATION_A_Lewis, WV",0,0,0,0,liquid,0,0,0,0,0,0,0,0,0,0,0,0,0,0,0,0,76.7,0.2,74.6,3120,498,7.2,990,190,0,0,0,0,0,0,SM18 2320B,2009,2,7,0,0,0,0,0,0,Injection,0,0,0,0,0,39.014,-80.347,0,0,0,0,0,0,0,0,0,0,0,0,0,0,0,0,0,0,0,0,0,0,0,0,1.884795364,-0.698970004,1.872738827,3.494154594,2.697229343,0.857332496,2.995635195,2.278753601,0,0,0,0,0,Sporadic,0,0,0,0,0,0,0,0,0,21296,Marcellus Shale Coalition ,"LOCATION_A_Lewis, WV",0,0,0,0,liquid,0,0,0,0.01,0.0496,0.276,20.2,0.0391,0.362,0.0445,3.5,0,96.1,0.003,0.726,0.0355,76.7,0.2,74.6,3120,498,7.2,990,190,0,0,0,0,0,0,SM18 2320B,2009,2,7,0,0,0,0,0,0,Injection,0,0,0,0,0,39.014,-80.347,0,0,0,0,0,0,0,0,0,0,0,0,0,0,0,-1.304518324,-0.559090918,1.305351369,-0.441291429,-1.351639989,0.544068044,1.982723388,-0.139063379,-1.449771647,1.884795364,-0.698970004,1.872738827,3.494154594,2.697229343,0.857332496,2.995635195,2.278753601,0,0,0,0,0,Sporadic,51.5,2.59,0,0,0,0,0,0,0,21297,Marcellus Shale Coalition ,"LOCATION_C_Lewis, WV",0,0,0,0,liquid,0,0,0,0.01,3.46,0.0631,16.4,0.0077,0.25,0.0092,3.2,0,86.1,0.005,0.103,0.0786,233,0.2,39.7,578,1190,8.9,719,110,0,0,0,0,0,0,SM18 2320B,2009,2,11,0,0,0,0,0,0,Injection,0,0,0,0,0,39.074,-80.34,0,0,0,0,0,0,0,0,0,0,0,0,0,0,0,0.539076099,-1.199970641,1.214843848,-0.602059991,-2.036212173,0.505149978,1.935003151,-0.987162775,-1.104577454,2.367355921,-0.698970004,1.598790507,2.761927838,3.075546961,0.949390007,2.85672889,2.041392685,0,0,0,0,0,Sporadic,269,45.1,0,0,0,0,0,0,0,21298,Marcellus Shale Coalition ,"LOCATION_N_Tyler, WV",0,0,0,0,liquid,0,0,0,0.1,44.7,1.42,16.1,0.0713,0.688,0.196,1.79,0,80,0.05,3.02,0.0807,154,0.9,132,734,1350,8.2,735,14.4,0,0,0,0,0,0,SM18 2320B,2009,7,14,0,0,0,0,0,0,Injection,0,0,0,0,0,39.389,-79.986,0,0,0,0,0,0,0,0,0,0,0,0,0,0,0,1.650307523,0.152288344,1.206825876,-0.162411562,-0.707743929,0.252853031,1.903089987,0.480006943,-1.093126465,2.187520721,-0.045757491,2.120573931,2.86569606,3.130333768,0.913813852,2.866287339,1.158362492,0,0,0,0,0,Sporadic,165,50.7,0,0,0,0,0,0,0,21299,Marcellus Shale Coalition ,"LOCATION_N_Tyler, WV",0,0,0,0,liquid,0,0,0,0,0,0,0,0,0,0,0,0,0,0,0,0.538,0,0,0,0,0,0,0,0,0,0,0,0,0,0,MCAWW 300.0A,2009,7,15,0,0,0,0,0,0,Injection,0,0,0,0,0,39.389,-79.986,0,0,0,0,0,0,0,0,0,0,0,0,0,0,0,0,0,0,0,0,0,0,0,-0.269217724,0,0,0,0,0,0,0,0,0,0,0,0,0,Sporadic,110,0,0,0,0,0,0,0,0,21300,Marcellus Shale Coalition ,"LOCATION_D_Greene, PA",0,0,0,0,liquid,0,0,0,0.01,0.103,0.111,56.4,0.0286,0.81,0.0284,18,0,345,0.005,0.789,0.036,120,1,234,3450,1970,7.1,1410,16,0,0,0,0,0,0,SM18 2320B,2009,2,12,0,0,0,0,0,0,Injection,0,0,0,0,0,39.827,-80.085,0,0,0,0,0,0,0,0,0,0,0,0,0,0,0,-0.987162775,-0.954677021,1.751279104,-0.091514981,-1.54668166,1.255272505,2.537819095,-0.102922997,-1.443697499,2.079181246,0,2.369215857,3.537819095,3.294466226,0.851258349,3.149219113,1.204119983,0,0,0,0,0,Sporadic,374,3.54,0,0,0,0,0,0,0,21301,Marcellus Shale Coalition ,"LOCATION_E_Greene, PA",0,0,0,0,liquid,0,0,0,0.1,0.502,2.21,265,0.25,1.23,1,56.1,0,1770,0.05,23.2,0.2,308,32.8,3560,996,4980,7,5910,1040,0,0,0,0,0,0,SM18 2320B,2009,4,1,0,0,0,0,0,0,Injection,0,0,0,0,0,39.906,-80.347,0,0,0,0,0,0,0,0,0,0,0,0,0,0,0,-0.299296283,0.344392274,2.423245874,0.089905111,0,1.748962861,3.247973266,1.365487985,-0.698970004,2.488550717,1.515873844,3.551449998,2.998259338,3.697229343,0.84509804,3.771587481,3.017033339,0,0,0,0,0,Sporadic,50.3,16.6,0,0,0,0,0,0,0,21302,Marcellus Shale Coalition ,"LOCATION_H_Westmoreland, PA",0,0,0,0,liquid,0,0,0,0.1,2.47,6.28,301,0.25,3.92,2.29,29.2,0,1410,0.05,78.5,0.169,81.8,41.7,2810,6410,9980,5.2,7080,230,0,0,0,0,0,0,SM18 2320B,2009,4,7,0,0,0,0,0,0,Injection,0,0,0,0,0,40.176,-79.769,0,0,0,0,0,0,0,0,0,0,0,0,0,0,0,0.392696953,0.797959644,2.478566496,0.593286067,0.359835482,1.465382851,3.149219113,1.894869657,-0.772113295,1.912753304,1.620136055,3.44870632,3.80685803,3.999130541,0.716003344,3.850033258,2.361727836,0,0,0,0,0,Sporadic,58.5,54.6,0,0,0,0,0,0,0,21303,Marcellus Shale Coalition ,"LOCATION_B_Washington, PA",0,0,0,0,liquid,0,0,0,0.0091,2.4,9.81,3260,0.021,0.441,16.4,266,0,6790,0.005,439,0.0519,121,107,10700,1730,34600,7.6,27800,790,0,0,0,0,0,0,SM18 2320B,2009,1,26,0,0,0,0,0,0,Injection,0,0,0,0,0,40.258,-80.352,0,0,0,0,0,0,0,0,0,0,0,0,0,0,0,0.380211242,0.991669007,3.5132176,-0.355561411,1.214843848,2.424881637,3.831869774,2.64246452,-1.284832642,2.08278537,2.029383778,4.029383778,3.238046103,4.539076099,0.880813592,4.444044796,2.897627091,0,0,0,0,0,Sporadic,198,257,0,0,0,0,0,0,0,21304,Marcellus Shale Coalition ,"LOCATION_F_Washington, PA",0,0,0,0,liquid,0,0,0,0.1,0.0396,0.0914,61.8,0.0493,2.31,0.0294,8.41,0,27.4,0.05,0.303,0.0385,126,0.2,30.7,851,476,7,462,90,0,0,0,0,0,0,SM18 2320B,2009,3,24,0,0,0,0,0,0,Injection,0,0,0,0,0,40.267,-80.421,0,0,0,0,0,0,0,0,0,0,0,0,0,0,0,-1.402304814,-1.039053804,1.790988475,0.36361198,-1.53165267,0.924795996,1.437750563,-0.518557371,-1.41453927,2.100370545,-0.698970004,1.487138375,2.92992956,2.677606953,0.84509804,2.664641976,1.954242509,0,0,0,0,0,Sporadic,59.2,50,0,0,0,0,0,0,0,21305,Marcellus Shale Coalition ,"LOCATION_P_Westmoreland, PA",0,0,0,0,liquid,0,0,0,0.1,0.0902,0.173,69.9,0.25,1,0.5,10.4,0,62,0.05,0.417,0.0453,38.6,0.2,152,35.3,726,7.3,401,10,0,0,0,0,0,0,SM18 2320B,2009,7,14,0,0,0,0,0,0,Injection,0,0,0,0,0,40.483,-79.593,0,0,0,0,0,0,0,0,0,0,0,0,0,0,0,-1.044793462,-0.761953897,1.844477176,0,-0.301029996,1.017033339,1.792391689,-0.379863945,-1.343901798,1.586587305,-0.698970004,2.181843588,1.547774705,2.860936621,0.86332286,2.603144373,1,0,0,0,0,0,Sporadic,73.7,4.01,0,0,0,0,0,0,0,21306,Marcellus Shale Coalition ,"LOCATION_R_Butler, PA",0,0,0,0,liquid,0,0,0,0.1,2,0.0675,5.45,0.0405,0.468,0.5,1.09,0,41.9,0.05,0.0585,0.052,60.4,10,18,1990,192,7.2,481,732,0,0,0,0,0,0,SM18 2320B,2009,6,22,0,0,0,0,0,0,Injection,0,0,0,0,0,40.743,-80.048,0,0,0,0,0,0,0,0,0,0,0,0,0,0,0,0.301029996,-1.170696227,0.736396502,-0.329754147,-0.301029996,0.037426498,1.622214023,-1.232844134,-1.283996656,1.781036939,1,1.255272505,3.298853076,2.283301229,0.857332496,2.682145076,2.864511081,0,0,0,0,0,Sporadic,11,50,0,0,0,0,0,0,0,21307,Marcellus Shale Coalition ,"LOCATION_L_Butler, PA",0,0,0,0,liquid,0,0,0,0.1,0.0545,0.108,33.8,0.25,1,0.5,7.17,0,72,0.05,0.206,0.138,62,9.2,115,511,599,7.8,221,4,0,0,0,0,0,0,SM18 2320B,2009,5,14,0,0,0,0,0,0,Injection,0,0,0,0,0,40.797,-80.076,0,0,0,0,0,0,0,0,0,0,0,0,0,0,0,-1.263603498,-0.966576245,1.5289167,0,-0.301029996,0.855519156,1.857332496,-0.68613278,-0.860120914,1.792391689,0.963787827,2.06069784,2.7084209,2.777426822,0.892094603,2.344392274,0.602059991,0,0,0,0,0,Sporadic,40,4.22,0,0,0,0,0,0,0,21308,Marcellus Shale Coalition ,"LOCATION_S_Centre, PA",0,0,0,0,liquid,0,0,0,0.1,0.0138,0.41,36,0.109,0.726,0.0311,16.2,0,71.8,0.05,0.597,0.14,109,0.2,58.5,4810,480,7.2,280,200,0,0,0,0,0,0,SM18 2320B,2009,8,25,0,0,0,0,0,0,Injection,0,0,0,0,0,41.057,-78.025,0,0,0,0,0,0,0,0,0,0,0,0,0,0,0,-1.860120914,-0.387216143,1.556302501,-0.139063379,-1.507239611,1.209515015,1.856124444,-0.224025669,-0.853871964,2.037426498,-0.698970004,1.767155866,3.682145076,2.681241237,0.857332496,2.447158031,2.301029996,0,0,0,0,0,Sporadic,32.6,2.59,0,0,0,0,0,0,0,21309,Marcellus Shale Coalition ,"LOCATION_G_Lycoming, PA",0,0,0,0,liquid,0,0,0,0.1,0.0687,0,31.8,0.12,13.1,0.0387,6.24,0,44.7,0.05,0.691,0.0469,5,0.2,86,502,6720,6,1920,4,0,0,0,0,0,0,SM18 2320B,2009,3,31,0,0,0,0,0,0,Injection,0,0,0,0,0,41.368,-77.26,0,0,0,0,0,0,0,0,0,0,0,0,0,0,0,-1.163043263,0,1.50242712,1.117271296,-1.412289035,0.79518459,1.650307523,-0.160521953,-1.328827157,0.698970004,-0.698970004,1.934498451,2.700703717,3.827369273,0.77815125,3.283301229,0.602059991,0,0,0,0,0,Sporadic,2920,50,0,0,0,0,0,0,0,21310,Marcellus Shale Coalition ,"LOCATION_I_Cameron, PA",0,0,0,0,liquid,0,0,0,0.1,0.0499,1.17,13,0.25,0.175,0.0517,0.0115,0,70.8,0.05,1.07,0.0794,33.4,1,90.2,2560,362,7.6,265,192,0,0,0,0,0,0,SM18 2320B,2009,5,9,0,0,0,0,0,0,Injection,0,0,0,0,0,41.385,-78.25,0,0,0,0,0,0,0,0,0,0,0,0,0,0,0,-1.301899454,0.068185862,1.113943352,-0.756961951,-1.286509457,-1.93930216,1.850033258,0.029383778,-1.100179498,1.523746467,0,1.955206538,3.408239965,2.558708571,0.880813592,2.423245874,2.283301229,0,0,0,0,0,Sporadic,8.4,3.79,0,0,0,0,0,0,0,21311,Marcellus Shale Coalition ,"LOCATION_O_Potter, PA",0,0,0,0,liquid,0,0,0,0.1,1.31,72.2,120,0.0794,0.954,1.93,14.8,0,658,0,27,0.924,66.1,20,1060,2420,4000,7.2,2670,5290,0,0,0,0,0,0,SM18 2320B,2009,7,1,0,0,0,0,0,0,Injection,0,0,0,0,0,41.582,-77.888,0,0,0,0,0,0,0,0,0,0,0,0,0,0,0,0.117271296,1.858537198,2.079181246,-0.020451625,0.285557309,1.170261715,2.818225894,1.431363764,-0.034328029,1.820201459,1.301029996,3.025305865,3.383815366,3.602059991,0.857332496,3.426511261,3.723455672,0,0,0,0,0,Sporadic,100,6.85,0,0,0,0,0,0,0,21312,Marcellus Shale Coalition ,"LOCATION_K_Bradford, PA",0,0,0,0,liquid,0,0,0,0.1,0,1.22,0,0.25,0,0,0,0,0,0,1.31,0,116,18.9,82,0,0,6.3,0,0,0,0,0,0,0,0,SM18 2320B,2009,5,7,0,0,0,0,0,0,Injection,0,0,0,0,0,41.687,-76.656,0,0,0,0,0,0,0,0,0,0,0,0,0,0,0,0,0.086359831,0,0,0,0,0,0.117271296,0,2.064457989,1.276461804,1.913813852,0,0,0.799340549,0,0,0,0,0,0,0,Sporadic,0,0,0,0,0,0,0,0,0,21313,Marcellus Shale Coalition ,"LOCATION_M_McKean, PA",0,0,0,0,liquid,0,0,0,0.1,2,0.579,6.08,0.0445,0.46,0.0281,1.46,0,34.2,0.05,0.768,0.0406,9.6,10,29.9,490,177,6.2,371,110,0,0,0,0,0,0,SM18 2320B,2009,5,19,0,0,0,0,0,0,Injection,0,0,0,0,0,41.702,-78.499,0,0,0,0,0,0,0,0,0,0,0,0,0,0,0,0.301029996,-0.237321436,0.783903579,-0.337242168,-1.55129368,0.164352856,1.534026106,-0.11463878,-1.391473966,0.982271233,1,1.475671188,2.69019608,2.247973266,0.792391689,2.56937391,2.041392685,0,0,0,0,0,Sporadic,2.9,50,0,0,0,0,0,0,0,21314,Marcellus Shale Coalition ,"LOCATION_J_Tioga, PA",0,0,0,0,liquid,0,0,0,0.1,0.202,87.1,293,0.25,1.51,2.59,25.3,0,1120,0.05,47.9,0.0455,191,36.6,2180,47400,9280,7.2,4840,230,0,0,0,0,0,0,SM18 2320B,2009,5,1,0,0,0,0,0,0,Injection,0,0,0,0,0,41.763,-77,0,0,0,0,0,0,0,0,0,0,0,0,0,0,0,-0.694648631,1.940018155,2.46686762,0.178976947,0.413299764,1.403120521,3.049218023,1.680335513,-1.341988603,2.281033367,1.563481085,3.338456494,4.675778342,3.967547976,0.857332496,3.684845362,2.361727836,0,0,0,0,0,Sporadic,27.7,13,0,0,0,0,0,0,0,21315,Marcellus Shale Coalition ,"LOCATION_Q_Westmoreland, PA",0,0,0,0,liquid,0,0,0,0.1,0.0335,0.227,26.8,0.0397,1,0.5,6.09,0,67.9,0.05,0.292,0.069,49,4.5,78.1,1770,426,6.9,311,120,0,0,0,0,0,0,SM18 2320B,2009,6,30,0,0,0,0,0,0,Injection,0,0,0,0,0,41.86,-75.932,0,0,0,0,0,0,0,0,0,0,0,0,0,0,0,-1.474955193,-0.643974143,1.428134794,0,-0.301029996,0.784617293,1.831869774,-0.534617149,-1.161150909,1.69019608,0.653212514,1.892651034,3.247973266,2.629409599,0.838849091,2.492760389,2.079181246,0,0,0,0,0,Sporadic,45.3,4.11,0,0,0,0,0,0,0,21316,Bucknell University,Pritz_127_Well,0,0,0,0,liquid,0,0,0,0,0,0,0,0,0,0,0,0,0,0,0,0,0,0,0,0,0,0,222681,0,0,0,1756,318,0,0,gamma-ray spectrometry,2009,4,1,0,0,0,0,0,0,PW,0,0,0,0,0,41.80947,-76.503228,0,0,0,0,0,0,0,0,0,0,0,0,0,5.522012579,0,0,0,0,0,0,0,0,0,0,0,0,0,0,0,0,5.347683163,0,0,0,3.244524512,2.50242712,0.742097392,Sporadic,0,0,0,0,0,0,0,0,0,41317,"CNX Gas Company, LLC",GH21 CV Well Pad,0,0,0,0,liquid,0,0,79560,0.1,57.5,10.75,27030,0.05,50.51,76.4,2930,3.06,81590,0.1,47.25,0.209,20,2040,0,39,0,4.87,272840,439,0,0,0,0,0,0,No method specified,2011,1,31,0,0,0,0,0,0,PW,0,0,0,0,0,39.887294,-80.28083,0,0,0,0,0,0,0,0,0,0,0,0,0,0,4.900694774,1.759667845,1.031408464,4.431846046,1.703377369,1.883093359,3.46686762,4.911636933,1.674401813,-0.679853714,1.301029996,3.309630167,0,1.591064607,0,0.687528961,5.435908041,2.64246452,0,0,0,0,0,Average,25,0,0,0,0,0,0,0,0,41318,"CNX Gas Company, LLC",CONSOL GH2ACV,0,0,0,0,liquid,0,0,45213,0.1,14.2,1829,15620,0.05,203.5,90.4,1508,9.62,37670,0.1,2727,0.1,44,915,0,4520,112817,5.29,126218,420,10500,3760,1970,2.7,0,0,No method specified,2009,2,28,0,0,0,0,0,0,PW,0,0,0,0,0,39.893075,-80.286186,0,0,0,0,0,0,0,0,0,0,0,0,0,729.6296296,4.655263325,1.152288344,3.262213705,4.19368103,2.308564414,1.95616843,3.178401342,4.57599562,3.435685138,-1,1.643452676,2.961421094,0,3.655138435,5.052374547,0.723455672,5.101121294,2.62324929,4.021189299,3.575187845,3.294466226,0.431363764,2.863102462,Average,28.2,0,0,0,0,0,0,0,0,41319,"CNX Gas Company, LLC",CONSOL GH2ACV,0,0,0,0,liquid,0,0,45213,0.1,14.2,1829,15620,0.05,203.5,0,1508,9.62,0,0.1,2727,0.1,44,0,0,4520,112817,5.29,126218,420,10500,3760,1970,2.7,0,0,No method specified,2011,3,25,0,0,0,0,0,0,PW,0,0,0,0,0,39.893075,-80.286186,0,0,0,0,0,0,0,0,0,0,0,0,0,729.6296296,4.655263325,1.152288344,3.262213705,4.19368103,2.308564414,0,3.178401342,0,3.435685138,-1,1.643452676,0,0,3.655138435,5.052374547,0.723455672,5.101121294,2.62324929,4.021189299,3.575187845,3.294466226,0.431363764,2.863102462,Average,28.2,0,0,0,0,0,0,0,0,41320,"CNX Gas Company, LLC",CNX 3 Well Pad,0,0,0,0,liquid,0,0,39669,0.1,2.85,1333,13670,0.05,124.5,56.8,1344,7.45,29950,0.1,1901,0.1,0,1750,0,1820,99485,5.93,122400,560,4420,2250,1680,0.611,0,0,No method specified,2011,1,8,0,0,0,0,0,0,PW,0,0,0,0,0,39.893419,-80.29576,0,0,0,0,0,0,0,0,0,0,0,0,0,2749.590835,4.598451253,0.45484486,3.124830149,4.135768515,2.095169351,1.754348336,3.128399269,4.476396827,3.278982117,-1,0,3.243038049,0,3.260071388,4.997757604,0.773054693,5.087781418,2.748188027,3.645422269,3.352182518,3.225309282,-0.21395879,3.439268071,Average,2.5,0,0,0,0,0,0,0,0,41321,"CNX Gas Company, LLC",CNX-3 Well Pad,0,0,0,0,liquid,0,0,39669,0.1,2.85,1333,13670,0.05,124.5,56.8,1344,7.45,29950,0.1,1901,0.1,256,1750,0,1820,0,5.93,122400,560,4420,2550,1680,0.611,0,0,No method specified,2011,1,31,0,0,0,0,0,0,PW,0,0,0,0,0,39.893419,-80.29576,0,0,0,0,0,0,0,0,0,0,0,0,0,2749.590835,4.598451253,0.45484486,3.124830149,4.135768515,2.095169351,1.754348336,3.128399269,4.476396827,3.278982117,-1,2.408239965,3.243038049,0,3.260071388,0,0.773054693,5.087781418,2.748188027,3.645422269,3.40654018,3.225309282,-0.21395879,3.439268071,Average,2.5,0,0,0,0,0,0,0,0,41322,"CNX Gas Company, LLC",CNX-2A Well Pad,0,0,0,0,liquid,0,0,50724,0.1,4.07,1659,17400,0.05,146.6,78.2,1767,9.29,37925,0.1,2509,0.1,157,2540,0,2790,0,5.71,159896,516,6040,3080,2390,1.97,0,0,No method specified,2011,1,31,0,0,0,0,0,0,PW,0,0,0,0,0,39.89573,-80.286246,0,0,0,0,0,0,0,0,0,0,0,0,0,1213.19797,4.705213494,0.609594409,3.219846386,4.240549248,2.16613397,1.893206753,3.24723655,4.578925589,3.399500661,-1,2.195899652,3.404833717,0,3.445604203,0,0.756636108,5.203837599,2.712649702,3.781036939,3.488550717,3.378397901,0.294466226,3.083931675,Average,2.5,0,0,0,0,0,0,0,0,41323,"CNX Gas Company, LLC",CNX-2B Well Pad,0,0,0,0,liquid,0,0,50427,0.1,3.25,1755,17370,0.05,171.3,73.9,1713,9.79,41390,0.1,2368,0.1,336,2470,0,2720,0,5.38,157112,609,5910,3710,2380,0.651,0,0,No method specified,2011,1,31,0,0,0,0,0,0,PW,0,0,0,0,0,39.89581,-80.286243,0,0,0,0,0,0,0,0,0,0,0,0,0,3655.913978,4.702663132,0.511883361,3.244277121,4.239799818,2.233757363,1.868644438,3.233757363,4.616895426,3.374381698,-1,2.526339277,3.392696953,0,3.434568904,0,0.730782276,5.196209357,2.784617293,3.771587481,3.56937391,3.376576957,-0.186419011,3.562995968,Average,2.5,0,0,0,0,0,0,0,0,41324,"CNX Gas Company, LLC",CNX2Pad,0,0,0,0,liquid,0,0,49832,0.1,3.77,1919,17280,0.05,0.1469,72.6,1623,0.00227,39810,0.1,2461,0.1,0,2730,0,500,113827,4.91,168254,310,4120,2250,2760,1.23,0,0,No method specified,2011,2,15,0,0,0,0,0,0,PW,0,0,0,0,0,39.895811,-80.286243,0,0,0,0,0,0,0,0,0,0,0,0,0,2243.902439,4.697508318,0.57634135,3.283074975,4.237543738,-0.832978204,1.860936621,3.21031852,4.599992178,3.391111614,-1,0,3.436162647,0,2.698970004,5.05624529,0.691081492,5.225965398,2.491361694,3.614897216,3.352182518,3.440909082,0.089905111,3.351003971,Average,2.5,0,0,0,0,0,0,0,0,41325,"CNX Gas Company, LLC",CNX-2 Well Pad,0,0,0,0,liquid,0,0,49832,0.1,3.77,1919,17280,0.05,146.9,72.6,1623,2.27,39810,0.1,2461,0.1,376,2730,0,500,0,4.91,168254,310,4120,2250,2760,1.23,0,0,No method specified,2011,1,31,0,0,0,0,0,0,PW,0,0,0,0,0,39.895832,-80.286346,0,0,0,0,0,0,0,0,0,0,0,0,0,2243.902439,4.697508318,0.57634135,3.283074975,4.237543738,2.167021796,1.860936621,3.21031852,4.599992178,3.391111614,-1,2.575187845,3.436162647,0,2.698970004,0,0.691081492,5.225965398,2.491361694,3.614897216,3.352182518,3.440909082,0.089905111,3.351003971,Average,2.5,0,0,0,0,0,0,0,0,41326,"CNX Gas Company, LLC",GH34 CV Well Pad,0,0,0,0,liquid,0,0,56808,0.1,3.33,1888,19510,0.05,157.6,74.5,1965,10.84,44070,0.1,2412,0.1,33,2830,0,30.2,0,5.5,166790,418,6170,3220,2470,15.9,0,0,No method specified,2011,1,31,0,0,0,0,0,0,PW,0,0,0,0,0,39.898849,-80.27869,0,0,0,0,0,0,0,0,0,0,0,0,0,155.3459119,4.7544095,0.522444234,3.27600199,4.290257269,2.197556213,1.872156273,3.293362555,4.644143051,3.382377303,-1,1.51851394,3.451786436,0,1.480006943,0,0.740362689,5.222170009,2.621176282,3.790285164,3.507855872,3.392696953,1.201397124,2.191299829,Average,2.5,0,0,0,0,0,0,0,0,41327,"CNX Gas Company, LLC",GH34CV,0,0,0,0,liquid,0,0,56808,0.1,3.33,1888,19510,0.05,157.6,0,1965,10.84,44070,0.1,2412000,0.1,0,2830,0,30.2,111706,5.5,166790,418,6170,3220,2470,15.9,0,0,No method specified,2011,3,6,0,0,0,0,0,0,PW,0,0,0,0,0,39.89885,-80.27869,0,0,0,0,0,0,0,0,0,0,0,0,0,155.3459119,4.7544095,0.522444234,3.27600199,4.290257269,2.197556213,0,3.293362555,4.644143051,6.382377303,-1,0,3.451786436,0,1.480006943,5.048076501,0.740362689,5.222170009,2.621176282,3.790285164,3.507855872,3.392696953,1.201397124,2.191299829,Average,2.5,0,0,0,0,0,0,0,0,41328,"CNX Gas Company, LLC",GH8 CV Well Pad,0,0,0,0,liquid,0,0,58621,0.1,4.24,1808,20010,0.05,113.4,76.5,2102,12.49,47220,0.1,2224,0.1,20,2560,0,1410,0,4.94,171040,192,5900,3090,2390,17.2,0,0,No method specified,2011,1,31,0,0,0,0,0,0,PW,0,0,0,0,0,39.901702,-80.294199,0,0,0,0,0,0,0,0,0,0,0,0,0,138.9534884,4.768053223,0.627365857,3.257198426,4.301247089,2.054613055,1.883661435,3.322632712,4.674125983,3.347134783,-1,1.301029996,3.408239965,0,3.149219113,0,0.693726949,5.233097688,2.283301229,3.770852012,3.489958479,3.378397901,1.235528447,2.142869454,Average,2.5,0,0,0,0,0,0,0,0,41329,"CNX Gas Company, LLC",GH6 CV Well Pad,0,0,0,0,liquid,0,0,52543,0.1,3.57,1569,17970,0.05,267.1,55.9,1863,11.08,43150,0.1,1721,0.1,20,2490,0,14.4,0,4.71,143064,193,5450,3130,1700,18.8,0,0,No method specified,2011,1,31,0,0,0,0,0,0,PW,0,0,0,0,0,39.902799,-80.28654,0,0,0,0,0,0,0,0,0,0,0,0,0,90.42553191,4.720514866,0.552668216,3.195622944,4.254548077,2.426673888,1.747411808,3.270212855,4.6349808,3.23578087,-1,1.301029996,3.396199347,0,1.158362492,0,0.673020907,5.155530364,2.285557309,3.736396502,3.495544338,3.230448921,1.274157849,1.956291072,Average,2.5,0,0,0,0,0,0,0,0,41330,"CNX Gas Company, LLC",GH10 CV Well Pad,0,0,0,0,liquid,0,0,50626,0.1,4.34,1895,17420,0.05,192.2,85.6,1731,10.36,46480,0.1,2575,0.1,32,2560,0,2510,0,5.11,151940,499,6950,3030,3160,0.503,0,0,No method specified,2011,1,31,0,0,0,0,0,0,PW,0,0,0,0,0,39.903535,-80.301657,0,0,0,0,0,0,0,0,0,0,0,0,0,6282.306163,4.704373615,0.63748973,3.277609214,4.241048151,2.283753383,1.932473765,3.238297068,4.667266119,3.410777233,-1,1.505149978,3.408239965,0,3.399673721,0,0.7084209,5.181672122,2.698100546,3.841984805,3.481442629,3.499687083,-0.298432015,3.798119098,Average,2.5,0,0,0,0,0,0,0,0,41331,"CNX Gas Company, LLC",GH10,0,0,0,0,liquid,0,0,50626,0.1,4.34,1895,17420,0.05,192.2,0,1731,10.36,46480,0.1,2575,0.1,32,2560,0,2510,105747,5.11,151940,499,6950,3030,3160,0.503,0,0,No method specified,2011,2,4,0,0,0,0,0,0,PW,0,0,0,0,0,39.903788,-80.301541,0,0,0,0,0,0,0,0,0,0,0,0,0,6282.306163,4.704373615,0.63748973,3.277609214,4.241048151,2.283753383,0,3.238297068,4.667266119,3.410777233,-1,1.505149978,3.408239965,0,3.399673721,5.024268055,0.7084209,5.181672122,2.698100546,3.841984805,3.481442629,3.499687083,-0.298432015,3.798119098,Average,2.5,0,0,0,0,0,0,0,0,41332,"CNX Gas Company, LLC",CONSOL GH11CV,0,0,0,0,liquid,0,0,51889,0.1,4.35,1865,17830,0.05,164.2,86.5,1789,10.51,47060,0.1,2712,0.1,20,2660,0,1110,0,4.74,162966,320,5700,3160,2300,1.7,0,0,No method specified,2011,1,31,0,0,0,0,0,0,PW,0,0,0,0,0,39.906496,-80.299696,0,0,0,0,0,0,0,0,0,0,0,0,0,1352.941176,4.715075301,0.638489257,3.270678836,4.251151343,2.215373153,1.937016107,3.252610341,4.672651923,3.433289685,-1,1.301029996,3.424881637,0,3.045322979,0,0.675778342,5.212097006,2.505149978,3.755874856,3.499687083,3.361727836,0.230448921,3.131278915,Average,2.5,0,0,0,0,0,0,0,0,41333,"CNX Gas Company, LLC",CONSOL GH11CV,0,0,0,0,liquid,0,0,51889,0.1,4.35,1865,17830,0.05,164.2,86.5,1789,0.01051,47060,0.1,2712,0.1,20,2660,0,1110,0,4.74,162966,320,5700,3160,1970,1.7,0,0,No method specified,2012,2,29,0,0,0,0,0,0,PW,0,0,0,0,0,39.906496,-80.299696,0,0,0,0,0,0,0,0,0,0,0,0,0,1158.823529,4.715075301,0.638489257,3.270678836,4.251151343,2.215373153,1.937016107,3.252610341,4.672651923,3.433289685,-1,1.301029996,3.424881637,0,3.045322979,0,0.675778342,5.212097006,2.505149978,3.755874856,3.499687083,3.294466226,0.230448921,3.064017305,Average,2.5,0,0,0,0,0,0,0,0,41334,"CNX Gas Company, LLC",CONSOL GH15CV,0,0,0,0,liquid,0,0,15304,0.1,0,328.6,5225,0.05,205,0,548.1,6.19,0,0,691.4,0.1,68,0,0,764,99400,5.73,78072,257,1400,966,0,0,0,0,No method specified,2009,9,30,0,0,0,0,0,0,PW,0,0,0,0,0,39.90921,-80.307429,0,0,0,0,0,0,0,0,0,0,0,0,0,0,4.184804957,0,2.516667559,3.718086295,2.311753861,0,2.738859802,0,2.839729375,-1,1.832508913,0,0,2.883093359,4.997386384,0.758154622,4.892495305,2.409933123,3.146128036,2.984977126,0,0,0,Average,0,0,0,0,0,0,0,0,0,41335,"CNX Gas Company, LLC",GH14 CV Well Pad,0,0,0,0,liquid,0,0,51424,0.1,18.4,1685,17560,0.051,170.5,67.2,1840,9.01,45120,0.1,2970,0.1,428,1230,0,4290,0,5.26,165543,220,2640,1990,1990,75,0,0,No method specified,2011,1,31,0,0,0,0,0,0,PW,0,0,0,0,0,39.910843,-80.300815,0,0,0,0,0,0,0,0,0,0,0,0,0,26.53333333,4.711165855,1.264817823,3.226599905,4.244524512,2.231724383,1.827369273,3.264817823,4.654369091,3.472756449,-1,2.631443769,3.089905111,0,3.632457292,0,0.720985744,5.218910821,2.342422681,3.421603927,3.298853076,3.298853076,1.875061263,1.423791813,Average,2.5,0,0,0,0,0,0,0,0,41336,"CNX Gas Company, LLC",NV22 CV Well Pad,0,0,0,0,liquid,0,0,40877,0.1,24.3,1521,14040,0.1,147.8,81.7,1413,7.58,41540,0.1,2635,0.1,106,1010,0,10900,0,5.86,146912,502,16100,8610,3670,0.935,0,0,No method specified,2011,1,31,0,0,0,0,0,0,PW,0,0,0,0,0,39.982743,-80.295051,0,0,0,0,0,0,0,0,0,0,0,0,0,3925.13369,4.611479015,1.385606274,3.182129214,4.147367108,2.169674434,1.912222057,3.150142162,4.618466492,3.42078062,-1,2.025305865,3.004321374,0,4.037426498,0,0.767897616,5.167057271,2.700703717,4.206825876,3.935003151,3.564666064,-0.029188389,3.593854453,Average,2.5,0,0,0,0,0,0,0,0,41337,"CNX Gas Company, LLC",NV26 CV Well Pad,0,0,0,0,liquid,0,0,28502,0.1,29,850,9645,18,430,67,1073,7.85,33900,0.1,0,2.54,3,0,0,10700,0,6.22,114532,2734,5220,1190,3380,44.4,0,0,No method specified,2011,1,7,0,0,0,0,0,0,PW,0,0,0,0,0,39.986475,-80.280627,0,0,0,0,0,0,0,0,0,0,0,0,0,76.12612613,4.454875336,1.462397998,2.929418926,3.984302232,2.633468456,1.826074803,3.030599722,4.530199698,0,0.404833717,0.477121255,0,0,4.029383778,0,0.793790385,5.058926845,3.43679851,3.717670503,3.075546961,3.5289167,1.64738297,1.88153373,Average,0,0,0,0,0,0,0,0,0,41338,"CNX Gas Company, LLC",NV26 CV Well Pad,0,0,0,0,liquid,0,0,28502,0.1,29,850,9645,18,430,67,1073,7.85,33900,0.1,2403,2.54,3,831,0,10700,0,6.22,114532,2734,5220,1190,3380,44.4,0,0,No method specified,2011,1,31,0,0,0,0,0,0,PW,0,0,0,0,0,39.986475,-80.280627,0,0,0,0,0,0,0,0,0,0,0,0,0,76.12612613,4.454875336,1.462397998,2.929418926,3.984302232,2.633468456,1.826074803,3.030599722,4.530199698,3.380753771,0.404833717,0.477121255,2.919601024,0,4.029383778,0,0.793790385,5.058926845,3.43679851,3.717670503,3.075546961,3.5289167,1.64738297,1.88153373,Average,5.1,0,0,0,0,0,0,0,0,41339,"CNX Gas Company, LLC",NV20 CV Well Pad,0,0,0,0,liquid,0,0,39093.936,0.1,26.1,1372,13270,0.1,149.7,82,1447,7.02,43870,0.1,2376.5,0.1,203,956,0,19400,0,6.2,150720,694,7280,3830,2870,0.736,0,0,No method specified,2011,3,16,0,0,0,0,0,0,PW,0,0,0,0,0,39.992379,-80.287292,0,0,0,0,0,0,0,0,0,0,0,0,0,3899.456522,4.592109398,1.416640507,3.137354111,4.122870923,2.1752218,1.913813852,3.160468531,4.642167634,3.375937819,-1,2.307496038,2.980457892,0,4.28780173,0,0.792391689,5.178170885,2.84135947,3.862131379,3.583198774,3.457881897,-0.133122186,3.591004082,Average,8,0,0,0,0,0,0,0,0,41340,"CNX Gas Company, LLC",NV17 CV Well Pad,0,0,0,0,liquid,0,0,57432.59,0.1,20.9,1996,19760,0.1,136,0,1965,9.9,47840,0.1,3346,0.1,120,1220,0,17300,105266,5.97,173838,762,11000,6860,4140,5.99,0,0,No method specified,2011,2,23,0,0,0,0,0,0,PW,0,0,0,0,0,40.004866,-80.287747,0,0,0,0,0,0,0,0,0,0,0,0,0,691.1519199,4.759158402,1.320146286,3.300160537,4.29578694,2.133538908,0,3.293362555,4.679791171,3.524525937,-1,2.079181246,3.086359831,0,4.238046103,5.022288121,0.775974331,5.240144717,2.881954971,4.041392685,3.836324116,3.617000341,0.777426822,2.839573519,Average,2.5,0,0,0,0,0,0,0,0,41341,Chesapeake Energy,James Tharp 3H (Patterson 328____,0,0,0,0,liquid,0,0,0,0,0,0,0,0,0,0,0,0,0,0.2,0,0,0,0,0,0,0,12.3,0,0,0,0,1.41,1.75,0,0,No method specified,2011,6,14,0,0,0,0,0,0,PW,0,0,0,0,0,41.41,-80.18,0,0,0,0,0,0,0,0,0,0,0,0,0,0.805714286,0,0,0,0,0,0,0,0,0,0,0,0,0,0,0,1.089905111,0,0,0,0,0.149219113,0.243038049,-0.093818936,Average,0,0,0,0,0,0,0,0,0,41342,Chesapeake Energy,James Tharp 3H (Patterson 328____,0,0,0,0,liquid,0,0,0,0,0,0,0,0,0,0,0,0,0,0.2,0,0,0,0,0,0,0,11.6,0,0,0,0,1.22,1.52,0,0,No method specified,2011,6,18,0,0,0,0,0,0,PW,0,0,0,0,0,41.41,-80.18,0,0,0,0,0,0,0,0,0,0,0,0,0,0.802631579,0,0,0,0,0,0,0,0,0,0,0,0,0,0,0,1.064457989,0,0,0,0,0.086359831,0.181843588,-0.095483757,Average,0,0,0,0,0,0,0,0,0,41343,Chesapeake Energy,James Tharp 3H (Patterson 328____,0,0,0,0,liquid,0,0,0,0,0,0,0,0,0,0,0,0,0,0.2,0,0,0,0,0,0,0,12.3,0,0,0,0,0.464,0.23,0,0,No method specified,2011,7,2,0,0,0,0,0,0,PW,0,0,0,0,0,41.41,-80.18,0,0,0,0,0,0,0,0,0,0,0,0,0,2.017391304,0,0,0,0,0,0,0,0,0,0,0,0,0,0,0,1.089905111,0,0,0,0,-0.333482019,-0.638272164,0.304790145,Average,0,0,0,0,0,0,0,0,0,41344,Chesapeake Energy,James Tharp 3H (Patterson 328____,0,0,0,0,liquid,0,0,0,0,0,0,0,0,0,0,0,0,0,0.2,0,0,0,0,0,0,0,9.74,0,0,0,0,0.719,0.494,0,0,No method specified,2011,7,23,0,0,0,0,0,0,PW,0,0,0,0,0,41.41,-80.18,0,0,0,0,0,0,0,0,0,0,0,0,0,1.455465587,0,0,0,0,0,0,0,0,0,0,0,0,0,0,0,0.988558957,0,0,0,0,-0.14327111,-0.306273051,0.163001941,Average,0,0,0,0,0,0,0,0,0,41345,"Chevron Appalachia, LLC",Jordan 22H,0,0,0,0,liquid,0,0,47800,2,50,4230,16600,5,171,93,1550,5,47200,0.1,3570,50,38.6,1040,0,6720,194000,6,200000,77,39100,5900,6000,990,0,0,No method specified,2011,7,19,0,0,0,0,0,0,PW,0,0,0,0,0,39.732444,-79.958027,0,0,0,0,0,0,0,0,0,0,0,0,0,6.060606061,4.679427897,1.698970004,3.626340367,4.220108088,2.23299611,1.968482949,3.190331698,4.673941999,3.552668216,1.698970004,1.586587305,3.017033339,0,3.827369273,5.28780173,0.77815125,5.301029996,1.886490725,4.592176757,3.770852012,3.77815125,2.995635195,0.782516056,Average,100,0,0,0,0,0,0,0,0,41346,"Chevron Appalachia, LLC",Jordan 21H,0,0,0,0,liquid,0,0,39400,0.1,50,6160,13500,5,163,80.3,1380,6,30700,0.1,2650,50,39,896,0,5570,174000,6,159000,73.5,25800,2700,6690,940,0,0,No method specified,2011,7,19,0,0,0,0,0,0,PW,0,0,0,0,0,39.732627,-79.957747,0,0,0,0,0,0,0,0,0,0,0,0,0,7.117021277,4.595496222,1.698970004,3.789580712,4.130333768,2.212187604,1.904715545,3.139879086,4.487138375,3.423245874,1.698970004,1.591064607,2.95230801,0,3.745855195,5.240549248,0.77815125,5.201397124,1.866287339,4.411619706,3.431363764,3.825426118,2.973127854,0.852298264,Average,100,0,0,0,0,0,0,0,0,41347,"Chevron Appalachia, LLC",Game Lands Unit 4H,0,0,0,0,liquid,0,0,40100,2,50,3940,14000,5,312,79.2,1260,5,37400,0.1,3390,50,31.8,958,0,5920,178000,5.9,181000,41.6,8300,1600,4350,980,0,0,No method specified,2011,7,19,0,0,0,0,0,0,PW,0,0,0,0,0,39.769238,-80.005288,0,0,0,0,0,0,0,0,0,0,0,0,0,4.43877551,4.603144373,1.698970004,3.595496222,4.146128036,2.494154594,1.898725182,3.100370545,4.572871602,3.530199698,1.698970004,1.50242712,2.981365509,0,3.772321707,5.250420002,0.770852012,5.257678575,1.619093331,3.919078092,3.204119983,3.638489257,2.991226076,0.647263181,Average,100,0,0,0,0,0,0,0,0,41348,"Chevron Appalachia, LLC",Game Lands Unit 3H,0,0,0,0,liquid,0,0,59100,0.1,155,1380,20700,5,148,96.5,1780,5,68400,0.1,4940,50,38,1540,0,6840,233000,5.7,270000,65,4800,3200,2510,1230,0,0,No method specified,2011,7,19,0,0,0,0,0,0,PW,0,0,0,0,0,39.772486,-80.006222,0,0,0,0,0,0,0,0,0,0,0,0,0,2.040650407,4.771587481,2.190331698,3.139879086,4.315970345,2.170261715,1.984527313,3.250420002,4.835056102,3.693726949,1.698970004,1.579783597,3.187520721,0,3.835056102,5.367355921,0.755874856,5.431363764,1.812913357,3.681241237,3.505149978,3.399673721,3.089905111,0.30976861,Average,100,0,0,0,0,0,0,0,0,41349,"Chevron Appalachia, LLC",Burchinati Units 46,0,0,0,0,liquid,0,0,58300,2,131,1880,20500,5,258,78.1,1740,5.25,64000,0.1,4160,50,51.4,2090,0,11400,23600,5.7,301000,260,3700,3700,2270,1220,0,0,No method specified,2011,7,20,0,0,0,0,0,0,PW,0,0,0,0,0,39.830044,-80.007819,0,0,0,0,0,0,0,0,0,0,0,0,0,1.860655738,4.765668555,2.117271296,3.274157849,4.311753861,2.411619706,1.892651034,3.240549248,4.806179974,3.619093331,1.698970004,1.710963119,3.320146286,0,4.056904851,4.372912003,0.755874856,5.478566496,2.414973348,3.568201724,3.568201724,3.356025857,3.086359831,0.269666027,Average,100,0,0,0,0,0,0,0,0,41350,"Chevron Appalachia, LLC",Burchinati Units 46,0,0,0,0,liquid,0,0,64600,0.1,147,1620,22700,5,201,87.3,1900,5,72700,0.1,4720,50,54.4,100,0,8150,23400,5.7,288000,262,4200,2700,2800,1180,0,0,No method specified,2011,7,20,0,0,0,0,0,0,PW,0,0,0,0,0,39.830075,-80.00778,0,0,0,0,0,0,0,0,0,0,0,0,0,2.372881356,4.810232518,2.167317335,3.209515015,4.356025857,2.303196057,1.941014244,3.278753601,4.861534411,3.673941999,1.698970004,1.7355989,2,0,3.911157609,4.369215857,0.755874856,5.459392488,2.418301291,3.62324929,3.431363764,3.447158031,3.071882007,0.375276024,Average,100,0,0,0,0,0,0,0,0,41351,"Chevron Appalachia, LLC",Burchinati Units 45,0,0,0,0,liquid,0,0,62800,0.1,147,1520,22100,5,204,83.9,1860,5,71300,0.1,4600,50,54.3,2100,0,9390,23500,5.6,296000,245,5200,2900,2780,1210,0,0,No method specified,2011,7,25,0,0,0,0,0,0,PW,0,0,0,0,0,39.830091,-80.007761,0,0,0,0,0,0,0,0,0,0,0,0,0,2.297520661,4.797959644,2.167317335,3.181843588,4.344392274,2.309630167,1.923761961,3.269512944,4.85308953,3.662757832,1.698970004,1.73479983,3.322219295,0,3.972665592,4.371067862,0.748188027,5.471291711,2.389166084,3.716003344,3.462397998,3.444044796,3.08278537,0.361259426,Average,100,0,0,0,0,0,0,0,0,41352,"Chevron Appalachia, LLC",Burchinati Unit 29,0,0,0,0,liquid,0,0,0,2,147,1300,24200,5,143,101,1910,5,79700,2,6290,50,12.4,1760,0,9130,241,5.3,327000,566,14400,11600,2500,1260,0,0,No method specified,2011,7,19,0,0,0,0,0,0,PW,0,0,0,0,0,39.845488,-79.972608,0,0,0,0,0,0,0,0,0,0,0,0,0,1.984126984,0,2.167317335,3.113943352,4.383815366,2.155336037,2.004321374,3.281033367,4.901458321,3.798650645,1.698970004,1.093421685,3.245512668,0,3.960470778,2.382017043,0.72427587,5.514547753,2.752816431,4.158362492,4.064457989,3.397940009,3.100370545,0.297569464,Average,100,0,0,0,0,0,0,0,0,41353,"Chevron Appalachia, LLC",Kirchner Units 4H,0,0,0,0,liquid,0,0,40300,0.1,15.3,4870,13800,5,250,93,1430,7.2,40200,2,2630,50,60.9,1220,0,4620,180000,5.5,174000,133,3600,1200,1810,794,0,0,No method specified,2011,7,21,0,0,0,0,0,0,PW,0,0,0,0,0,39.848441,-79.878608,0,0,0,0,0,0,0,0,0,0,0,0,0,2.279596977,4.605305046,1.184691431,3.687528961,4.139879086,2.397940009,1.968482949,3.155336037,4.604226053,3.419955748,1.698970004,1.784617293,3.086359831,0,3.664641976,5.255272505,0.740362689,5.240549248,2.123851641,3.556302501,3.079181246,3.257678575,2.899820502,0.357858072,Average,100,0,0,0,0,0,0,0,0,41354,"Chevron Appalachia, LLC",Kirchner Units 2H,0,0,0,0,liquid,0,0,38600,0.1,50,6130,13200,5,189,91.8,1380,6.25,36300,2,2820,50,52.8,1230,0,3880,145000,5.7,165000,80.6,6400,2400,3370,950,0,0,No method specified,2011,7,21,0,0,0,0,0,0,PW,0,0,0,0,0,39.848469,-79.87853,0,0,0,0,0,0,0,0,0,0,0,0,0,3.547368421,4.586587305,1.698970004,3.787460475,4.120573931,2.276461804,1.962842681,3.139879086,4.559906625,3.450249108,1.698970004,1.722633923,3.089905111,0,3.588831726,5.161368002,0.755874856,5.217483944,1.906335042,3.806179974,3.380211242,3.527629901,2.977723605,0.549906296,Average,100,0,0,0,0,0,0,0,0,41355,"Chevron Appalachia, LLC",Headlee Unit 9H,0,0,0,0,liquid,0,0,18800,2000,50,1490,7510,5,254,56.7,1000,5.9,21800,0.1,1600,50,21.3,532,0,2090,106000,5.5,104000,48.4,10800,200,5990,590,0,0,No method specified,2011,7,21,0,0,0,0,0,0,PW,0,0,0,0,0,39.867688,-79.962822,0,0,0,0,0,0,0,0,0,0,0,0,0,10.15254237,4.274157849,1.698970004,3.173186268,3.875639937,2.404833717,1.753583059,3,4.338456494,3.204119983,1.698970004,1.328379603,2.725911632,0,3.320146286,5.025305865,0.740362689,5.017033339,1.684845362,4.033423755,2.301029996,3.777426822,2.770852012,1.006574811,Average,100,0,0,0,0,0,0,0,0,41356,"Chevron Appalachia, LLC",Yareck Units 1H-A,0,0,0,0,liquid,0,0,18100,0.1,38.2,1440,6120,5,219,65.4,684,5,24000,2,1660,50,15.3,688,0,5020,123000,6.7,100000,238,7500,1440,5000,600,0,0,No method specified,2011,7,22,0,0,0,0,0,0,PW,0,0,0,0,0,39.908488,-80.035386,0,0,0,0,0,0,0,0,0,0,0,0,0,8.333333333,4.257678575,1.582063363,3.158362492,3.786751422,2.340444115,1.815577748,2.835056102,4.380211242,3.220108088,1.698970004,1.184691431,2.837588438,0,3.700703717,5.089905111,0.826074803,5,2.376576957,3.875061263,3.158362492,3.698970004,2.77815125,0.920818754,Average,100,0,0,0,0,0,0,0,0,41357,"Chevron Appalachia, LLC",Yareck Units 3H,0,0,0,0,liquid,0,0,15200,0.1,50,1660,6100,5,289,60.9,1000,5,23100,2,1570,50,296,690,0,5090,138000,6.6,123000,82.8,9700,1140,7350,570,0,0,No method specified,2011,7,22,0,0,0,0,0,0,PW,0,0,0,0,0,39.908558,-80.035344,0,0,0,0,0,0,0,0,0,0,0,0,0,12.89473684,4.181843588,1.698970004,3.220108088,3.785329835,2.460897843,1.784617293,3,4.36361198,3.195899652,1.698970004,2.471291711,2.838849091,0,3.706717782,5.139879086,0.819543936,5.089905111,1.918030337,3.986771734,3.056904851,3.866287339,2.755874856,1.110412483,Average,100,0,0,0,0,0,0,0,0,41358,"Chevron Appalachia, LLC",Buday Unit 8H,0,0,0,0,liquid,0,0,37900,2,55.1,2280,13100,5,138,82.7,1240,5.99,41400,2,2680,50,112,1190,0,4750,186000,6.3,176000,120,7500,3000,5510,900,0,0,No method specified,2011,7,25,0,0,0,0,0,0,PW,0,0,0,0,0,39.91115,-79.990138,0,0,0,0,0,0,0,0,0,0,0,0,0,6.122222222,4.57863921,1.741151599,3.357934847,4.117271296,2.139879086,1.91750551,3.093421685,4.617000341,3.428134794,1.698970004,2.049218023,3.075546961,0,3.67669361,5.269512944,0.799340549,5.245512668,2.079181246,3.875061263,3.477121255,3.741151599,2.954242509,0.786909089,Average,100,0,0,0,0,0,0,0,0,41359,"Chevron Appalachia, LLC",Buday Unit 11H,0,0,0,0,liquid,0,0,35800,2,50,2260,12300,5,200,82.3,1230,6.06,37700,0.1,2330,50,196,1050,0,3050,173000,6.3,168000,26.4,4900,2400,3470,713,0,0,No method specified,2011,7,25,0,0,0,0,0,0,PW,0,0,0,0,0,39.911175,-79.990169,0,0,0,0,0,0,0,0,0,0,0,0,0,4.866760168,4.553883027,1.698970004,3.354108439,4.089905111,2.301029996,1.915399835,3.089905111,4.57634135,3.367355921,1.698970004,2.292256071,3.021189299,0,3.484299839,5.238046103,0.799340549,5.225309282,1.421603927,3.69019608,3.380211242,3.540329475,2.85308953,0.687239945,Average,100,0,0,0,0,0,0,0,0,41360,"Chevron Appalachia, LLC",Skovran Units 33H,0,0,0,0,liquid,0,0,22300,0.1,50,4460,8940,5,187,70.9,1000,5.38,28200,2,1880,50,10,638,0,2690,154000,4.8,131000,166,10200,1760,8090,820,0,0,No method specified,2011,7,26,0,0,0,0,0,0,PW,0,0,0,0,0,39.935213,-79.853547,0,0,0,0,0,0,0,0,0,0,0,0,0,9.865853659,4.348304863,1.698970004,3.649334859,3.951337519,2.271841607,1.850646235,3,4.450249108,3.274157849,1.698970004,1,2.804820679,0,3.42975228,5.187520721,0.681241237,5.117271296,2.220108088,4.008600172,3.245512668,3.907948522,2.913813852,0.994134669,Average,100,0,0,0,0,0,0,0,0,41361,"Chevron Appalachia, LLC",Skovran Units 32H,0,0,0,0,liquid,0,0,32600,0.1,50,5020,11100,5,344,89.3,1160,5.75,34000,2,2390,50,179,845,0,5170,166000,6.5,148000,736,0,0,0,0,0,0,No method specified,2011,7,26,0,0,0,0,0,0,PW,0,0,0,0,0,39.935247,-79.853619,0,0,0,0,0,0,0,0,0,0,0,0,0,0,4.5132176,1.698970004,3.700703717,4.045322979,2.536558443,1.950851459,3.064457989,4.531478917,3.378397901,1.698970004,2.252853031,2.926856709,0,3.713490543,5.220108088,0.812913357,5.170261715,2.866877814,0,0,0,0,0,Average,100,0,0,0,0,0,0,0,0,41362,"Chevron Appalachia, LLC",Jarek Unit 7,0,0,0,0,liquid,0,0,58100,2,155,1630,20500,5,163,85.7,1690,5,63200,0.1,5880,50,44,2250,0,6380,238000,5.8,309000,283,4700,4800,2460,1250,0,0,No method specified,2011,7,21,0,0,0,0,0,0,PW,0,0,0,0,0,39.938226,-79.949501,0,0,0,0,0,0,0,0,0,0,0,0,0,1.968,4.764176132,2.190331698,3.212187604,4.311753861,2.212187604,1.932980822,3.227886705,4.800717078,3.769377326,1.698970004,1.643452676,3.352182518,0,3.804820679,5.376576957,0.763427994,5.489958479,2.451786436,3.672097858,3.681241237,3.390935107,3.096910013,0.294025094,Average,104,0,0,0,0,0,0,0,0,41363,"Chevron Appalachia, LLC",Consol USX Unit 13,0,0,0,0,liquid,0,0,38800,2,11.8,3440,13300,5,108,81.9,1380,7.42,34600,2,2160,50,10,1050,0,8840,184000,4.5,170000,70,2800,1500,1980,920,0,0,No method specified,2011,7,22,0,0,0,0,0,0,PW,0,0,0,0,0,39.942481,-79.982558,0,0,0,0,0,0,0,0,0,0,0,0,0,2.152173913,4.588831726,1.071882007,3.536558443,4.123851641,2.033423755,1.913283902,3.139879086,4.539076099,3.334453751,1.698970004,1,3.021189299,0,3.946452265,5.264817823,0.653212514,5.230448921,1.84509804,3.447158031,3.176091259,3.29666519,2.963787827,0.332877363,Average,100,0,0,0,0,0,0,0,0,41364,"Chevron Appalachia, LLC",Consul/USX 53,0,0,0,0,liquid,0,0,6930,2,5,574,2380,5,84.3,16,243,5,6380,0.1,451,50,20.6,172,0,1810,41.5,5.3,31100,15.7,1510,380,1420,224,0,0,No method specified,2011,7,22,0,0,0,0,0,0,PW,0,0,0,0,0,39.944498,-79.971943,0,0,0,0,0,0,0,0,0,0,0,0,0,6.339285714,3.840733235,0.698970004,2.758911892,3.376576957,1.925827575,1.204119983,2.385606274,3.804820679,2.654176542,1.698970004,1.31386722,2.235528447,0,3.257678575,1.618048097,0.72427587,4.492760389,1.195899652,3.178976947,2.579783597,3.152288344,2.350248018,0.802040326,Average,50,0,0,0,0,0,0,0,0,41365,"Chevron Appalachia, LLC",Faverio Unit 5H,0,0,0,0,liquid,0,0,27600,0.1,50,4610,9400,5,285,76.9,1000,5,31300,0.1,1970,50,126,776,0,4160,150000,6,118000,3270,13600,1940,7780,780,0,0,No method specified,2011,7,26,0,0,0,0,0,0,PW,0,0,0,0,0,39.948283,-79.830655,0,0,0,0,0,0,0,0,0,0,0,0,0,9.974358974,4.440909082,1.698970004,3.663700925,3.973127854,2.45484486,1.88592634,3,4.495544338,3.294466226,1.698970004,2.100370545,2.889861721,0,3.619093331,5.176091259,0.77815125,5.071882007,3.514547753,4.133538908,3.28780173,3.890979597,2.892094603,0.998884994,Average,100,0,0,0,0,0,0,0,0,41366,"Chevron Appalachia, LLC",Faverio Unit 6H,0,0,0,0,liquid,0,0,42000,0.1,76.5,2900,14700,5,227,89.7,1270,5,46500,2,3520,50,62.1,1070,0,6180,214000,5.9,203000,121,8100,1200,4680,1000,0,0,No method specified,2011,7,26,0,0,0,0,0,0,PW,0,0,0,0,0,39.948347,-79.830655,0,0,0,0,0,0,0,0,0,0,0,0,0,4.68,4.62324929,1.883661435,3.462397998,4.167317335,2.356025857,1.952792443,3.103803721,4.667452953,3.546542663,1.698970004,1.7930916,3.029383778,0,3.790988475,5.330413773,0.770852012,5.307496038,2.08278537,3.908485019,3.079181246,3.670245853,3,0.670245853,Average,100,0,0,0,0,0,0,0,0,41367,"Chevron Appalachia, LLC",National Mines Corp 26H,0,0,0,0,liquid,0,0,28400,2,50,3610,9720,5,182,75.1,1010,5.94,29700,0.1,1890,50,75.4,909,0,3650,174000,6.2,159000,299,10700,2700,4130,830,0,0,No method specified,2011,7,27,0,0,0,0,0,0,PW,0,0,0,0,0,39.954019,-79.942361,0,0,0,0,0,0,0,0,0,0,0,0,0,4.975903614,4.45331834,1.698970004,3.557507202,3.987666265,2.260071388,1.875639937,3.004321374,4.472756449,3.276461804,1.698970004,1.877371346,2.958563883,0,3.562292864,5.240549248,0.792391689,5.201397124,2.475671188,4.029383778,3.431363764,3.615950052,2.919078092,0.696871959,Average,100,0,0,0,0,0,0,0,0,41368,"Chevron Appalachia, LLC",Cardine Unit 7H,0,0,0,0,liquid,0,0,18900,2,50,4640,7590,5,180,60.1,1000,5,23700,2,1530,50,136,797,0,2870,142,6.3,129000,212,7800,310,6830,770,0,0,No method specified,2011,7,20,0,0,0,0,0,0,PW,0,0,0,0,0,39.958559,-79.840367,0,0,0,0,0,0,0,0,0,0,0,0,0,8.87012987,4.276461804,1.698970004,3.666517981,3.880241776,2.255272505,1.778874472,3,4.374748346,3.184691431,1.698970004,2.133538908,2.901458321,0,3.457881897,2.152288344,0.799340549,5.11058971,2.326335861,3.892094603,2.491361694,3.834420704,2.886490725,0.947929979,Average,100,0,0,0,0,0,0,0,0,41369,"Chevron Appalachia, LLC",Cardine Unit 5H,0,0,0,0,liquid,0,0,21300,2,50,3890,8540,5,203,63.5,1000,5.04,25000,0.1,1900,50,105,916,0,4670,145000,6.3,129000,114,13500,1000,7660,810,0,0,No method specified,2011,7,20,0,0,0,0,0,0,PW,0,0,0,0,0,39.958625,-79.84037,0,0,0,0,0,0,0,0,0,0,0,0,0,9.456790123,4.328379603,1.698970004,3.589949601,3.931457871,2.307496038,1.802773725,3,4.397940009,3.278753601,1.698970004,2.021189299,2.961895474,0,3.669316881,5.161368002,0.799340549,5.11058971,2.056904851,4.130333768,3,3.88422877,2.908485019,0.975743751,Average,100,0,0,0,0,0,0,0,0,41370,"Chevron Appalachia, LLC",Jackson Farms Unit 37H,0,0,0,0,liquid,0,0,15400,2,50,2650,6150,5,382,50.9,1000,5.06,20300,1.96,1260,50,99.3,2520,0,62600,141,5.7,133000,86,9000,1020,3780,591,0,0,No method specified,2011,7,25,0,0,0,0,0,0,PW,0,0,0,0,0,39.969077,-79.838688,0,0,0,0,0,0,0,0,0,0,0,0,0,6.395939086,4.187520721,1.698970004,3.423245874,3.788875116,2.582063363,1.706717782,3,4.307496038,3.100370545,1.698970004,1.996949248,3.401400541,0,4.796574333,2.149219113,0.755874856,5.123851641,1.934498451,3.954242509,3.008600172,3.5774918,2.771587481,0.805904319,Average,5.6,0,0,0,0,0,0,0,0,41371,"Chevron Appalachia, LLC",Jackson Farms Unit 38H,0,0,0,0,liquid,0,0,22400,2,50,2380,8960,5,318,70.2,1000,5.6,33000,0.1,1830,50,230,633,0,21000,126,6.3,118000,474,6900,730,7540,740,0,0,No method specified,2011,7,25,0,0,0,0,0,0,PW,0,0,0,0,0,39.96908,-79.83863,0,0,0,0,0,0,0,0,0,0,0,0,0,10.18918919,4.350248018,1.698970004,3.376576957,3.95230801,2.50242712,1.846337112,3,4.51851394,3.26245109,1.698970004,2.361727836,2.80140371,0,4.322219295,2.100370545,0.799340549,5.071882007,2.675778342,3.838849091,2.86332286,3.877371346,2.86923172,1.008139626,Average,100,0,0,0,0,0,0,0,0,41372,"Chevron Appalachia, LLC",Addleman Unit 1,0,0,0,0,liquid,0,0,39300,2,50,2420,13600,5,256,98.8,1300,5.99,40400,2,2840,50,43.2,935,0,3190,170000,6,155000,349,9700,2700,6020,810,0,0,No method specified,2011,8,1,0,0,0,0,0,0,PW,0,0,0,0,0,40.008075,-80.074436,0,0,0,0,0,0,0,0,0,0,0,0,0,7.432098765,4.59439255,1.698970004,3.383815366,4.133538908,2.408239965,1.994756945,3.113943352,4.606381365,3.45331834,1.698970004,1.635483747,2.970811611,0,3.503790683,5.230448921,0.77815125,5.190331698,2.542825427,3.986771734,3.431363764,3.779596491,2.908485019,0.871111472,Average,100,0,0,0,0,0,0,0,0,41373,"Chevron Appalachia, LLC",Addleman Unit 1,0,0,0,0,liquid,0,0,0,0,0,0,0,0,0,0,0,0,0,0,0,0,0,935,0,0,0,6,0,0,0,0,0,0,0,0,No method specified,2011,8,2,0,0,0,0,0,0,PW,0,0,0,0,0,40.008075,-80.074436,0,0,0,0,0,0,0,0,0,0,0,0,0,0,0,0,0,0,0,0,0,0,0,0,0,2.970811611,0,0,0,0.77815125,0,0,0,0,0,0,0,Average,100,0,0,0,0,0,0,0,0,41374,"Chevron Appalachia, LLC",Addleman Unit 1,0,0,0,0,liquid,0,0,0,0,0,0,0,0,0,0,0,0,0,0,0,0,0,0,0,0,0,0,0,349,0,0,0,0,0,0,No method specified,2011,8,3,0,0,0,0,0,0,PW,0,0,0,0,0,40.008075,-80.074436,0,0,0,0,0,0,0,0,0,0,0,0,0,0,0,0,0,0,0,0,0,0,0,0,0,0,0,0,0,0,0,2.542825427,0,0,0,0,0,Average,0,0,0,0,0,0,0,0,0,41375,"Chevron Appalachia, LLC",Addleman Unit 1,0,0,0,0,liquid,0,0,0,0,0,0,0,0,0,0,0,0,0,0,0,0,0,0,0,3190,0,0,155000,0,0,0,0,0,0,0,No method specified,2011,8,6,0,0,0,0,0,0,PW,0,0,0,0,0,40.008075,-80.074436,0,0,0,0,0,0,0,0,0,0,0,0,0,0,0,0,0,0,0,0,0,0,0,0,0,0,0,3.503790683,0,0,5.190331698,0,0,0,0,0,0,Average,0,0,0,0,0,0,0,0,0,41376,"Chevron Appalachia, LLC",Addleman Unit 1,0,0,0,0,liquid,0,0,0,0.1,0,1840,0,0,0,0,0,0,0,0.1,0,0,0,0,0,0,0,0,0,0,0,0,0,0,0,0,No method specified,2011,8,7,0,0,0,0,0,0,PW,0,0,0,0,0,40.008075,-80.074436,0,0,0,0,0,0,0,0,0,0,0,0,0,0,0,0,3.264817823,0,0,0,0,0,0,0,0,0,0,0,0,0,0,0,0,0,0,0,0,Average,0,0,0,0,0,0,0,0,0,41377,"Chevron Appalachia, LLC",Addleman Unit 1,0,0,0,0,liquid,0,0,39300,0,50,0,13600,0,118,98.8,1300,0,40400,0,2840,0,0,0,0,0,0,0,0,0,0,0,0,0,0,0,No method specified,2011,8,8,0,0,0,0,0,0,PW,0,0,0,0,0,40.008075,-80.074436,0,0,0,0,0,0,0,0,0,0,0,0,0,0,4.59439255,1.698970004,0,4.133538908,2.071882007,1.994756945,3.113943352,4.606381365,3.45331834,0,0,0,0,0,0,0,0,0,0,0,0,0,0,Average,0,0,0,0,0,0,0,0,0,41378,"Chevron Appalachia, LLC",Addleman Unit 1,0,0,0,0,liquid,0,0,0,0,0,0,0,0,0,0,0,0,0,0,0,0,0,0,0,0,170000,0,0,0,0,0,0,0,0,0,No method specified,2011,8,11,0,0,0,0,0,0,PW,0,0,0,0,0,40.008075,-80.074436,0,0,0,0,0,0,0,0,0,0,0,0,0,0,0,0,0,0,0,0,0,0,0,0,0,0,0,0,5.230448921,0,0,0,0,0,0,0,0,Average,0,0,0,0,0,0,0,0,0,41379,"Chevron Appalachia, LLC",Addleman Unit 1,0,0,0,0,liquid,0,0,0,2,0,2420,0,5,256,0,0,5.99,0,2,0,50,0,0,0,0,0,0,0,0,0,0,0,0,0,0,No method specified,2011,8,15,0,0,0,0,0,0,PW,0,0,0,0,0,40.008075,-80.074436,0,0,0,0,0,0,0,0,0,0,0,0,0,0,0,0,3.383815366,0,2.408239965,0,0,0,0,1.698970004,0,0,0,0,0,0,0,0,0,0,0,0,0,Average,0,0,0,0,0,0,0,0,0,41380,"Chevron Appalachia, LLC",Yanosky Unit 5,0,0,0,0,liquid,0,0,15500,0.1,50,1570,6220,5,116,50,1000,5,17300,2,1320,50,38.1,551,0,1950,107000,6.1,79000,42.7,0,0,0,0,0,0,No method specified,2011,7,27,0,0,0,0,0,0,PW,0,0,0,0,0,40.010322,-80.018461,0,0,0,0,0,0,0,0,0,0,0,0,0,0,4.190331698,1.698970004,3.195899652,3.793790385,2.064457989,1.698970004,3,4.238046103,3.120573931,1.698970004,1.580924976,2.741151599,0,3.290034611,5.029383778,0.785329835,4.897627091,1.630427875,0,0,0,0,0,Average,100,0,0,0,0,0,0,0,0,41381,"Chevron Appalachia, LLC",Eckerd Units 4H,0,0,0,0,liquid,0,0,22300,2,50,2110,8920,5,203,66.7,1000,7.28,25400,2,1910,50,105,749,0,3010,151000,6.1,126000,143,9400,1000,6520,770,0,0,No method specified,2011,7,27,0,0,0,0,0,0,PW,0,0,0,0,0,40.038083,-80.05098,0,0,0,0,0,0,0,0,0,0,0,0,0,8.467532468,4.348304863,1.698970004,3.324282455,3.950364854,2.307496038,1.824125834,3,4.404833717,3.281033367,1.698970004,2.021189299,2.874481818,0,3.478566496,5.178976947,0.785329835,5.100370545,2.155336037,3.973127854,3,3.814247596,2.886490725,0.927756871,Average,100,0,0,0,0,0,0,0,0,41382,"Chevron Appalachia, LLC",Pritts Unit 3H,0,0,0,0,liquid,0,0,62700,2,55.4,1420,22500,5,121,222,1560,9.91,69000,0.1,2880,50,10,0,0,15400,251000,4.8,320000,212,21000,2200,10700,2430,0,0,No method specified,2011,7,29,0,0,0,0,0,0,PW,0,0,0,0,0,40.073016,-79.633347,0,0,0,0,0,0,0,0,0,0,0,0,0,4.403292181,4.797267541,1.743509765,3.152288344,4.352182518,2.08278537,2.346352974,3.193124598,4.838849091,3.459392488,1.698970004,1,0,0,4.187520721,5.399673721,0.681241237,5.505149978,2.326335861,4.322219295,3.342422681,4.029383778,3.385606274,0.643777504,Average,100,0,0,0,0,0,0,0,0,41383,"Chevron Appalachia, LLC",Fayette Beagle Club Units 5H,0,0,0,0,liquid,0,0,51600,0.1,109,2560,18300,5,238,97.3,1440,5,57800,0.1,4950,50,25.4,1440,0,14500,250000,5.8,261000,285,6100,5900,2560,1240,0,0,No method specified,2011,7,28,0,0,0,0,0,0,PW,0,0,0,0,0,40.102836,-79.793444,0,0,0,0,0,0,0,0,0,0,0,0,0,2.064516129,4.712649702,2.037426498,3.408239965,4.26245109,2.376576957,1.98811284,3.158362492,4.761927838,3.694605199,1.698970004,1.404833717,3.158362492,0,4.161368002,5.397940009,0.763427994,5.416640507,2.45484486,3.785329835,3.770852012,3.408239965,3.093421685,0.31481828,Average,100,0,0,0,0,0,0,0,0,41384,"Chevron Appalachia, LLC",Wicks Compressor,0,0,0,0,liquid,0,0,27900,0.1,53.1,1420,9530,0.5,577,64,994,17.2,32900,0.1,2210,5,143,1000,0,72100,149000,5.4,126000,588,10800,2580,3130,640,0,0,No method specified,2011,12,21,0,0,0,0,0,0,PW,0,0,0,0,0,40.175,-80.2506,0,0,0,0,0,0,0,0,0,0,0,0,0,4.890625,4.445604203,1.725094521,3.152288344,3.979092901,2.761175813,1.806179974,2.997386384,4.517195898,3.344392274,0.698970004,2.155336037,3,0,4.857935265,5.173186268,0.73239376,5.100370545,2.769377326,4.033423755,3.411619706,3.495544338,2.806179974,0.689364364,Average,5.54,0,0,0,0,0,0,0,0,41385,"Chevron Appalachia, LLC",Elias 11H,0,0,0,0,liquid,0,0,20100,2,50,3330,8060,5,164,72.7,1000,5.31,27800,2,1840,50,95,900,0,10500,167000,6.2,128000,62.7,22600,3300,13100,880,0,0,No method specified,2011,7,28,0,0,0,0,0,0,PW,0,0,0,0,0,40.187166,-79.718,0,0,0,0,0,0,0,0,0,0,0,0,0,14.88636364,4.303196057,1.698970004,3.522444234,3.906335042,2.214843848,1.861534411,3,4.444044796,3.264817823,1.698970004,1.977723605,2.954242509,0,4.021189299,5.222716471,0.792391689,5.10720997,1.797267541,4.354108439,3.51851394,4.117271296,2.944482672,1.172788624,Average,100,0,0,0,0,0,0,0,0,41386,"Chevron Appalachia, LLC",Elias 12H,0,0,0,0,liquid,0,0,18600,2,50,2750,7430,5,320,68.8,1000,5.9,24500,2,1520,50,143,884,0,7380,165000,6.2,122000,198,19900,3400,11100,700,0,0,No method specified,2011,7,28,0,0,0,0,0,0,PW,0,0,0,0,0,40.187194,-79.718,0,0,0,0,0,0,0,0,0,0,0,0,0,15.85714286,4.269512944,1.698970004,3.439332694,3.870988814,2.505149978,1.837588438,3,4.389166084,3.181843588,1.698970004,2.155336037,2.946452265,0,3.868056362,5.217483944,0.792391689,5.086359831,2.29666519,4.298853076,3.531478917,4.045322979,2.84509804,1.200224939,Average,100,0,0,0,0,0,0,0,0,41387,"Chevron Appalachia, LLC",Kisner Unit 6,0,0,0,0,liquid,0,0,77200,2,122,2130,27600,5,199,140,2000,5,65800,0.1,9450,50,12.6,2110,0,13600,22600,5.6,284000,306,6000,3300,2390,1400,0,0,No method specified,2011,7,21,0,0,0,0,0,0,PW,0,0,0,0,0,40.196633,-79.714062,0,0,0,0,0,0,0,0,0,0,0,0,0,1.707142857,4.8876173,2.086359831,3.328379603,4.440909082,2.298853076,2.146128036,3.301029996,4.818225894,3.975431809,1.698970004,1.100370545,3.324282455,0,4.133538908,4.354108439,0.748188027,5.45331834,2.485721426,3.77815125,3.51851394,3.378397901,3.146128036,0.232269865,Average,100,0,0,0,0,0,0,0,0,41388,"Chevron Appalachia, LLC",Shoaf 7,0,0,0,0,liquid,0,0,66600,0.1,144,2490,23700,5,206,124,1800,5.63,65000,0.1,6060,50,10,1610,0,15700,244000,5.1,329000,268,4100,4000,2760,1380,0,0,No method specified,2011,7,29,0,0,0,0,0,0,PW,0,0,0,0,0,40.235105,-79.744313,0,0,0,0,0,0,0,0,0,0,0,0,0,2,4.823474229,2.158362492,3.396199347,4.374748346,2.31386722,2.093421685,3.255272505,4.812913357,3.782472624,1.698970004,1,3.206825876,0,4.195899652,5.387389826,0.707570176,5.517195898,2.428134794,3.612783857,3.602059991,3.440909082,3.139879086,0.301029996,Average,100,0,0,0,0,0,0,0,0,41389,"Chevron Appalachia, LLC",Lash Unit 16,0,0,0,0,liquid,0,0,70200,0.1,161,2360,25000,5,184,132,1890,5,63900,0.1,6120,50,10,1640,0,10200,24600,4.7,347000,202,8900,3700,2320,1380,0,0,No method specified,2011,7,29,0,0,0,0,0,0,PW,0,0,0,0,0,40.31,-79.47,0,0,0,0,0,0,0,0,0,0,0,0,0,1.68115942,4.846337112,2.206825876,3.372912003,4.397940009,2.264817823,2.120573931,3.276461804,4.805500858,3.786751422,1.698970004,1,3.214843848,0,4.008600172,4.390935107,0.672097858,5.540329475,2.305351369,3.949390007,3.568201724,3.365487985,3.139879086,0.225608898,Average,100,0,0,0,0,0,0,0,0,41390,"Great Oak Enerqy, lnc.",EXPORT FUEL 1,0,0,0,0,liquid,0,0,42086,1,6.8,3777.5,14302.7,0.5,106.4,0,1547.3,0.0087,52322,1,2347,0.5,0,1660,0,2025,159192,5.21,200800,500,6060,2452,134.6,210.9,0,0,No method specified,2010,5,27,0,0,0,0,0,0,PW,0,0,0,0,0,40.435439,-79.584499,0,0,0,0,0,0,0,0,0,0,0,0,0,0.638217165,4.624137651,0.832508913,3.577204473,4.155418029,2.026941628,0,3.189574526,4.718684336,3.37051309,-0.301029996,0,3.220108088,0,3.306425028,5.201921239,0.716837723,5.302763708,2.698970004,3.782472624,3.389520466,2.12904506,2.32407658,-0.19503152,Average,5,0,0,0,0,0,0,0,0,41391,"McCutcheon Enterprises, lnc.",BLX,0,0,0,0,liquid,0,0,0,0,0,0,0,0,0,0,0,0,0,0,0,0,0,0,0,0,0,0,0,0,0,0,0,0,0,0,No method specified,2012,3,29,0,0,0,0,0,0,PW,0,0,0,0,0,40.32921,-79.641982,0,0,0,0,0,0,0,0,0,0,0,0,0,0,0,0,0,0,0,0,0,0,0,0,0,0,0,0,0,0,0,0,0,0,0,0,0,Average,0,0,0,0,0,0,0,0,0,41392,Mieka LLC,Schimizzi,0,0,0,0,liquid,0,0,36400,0.003,6.39,3070,12300,3.84,263,0,1390,10.3,39400,0.005,1720,0.553,25,1074,0,884,296000,5.44,192780,112,5969,5347,41.25,177.6,0,0,No method specified,2012,2,21,0,0,0,0,0,0,PW,0,0,0,0,0,40.327894,-79.488102,0,0,0,0,0,0,0,0,0,0,0,0,0,0.232263514,4.561101384,0.805500858,3.487138375,4.089905111,2.419955748,0,3.1430148,4.595496222,3.235528447,-0.257274869,1.397940009,3.031004281,0,2.946452265,5.471291711,0.7355989,5.285061976,2.049218023,3.775901579,3.728110184,1.615423953,2.249442961,-0.634019009,Average,25,0,0,0,0,0,0,0,0,41393,NYSDEC (1999),83,0,0,0,0,liquid,0,0,0,0,0,0,0,0,0,0,0,0,0,0,0,0,0,0,0,0,0,0,0,0,0,0,1620,1790,0,0,_-spectrometry,1996,12,15,0,0,0,0,0,0,PW,0,0,0,0,0,42,-76.31,0,0,0,0,0,0,0,0,0,0,0,0,0,0.905027933,0,0,0,0,0,0,0,0,0,0,0,0,0,0,0,0,0,0,0,0,3.209515015,3.252853031,-0.043338016,Sporadic,0,0,0,0,0,0,0,0,0,41394,NYSDEC (1999),81,0,0,0,0,liquid,0,0,0,0,0,0,0,0,0,0,0,0,0,0,0,0,0,0,0,0,0,0,0,0,0,0,901,250,0,0,_-spectrometry,1996,10,30,0,0,0,0,0,0,PW,0,0,0,0,0,42.01,-77.95,0,0,0,0,0,0,0,0,0,0,0,0,0,3.604,0,0,0,0,0,0,0,0,0,0,0,0,0,0,0,0,0,0,0,0,2.954724791,2.397940009,0.556784782,Sporadic,0,0,0,0,0,0,0,0,0,41395,NYSDEC (1999),82,0,0,0,0,liquid,0,0,0,0,0,0,0,0,0,0,0,0,0,0,0,0,0,0,0,0,0,0,0,0,0,0,3760,1110,0,0,_-spectrometry,1996,12,15,0,0,0,0,0,0,PW,0,0,0,0,0,42.03,-76.26,0,0,0,0,0,0,0,0,0,0,0,0,0,3.387387387,0,0,0,0,0,0,0,0,0,0,0,0,0,0,0,0,0,0,0,0,3.575187845,3.045322979,0.529864866,Sporadic,0,0,0,0,0,0,0,0,0,41396,NYSDEC (1999),78,0,0,0,0,liquid,0,0,0,0,0,0,0,0,0,0,0,0,0,0,0,0,0,0,0,0,0,0,0,0,0,0,156,504,0,0,_-spectrometry,1996,10,30,0,0,0,0,0,0,PW,0,0,0,0,0,42.07,-79.27,0,0,0,0,0,0,0,0,0,0,0,0,0,0.30952381,0,0,0,0,0,0,0,0,0,0,0,0,0,0,0,0,0,0,0,0,2.193124598,2.702430536,-0.509305938,Sporadic,0,0,0,0,0,0,0,0,0,41397,NYSDEC (1999),66,0,0,0,0,liquid,0,0,0,0,0,0,0,0,0,0,0,0,0,0,0,0,0,0,0,0,0,0,0,0,0,0,1550,319,0,0,_-spectrometry,1996,10,30,0,0,0,0,0,0,PW,0,0,0,0,0,42.08,-79.54,0,0,0,0,0,0,0,0,0,0,0,0,0,4.858934169,0,0,0,0,0,0,0,0,0,0,0,0,0,0,0,0,0,0,0,0,3.190331698,2.503790683,0.686541015,Sporadic,0,0,0,0,0,0,0,0,0,41398,NYSDEC (1999),67,0,0,0,0,liquid,0,0,0,0,0,0,0,0,0,0,0,0,0,0,0,0,0,0,0,0,0,0,0,0,0,0,366,1660,0,0,_-spectrometry,1996,10,30,0,0,0,0,0,0,PW,0,0,0,0,0,42.09,-79.43,0,0,0,0,0,0,0,0,0,0,0,0,0,0.220481928,0,0,0,0,0,0,0,0,0,0,0,0,0,0,0,0,0,0,0,0,2.563481085,3.220108088,-0.656627003,Sporadic,0,0,0,0,0,0,0,0,0,41399,NYSDEC (1999),68,0,0,0,0,liquid,0,0,0,0,0,0,0,0,0,0,0,0,0,0,0,0,0,0,0,0,0,0,0,0,0,0,654,1440,0,0,_-spectrometry,1996,10,30,0,0,0,0,0,0,PW,0,0,0,0,0,42.13,-79.47,0,0,0,0,0,0,0,0,0,0,0,0,0,0.454166667,0,0,0,0,0,0,0,0,0,0,0,0,0,0,0,0,0,0,0,0,2.815577748,3.158362492,-0.342784744,Sporadic,0,0,0,0,0,0,0,0,0,41400,NYSDEC (1999),65,0,0,0,0,liquid,0,0,0,0,0,0,0,0,0,0,0,0,0,0,0,0,0,0,0,0,0,0,0,0,0,0,484,387,0,0,_-spectrometry,1996,10,30,0,0,0,0,0,0,PW,0,0,0,0,0,42.16,-79.58,0,0,0,0,0,0,0,0,0,0,0,0,0,1.250645995,0,0,0,0,0,0,0,0,0,0,0,0,0,0,0,0,0,0,0,0,2.684845362,2.587710965,0.097134397,Sporadic,0,0,0,0,0,0,0,0,0,41401,NYSDEC (1999),75,0,0,0,0,liquid,0,0,0,0,0,0,0,0,0,0,0,0,0,0,0,0,0,0,0,0,0,0,0,0,0,0,585,0,0,0,_-spectrometry,1996,10,30,0,0,0,0,0,0,PW,0,0,0,0,0,42.17,-79.36,0,0,0,0,0,0,0,0,0,0,0,0,0,0,0,0,0,0,0,0,0,0,0,0,0,0,0,0,0,0,0,0,0,0,2.767155866,0,0,Sporadic,0,0,0,0,0,0,0,0,0,41402,NYSDEC (1999),76,0,0,0,0,liquid,0,0,0,0,0,0,0,0,0,0,0,0,0,0,0,0,0,0,0,0,0,0,0,0,0,0,951,1500,0,0,_-spectrometry,1996,10,30,0,0,0,0,0,0,PW,0,0,0,0,0,42.22,-79.38,0,0,0,0,0,0,0,0,0,0,0,0,0,0.634,0,0,0,0,0,0,0,0,0,0,0,0,0,0,0,0,0,0,0,0,2.978180517,3.176091259,-0.197910742,Sporadic,0,0,0,0,0,0,0,0,0,41403,NYSDEC (1999),74,0,0,0,0,liquid,0,0,0,0,0,0,0,0,0,0,0,0,0,0,0,0,0,0,0,0,0,0,0,0,0,0,953,444,0,0,_-spectrometry,1996,10,30,0,0,0,0,0,0,PW,0,0,0,0,0,42.23,-79.24,0,0,0,0,0,0,0,0,0,0,0,0,0,2.146396396,0,0,0,0,0,0,0,0,0,0,0,0,0,0,0,0,0,0,0,0,2.979092901,2.64738297,0.331709931,Sporadic,0,0,0,0,0,0,0,0,0,41404,NYSDEC (1999),64,0,0,0,0,liquid,0,0,0,0,0,0,0,0,0,0,0,0,0,0,0,0,0,0,0,0,0,0,0,0,0,0,324,503,0,0,_-spectrometry,1996,10,30,0,0,0,0,0,0,PW,0,0,0,0,0,42.27,-79.72,0,0,0,0,0,0,0,0,0,0,0,0,0,0.644135189,0,0,0,0,0,0,0,0,0,0,0,0,0,0,0,0,0,0,0,0,2.51054501,2.701567985,-0.191022975,Sporadic,0,0,0,0,0,0,0,0,0,41405,NYSDEC (1999),73,0,0,0,0,liquid,0,0,0,0,0,0,0,0,0,0,0,0,0,0,0,0,0,0,0,0,0,0,0,0,0,0,160,574,0,0,_-spectrometry,1996,10,30,0,0,0,0,0,0,PW,0,0,0,0,0,42.31,-79.19,0,0,0,0,0,0,0,0,0,0,0,0,0,0.278745645,0,0,0,0,0,0,0,0,0,0,0,0,0,0,0,0,0,0,0,0,2.204119983,2.758911892,-0.55479191,Sporadic,0,0,0,0,0,0,0,0,0,41406,NYSDEC (1999),63,0,0,0,0,liquid,0,0,0,0,0,0,0,0,0,0,0,0,0,0,0,0,0,0,0,0,0,0,0,0,0,0,148,100,0,0,_-spectrometry,1996,10,30,0,0,0,0,0,0,PW,0,0,0,0,0,42.38,-79.52,0,0,0,0,0,0,0,0,0,0,0,0,0,1.48,0,0,0,0,0,0,0,0,0,0,0,0,0,0,0,0,0,0,0,0,2.170261715,2,0.170261715,Sporadic,0,0,0,0,0,0,0,0,0,41407,NYSDEC (1999),36,0,0,0,0,liquid,0,0,0,0,0,0,0,0,0,0,0,0,0,0,0,0,0,0,0,0,0,0,0,0,0,0,402,1100,0,0,_-spectrometry,1996,8,15,0,0,0,0,0,0,PW,0,0,0,0,0,42.42,-78.66,0,0,0,0,0,0,0,0,0,0,0,0,0,0.365454545,0,0,0,0,0,0,0,0,0,0,0,0,0,0,0,0,0,0,0,0,2.604226053,3.041392685,-0.437166632,Sporadic,0,0,0,0,0,0,0,0,0,41408,NYSDEC (1999),38,0,0,0,0,liquid,0,0,0,0,0,0,0,0,0,0,0,0,0,0,0,0,0,0,0,0,0,0,0,0,0,0,1164,429,0,0,_-spectrometry,1996,8,15,0,0,0,0,0,0,PW,0,0,0,0,0,42.44,-78.68,0,0,0,0,0,0,0,0,0,0,0,0,0,2.713286713,0,0,0,0,0,0,0,0,0,0,0,0,0,0,0,0,0,0,0,0,3.06595298,2.632457292,0.433495688,Sporadic,0,0,0,0,0,0,0,0,0,41409,NYSDEC (1999),41,0,0,0,0,liquid,0,0,0,0,0,0,0,0,0,0,0,0,0,0,0,0,0,0,0,0,0,0,0,0,0,0,259,0,0,0,_-spectrometry,1996,8,15,0,0,0,0,0,0,PW,0,0,0,0,0,42.46,-78.71,0,0,0,0,0,0,0,0,0,0,0,0,0,0,0,0,0,0,0,0,0,0,0,0,0,0,0,0,0,0,0,0,0,0,2.413299764,0,0,Sporadic,0,0,0,0,0,0,0,0,0,41410,NYSDEC (1999),39,0,0,0,0,liquid,0,0,0,0,0,0,0,0,0,0,0,0,0,0,0,0,0,0,0,0,0,0,0,0,0,0,398,234,0,0,_-spectrometry,1996,8,15,0,0,0,0,0,0,PW,0,0,0,0,0,42.47,-78.68,0,0,0,0,0,0,0,0,0,0,0,0,0,1.700854701,0,0,0,0,0,0,0,0,0,0,0,0,0,0,0,0,0,0,0,0,2.599883072,2.369215857,0.230667215,Sporadic,0,0,0,0,0,0,0,0,0,41411,NYSDEC (1999),70,0,0,0,0,liquid,0,0,0,0,0,0,0,0,0,0,0,0,0,0,0,0,0,0,0,0,0,0,0,0,0,0,64.2,83,0,0,_-spectrometry,1996,8,15,0,0,0,0,0,0,PW,0,0,0,0,0,42.54,-78.89,0,0,0,0,0,0,0,0,0,0,0,0,0,0.773493976,0,0,0,0,0,0,0,0,0,0,0,0,0,0,0,0,0,0,0,0,1.807535028,1.919078092,-0.111543064,Sporadic,0,0,0,0,0,0,0,0,0,41412,NYSDEC (1999),79,0,0,0,0,liquid,0,0,0,0,0,0,0,0,0,0,0,0,0,0,0,0,0,0,0,0,0,0,0,0,0,0,111,60,0,0,_-spectrometry,1996,8,15,0,0,0,0,0,0,PW,0,0,0,0,0,42.56,-78.79,0,0,0,0,0,0,0,0,0,0,0,0,0,1.85,0,0,0,0,0,0,0,0,0,0,0,0,0,0,0,0,0,0,0,0,2.045322979,1.77815125,0.267171728,Sporadic,0,0,0,0,0,0,0,0,0,41413,NYSDEC (1999),54,0,0,0,0,liquid,0,0,0,0,0,0,0,0,0,0,0,0,0,0,0,0,0,0,0,0,0,0,0,0,0,0,238,269,0,0,_-spectrometry,1996,8,15,0,0,0,0,0,0,PW,0,0,0,0,0,42.74,-78.36,0,0,0,0,0,0,0,0,0,0,0,0,0,0.884758364,0,0,0,0,0,0,0,0,0,0,0,0,0,0,0,0,0,0,0,0,2.376576957,2.42975228,-0.053175323,Sporadic,0,0,0,0,0,0,0,0,0,41414,NYSDEC (1999),59,0,0,0,0,liquid,0,0,0,0,0,0,0,0,0,0,0,0,0,0,0,0,0,0,0,0,0,0,0,0,0,0,0,0,0,0,_-spectrometry,1996,10,15,0,0,0,0,0,0,PW,0,0,0,0,0,42.78,-76.9,0,0,0,0,0,0,0,0,0,0,0,0,0,0,0,0,0,0,0,0,0,0,0,0,0,0,0,0,0,0,0,0,0,0,0,0,0,Sporadic,0,0,0,0,0,0,0,0,0,41415,NYSDEC (1999),53,0,0,0,0,liquid,0,0,0,0,0,0,0,0,0,0,0,0,0,0,0,0,0,0,0,0,0,0,0,0,0,0,708,350,0,0,_-spectrometry,1996,8,15,0,0,0,0,0,0,PW,0,0,0,0,0,42.81,-78.11,0,0,0,0,0,0,0,0,0,0,0,0,0,2.022857143,0,0,0,0,0,0,0,0,0,0,0,0,0,0,0,0,0,0,0,0,2.850033258,2.544068044,0.305965213,Sporadic,0,0,0,0,0,0,0,0,0,41416,NYSDEC (1999),62,0,0,0,0,liquid,0,0,0,0,0,0,0,0,0,0,0,0,0,0,0,0,0,0,0,0,0,0,0,0,0,0,146,0,0,0,_-spectrometry,1996,10,15,0,0,0,0,0,0,PW,0,0,0,0,0,42.81,-77.54,0,0,0,0,0,0,0,0,0,0,0,0,0,0,0,0,0,0,0,0,0,0,0,0,0,0,0,0,0,0,0,0,0,0,2.164352856,0,0,Sporadic,0,0,0,0,0,0,0,0,0,41417,NYSDEC (1999),50,0,0,0,0,liquid,0,0,0,0,0,0,0,0,0,0,0,0,0,0,0,0,0,0,0,0,0,0,0,0,0,0,477,651,0,0,_-spectrometry,1996,8,15,0,0,0,0,0,0,PW,0,0,0,0,0,42.82,-78.1,0,0,0,0,0,0,0,0,0,0,0,0,0,0.732718894,0,0,0,0,0,0,0,0,0,0,0,0,0,0,0,0,0,0,0,0,2.678518379,2.813580989,-0.13506261,Sporadic,0,0,0,0,0,0,0,0,0,41418,NYSDEC (1999),51,0,0,0,0,liquid,0,0,0,0,0,0,0,0,0,0,0,0,0,0,0,0,0,0,0,0,0,0,0,0,0,0,450,326,0,0,_-spectrometry,1996,8,15,0,0,0,0,0,0,PW,0,0,0,0,0,42.83,-78.1,0,0,0,0,0,0,0,0,0,0,0,0,0,1.380368098,0,0,0,0,0,0,0,0,0,0,0,0,0,0,0,0,0,0,0,0,2.653212514,2.5132176,0.139994914,Sporadic,0,0,0,0,0,0,0,0,0,41419,NYSDEC (1999),58,0,0,0,0,liquid,0,0,0,0,0,0,0,0,0,0,0,0,0,0,0,0,0,0,0,0,0,0,0,0,0,0,557,933,0,0,_-spectrometry,1996,10,15,0,0,0,0,0,0,PW,0,0,0,0,0,42.84,-76.85,0,0,0,0,0,0,0,0,0,0,0,0,0,0.596998928,0,0,0,0,0,0,0,0,0,0,0,0,0,0,0,0,0,0,0,0,2.745855195,2.969881644,-0.224026449,Sporadic,0,0,0,0,0,0,0,0,0,41420,NYSDEC (1999),49,0,0,0,0,liquid,0,0,0,0,0,0,0,0,0,0,0,0,0,0,0,0,0,0,0,0,0,0,0,0,0,0,290,460,0,0,_-spectrometry,1996,8,15,0,0,0,0,0,0,PW,0,0,0,0,0,42.88,-78.3,0,0,0,0,0,0,0,0,0,0,0,0,0,0.630434783,0,0,0,0,0,0,0,0,0,0,0,0,0,0,0,0,0,0,0,0,2.462397998,2.662757832,-0.200359834,Sporadic,0,0,0,0,0,0,0,0,0,41421,NYSDEC (1999),56,0,0,0,0,liquid,0,0,0,0,0,0,0,0,0,0,0,0,0,0,0,0,0,0,0,0,0,0,0,0,0,0,1240,1333,0,0,_-spectrometry,1996,10,15,0,0,0,0,0,0,PW,0,0,0,0,0,42.91,-76.65,0,0,0,0,0,0,0,0,0,0,0,0,0,0.930232558,0,0,0,0,0,0,0,0,0,0,0,0,0,0,0,0,0,0,0,0,3.093421685,3.124830149,-0.031408464,Sporadic,0,0,0,0,0,0,0,0,0,41422,NYSDEC (1999),43,0,0,0,0,liquid,0,0,0,0,0,0,0,0,0,0,0,0,0,0,0,0,0,0,0,0,0,0,0,0,0,0,413,856,0,0,_-spectrometry,1996,8,15,0,0,0,0,0,0,PW,0,0,0,0,0,42.93,-78.46,0,0,0,0,0,0,0,0,0,0,0,0,0,0.482476636,0,0,0,0,0,0,0,0,0,0,0,0,0,0,0,0,0,0,0,0,2.615950052,2.932473765,-0.316523713,Sporadic,0,0,0,0,0,0,0,0,0,41423,NYSDEC (1999),60,0,0,0,0,liquid,0,0,0,0,0,0,0,0,0,0,0,0,0,0,0,0,0,0,0,0,0,0,0,0,0,0,369,890,0,0,_-spectrometry,1996,10,15,0,0,0,0,0,0,PW,0,0,0,0,0,42.93,-77.98,0,0,0,0,0,0,0,0,0,0,0,0,0,0.414606742,0,0,0,0,0,0,0,0,0,0,0,0,0,0,0,0,0,0,0,0,2.567026366,2.949390007,-0.38236364,Sporadic,0,0,0,0,0,0,0,0,0,41424,NYSDEC (1999),61,0,0,0,0,liquid,0,0,0,0,0,0,0,0,0,0,0,0,0,0,0,0,0,0,0,0,0,0,0,0,0,0,538,625,0,0,_-spectrometry,1996,10,15,0,0,0,0,0,0,PW,0,0,0,0,0,42.94,-77.91,0,0,0,0,0,0,0,0,0,0,0,0,0,0.8608,0,0,0,0,0,0,0,0,0,0,0,0,0,0,0,0,0,0,0,0,2.730782276,2.795880017,-0.065097742,Sporadic,0,0,0,0,0,0,0,0,0,41425,NYSDEC (1999),48,0,0,0,0,liquid,0,0,0,0,0,0,0,0,0,0,0,0,0,0,0,0,0,0,0,0,0,0,0,0,0,0,0,347,0,0,_-spectrometry,1996,8,15,0,0,0,0,0,0,PW,0,0,0,0,0,42.95,-78.3,0,0,0,0,0,0,0,0,0,0,0,0,0,0,0,0,0,0,0,0,0,0,0,0,0,0,0,0,0,0,0,0,0,0,0,2.540329475,0,Sporadic,0,0,0,0,0,0,0,0,0,41426,NYSDEC (1999),45,0,0,0,0,liquid,0,0,0,0,0,0,0,0,0,0,0,0,0,0,0,0,0,0,0,0,0,0,0,0,0,0,169,565,0,0,_-spectrometry,1996,8,15,0,0,0,0,0,0,PW,0,0,0,0,0,43.02,-78.45,0,0,0,0,0,0,0,0,0,0,0,0,0,0.299115044,0,0,0,0,0,0,0,0,0,0,0,0,0,0,0,0,0,0,0,0,2.227886705,2.752048448,-0.524161743,Sporadic,0,0,0,0,0,0,0,0,0,41427,NYSDEC (1999),44,0,0,0,0,liquid,0,0,0,0,0,0,0,0,0,0,0,0,0,0,0,0,0,0,0,0,0,0,0,0,0,0,63,0,0,0,_-spectrometry,1996,8,15,0,0,0,0,0,0,PW,0,0,0,0,0,43.03,-78.46,0,0,0,0,0,0,0,0,0,0,0,0,0,0,0,0,0,0,0,0,0,0,0,0,0,0,0,0,0,0,0,0,0,0,1.799340549,0,0,Sporadic,0,0,0,0,0,0,0,0,0,41428,NYSDEC (1999),46,0,0,0,0,liquid,0,0,0,0,0,0,0,0,0,0,0,0,0,0,0,0,0,0,0,0,0,0,0,0,0,0,175,255,0,0,_-spectrometry,1996,8,15,0,0,0,0,0,0,PW,0,0,0,0,0,43.05,-78.25,0,0,0,0,0,0,0,0,0,0,0,0,0,0.68627451,0,0,0,0,0,0,0,0,0,0,0,0,0,0,0,0,0,0,0,0,2.243038049,2.40654018,-0.163502132,Sporadic,0,0,0,0,0,0,0,0,0,41429,NYSDEC (2009),30,0,0,0,0,liquid,0,0,0,0,0,0,0,0,0,0,0,0,0,0,0,0,0,0,0,0,0,0,0,0,9426,2780,4049,826,0,0,No method specified,2009,4,1,0,0,0,0,0,0,PW,0,0,0,0,0,42.02,-77.47,0,0,0,0,0,0,0,0,0,0,0,0,0,4.901937046,0,0,0,0,0,0,0,0,0,0,0,0,0,0,0,0,0,0,3.974327435,3.444044796,3.607347777,2.916980047,0.690367729,Sporadic,0,0,0,0,0,0,0,0,0,41430,NYSDEC (2009),27,0,0,0,0,liquid,0,0,0,0,0,0,0,0,0,0,0,0,0,0,0,0,0,0,0,0,0,0,0,0,17940,4765,2472,874,0,0,No method specified,2008,10,7,0,0,0,0,0,0,PW,0,0,0,0,0,42.05,-77.04,0,0,0,0,0,0,0,0,0,0,0,0,0,2.828375286,0,0,0,0,0,0,0,0,0,0,0,0,0,0,0,0,0,0,4.253822439,3.678062905,3.393048466,2.941511433,0.451537034,Sporadic,0,0,0,0,0,0,0,0,0,41431,NYSDEC (2009),27,0,0,0,0,liquid,0,0,0,0,0,0,0,0,0,0,0,0,0,0,0,0,0,0,0,0,0,0,0,0,3968,618,7885,234,0,0,No method specified,2009,4,1,0,0,0,0,0,0,PW,0,0,0,0,0,42.05,-77.04,0,0,0,0,0,0,0,0,0,0,0,0,0,33.6965812,0,0,0,0,0,0,0,0,0,0,0,0,0,0,0,0,0,0,3.598571663,2.790988475,3.896801698,2.369215857,1.52758584,Sporadic,0,0,0,0,0,0,0,0,0,41432,NYSDEC (2009),28,0,0,0,0,liquid,0,0,0,0,0,0,0,0,0,0,0,0,0,0,0,0,0,0,0,0,0,0,206446,0,14530,4561,2647,782,0,0,No method specified,2008,10,8,0,0,0,0,0,0,PW,0,0,0,0,0,42.28,-77.08,0,0,0,0,0,0,0,0,0,0,0,0,0,3.384910486,0,0,0,0,0,0,0,0,0,0,0,0,0,0,0,0,5.314806473,0,4.162265614,3.659060072,3.422753941,2.893206753,0.529547188,Sporadic,0,0,0,0,0,0,0,0,0,41433,NYSDEC (2009),35,0,0,0,0,liquid,0,0,0,0,0,0,0,0,0,0,0,0,0,0,0,0,0,0,0,0,0,0,0,0,123000,12000,16030,912,0,0,No method specified,2008,10,8,0,0,0,0,0,0,PW,0,0,0,0,0,42.29,-77.06,0,0,0,0,0,0,0,0,0,0,0,0,0,17.57675439,0,0,0,0,0,0,0,0,0,0,0,0,0,0,0,0,0,0,5.089905111,4.079181246,4.204933522,2.959994838,1.244938684,Sporadic,0,0,0,0,0,0,0,0,0,41434,NYSDEC (2009),33,0,0,0,0,liquid,0,0,0,0,0,0,0,0,0,0,0,0,0,0,0,0,0,0,0,0,0,0,205102,0,18330,0,13510,929,0,0,No method specified,2009,3,26,0,0,0,0,0,0,PW,0,0,0,0,0,42.29,-77.07,0,0,0,0,0,0,0,0,0,0,0,0,0,14.54251884,0,0,0,0,0,0,0,0,0,0,0,0,0,0,0,0,5.311969895,0,4.263162465,0,4.130655349,2.968015714,1.162639635,Sporadic,0,0,0,0,0,0,0,0,0,41435,NYSDEC (2009),31,0,0,0,0,liquid,0,0,0,0,0,0,0,0,0,0,0,0,0,0,0,0,0,0,0,0,0,0,0,0,20750,2389,6125,516,0,0,No method specified,2009,4,6,0,0,0,0,0,0,PW,0,0,0,0,0,42.34,-76.94,0,0,0,0,0,0,0,0,0,0,0,0,0,11.87015504,0,0,0,0,0,0,0,0,0,0,0,0,0,0,0,0,0,0,4.317018101,3.37821615,3.787106093,2.712649702,1.074456391,Sporadic,0,0,0,0,0,0,0,0,0,41436,NYSDEC (2009),24,0,0,0,0,liquid,0,0,0,0,0,0,0,0,0,0,0,0,0,0,0,0,0,0,0,0,0,0,0,0,70,7,0.163,0.029,0,0,No method specified,2009,4,1,0,0,0,0,0,0,PW,0,0,0,0,0,42.4,-77.41,0,0,0,0,0,0,0,0,0,0,0,0,0,5.620689655,0,0,0,0,0,0,0,0,0,0,0,0,0,0,0,0,0,0,1.84509804,0.84509804,-0.787812396,-1.537602002,0.749789607,Sporadic,0,0,0,0,0,0,0,0,0,41437,NYSDEC (2009),25,0,0,0,0,liquid,0,0,0,0,0,0,0,0,0,0,0,0,0,0,0,0,0,0,0,0,0,0,0,0,54.6,59,0.195,0.428,0,0,No method specified,2009,4,1,0,0,0,0,0,0,PW,0,0,0,0,0,42.41,-77.42,0,0,0,0,0,0,0,0,0,0,0,0,0,0.455607477,0,0,0,0,0,0,0,0,0,0,0,0,0,0,0,0,0,0,1.737192643,1.770852012,-0.709965389,-0.368556231,-0.341409158,Sporadic,0,0,0,0,0,0,0,0,0,41438,NYSDEC (2009),34,0,0,0,0,liquid,0,0,0,0,0,0,0,0,0,0,0,0,0,0,0,0,0,0,0,0,0,0,0,0,16550,1323,15140,957,0,0,No method specified,2009,4,6,0,0,0,0,0,0,PW,0,0,0,0,0,42.44,-76.91,0,0,0,0,0,0,0,0,0,0,0,0,0,15.82027168,0,0,0,0,0,0,0,0,0,0,0,0,0,0,0,0,0,0,4.218797998,3.121559844,4.180125875,2.980911938,1.199213937,Sporadic,0,0,0,0,0,0,0,0,0,41439,NYSDEC (2009),26,0,0,0,0,liquid,0,0,0,0,0,0,0,0,0,0,0,0,0,0,0,0,0,0,0,0,0,0,0,0,3914,715,1779,201,0,0,No method specified,2009,4,2,0,0,0,0,0,0,PW,0,0,0,0,0,42.45,-75.61,0,0,0,0,0,0,0,0,0,0,0,0,0,8.850746269,0,0,0,0,0,0,0,0,0,0,0,0,0,0,0,0,0,0,3.592620821,2.854306042,3.250175948,2.303196057,0.946979891,Sporadic,0,0,0,0,0,0,0,0,0,41440,PA DEP (1992),101,0,0,0,0,liquid,0,0,0,0,0,0,0,0,0,0,0,0,0,0,0,0,0,0,0,0,0,0,354034,0,0,0,566,2110,0,0,No method specified,1991,6,1,0,0,0,0,0,0,PW,0,0,0,0,0,39.96,-79.4,0,0,0,0,0,0,0,0,0,0,0,0,0,0.268246445,0,0,0,0,0,0,0,0,0,0,0,0,0,0,0,0,5.549044972,0,0,0,2.752816431,3.324282455,-0.571466024,Sporadic,0,0,0,0,0,0,0,0,0,41441,PA DEP (1992),100,0,0,0,0,liquid,0,0,0,0,0,0,0,0,0,0,0,0,0,0,0,0,0,0,0,0,0,0,341918,0,0,0,4685,2038,0,0,No method specified,1991,6,1,0,0,0,0,0,0,PW,0,0,0,0,0,39.97,-79.36,0,0,0,0,0,0,0,0,0,0,0,0,0,2.298822375,0,0,0,0,0,0,0,0,0,0,0,0,0,0,0,0,5.533921964,0,0,0,3.670709595,3.30920418,0.361505416,Sporadic,0,0,0,0,0,0,0,0,0,41442,PA DEP (1992),110,0,0,0,0,liquid,0,0,0,0,0,0,0,0,0,0,0,0,0,0,0,0,0,0,0,0,0,0,176676,0,0,0,203,1543,0,0,No method specified,1991,6,1,0,0,0,0,0,0,PW,0,0,0,0,0,40.06,-78.92,0,0,0,0,0,0,0,0,0,0,0,0,0,0.131561892,0,0,0,0,0,0,0,0,0,0,0,0,0,0,0,0,5.247177558,0,0,0,2.307496038,3.188365926,-0.880869888,Sporadic,0,0,0,0,0,0,0,0,0,41443,PA DEP (1992),111,0,0,0,0,liquid,0,0,0,0,0,0,0,0,0,0,0,0,0,0,0,0,0,0,0,0,0,0,182274,0,0,0,1988,499,0,0,No method specified,1991,6,1,0,0,0,0,0,0,PW,0,0,0,0,0,40.08,-79.07,0,0,0,0,0,0,0,0,0,0,0,0,0,3.983967936,0,0,0,0,0,0,0,0,0,0,0,0,0,0,0,0,5.260724724,0,0,0,3.29841638,2.698100546,0.600315834,Sporadic,0,0,0,0,0,0,0,0,0,41444,PA DEP (1992),120,0,0,0,0,liquid,0,0,0,0,0,0,0,0,0,0,0,0,0,0,0,0,0,0,0,0,0,0,402148,0,0,0,857,71,0,0,No method specified,1991,6,1,0,0,0,0,0,0,PW,0,0,0,0,0,40.26,-79.53,0,0,0,0,0,0,0,0,0,0,0,0,0,12.07042254,0,0,0,0,0,0,0,0,0,0,0,0,0,0,0,0,5.604385913,0,0,0,2.932980822,1.851258349,1.081722473,Sporadic,0,0,0,0,0,0,0,0,0,41445,PA DEP (1992),118,0,0,0,0,liquid,0,0,0,0,0,0,0,0,0,0,0,0,0,0,0,0,0,0,0,0,0,0,134164,0,0,0,255,456,0,0,No method specified,1991,6,1,0,0,0,0,0,0,PW,0,0,0,0,0,40.33,-80.24,0,0,0,0,0,0,0,0,0,0,0,0,0,0.559210526,0,0,0,0,0,0,0,0,0,0,0,0,0,0,0,0,5.127635998,0,0,0,2.40654018,2.658964843,-0.252424662,Sporadic,0,0,0,0,0,0,0,0,0,41446,PA DEP (1992),84,0,0,0,0,liquid,0,0,0,0,0,0,0,0,0,0,0,0,0,0,0,0,0,0,0,0,0,0,143432,0,0,0,512,202,0,0,No method specified,1991,6,1,0,0,0,0,0,0,PW,0,0,0,0,0,40.36,-80.21,0,0,0,0,0,0,0,0,0,0,0,0,0,2.534653465,0,0,0,0,0,0,0,0,0,0,0,0,0,0,0,0,5.156646054,0,0,0,2.709269961,2.305351369,0.403918592,Sporadic,0,0,0,0,0,0,0,0,0,41447,PA DEP (1992),105,0,0,0,0,liquid,0,0,0,0,0,0,0,0,0,0,0,0,0,0,0,0,0,0,0,0,0,0,198668,0,0,0,2575,1866,0,0,No method specified,1991,6,1,0,0,0,0,0,0,PW,0,0,0,0,0,40.48,-79.17,0,0,0,0,0,0,0,0,0,0,0,0,0,1.379957128,0,0,0,0,0,0,0,0,0,0,0,0,0,0,0,0,5.29812792,0,0,0,3.410777233,3.270911639,0.139865594,Sporadic,0,0,0,0,0,0,0,0,0,41448,PA DEP (1992),119,0,0,0,0,liquid,0,0,0,0,0,0,0,0,0,0,0,0,0,0,0,0,0,0,0,0,0,0,221134,0,0,0,170,46,0,0,No method specified,1991,6,1,0,0,0,0,0,0,PW,0,0,0,0,0,40.49,-79.58,0,0,0,0,0,0,0,0,0,0,0,0,0,3.695652174,0,0,0,0,0,0,0,0,0,0,0,0,0,0,0,0,5.344655522,0,0,0,2.230448921,1.662757832,0.56769109,Sporadic,0,0,0,0,0,0,0,0,0,41449,PA DEP (1992),106,0,0,0,0,liquid,0,0,0,0,0,0,0,0,0,0,0,0,0,0,0,0,0,0,0,0,0,0,121928,0,0,0,450,313,0,0,No method specified,1991,6,1,0,0,0,0,0,0,PW,0,0,0,0,0,40.65,-79.19,0,0,0,0,0,0,0,0,0,0,0,0,0,1.437699681,0,0,0,0,0,0,0,0,0,0,0,0,0,0,0,0,5.08610345,0,0,0,2.653212514,2.495544338,0.157668176,Sporadic,0,0,0,0,0,0,0,0,0,41450,PA DEP (1992),88,0,0,0,0,liquid,0,0,0,0,0,0,0,0,0,0,0,0,0,0,0,0,0,0,0,0,0,0,195404,0,0,0,1154,1083,0,0,No method specified,1991,6,1,0,0,0,0,0,0,PW,0,0,0,0,0,40.66,-78.83,0,0,0,0,0,0,0,0,0,0,0,0,0,1.065558633,0,0,0,0,0,0,0,0,0,0,0,0,0,0,0,0,5.29093345,0,0,0,3.062205809,3.034628457,0.027577352,Sporadic,0,0,0,0,0,0,0,0,0,41451,PA DEP (1992),87,0,0,0,0,liquid,0,0,0,0,0,0,0,0,0,0,0,0,0,0,0,0,0,0,0,0,0,0,175296,0,0,0,1408,904,0,0,No method specified,1991,6,1,0,0,0,0,0,0,PW,0,0,0,0,0,40.7,-78.76,0,0,0,0,0,0,0,0,0,0,0,0,0,1.557522124,0,0,0,0,0,0,0,0,0,0,0,0,0,0,0,0,5.243772006,0,0,0,3.148602655,2.95616843,0.192434224,Sporadic,0,0,0,0,0,0,0,0,0,41452,PA DEP (1992),104,0,0,0,0,liquid,0,0,0,0,0,0,0,0,0,0,0,0,0,0,0,0,0,0,0,0,0,0,186736,0,0,0,2019,2196,0,0,No method specified,1991,6,1,0,0,0,0,0,0,PW,0,0,0,0,0,40.74,-78.82,0,0,0,0,0,0,0,0,0,0,0,0,0,0.919398907,0,0,0,0,0,0,0,0,0,0,0,0,0,0,0,0,5.271228052,0,0,0,3.305136319,3.341632336,-0.036496017,Sporadic,0,0,0,0,0,0,0,0,0,41453,PA DEP (1992),86,0,0,0,0,liquid,0,0,0,0,0,0,0,0,0,0,0,0,0,0,0,0,0,0,0,0,0,0,0,0,0,0,20,13,0,0,No method specified,1991,6,1,0,0,0,0,0,0,PW,0,0,0,0,0,40.78,-79.25,0,0,0,0,0,0,0,0,0,0,0,0,0,1.538461538,0,0,0,0,0,0,0,0,0,0,0,0,0,0,0,0,0,0,0,0,1.301029996,1.113943352,0.187086643,Sporadic,0,0,0,0,0,0,0,0,0,41454,PA DEP (1992),85,0,0,0,0,liquid,0,0,0,0,0,0,0,0,0,0,0,0,0,0,0,0,0,0,0,0,0,0,0,0,0,0,315,165,0,0,No method specified,1991,6,1,0,0,0,0,0,0,PW,0,0,0,0,0,40.79,-79.26,0,0,0,0,0,0,0,0,0,0,0,0,0,1.909090909,0,0,0,0,0,0,0,0,0,0,0,0,0,0,0,0,0,0,0,0,2.498310554,2.217483944,0.28082661,Sporadic,0,0,0,0,0,0,0,0,0,41455,PA DEP (1992),91,0,0,0,0,liquid,0,0,0,0,0,0,0,0,0,0,0,0,0,0,0,0,0,0,0,0,0,0,185146,0,0,0,2015,1749,0,0,No method specified,1991,6,1,0,0,0,0,0,0,PW,0,0,0,0,0,40.83,-78.61,0,0,0,0,0,0,0,0,0,0,0,0,0,1.152086907,0,0,0,0,0,0,0,0,0,0,0,0,0,0,0,0,5.267514334,0,0,0,3.30427505,3.242789809,0.061485241,Sporadic,0,0,0,0,0,0,0,0,0,41456,PA DEP (1992),92,0,0,0,0,liquid,0,0,0,0,0,0,0,0,0,0,0,0,0,0,0,0,0,0,0,0,0,0,230924,0,0,0,107,77,0,0,No method specified,1991,6,1,0,0,0,0,0,0,PW,0,0,0,0,0,40.84,-78.72,0,0,0,0,0,0,0,0,0,0,0,0,0,1.38961039,0,0,0,0,0,0,0,0,0,0,0,0,0,0,0,0,5.363469072,0,0,0,2.029383778,1.886490725,0.142893053,Sporadic,0,0,0,0,0,0,0,0,0,41457,PA DEP (1992),107,0,0,0,0,liquid,0,0,0,0,0,0,0,0,0,0,0,0,0,0,0,0,0,0,0,0,0,0,0,0,0,0,1280,848,0,0,No method specified,1991,6,1,0,0,0,0,0,0,PW,0,0,0,0,0,40.97,-78.9,0,0,0,0,0,0,0,0,0,0,0,0,0,1.509433962,0,0,0,0,0,0,0,0,0,0,0,0,0,0,0,0,0,0,0,0,3.10720997,2.928395852,0.178814117,Sporadic,0,0,0,0,0,0,0,0,0,41458,PA DEP (1992),89,0,0,0,0,liquid,0,0,0,0,0,0,0,0,0,0,0,0,0,0,0,0,0,0,0,0,0,0,222672,0,0,0,163,126,0,0,No method specified,1991,6,1,0,0,0,0,0,0,PW,0,0,0,0,0,41.11,-77.77,0,0,0,0,0,0,0,0,0,0,0,0,0,1.293650794,0,0,0,0,0,0,0,0,0,0,0,0,0,0,0,0,5.34766561,0,0,0,2.212187604,2.100370545,0.111817059,Sporadic,0,0,0,0,0,0,0,0,0,41459,PA DEP (1992),90,0,0,0,0,liquid,0,0,0,0,0,0,0,0,0,0,0,0,0,0,0,0,0,0,0,0,0,0,252980,0,0,0,1489,636,0,0,No method specified,1991,6,1,0,0,0,0,0,0,PW,0,0,0,0,0,41.12,-77.87,0,0,0,0,0,0,0,0,0,0,0,0,0,2.341194969,0,0,0,0,0,0,0,0,0,0,0,0,0,0,0,0,5.403086188,0,0,0,3.172894698,2.803457116,0.369437582,Sporadic,0,0,0,0,0,0,0,0,0,41460,PA DEP (1992),94,0,0,0,0,liquid,0,0,0,0,0,0,0,0,0,0,0,0,0,0,0,0,0,0,0,0,0,0,153096,0,0,0,811,530,0,0,No method specified,1991,6,1,0,0,0,0,0,0,PW,0,0,0,0,0,41.15,-77.74,0,0,0,0,0,0,0,0,0,0,0,0,0,1.530188679,0,0,0,0,0,0,0,0,0,0,0,0,0,0,0,0,5.184963844,0,0,0,2.909020854,2.72427587,0.184744985,Sporadic,0,0,0,0,0,0,0,0,0,41461,PA DEP (1992),93,0,0,0,0,liquid,0,0,0,0,0,0,0,0,0,0,0,0,0,0,0,0,0,0,0,0,0,0,194902,0,0,0,731,491,0,0,No method specified,1991,6,1,0,0,0,0,0,0,PW,0,0,0,0,0,41.17,-77.7,0,0,0,0,0,0,0,0,0,0,0,0,0,1.488798371,0,0,0,0,0,0,0,0,0,0,0,0,0,0,0,0,5.289816296,0,0,0,2.863917377,2.691081492,0